2010-12-08 00:00:00,Agilent Collaborates With University of Davis On Food Safety Research
2011-03-01 00:00:00,Agilent Acquires BIOCIUS Life
2011-09-19 00:00:00,Agilent Announces Signal Analyzer For Wide Bandwidth Signal Analysis
2012-04-27 00:00:00,Agilent Inc And Centellax Announce Agilent Will Acquire Centellaxs Test and Measurement Business
2012-06-21 00:00:00,Agilent Completes Acquisition of Dako
2012-09-04 00:00:00,Agilent Technologies Inc Introduces PXI Vector Signal Generator
2012-09-07 00:00:00,Agilent Technologies Inc Signs Exclusive Supply Agreement To Provide Components For LipoSciences Vantera Clinical Analyzer
2012-11-02 00:00:00,Agilent Technologies Announces Precision Power Source for
