2011-04-13 00:00:00,Alcoa Announces Pricing of Notes Offering
2011-05-05 00:00:00,Alcoa Declares Common And Preferred Share Dividend
2011-06-17 00:00:00,Alcoa And Sign Memorandum Of Understanding For Technical And Commercial Collaboration
2011-06-24 00:00:00,Alcoa Signs Contract to Supply Aluminum Solutions to Airbus
2011-09-30 00:00:00,Alcoa Announces Quarterly Dividend
2012-10-09 00:00:00,Alcoa Inc And Aluminium Bahrain Resolve Civil Litigation
2012-10-10 00:00:00,Oil Falls on Expectations of Gain in US Supply Report
