2011-02-24 00:00:00,ACE Limited Declares First Quarter Dividend
2011-05-04 00:00:00,ACE Limited Lowers FY 2011 EPS Guidance
2011-09-08 00:00:00,Penn Millers Holding Corp To Be Acquired By ACE Subsidiary
2011-10-25 00:00:00,ACE Ltd Raises FY 2011 EPS Guidance
2011-11-17 00:00:00,ACE Ltd Recommends Increase In Dividend
2011-12-28 00:00:00,ACE Ltd Acquires General Insurer Rio Guayas In Ecuador
2012-06-13 00:00:00,ACE Limited To Acquire PT Asuransi Jaya Proteksi
2012-07-06 00:00:00,ACE Limited Partners with RAC To Offer Travel Insurance
2012-07-24 00:00:00,ACE Limited Raises FY 2012 EPS Guidance
2012-08-09 00:00:00,ACE Limited Declares Quarterly Dividend
2012-10-23 00:00:00,ACE Limited Raises FY 2012 EPS Guidance
2012-10-24 00:00:00,ACE Beats EPS Ups View Analyst Blog
2012-11-07 00:00:00,ACE LIMITED New Podcast from ACE Provides Perspectives and Preventative
