2010-12-28 00:00:00,ACE Limited Completes Acquisition of Rain and Hail Insurance
2011-02-01 00:00:00,ACE Limited Completes Acquisition Of New York Operations In Korea
2011-02-03 00:00:00,ACE Limited Issues FY 2011 Revenue In Line With Call
2011-04-01 00:00:00,ACE Limited Completes Acquisition Of New York Lifes Operations In Hong Kong
2011-05-04 00:00:00,ACE Limited Lowers FY 2011 EPS Guidance
2011-07-26 00:00:00,ACE Ltd Raises FY 2011 Earnings Guidance
2011-09-08 00:00:00,Penn Millers Holding Corp To Be Acquired By ACE Subsidiary
2011-10-25 00:00:00,ACE Ltd Raises FY 2011 EPS Guidance
2011-11-30 00:00:00,Penn Millers Holding Corp Completes Sale To ACE Subsidiary
2011-12-28 00:00:00,ACE Ltd Acquires General Insurer Rio Guayas In Ecuador
2012-02-01 00:00:00,ACE Ltd Reaffirms FY 2012 EPS Call
2012-04-25 00:00:00,ACE Ltd Raises FY 2012 EPS Call
2012-08-09 00:00:00,ACE Limited Declares Quarterly Dividend
2012-09-18 00:00:00,ACE Limited Acquires of Asuransi Jaya Proteksi in Indonesia
2012-10-18 00:00:00,ACE to Acquire Mexican Personal Lines Insurer ABA Seguros
2012-10-23 00:00:00,ACE Limited Raises FY 2012 EPS Guidance
2012-10-24 00:00:00,ACE Beats EPS Ups View Analyst Blog
