2010-12-16 00:00:00,Axcelis Secures Contract
2011-01-11 00:00:00,Axcelis Announces Appointment Of New CFO
2011-02-01 00:00:00,Axcelis Issues Q1 2011 EPS Guidance Below Call
2011-07-26 00:00:00,Axcelis Secures Contract
2012-08-03 00:00:00,Axcelis Issues Q3 2012 Guidance Below Analysts Call
2012-08-29 00:00:00,Axcelis Technologies Inc Receives Order For Integra RS Plasma Dry Strip Systems
2012-09-25 00:00:00,Axcelis Technologies Inc Secures Contract From Chip Manufacturer
2012-10-17 00:00:00,Axcelis Announces Timing And Availability Of Third Quarter Results And
2012-10-22 00:00:00,Axcelis Technologies To Present At The Piper Jaffray Media and
