2010-11-04 00:00:00,Accenture Plc Secures Engineering Services Contract From Navy
2010-11-08 00:00:00,Accenture Plc Secures Contract From American Water
2010-11-10 00:00:00,Accenture Plc Completes Acquisition Of Mogenesis
2010-11-16 00:00:00,Accenture Plc And BMC Software Expand Relationship With Technology Joint Development And Delivery Agreements
2010-11-18 00:00:00,KF Awards Accenture Plc Finance And Accounting Business Process Outsourcing Contract
2010-11-19 00:00:00,Accenture Plc Agrees To Acquire CAS Computer Systemberatung AG
2010-11-30 00:00:00,Accenture Plc To Open Analytics Innovation Centre In Ireland
2010-12-02 00:00:00,Accenture Plc And NHN Corporation Sign Agreement To Collaborate To Develop Mobile Applications For Smartphones
2010-12-06 00:00:00,Accenture Plc Secures Contract From IT Services
2010-12-07 00:00:00,Accenture Plc Broadens Digital Relationship With Universal Music Group
2010-12-08 00:00:00,National Water Company Of Saudi Arabia Selects Accenture Plc For Comprehensive IT Solution
2010-12-14 00:00:00,Accenture Plc Announces Multi Year Technology Services Agreement With Hilton Worldwide
2010-12-16 00:00:00,Accenture Plc Issues Q2 2011 Revenue Guidance In Line With Raises FY 2011 Guidance
2010-12-20 00:00:00,Accenture Plc Wins Portal Implementation Contract From State Government of Nagaland
2010-12-21 00:00:00,Accenture Plc Supports Global Business Transformation Program at Fast Retailing
2011-01-10 00:00:00,Accenture Plc Completes Acquisition of CAS Computer und Systemberatung AG
2011-01-18 00:00:00,ONC Selects Accenture Plc To Help Achieve Healthcare IT Interoperability
2011-01-19 00:00:00,Carlsberg Engages Application Services Contract With Accenture Plc
2011-02-14 00:00:00,Accenture Plc And NetApp Expand Relationship With Agreements On Technology And Joint Development And Delivery Of New Enterprise Solutions
2011-02-28 00:00:00,Accenture Plc Receives Consip SpA Contract to Develop eProcurement System to Transform Italian Government Procurement
2011-03-02 00:00:00,Accenture Plc Secures Procurement Transformation Contract From City Of London Corporation
2011-03-15 00:00:00,Israel Electric Corporation Awards Accenture Plc IT Services Contract
2011-03-24 00:00:00,Accenture Plc Issues Q3 2011 Revenue Guidance Above Raises FY 2011 Declares Semi Annual Cash Dividend
2011-03-28 00:00:00,Ministry of Justice Awards Systems Integration Contract To Accenture Plc
2011-03-29 00:00:00,Accenture Plc Secures Five Year Outsourcing And Management Consulting Contract From CEVA LOGISTICS
2011-03-30 00:00:00,Banco Bilbao Vizcaya Selects Accenture Alnova Banking Solution To Support Aggressive Technology Transformation
2011-04-06 00:00:00,Accenture Plc And RSA UK Extend Business Process Outsourcing Agreement For Insurance Services
2011-04-19 00:00:00,InBev And Accenture Plc Collaborate On Digital Merchandising Pilot
2011-04-27 00:00:00,Nokia Oyj Announces Plans for Strategic Collaboration to Transfer Symbian Software Activities and About Employees to Accenture
2011-04-28 00:00:00,Accenture Plc Teams With Harold Freeman Patient Navigation Institute
2011-05-12 00:00:00,Navy Mutual Aid Association Selects Accenture Plc To Support Life Insurance And Annuity Business
2011-05-17 00:00:00,Accenture Plc And SAP AG Announces Strategic Relationship
2011-06-07 00:00:00,Accenture Plc To Acquire Majority Stake In Al Faisaliah Business Technology Company
2011-06-14 00:00:00,CF Industries Selects Accenture Plc To Implement Information System
2011-06-20 00:00:00,Accenture Plc Implements Nationwide Electronic Health Record System In Singapore
2011-06-22 00:00:00,Accenture Plc Finalize Symbian Software Development And Support Services Outsourcing Agreement With Nokia
2011-06-23 00:00:00,Accenture Plc Issues Q4 2011 Revenue Guidance Above Raises FY 2011 Guidance
2011-06-29 00:00:00,Accenture Plc Receives Contract From Air Force Electronic Systems Center
2011-07-18 00:00:00,Accenture Plc to Deliver Automated Border Control Systems at Schiphol Airport in Amsterdam
2011-07-22 00:00:00,Accenture Plc Secures Contract
2011-07-27 00:00:00,Accenture Plc To Partner With Pepco Holdings Inc To Build Communications Network Management System
2011-08-01 00:00:00,Accenture Plc To Deliver Information Technology And Finance And Accounting Services To Intertek Under Outsourcing Contract
2011-08-03 00:00:00,LOreal Selects Accenture Plc To Support Field Sales Operations
2011-08-05 00:00:00,Internal Revenue Service Selects Accenture Plc As Contractor For Total Information Processing Support Services Information Technology Services
2011-08-11 00:00:00,Department of Justice Includes Accenture Accenture Federal Services In IT Services Contract
2011-08-17 00:00:00,Australia Selects Accenture Plc To Build Personal System
2011-08-22 00:00:00,Accenture Plc Expand Credit Industry Capabilities With Acquisition Of Launches Accenture Credit Services
2011-08-23 00:00:00,Accenture Plc Completes Acquisition of Duck Creek Technologies
2011-08-25 00:00:00,Accenture Accenture Federal Services Secures Contract From Department Of Navy
2011-09-12 00:00:00,Accenture Plc To Pay Million In False Claims
2011-09-20 00:00:00,Accenture Plc Secures Contract From Thomas Cook Group Plc
2011-09-27 00:00:00,Accenture Plc Issues FY 2012 EPS Guidance Above Issues Q1 2012 Revenue Guidance Above Declares Dividend
2011-09-30 00:00:00,Nokia Oyj And Accenture Plc Close Symbian Software Development And Support Services Outsourcing Agreement
2011-10-18 00:00:00,Accenture Plc And Guidewire Software Inc Settle Patent Lawsuits
2011-10-26 00:00:00,Accenture Plc Selected For Application Development And Management Services
2011-11-02 00:00:00,Accenture Plc Secures Contract For Kansas Eligibility And Enforcement System
2011-11-03 00:00:00,Accenture Plc Completes Acquisition Of Zenta
2011-11-14 00:00:00,Accenture Plc Secures Management Consulting Contract From Maharashtra Government
2011-11-28 00:00:00,Accenture Plc And Enbridge Enbridge Gas Distribution Sign Extension Of BPO Agreement
2011-11-29 00:00:00,Accenture Plc Secures Contract For California Department Of Consumer Affairs Licensing System
2011-12-07 00:00:00,Accenture Plc To Work with CGI Group And State Of California Franchise Tax Board To Modernize Systems
2011-12-09 00:00:00,Accenture Plc Wins Project Management And Application Outsourcing Contract From Ministry of Internal Affairs And Communications
2011-12-15 00:00:00,Accenture Plc Issues Q2 2012 Revenue Guidance In Line With Reaffirms FY 2012 Revenue Lowers FY 2012 EPS Guidance
2011-12-21 00:00:00,Accenture Plc Secures Biometric Identity System Contract From Department Of Homeland Security
2012-01-11 00:00:00,Directorate of Legal and Administrative Information and Accenture Plc Build First Environment in France
2012-01-24 00:00:00,Accenture Plc Announces Acquisition Of Neo Metrics Analytics
2012-02-13 00:00:00,New Crime Management System For The Norwegian National Police Directorate Being Developed By Accenture Plc
2012-02-15 00:00:00,Accenture Plc Opens New Research Development Lab In Beijing To Develop Technology Innovations For Clients In China And Region
2012-03-07 00:00:00,Farm Bureau Financial Services Selects Accenture Plc Claim Components to Optimize Claims Handling
2012-03-22 00:00:00,Accenture Plc Issues Q3 2012 Revenue Guidance Above Raises FY 2012 Guidance
2012-03-29 00:00:00,Guinness Anchor Berhad Selects Accenture Plc To Transform Sales Systems
2012-04-03 00:00:00,Accenture Plc To Team With SAS Institute To Help Folksam Meet Solvency II Requirements
2012-04-10 00:00:00,Accenture Plc Completes Acquisition of Neo Metrics Analytics
2012-05-08 00:00:00,Accenture PLC To Team With Serco For Transformation Of Defence Business Services For Ministry Of Defence
2012-05-10 00:00:00,Accenture PLC Secures Contract Extension For Medical Imaging In
2012-06-04 00:00:00,Accenture PLC Expands Relationship With Nordea Through Application Development And Maintenance Services Agreement
2012-06-05 00:00:00,India Department Of Electronics And Information Technology Selects Accenture PLC To Review Semiconductor Fabrication Proposals
2012-06-06 00:00:00,Accenture Accenture Federal Services Secures Contract From National Institutes Of Health
2012-06-13 00:00:00,Wing Lung Bank Selects Accenture PLC to Plan and Oversee Core Banking Transformation Program
2012-06-25 00:00:00,Guardia Civil Selects Accenture PLC to Enhance Information Sharing Across Police Systems
2012-06-27 00:00:00,State of California Selects Accenture PLC To Implement California Health Insurance Exchange
2012-06-28 00:00:00,Accenture PLC Issues Q4 2012 Revenue Guidance Below Reaffirms FY 2012 Revenue Lowers FY 2012 EPS Guidance
2012-07-05 00:00:00,Ministry Of Forestry and Fisheries Selects Accenture PLC To Support Food Supply Chain Project
2012-08-02 00:00:00,Accenture PLC Enters Into Agreement To Acquire Octagon Research
2012-08-08 00:00:00,Accenture Accenture Federal Services Qualifies For Million FBI IT Services IDIQ
2012-08-14 00:00:00,BP Selects Accenture PLC As Global Outsourcing Provider Of Finance And Accounting Services
2012-09-13 00:00:00,Accenture PLC Help Oi SA Transform Business Operations And Support Strategic Growth Objectives
2012-09-25 00:00:00,Swedish National Police Board Selects Accenture PLC As Strategic IT Partner
2012-09-26 00:00:00,Accenture PLC Completes Acquisition Of Octagon Research Solutions
2012-09-27 00:00:00,Accenture PLC Issues Q1 2013 Revenue Guidance In Line With Issues FY 2013 Guidance Above Increases Cash Dividend
2012-10-01 00:00:00,Accenture PLC Acquires IPTV Assets from Nokia Siemens Networks
2012-10-04 00:00:00,Weekly Investment Ratings Changes for Accenture Plc
2012-10-05 00:00:00,Why Accenture is a Top 10 SAFE International Dividend Stock
2012-10-08 00:00:00,Accenture Plc Expands Its Relationship With Bbva Chile Through Four Year Core Banking Application Maintenance Agreement
2012-10-09 00:00:00,Accenture PLC Announces Acquisition Of avVenta Worldwide
2012-10-10 00:00:00,Accenture Takes Over avVenta Analyst Blog
2012-10-11 00:00:00,Accenture PLC Secures Contract
2012-10-12 00:00:00,Accenture Wins Norway EHR Deal Analyst Blog
2012-10-15 00:00:00,Societe Generale Raises Price Target on Accenture Plc
2012-10-16 00:00:00,Accenture PLC Secures Contract From Italian Medicines Agency For Implementation And Maintenance Of Evaluation Systems In Italy
2012-10-18 00:00:00,Accenture Accenture Federal Services Receives Million Navy Contract for Space Naval Warfare Systems Center Pacific
2012-10-19 00:00:00,More Contracts for Accenture Analyst Blog
2012-10-22 00:00:00,Accenture Names CEO Nanterme To Additional Position Of Chairman
2012-10-23 00:00:00,ACCENTURE PLC Accenture Life Safety Solution Named New Product of the
2012-10-24 00:00:00,Accenture Survey Sees Improvement in Consumer Holiday Sentiment
2012-10-25 00:00:00,Accenture PLC Appoints CEO Pierre Nanterme To Additional Position Of Chairman
2012-10-31 00:00:00,Stocks in the News Wednesday UBS
2012-11-01 00:00:00,ACCENTURE PLC David Moskovitz to Lead Accenture Federal Services
