2011-02-10 00:00:00,Acxiom Corporation To Help Sony Ericsson Make Stronger Connections With Consumers
2011-02-17 00:00:00,Clearwave Corporation Launches Patient Recognition Solution In Partnership With Acxiom Corporation
2011-04-04 00:00:00,Law Offices of Goldfarb Branham LLP Investigating Shareholder Claims Against Acxiom Board For Multimillion Dollar
2011-04-05 00:00:00,Harwood Feffer LLP Investigates Possible Securities Law Violations At Acxiom Corporation
2011-04-27 00:00:00,Izard Nobel LLP Announces Class Action Lawsuit Against Acxiom Corporation
2011-05-11 00:00:00,Law Office Of Brodsky LLC Announces Investigation Of Acxiom Corporation
2011-08-30 00:00:00,Acxiom Corporation Announces Million Stock Repurchase Program
2012-02-02 00:00:00,Acxiom Corporation Completes Sale of Acxiom Information Security Services
2012-05-24 00:00:00,Acxiom Corporation Increases Share Repurchase Program To Million
2012-10-02 00:00:00,ACXIOM CORPORATION Most Marketers Seek Customer but Lack
2012-10-16 00:00:00,ACXIOM CORPORATION Acxiom Congratulates United Airlines on Winning
2012-10-17 00:00:00,Acxiom To Discuss Second Quarter Earnings
2012-10-18 00:00:00,Acxiom Applauds Ranking as DMA Top Marketer of the Year
2012-10-25 00:00:00,Earnings APKT
