2010-11-23 00:00:00,Adobe Systems Announces Plans For New Data Centre To Serve Omniture Business Unit Customers In Europe
2010-12-07 00:00:00,Bonnier Group Selects Adobe Adobe Digital Publishing Suite For Newspaper Tablet Editions
2010-12-13 00:00:00,Adobe Systems Announces Strategic Alliance Agreement with Deloitte
2010-12-20 00:00:00,Adobe Systems Issues Q1 2011 Guidance Above Estimates
2011-03-22 00:00:00,Adobe Systems Issues Q2 2011 Guidance Below Estimates
2011-06-21 00:00:00,Adobe Systems Issues Q3 2011 Guidance In Line With Reaffirms FY 2011 Revenue Guidance
2011-08-09 00:00:00,MOSAID Technologies Incorporated Files Suit Against Seven Companies Including Adobe Systems
2011-09-09 00:00:00,EMC Corporation Teams Up With Adobe Systems To Deliver Editing And Storage Technologies
2011-11-01 00:00:00,Adobe Systems Acquires Auditude
2012-02-28 00:00:00,Pitney Bowes Selects Adobe Systems To Help Power Personalization And Customization Of Volly Secure Digital Delivery Service
2012-03-19 00:00:00,Adobe Systems Issues Q2 2012 Guidance Below Raises FY 2012 Guidance
2012-03-21 00:00:00,Adobe Systems Partners With hybris On Commerce For Web Experience Management
2012-06-19 00:00:00,Adobe Systems Incorporated Issues Q3 2012 EPS Revenue Below Raises FY 2012 EPS Lowers High End Of Prior FY 2012 Revenue Outlook To A Range In Line With Estimates
2012-09-19 00:00:00,Adobe Systems Inc Issues Q4 2012 Guidance Below Estimates
2012-10-19 00:00:00,Investment Ratings Reiterations for 19th ABE
