2010-12-07 00:00:00,Bonnier Group Selects Adobe Adobe Digital Publishing Suite For Newspaper Tablet Editions
2010-12-20 00:00:00,Adobe Systems Issues Q1 2011 Guidance Above Estimates
2011-01-18 00:00:00,Adobe Systems Acquires Demdex
2011-04-11 00:00:00,Adobe Systems Announces Launch Of Creative Suite Product Line
2011-05-18 00:00:00,BSQUARE Announces Distribution And Support For Adobe Adobe Reader Mobile SDK
2011-05-20 00:00:00,Adobe Systems Cooperates With SAP AG To Ease Extension Of SAP Applications To Leading Platforms
2011-09-08 00:00:00,Adobe Systems Announces Acquisition Of Certain Assets Of IRIDAS
2011-09-09 00:00:00,EMC Corporation Teams Up With Adobe Systems To Deliver Editing And Storage Technologies
2011-11-01 00:00:00,Adobe Systems Acquires Auditude
2011-11-08 00:00:00,Adobe Systems Reaffirms Q4 2011 Announces Elimination Of Approximately 750 Comments On Q4 2011 Charge Guidance
2012-02-28 00:00:00,Pitney Bowes Selects Adobe Systems To Help Power Personalization And Customization Of Volly Secure Digital Delivery Service
2012-03-19 00:00:00,Adobe Systems Issues Q2 2012 Guidance Below Raises FY 2012 Guidance
2012-03-21 00:00:00,Adobe Systems Partners With hybris On Commerce For Web Experience Management
2012-06-19 00:00:00,Adobe Systems Incorporated Issues Q3 2012 EPS Revenue Below Raises FY 2012 EPS Lowers High End Of Prior FY 2012 Revenue Outlook To A Range In Line With Estimates
2012-09-19 00:00:00,Adobe Systems Inc Issues Q4 2012 Guidance Below Estimates
2012-10-19 00:00:00,Investment Ratings Reiterations for 19th ABE
2012-10-22 00:00:00,Adobe Data Finds Mobile Search and Facebook Engagement Booming
2012-10-23 00:00:00,Financial Overview of Top Five Application Software Stocks ORCL
2012-10-24 00:00:00,Adobe Consumers think online marketing work
2012-11-05 00:00:00,Turning Loss Leaders Into Profits in Smartphones and Tablets
