2011-02-08 00:00:00,Analog Introduces Integrated Analog Subsystem for ECG Applications
2011-02-15 00:00:00,Analog Issues Q2 2011 Earnings Guidance In Line With Declares Quarterly Dividend
2011-05-17 00:00:00,Analog Introduces First Signal And Power Isolated Transceivers For Safe Systems
2011-08-16 00:00:00,Analog Issues Q4 2011 Guidance Below Estimates
2011-11-21 00:00:00,Analog Declares Issues Q1 2012 EPS Guidance Below Comments On Q1 2012 Revenue Guidance
2012-02-22 00:00:00,Analog Issues Q2 2012 Guidance Below Increases Cash Dividend By
2012-05-22 00:00:00,Analog Declares Dividend
2012-05-23 00:00:00,Analog Issues Q3 2012 Guidance In Line With Call
2012-08-21 00:00:00,Analog Devices Inc Declares Cash Dividend
2012-10-10 00:00:00,Octal ultrasound receiver from ADI feature JESD204B interface
2012-10-11 00:00:00,Analog Devices Rating Lowered to Equal Weight at Morgan Stanley
2012-10-24 00:00:00,Analog Devices Releases Graphical Audio Development Tool for SHARC
2012-11-02 00:00:00,Fundamentals of Energy Metering
2012-11-07 00:00:00,Analog to Report Fourth Quarter and Fiscal Year 2012 Financial
