2010-12-23 00:00:00,Knowles MEMS Microphones Infringe Analog Patent
2011-02-08 00:00:00,Analog Introduces Integrated Analog Subsystem for ECG Applications
2011-03-30 00:00:00,Analog Devices Prices Million Senior Unsecured Notes Offering
2011-12-01 00:00:00,Analog And Richardson RFPD Sign Worldwide Distributor Agreement To Expand Support for RF Systems Designers
2012-03-13 00:00:00,Analog Will Move To NASDAQ
2012-03-30 00:00:00,Analog Acquires
2012-10-08 00:00:00,Analog Devices Stock Rating Lowered by ISI Group
2012-10-10 00:00:00,Analog Devices Steady Dividend Payer as NASDAQ Sputters
2012-10-12 00:00:00,Analog Devices Downgraded by Morgan Stanley to
2012-10-24 00:00:00,Analog Devices Releases Graphical Audio Development Tool for SHARC
2012-11-05 00:00:00,Analog launches flash drivers
