2012-07-26 00:00:00,Audience Inc Issues Q3 2012 Guidance
2012-09-07 00:00:00,Law Offices Of Howard Smith Announces Investigation On Behalf Of Shareholders Of
2012-09-19 00:00:00,Ryan LLP Announces Investigation of Audience Inc
2012-09-20 00:00:00,Glancy Binkow Goldberg LLP Announces Investigation Of Audience Inc
2012-09-24 00:00:00,Glancy Binkow Goldberg LLP Announces Class Action Lawsuit Against Audience Inc
2012-09-28 00:00:00,Law Offices of Howard Smith Announces Class Action Lawsuit Against Audience Inc
2012-10-02 00:00:00,Faruqi LLP Announces Investigation Of Potential Securities Fraud At Audience Inc
2012-10-22 00:00:00,Audience Inc Investor Lawsuit Over Alleged False and Misleading
