2011-02-09 00:00:00,Ameren Corporation Directors Declare Quarterly Dividend
2011-02-22 00:00:00,Ameren Corporation Issues FY 2011 EPS Guidance In Line With Estimates
2011-05-05 00:00:00,Ameren Corporation Reaffirms FY 2011 EPS Guidance
2011-08-04 00:00:00,Peabody Energy and Ameren Corporation Sign Contract For 91 Million Tons Of Powder River Basin Coal
2011-11-04 00:00:00,Ameren Corporation Raises FY 2011 EPS Guidance
2012-02-10 00:00:00,Ameren Corporation Directors Declare Quarterly Dividend
2012-02-23 00:00:00,Ameren Corporation Issues FY 2012 EPS Guidance In Line With Call
2012-04-24 00:00:00,Ameren Corporation Declare Quarterly Dividend
2012-08-02 00:00:00,Ameren Corporation Raises FY 2012 EPS Guidance
2012-08-13 00:00:00,Ameren Ameren Illinois Announces Pricing of Senior Secured Notes Offering
2012-10-23 00:00:00,Equities Research Ratings Reiterations for 23rd AAPL
2012-11-02 00:00:00,Hurricane Sandy Day 5 Live Death Toll Rises Sharply
2012-11-05 00:00:00,Stocks Reaching Trendline Support on
