2011-02-22 00:00:00,Ameren Corporation Issues FY 2011 EPS Guidance In Line With Estimates
2011-08-04 00:00:00,Peabody Energy and Ameren Corporation Sign Contract For 91 Million Tons Of Powder River Basin Coal
2011-11-04 00:00:00,Ameren Corporation Raises FY 2011 EPS Guidance
2012-08-02 00:00:00,Ameren Corporation Raises FY 2012 EPS Guidance
2012-08-13 00:00:00,Ameren Ameren Illinois Announces Pricing of Senior Secured Notes Offering
2012-10-23 00:00:00,Equities Research Ratings Reiterations for 23rd AAPL
2012-11-05 00:00:00,Notable Two Hundred Day Moving Average Cross AEE
