2010-11-04 00:00:00,Telefonica Brazil Selects Allot Communications To Deliver Network Management Services
2012-05-15 00:00:00,Allot Communications Completes Ortiva Wireless Acquisition
2012-07-31 00:00:00,Allot Communications To Acquire Oversi Networks
2012-10-03 00:00:00,Allot Communications to Host Third Quarter 2012 Earnings Results Conference
2012-10-08 00:00:00,Research Ratings Reiterations for 8th ALLT
2012-10-09 00:00:00,Stocks in News
2012-10-11 00:00:00,Allot Communications Upgraded to at Jefferies Group
