2010-11-29 00:00:00,Altera Corporation Reaffirms Q4 2010 Revenue Guidance
2011-09-06 00:00:00,Altera Corporation Lowers Q3 2011 Sales Guidance
2012-03-08 00:00:00,Altera Corporation Lowers High End Of Prior Q1 2012 Revenue Guidance To A Range Below Reaffirms Q2 2012 Revenue Guidance
2012-03-22 00:00:00,Altera Corporation And TSMC Jointly Develop Heterogeneous 3D IC Test Vehicle
2012-07-24 00:00:00,Altera Corporation Issues Q3 2012 Revenue Guidance Above Estimates
2012-09-04 00:00:00,Altera Corp Reaffirms Q3 2012 Revenue Guidance
2012-10-19 00:00:00,Earnings Altera Corporation Analyst Blog
2012-10-22 00:00:00,The Zacks Analyst Blog Dunkin Brands Cheesecake Factory
2012-10-23 00:00:00,Altera Corp Declares Quarterly Cash Dividend
2012-10-31 00:00:00,Altera Introduces Serial RapidIO IP Cores to Ensure Interoperability in Next
2012-11-02 00:00:00,Altera Announces Upcoming Schedule of Events With the Financial Community
