2010-11-29 00:00:00,Altera Corporation Reaffirms Q4 2010 Revenue Guidance
2010-12-09 00:00:00,Intellectual Ventures Sues Nine Technology Companies Including Altera
2011-01-25 00:00:00,Altera Corporation Issues Q1 2011 Revenue Guidance Above Declares Quarterly Cash Dividend
2011-03-01 00:00:00,Altera Corporation Reaffirms Q1 2011 Revenue Guidance
2011-04-26 00:00:00,Altera Corporation Issues Q2 2011 Revenue Guidance Above Announces Quarterly Dividend
2012-01-24 00:00:00,Altera Corporation Declares Quarterly Dividend
2012-03-22 00:00:00,Altera Corporation And TSMC Jointly Develop Heterogeneous 3D IC Test Vehicle
2012-04-19 00:00:00,Altera Corporation Declares Quarterly Cash Dividend
2012-09-04 00:00:00,Altera Corp Reaffirms Q3 2012 Revenue Guidance
