2011-05-03 00:00:00,Alexion Raises FY 2011 Revenue Reaffirms FY 2011 EPS Call
2011-06-20 00:00:00,Alexion And Alexion Pharma International Srl Initiates Clinical Trial Of Eculizumab As Potential Treatment For Patients With
2011-12-28 00:00:00,Alexion To Acquire Enobia Pharma Corp
2012-03-07 00:00:00,Alexion Pharmaceuticals Inc Announces Data From Phase 2 Study Of Asfotase Alfa In Hypophosphatasia
2012-06-12 00:00:00,Alexion Pharmaceuticals Inc Reaffirms FY 2012 Call
2012-10-12 00:00:00,Alexion Pharmaceuticals Price Target Raised to at Bank of America
