2010-12-08 00:00:00,Applied Announces Cash Dividend
2011-04-05 00:00:00,Quantum Global Technologies To Acquire Chamber Cleaning And Coating Services Group From Applied
2012-02-16 00:00:00,Applied Issues Q2 2012 Guidance Above Call
2012-08-16 00:00:00,Applied Materials Inc Comments On Q4 2012 Revenue Issues Q4 2012 EPS Guidance Below Call
2012-09-13 00:00:00,Applied Materials Inc Announces Cash Dividend
2012-10-17 00:00:00,Most Active Alpha Natural Murphy Applied Materials
2012-10-18 00:00:00,stocks fall as jobless claims climb
2012-11-01 00:00:00,Largest option buying in equities so far
2012-11-05 00:00:00,JPMorgan Chase Reaffirms Neutral Rating on Applied Materials
