2010-12-27 00:00:00,Advanced Micro Announces Change In Accounting Treatment For Investment In Globalfoundries
2011-02-08 00:00:00,Advanced Micro and Barco Advance Medical Diagnoses With Enhanced Visual Imaging
2011-04-27 00:00:00,Advanced Micro and MulticoreWare Team to Help Developers Optimize the Use of OpenCL for AMD Fusion APUs
2012-03-23 00:00:00,Advanced Micro Completes Acquisition Of SeaMicro
2012-03-26 00:00:00,Rockwell Collins Selects Advanced Micro Radeon E2400 Embedded Graphics Processor For Inclusion In Integrated Flight Deck Pro Line Fusion
2012-06-26 00:00:00,San Francisco Giants Selects Advanced Micro Inc As Technology Partner
2012-10-11 00:00:00,Advanced Micro Devices Inc Lowers Q3 2012 Revenue Guidance
2012-10-25 00:00:00,AMD Faces Looming Cash Crunch Amid Quest for New Markets
2012-10-26 00:00:00,Fitch Revises Advanced Micro Devices Outlook To
2012-10-31 00:00:00,AMD Jumps Into The ARM Server Business
2012-11-02 00:00:00,Advanced Micro Aims To Launch 64 Bit ARM Server
2012-11-05 00:00:00,This Semiconductor Breaks Bearish Trend and 6 To Watch
2012-11-06 00:00:00,AMD cuts 400 Austin jobs
