2010-11-08 00:00:00,To Acquire And
2010-12-14 00:00:00,Meyclub Signs Partnership Agreement with French Website
2010-12-21 00:00:00,rnb Retail and Brands AB Subsidiary to Sell via
2011-01-25 00:00:00,To Sell Bulk Email
2011-06-29 00:00:00,Dassault Systemes SA Partners with Subsidiary
2011-07-12 00:00:00,Files Petition To Ask Californians To Repeal Online Collection
2011-07-26 00:00:00,Issues Q3 2011 Operating Profit Guidance Below Estimates
2011-07-28 00:00:00,Announces Digital Video License Agreement With NBCUniversal Domestic TV Distribution
2011-08-24 00:00:00,Walt News Corporation And JV Hulu Seen Drawing Bids From
2011-11-08 00:00:00,And Others Likely To Be Interested In webOS
2012-01-25 00:00:00,Amazon Web Services Announces AWS Storage Gateway to Connect Enterprise Data with Cloud
2012-03-19 00:00:00,To Acquire Kiva
2012-04-26 00:00:00,Issues Q2 2012 Earnings Guidance Below Estimates
2012-07-02 00:00:00,Inc Buys Map Startup
2012-07-06 00:00:00,Plans Foxconn International Holdings Ltd Working On
2012-07-23 00:00:00,To Expand Mobile
2012-08-06 00:00:00,Splendid Medien Subsidiary Signs Contract with On Line Video LOVEFiLM
2012-08-30 00:00:00,Inc Teams With Nokia Oyj For
2012-09-04 00:00:00,Inc And EPIX Announces New Prime Instant Video Agreement
2012-09-05 00:00:00,Inc To Launch New
2012-09-20 00:00:00,Stores Inc Stops Selling
2012-09-28 00:00:00,Inc Launches New
2012-10-15 00:00:00,Inc In Talks To Buy Texas Instruments Mobile Chip
