2010-11-08 00:00:00,Arrow Signs Global Distribution Agreement with
2011-01-27 00:00:00,Issues Q3 2011 Guidance In Line With Estimates
2011-04-27 00:00:00,Issues Q4 2011 EPS Guidance Below Estimates
2011-08-03 00:00:00,Issues Q1 2012 Guidance In Line With Estimates
2012-04-09 00:00:00,Inc Receives Contracts In Excess Of Million
2012-05-14 00:00:00,Inc Increases Stock Buy Back Authorization
2012-08-06 00:00:00,Anaren Inc Issues Q1 2013 Guidance In Line With Estimates
2012-09-27 00:00:00,Anaren Inc Receives Order In Excess Of Million
2012-10-08 00:00:00,Mercury Computer Cuts Jobs and Guidance for First Quarter
2012-10-15 00:00:00,Earnings Release and Conference Call Reporting Information
2012-10-23 00:00:00,Earnings ANEN
2012-10-24 00:00:00,Anaren Releases Q2 Earnings Guidance
