2011-03-07 00:00:00,Alpha Natural Announces Equity Investment In Inc
2011-05-13 00:00:00,Alpha Natural Announces Public Offering Of Billion Senior Notes
2011-05-31 00:00:00,Alpha Natural To Acquire Massey Energy Company
2011-12-06 00:00:00,Alpha Natural Reaches Agreement with United States Office And United States Department of Resolves Civil Proceedings with Mine Safety and Health Administration
2012-01-30 00:00:00,The Securities Arbitration Law Firm Of Klayman Toskes Launches Investigation Against Alpha Natural
2012-09-18 00:00:00,Alpha Natural Resources Inc Cuts
2012-10-26 00:00:00,Alpha Natural Resources Announces Completion of Its Tender Offer for
2012-11-01 00:00:00,TreeHouse Foods Larger Than S and P 500 Component Alpha Natural Resources
2012-11-05 00:00:00,Alpha Earnings Slump On Weak Demand But A Recovery Awaits
2012-11-06 00:00:00,Alpha Natural Resources PT Raised to
2012-11-07 00:00:00,Most Active for Nov 2012 VOD
