2011-03-07 00:00:00,Alpha Natural Announces Equity Investment In Inc
2011-05-13 00:00:00,Alpha Natural Announces Public Offering Of Billion Senior Notes
2011-06-01 00:00:00,Alpha Natural Announces Completion Of Offering Of Billion Of Senior Notes
2011-12-06 00:00:00,Alpha Natural Reaches Agreement with United States Office And United States Department of Resolves Civil Proceedings with Mine Safety and Health Administration
2012-01-30 00:00:00,The Securities Arbitration Law Firm Of Klayman Toskes Launches Investigation Against Alpha Natural
2012-03-20 00:00:00,Alpha Natural Announces Retirement Of Michael Quillen As Chairman And Director
2012-09-18 00:00:00,Alpha Natural Resources Inc Cuts
2012-09-28 00:00:00,Alpha Natural Resources Inc Announces Pricing Of Senior Notes
2012-10-18 00:00:00,Alpha Natural Poses An Imminent Danger To Shareholders
2012-11-07 00:00:00,Most Active for Nov 2012 VOD
