2012-01-30 00:00:00,The Securities Arbitration Law Firm Of Klayman Toskes Launches Investigation Against Alpha Natural
2012-03-20 00:00:00,Alpha Natural Announces Retirement Of Michael Quillen As Chairman And Director
2012-09-28 00:00:00,Alpha Natural Resources Inc Announces Pricing Of Senior Notes
2012-10-26 00:00:00,Alpha Natural Resources Announces Completion of Its Tender Offer for
2012-11-01 00:00:00,Alpha Natural Resources Weak Met Coal Demand Could Impact Results
2012-11-05 00:00:00,Alpha Earnings Slump On Weak Demand But A Recovery Awaits
2012-11-06 00:00:00,EOG Resources Stock Rallies on Analysts Topping Results
