2010-12-06 00:00:00,Amphenol Executive Chairman To Retire Effective January 8K
2011-04-29 00:00:00,Amphenol Announces Second Quarter 2011 Dividend Payment
2011-07-28 00:00:00,Amphenol Announces Third Quarter 2011 Dividend Payment
2012-04-26 00:00:00,Amphenol Announces Second Quarter 2012 Dividend Payment and Quarterly Dividend Increase For 2012
2012-10-22 00:00:00,Amphenol Upgraded to Buy at Cross Research
2012-10-25 00:00:00,Amphenol Corp Announces Fourth Quarter 2012 Dividend
2012-11-02 00:00:00,Forbes Earnings TE Connectivity
2012-11-06 00:00:00,Indicated Dividend Yield Rankings of 500 Companies
