2011-01-03 00:00:00,Airgas Acquires Conley And Two Other Businesses
2011-01-07 00:00:00,Air Products and Extends Tender Offer To Acquire Airgas
2011-01-19 00:00:00,Airgas Signs Three Year Supply Contract With The Linc Group
2011-02-03 00:00:00,Air Products and Extends Tender Offer to Acquire
2011-03-01 00:00:00,Airgas Signs Supply Contract With TDIndustries
2011-03-08 00:00:00,Airgas Partners With Wholesale To Distribute AiRx Diesel Exhaust Fluid
2011-07-11 00:00:00,Partners With MacEwen to Distribute AiRx Diesel Exhaust Fluid
2011-08-29 00:00:00,Airgas Increases Second Quarter Dividend By
2011-12-06 00:00:00,Airgas Raises FY 2012 EPS Call
2012-03-01 00:00:00,Airgas Declares Regular Dividend For Fourth Quarter FY2012
2012-08-08 00:00:00,Airgas Announces Six Acquisitions
2012-08-14 00:00:00,Airgas Inc Declares Regular Dividend for Second Quarter FY2013
2012-08-15 00:00:00,Airgas Inc Announces Reorganization of East Region
2012-10-17 00:00:00,Equity Ratings Changes for October APOL
2012-10-18 00:00:00,Airgas Second Quarter Earnings Sneak Peek
2012-11-06 00:00:00,Indicated Dividend Yield Ranking for the 500 by Industry
