2010-12-10 00:00:00,Allegheny Technologies Declares Quarterly Dividend
2010-12-16 00:00:00,Allegheny Technologies JV Company Secures Contract
2011-04-29 00:00:00,Allegheny Technologies Declares Quarterly Dividend
2011-06-20 00:00:00,Allegheny Technologies Announces Agreement For ATI 718Plus Alloy
2011-12-09 00:00:00,Allegheny Technologies Declares Quarterly Dividend
2012-02-23 00:00:00,Allegheny Technologies Declares Quarterly Dividend
2012-05-11 00:00:00,Allegheny Technologies Declares Quarterly Dividend
2012-06-06 00:00:00,Goodrich Corporation To Use Allegheny Technologies Thin Titanium Product For Aerospace Application
2012-10-10 00:00:00,Allegheny Technologies Announces Webcast of Conference Call for Third
2012-10-19 00:00:00,Forbes Earnings Allegheny Technologies
2012-11-02 00:00:00,Sheffield Forgemasters completes order for Allegheny
2012-11-06 00:00:00,Indicated Dividend Yield Ranking for the 500 by Industry
