2010-11-09 00:00:00,Avago Technologies Limited Launches New Robust Fiber Optic Links for Harsh Temperature Environments
2011-01-18 00:00:00,Avago Technologies Limited Announces Sale Of Ordinary Shares By Selling Shareholders
2011-02-23 00:00:00,Avago Technologies Limited Comments On Q2 2011 Revenue Guidance
2012-08-30 00:00:00,Avago Technologies Ltd Announces Interim Dividend
2012-10-08 00:00:00,Search local coupons and more
2012-10-10 00:00:00,Tech Go Long On This Stock Now
2012-10-19 00:00:00,Schneider drops sale of sensors sources
