2010-11-09 00:00:00,Avago Technologies Limited Launches New Robust Fiber Optic Links for Harsh Temperature Environments
2010-12-16 00:00:00,Elan Microelectronics Reaches Settlement Agreement with Avago Technologies
2011-01-18 00:00:00,Avago Technologies Limited Announces Sale Of Ordinary Shares By Selling Shareholders
2011-02-23 00:00:00,Avago Technologies Limited Comments On Q2 2011 Revenue Guidance
2011-03-08 00:00:00,Avago Technologies Ltd Unveils Optical Transceiver Platform With Per Lane Performance
2011-03-10 00:00:00,Avago Technologies Ltd Announces Dividend
2011-04-06 00:00:00,Cypress Semiconductor Intends To Defend Patent Lawsuit Filed By Avago
2011-05-24 00:00:00,Avago Technologies Ltd Comments On Q3 2011 Revenue Guidance
2011-06-09 00:00:00,Avago Technologies Ltd Announces Announces Authorization For Share Repurchase Program
2011-12-01 00:00:00,Avago Technologies Ltd Comments On Q1 2012 Revenue Guidance In Line With Estimates
2011-12-09 00:00:00,Avago Technologies Ltd Announces Interim Dividend
2012-02-22 00:00:00,Avago Technologies Ltd Issues Q2 2012 Revenue Guidance In Line With Estimates
2012-03-08 00:00:00,Avago Technologies Ltd Announces Interim Dividend
2012-04-05 00:00:00,Avago Technologies Ltd Reauthorizes Share Repurchase Program Of Up To 15 Million Shares
2012-05-15 00:00:00,Avago Technologies Ltd And TriQuint Agree To Confidential Settlement of All Outstanding Claims
2012-05-22 00:00:00,Avago Technologies Ltd Issues Q3 2012 Revenue Guidance In Line With Call
2012-06-07 00:00:00,Avago Technologies Ltd Announces Interim Dividend
2012-08-16 00:00:00,Avago Technologies Ltd Issues Q4 2012 Revenue Guidance Below Estimates
2012-08-30 00:00:00,Avago Technologies Ltd Announces Interim Dividend
2012-10-04 00:00:00,2 Apple Forgotten Or Out Of
2012-10-08 00:00:00,Search local coupons and more
2012-10-09 00:00:00,Leading Investment Service Examines iPhone Suppliers
2012-10-10 00:00:00,Tech Go Long On This Stock Now
2012-10-12 00:00:00,5 iPhone Stocks That Apple
2012-10-18 00:00:00,Why the Street Should Love Avago Earnings
2012-10-19 00:00:00,Schneider drops sale of sensors sources
2012-10-22 00:00:00,2 ways to play a new iPad
2012-10-23 00:00:00,A Look at 10 Companies With High Debt Characteristics
2012-10-25 00:00:00,Loss Narrows at TriQuint Analyst Blog
2012-11-01 00:00:00,Avago escalate patent war
