2010-11-08 00:00:00,The Boeing Company Receives Order For 12 Boeing
2010-11-16 00:00:00,The Boeing Company Announces To Acquire CDM Technologies
2010-11-17 00:00:00,The Boeing Airplane Health Management Activated On Air China 737 Fleet
2010-11-18 00:00:00,AerCap Holdings Signs Letter Of Intent With The Boeing Company For Up To 15 Consisting Of 10 Firm Aircraft And Five Purchase Rights
2010-11-22 00:00:00,The Boeing Company Announces Agreement To Acquire Summit Aeronautics Group in Montana
2010-11-30 00:00:00,The Boeing Company Secures Order For 22 737s From Copa Airlines
2010-12-07 00:00:00,The Boeing Company Completes Acquisition Of CDM Technologies
2010-12-13 00:00:00,The Boeing Company Approves Quarterly Dividend Of Per Share
2010-12-17 00:00:00,The Boeing Company And Fujitsu Limited Form Strategic Alliance In Airline Information Maintenance Services
2010-12-20 00:00:00,The Boeing Company To Build System For Government Of Mexico
2010-12-21 00:00:00,The Boeing Company Completes Acquisition of Summit Aeronautic Group in Montana
2011-01-04 00:00:00,The Boeing Company Receives Order For 38 Next Generation 737 Airplanes
2011-01-19 00:00:00,The Boeing Company Receives Final Approval From Chinese Government Confirming Billion Aircraft Agreement
2011-01-20 00:00:00,The Boeing Company To Cut 900 Jobs At California
2011-01-25 00:00:00,The Boeing Company Receives Billion Contract For Poseidon Initial Production
2011-01-26 00:00:00,The Boeing Company Issues FY 2011 Guidance In Line With Estimates
2011-02-02 00:00:00,The Boeing Company Announces 737 Order
2011-02-03 00:00:00,The Boeing Company Takes Orders For 10 Loses 32
2011-02-08 00:00:00,The Boeing Company Expects India To Buy Defense Equipment Worth Billion Over Ten
2011-02-15 00:00:00,The Boeing Company To Sell Three Aircraft To Lan Airlines
2011-02-24 00:00:00,The Boeing Company Receives US Air Force Contract to Build Refueling Tanker
2011-02-28 00:00:00,The Boeing Company And TAM Linhas Aereas Complete Contract For Two
2011-03-08 00:00:00,The Boeing Company And Air China Sign Agreement For Intercontinentals
2011-03-09 00:00:00,The Boeing Company And Aeroflot Announces Order For Eight 777s
2011-03-18 00:00:00,The Boeing Company And Korean Air Announce Order For Two Freighters
2011-04-01 00:00:00,The Boeing Company And Turkish Airlines Confirm Order For 15 737s
2011-04-07 00:00:00,Honeywell International Teams With The Boeing Company To Develop New System To Secure Shopping Industrial Facilities
2011-04-13 00:00:00,US Likely To Appeal WTO Ruling On The Boeing
2011-04-27 00:00:00,The Boeing Company Reaffirms FY 2011 Guidance
2011-05-02 00:00:00,The Boeing Company Approves Quarterly Dividend Of Share
2011-05-03 00:00:00,Lan Airlines Expects Delivery Of Five The Boeing Dreamliners In
2011-05-10 00:00:00,Lan Airlines SA Signs Agreement With The Boeing Company To Acquire Five Aircraft Boeing With Option To Acquire Four More Aircraft
2011-05-17 00:00:00,Spirit AeroSystems Completes 787 Contract Amendment With The Boeing Company
2011-05-19 00:00:00,The Boeing Company And Lufthansa Cargo Finalize Order For Five 777 Freighters
2011-05-23 00:00:00,US Court Orders More Hearings On The Boeing Company And General Dynamics Navy Jet
2011-05-31 00:00:00,GOL Linhas Aereas Inteligentes SA Receives Its First Next Generation Aircraft from The Boeing Company
2011-06-13 00:00:00,Thai Airways International Orders 37 Planes from EADS Airbus and The Boeing
2011-06-15 00:00:00,The Boeing Company To Build 10 Airlifters For Indian Air Story
2011-06-20 00:00:00,The Boeing Company Statement On Air Lease Corporation Agreement For Up To 33 Airplanes
2011-06-21 00:00:00,The Boeing Company And MIAT Mongolian Airlines Announce Order For and Jetliners
2011-06-22 00:00:00,Mitsubishi Heavy Mitsubishi Aircraft And The Boeing Company Tie Up On Jet Delivery
2011-06-27 00:00:00,The Boeing Company Approves Quarterly Dividend Of Share
2011-06-28 00:00:00,The Boeing Company Opens Plant For 787 Component In
2011-06-30 00:00:00,Judge Rejects The Boeing Company Motion To Dismiss NLRB
2011-07-20 00:00:00,AMR American Airlines Announces Aircraft Order With The Boeing Company And EADS Airbus
2011-07-21 00:00:00,The Boeing Company to Acquire Solutions Made Simple
2011-07-27 00:00:00,The Boeing Company Raises FY 2011 EPS Reaffirms FY 2011 Revenue Guidance
2011-08-01 00:00:00,The Boeing Company And Korean Air Announce Order for Two Additional
2011-08-02 00:00:00,Colorado Rare Awards Contract for Remote Sensing To The Boeing Company
2011-08-04 00:00:00,The Boeing Company And GE Capital Aviation Services Finalizes Order For Freighters And
2011-08-08 00:00:00,The Boeing Company And Siemens AG Form Strategic Alliance For DOD Energy
2011-08-10 00:00:00,GOL Linhas Aereas Inteligentes SA Receives Boeing 737 Next Generation with Engines from The Boeing Company
2011-08-15 00:00:00,The Boeing Company And Air Lease Corporation Finalizes Order For And
2011-08-18 00:00:00,The Boeing Company To Provide 787 Predictive Maintenance Service To Japan Airlines
2011-08-22 00:00:00,UK To Buy 14 The Boeing Chinook
2011-08-23 00:00:00,Delta Air Lines Expected To Order 100 The Boeing Company
2011-08-25 00:00:00,The Boeing Company And Delta Air Lines Announce Order for 100 Next
2011-09-20 00:00:00,AAR And The Boeing Company To Collaborate On Royal Netherlands Air Force Rotorcraft Support
2011-09-27 00:00:00,The Boeing Company And UTair Aviation Finalize Order For 40 737s
2011-10-13 00:00:00,The Boeing Company Starts Trading on OTC
2011-10-18 00:00:00,The Boeing Tapestry Solutions To Conduct US Army Training In Europe
2011-10-26 00:00:00,The Boeing Company Raises FY 2011 EPS Narrows FY 2011 Revenue Guidance To A Range In Line With Estimates
2011-10-31 00:00:00,The Boeing Company Declares Quarterly Dividend Of Share
2011-11-01 00:00:00,The Boeing Company Announces CFO Retirement
2011-11-11 00:00:00,The Boeing Company And BioEnergy To Work On Renewable Biofuel For Aviation
2011-11-14 00:00:00,The Boeing Oman Air Announces Order For Six Boeing 787 Dreamliners
2011-11-15 00:00:00,Qatar Airways Announces Order for The Boeing Two Boeing 777 Freighters
2011-11-17 00:00:00,The Boeing Company And Singapore Airlines Finalize Order for Eight
2011-12-02 00:00:00,Kalitta Air Closes Closes On Purchase Of The Boeing Boeing
2011-12-09 00:00:00,The Boeing Company Invests In Everett Delivery Center
2011-12-12 00:00:00,The Boeing Company Announces Dividend Increase
2011-12-13 00:00:00,The Boeing Company Secures Order From Launch Customer Southwest Airlines
2011-12-15 00:00:00,FedEx Corporation Signs An Agreement With The Boeing Company To Purchase 27 New Aircraft
2011-12-30 00:00:00,The Boeing Company And Northrop Grumman GMD Team Receives Contract From US Missile Defense Agency
2012-01-20 00:00:00,Jet Airways Limited Announces Purchase Agreement For Acquisition Of Boeing Aircraft
2012-01-25 00:00:00,The Boeing Company Receives Order from Norwegian Air Shuttle
2012-02-08 00:00:00,Britain To Buy Transport Aircraft From The Boeing
2012-02-14 00:00:00,The Boeing Lion Air Finalize Historic Order For Up To 380 737s
2012-02-15 00:00:00,The Boeing New European Airline Volotea Agree To 717 Leasing Deal
2012-02-29 00:00:00,China Southern Airlines Company Limited to Buy Aircraft from The Boeing Company
2012-03-01 00:00:00,The Boeing Company And Air Astana Announces Order For Four and Three 787 Dreamliners
2012-03-06 00:00:00,Commercial Aircraft of China And The Boeing Company Sign Collaboration Agreement To Partner In Areas Advancing Commercial Aviation Industry Growth
2012-03-22 00:00:00,The Boeing EADS Airbus And Embraer To Collaborate On Aviation Biofuel Commercialization
2012-04-09 00:00:00,The Boeing Transaero Airlines Finalize Order For Four 787 Dreamliners
2012-04-13 00:00:00,Court of Appeal of State of Second District Overturns California Superior Court Jury Verdict In Litigation Between Pendrell Subsidiary And The Boeing Company
2012-04-26 00:00:00,The Boeing Company To Acquire Inmedius
2012-04-30 00:00:00,The Boeing Company Approves Quarterly Dividend
2012-05-09 00:00:00,The Boeing Company Completes Acquisition Of Inmedius
2012-06-20 00:00:00,The Boeing Company Announces Air Traffic Management Research Collaboration In Jones
2012-06-25 00:00:00,The Boeing Company Approves Quarterly Dividend
2012-06-26 00:00:00,Pendrell ICO Global Announces Withdrawal Of Petition For Review In The Boeing Company Litigation
2012-07-05 00:00:00,Virgin Australia Holdings Orders 23 The Boeing 737 Max
2012-07-09 00:00:00,The Boeing Company And Air Lease Corporation Announce Order For 75 737 MAXs
2012-07-11 00:00:00,The Boeing TUI Travel PLC Sign Flight Training Agreement
2012-07-12 00:00:00,The Boeing Company Announces 737 Order From United Airlines
2012-07-19 00:00:00,Korean Air To Buy Two Planes From The Boeing
2012-07-20 00:00:00,The Boeing Company Receives Order For Two From Korean Air
2012-07-25 00:00:00,The Boeing Company Raises FY 2012 Guidance
2012-08-02 00:00:00,The Boeing Company And EL AL Finalize Order For Two Additional
2012-08-03 00:00:00,Silkair To Order Up To 68 New The Boeing Aircraft
2012-09-20 00:00:00,Boeing Co and Avolon Finalize Order for 737 MAXs and 737s
2012-09-21 00:00:00,Boeing Co Wins Billion Deal For Surveillance
2012-09-24 00:00:00,Boeing Co Receives Billion Contract For 11 Poseidon Aircraft
2012-10-01 00:00:00,Boeing Co And GOL Announce Order For 60 737 MAX Airplanes
2012-10-02 00:00:00,National Bank of Abu Dhabi PJSC Signs Aircraft Financing Agreement with Boeing Co
2012-10-10 00:00:00,Boeing Co To Build SES New Satellite Of Communications
2012-10-11 00:00:00,Alaska Air Group Alaska Airlines To Order 50 Boeing Co 737
2012-10-18 00:00:00,Earnings The Boeing Company Analyst Blog
2012-10-24 00:00:00,Boeing Co Raises FY 2012 Guidance
2012-10-25 00:00:00,1 Key Takeaway from Earnings
2012-10-31 00:00:00,THE BOEING COMPANY Boeing Opens 1st System Integration Lab for
2012-11-01 00:00:00,Alan Mullaly To Remain With Company Through 2014
