2010-12-03 00:00:00,Coal of Africa Limited Announces Holding Interest Of Bank of America Corporation
2010-12-13 00:00:00,Bank of America Bank of America Merrill Lynch Launches eFX Trading Platform For Options
2011-02-08 00:00:00,The Briscoe Law Firm Investigates Bank of America Corporation On Behalf of Shareholders For Possible Breaches of Fiduciary Duties By Officers And Directors
2011-03-02 00:00:00,Emergency Medical Services And Bank of America Sued Over Company
2011-03-17 00:00:00,Bank of America Corporation Declares Quarterly Dividend On Series L Preferred Stock
2011-03-24 00:00:00,Merricks Capital Special Opportunity Fund Limited Announces Ownership Interest Of Bank of America Corporation
2011-03-29 00:00:00,Keller Rohrback Announces Investigation of Bank of America Corporation And JPMorgan Chase Regarding Force Placed Insurance
2011-03-30 00:00:00,Glancy Binkow Goldberg LLP Announces Class Action Lawsuit Against Bank of America Corporation
2011-04-14 00:00:00,Bank of America Corporation Acquires Stake In Blue Energy Ltd
2011-04-25 00:00:00,The Securities Arbitration Law Firm of Klayman Toskes Files Million Claim Against Bank of America Merrill Lynch
2011-05-05 00:00:00,Keller Rohrback Announces Investigation of Bank of America Corporation and Other Lenders Regarding FHA Mortgage Insurance
2011-05-09 00:00:00,Saracen Mineral Holdings Limited Announces Holding Bank of America Corporation
2011-05-11 00:00:00,Bank of America Corporation Declares Quarterly Dividends On Common Stock And Preferred Stock
2011-05-16 00:00:00,Bank of America Corporation Launches Small Business Charge Cards
2011-07-06 00:00:00,Finkelstein Thompson LLP Announces Investigation Of Bank of America Corporation
2011-07-12 00:00:00,MBIA And Bank of America Merrill Lynch Co To Dismiss
2011-08-15 00:00:00,Bank of America Corporation To Exit International Credit Card To Sell Spain Credit Card Business
2011-08-16 00:00:00,Bank of America Corporation In Talks To Sell Investments To Blackstone Group
2011-08-19 00:00:00,Bank of America Corporation Set To Cut Jobs This
2011-08-26 00:00:00,Bank of America Corporation To Sell At Least Half Of China Construction Bank Corporation
2011-08-29 00:00:00,FDIC Intervenes In Bank of America Billion Mortgage
2011-09-12 00:00:00,Bank of America Corporation Plans Job
2011-09-27 00:00:00,Hagens Berman Advances Investigation of Bank of America Corporation Following Lawsuit Filing
2011-09-29 00:00:00,Invesco Square Mile Canyon Combine To Acquire Million Loan Portfolio From Bank of America
2011-10-20 00:00:00,US Judge Takes Billion Bank of America Corporation Deal From State
2011-10-21 00:00:00,American International Loses Bid To Move Billion Fraud Case Versus Bank of America
2011-11-14 00:00:00,Bank of America Corporation Selling Most Of Remaining China Construction Bank Corporation
2011-11-16 00:00:00,Woori Finance Holdings Woori Bank Says Preparing To Sue Bank of America Royal Bank of Scotland Over
2011-11-18 00:00:00,Bank of America Corporation Declares Quarterly Dividends
2011-11-22 00:00:00,Bank of America Corporation Increases Stake In Adamus Resources Limited
2011-11-23 00:00:00,Bank of America Corporation Decreases Stake In Adamus Resources Limited
2011-12-01 00:00:00,Massachusetts Attorney General Files Lawsuit Against Bank of America Corporation And Other
2011-12-05 00:00:00,Platinum Australia Limited Announces Holding Interest Of Bank of America Corporation And Related Bodies
2011-12-06 00:00:00,Bank of America Merrill Unit In Million Mortgage
2011-12-07 00:00:00,Bank of America Corporation Loses Bid To Oust American International Law Firm From
2011-12-16 00:00:00,Bank of America Corporation Declares Quarterly Dividend on Series L Preferred Stock
2012-01-25 00:00:00,The Securities Arbitration Law Firm of Klayman Toskes Launches Investigation On Behalf Of Customers Of Phil Scott Team And Bank of America Merrill Lynch
2012-02-07 00:00:00,Bank of America Corporation Wins Class Action
2012-02-16 00:00:00,Warns May Downgrade 17 Global Banks And Securities Firms Including Bank of America
2012-03-06 00:00:00,Bank Of America Corporation Acquires Stake In Beach Energy Limited
2012-03-22 00:00:00,Bank of America Corporation Decreases Stake In Elders Limited
2012-03-23 00:00:00,Bank of America Corporation Ceases To Be Substantial Holder In Platinum Australia Limited
2012-04-10 00:00:00,Bank Of America Corporation Acquires Stake In Noble Mineral Resources Ltd
2012-04-13 00:00:00,Bank of America US Bancorp Sued For Role As WaMu Bond
2012-04-23 00:00:00,Credit Goldman Sachs Band Together For NY Fed CDO Bid To Outbid Bank of America Corporation And Other Wall Street
2012-04-24 00:00:00,MacroSolve Inc Files Patent Infringement Suits Against Inc And Bank of America Corporation
2012-05-01 00:00:00,Bank of America Corporation Planning More Job
2012-05-10 00:00:00,NY Fed Sells American International Bailout Assets To Bank of America Merrill Leaving Citigroup And
2012-05-15 00:00:00,US Court Refuses To Delay Bank of America Merrill Settlement
2012-05-22 00:00:00,Credit Suisse Group AG Wins Latest Maiden Lane III Deutsche Bank Bank of America Merrill Others Vying For Duke
2012-06-15 00:00:00,Bank of America Corp Declares Quarterly Dividend On Series L Preferred Stock
2012-06-20 00:00:00,Bank of America Corp Directors Settle Lawsuit Over Merrill Lynch
2012-07-11 00:00:00,Bank of America Corp Declares Quarterly Dividends
2012-07-17 00:00:00,Syncora Holdings Ltd Settles Litigation With Countrywide Financial Bank of America Corporation And Affiliates
2012-07-23 00:00:00,Indophil Resources NL Announces Holding Interest Of Bank Of America Corporation And Its Related Corporate Bodies
2012-07-24 00:00:00,Walnut Place Drops Objections To Billion Bank Of America Corp
2012-08-14 00:00:00,Bank of America Corp Acquires Stake In IOOF Holdings Limited
2012-08-24 00:00:00,Dart Energy Ltd Announces Holding Interest Of Bank Of America Corporation And Its Related Corporate Bodies
2012-08-29 00:00:00,Bank of America Corp Seeks End To Lawsuit Tied To American International
2012-08-30 00:00:00,Bank Of America Corporation And Its Related Corporate Bodies Cease To Be Substantial Shareholders Of Indophil Resources NL
2012-09-17 00:00:00,Bank of America Corp Declares Quarterly Dividend on Series L Preferred Stock
2012-10-12 00:00:00,Saxena White and Kahn Swick LLC Announce the Proposed
2012-10-15 00:00:00,Home Owners File Class Action Suit Vs Banks Over Libor Including Barclays Bank of America UBS
2012-10-24 00:00:00,Bank of America Corp Declares Quarterly Dividends
2012-10-25 00:00:00,Bank of America Names Matthew Elliott President for Michigan
2012-11-05 00:00:00,Mortgage Rates Slight Upticks at Bank of America
2012-11-06 00:00:00,Top 6 Volume Hot Bank of Ford
