2010-11-30 00:00:00,Lehman Brothers Sues Bank of America Corporation And Barclays PLC Over Million
2010-12-07 00:00:00,Bank of America Corporation Statement On Resolutions With State And Federal Agencies Over Municipal Bidding Practices
2011-01-25 00:00:00,Dexia SA Files Complaint Against Bank of America over Countrywide
2011-01-26 00:00:00,Bank of America Corporation Declares Quarterly Dividends On Common Stock And Preferred Stock
2011-01-27 00:00:00,Proceeds With Amended Complaint Against Goldman Sachs And Bank of America Corporation Subsidiary Merrill Lynch
2011-02-02 00:00:00,Robbins Geller Rudman Dowd LLP Files Class Action Suit Against Bank of America Corporation
2011-02-24 00:00:00,Frank Sailer LLP Files Class Action Against Bank of America Corporation
2011-03-02 00:00:00,Emergency Medical Services And Bank of America Sued Over Company
2011-03-14 00:00:00,Altona Mining Limited Announces Ownership Interest Of Bank of America Corporation
2011-03-17 00:00:00,Bank of America Corporation Declares Quarterly Dividend On Series L Preferred Stock
2011-03-22 00:00:00,Prosperity Resources Limited Announces Holding Interest Of Bank Of America Corporation
2011-03-23 00:00:00,Fed Tells Bank of America Corporation To Rein In Dividend
2011-03-24 00:00:00,Merricks Capital Special Opportunity Fund Limited Announces Ownership Interest Of Bank of America Corporation
2011-03-29 00:00:00,Keller Rohrback Announces Investigation of Bank of America Corporation And JPMorgan Chase Regarding Force Placed Insurance
2011-03-30 00:00:00,Glancy Binkow Goldberg LLP Announces Class Action Lawsuit Against Bank of America Corporation
2011-03-31 00:00:00,Labaton Sucharow LLP Files Class Action Lawsuit On Behalf Of Investors In Bank of America Corporation
2011-04-04 00:00:00,Bank of America Corporation Declares Preferred Dividends
2011-04-08 00:00:00,Woori Investment Securities In Talks To Buy Bank of America Merrill South Korean PB
2011-04-14 00:00:00,Bank of America Corporation Acquires Stake In Blue Energy Ltd
2011-04-15 00:00:00,Keller Rohrback Announces Investigation of Bank of America Corporation And JPMorgan Chase Regarding Mortgages Protected By Servicemembers Civil Relief Act
2011-04-18 00:00:00,Bank of America Merrill Lynch Sells Asia PE Assets To Paul Capital
2011-04-19 00:00:00,Three Asset Management Firms Sue Banks Including Bank of America Corporation Over
2011-04-25 00:00:00,The Securities Arbitration Law Firm of Klayman Toskes Files Million Claim Against Bank of America Merrill Lynch
2011-04-29 00:00:00,Dragon Mining Limited Announces Ownership Interest Of Bank of America Corporation
2011-05-02 00:00:00,Thornburg Mortgage Bankruptcy Trustee Sues Banks Including Bank of America Corporation For
2011-05-05 00:00:00,Keller Rohrback Announces Investigation of Bank of America Corporation and Other Lenders Regarding FHA Mortgage Insurance
2011-05-09 00:00:00,Saracen Mineral Holdings Limited Announces Holding Bank of America Corporation
2011-05-11 00:00:00,Bank of America Corporation Declares Quarterly Dividends On Common Stock And Preferred Stock
2011-05-16 00:00:00,Bank of America Corporation Launches Small Business Charge Cards
2011-06-01 00:00:00,Bank of America Corporation Completes Sale Of Balboa Insurance Business to QBE Insurance Group Limited
2011-06-02 00:00:00,Bank of America Corporation Spins Off Its Last Large Private Equity
2011-06-15 00:00:00,Bank of America Merrill Being Investigated By
2011-06-17 00:00:00,Bank of America Corporation Declares Quarterly Dividend On Series L Preferred Stock
2011-06-21 00:00:00,Bank of America Corporation May Sell Part Of China Construction Bank Corporation Stake Later This
2011-07-06 00:00:00,Finkelstein Thompson LLP Announces Investigation Of Bank of America Corporation
2011-07-12 00:00:00,MBIA And Bank of America Merrill Lynch Co To Dismiss
2011-07-18 00:00:00,Khang Khang LLP Announces Class Action Lawsuit Against Bank of America Corporation
2011-07-20 00:00:00,Bank of America Merrill Files Claims Against Former Advisers For
2011-08-05 00:00:00,Stull Brody Commences Investigation Of Bank of America Corporation
2011-08-08 00:00:00,American International Expected To Sue Bank of America Over Mortgage
2011-08-11 00:00:00,Bank of America Corporation Talks To Gulf Funds To Cut Billion China Construction Bank Corporation
2011-08-15 00:00:00,Bank of America Corporation To Exit International Credit Card To Sell Spain Credit Card Business
2011-08-16 00:00:00,Bank of America Corporation In Talks To Sell Investments To Blackstone Group
2011-08-17 00:00:00,Bank of America Corporation Mulls Foreclosure Probe
2011-08-19 00:00:00,Bank of America Corporation Set To Cut Jobs This
2011-08-22 00:00:00,Bank of America Corporation Declares Quarterly Dividends
2011-08-25 00:00:00,The Charles Schwab Corporation Sues Major Banks Including Bank of America Corporation Over
2011-09-09 00:00:00,Bank of America Corporation Discussing About Job
2011-09-12 00:00:00,Bank of America Corporation Plans Job
2011-09-16 00:00:00,Bank of America Corporation Declares Quarterly Dividend On Series L Preferred Stock
2011-09-22 00:00:00,Bank of America Corporation To Sell Stake In NPC
2011-09-23 00:00:00,Robbins Geller Rudman Dowd LLP Files Class Action Suit Against Bank of America Corporation
2011-09-27 00:00:00,Hagens Berman Advances Investigation of Bank of America Corporation Following Lawsuit Filing
2011-09-29 00:00:00,Invesco Square Mile Canyon Combine To Acquire Million Loan Portfolio From Bank of America
2011-11-07 00:00:00,Bank of America Corporation Considering Further Stake Sale In China Construction Bank
2011-11-14 00:00:00,Bank of America Corporation Selling Most Of Remaining China Construction Bank Corporation
2011-11-16 00:00:00,Woori Finance Holdings Woori Bank Says Preparing To Sue Bank of America Royal Bank of Scotland Over
2011-11-18 00:00:00,Bank of America Corporation Declares Quarterly Dividends
2011-11-22 00:00:00,Bank of America Corporation Increases Stake In Adamus Resources Limited
2011-11-23 00:00:00,Bank of America Corporation Decreases Stake In Adamus Resources Limited
2011-11-28 00:00:00,Bank of America Corporation Ceases To Be Substantial Holder In Red 5 Limited
2011-12-01 00:00:00,Massachusetts Attorney General Files Lawsuit Against Bank of America Corporation And Other
2011-12-16 00:00:00,Bank of America Corporation Declares Quarterly Dividend on Series L Preferred Stock
2012-03-05 00:00:00,Bank Of America Corporation Ceases To Be Substantial Holder In Beach Energy Limited
2012-03-06 00:00:00,Bank Of America Corporation Acquires Stake In Beach Energy Limited
2012-04-10 00:00:00,Bank Of America Corporation Acquires Stake In Noble Mineral Resources Ltd
2012-04-11 00:00:00,Bank of America Corporation Declares Quarterly Dividends
2012-04-13 00:00:00,Bank of America US Bancorp Sued For Role As WaMu Bond
2012-04-17 00:00:00,Bank of America Corporation Puts Wealth Arm Up For
2012-04-18 00:00:00,Apple Visa Intel The Company and Bank of America Corp Start Trading on Bucharest The Corporate Wire
2012-04-19 00:00:00,Judge Dismisses Claims Against Bank of America Corporation And Other Banks In General Electric Co
2012-04-23 00:00:00,Credit Goldman Sachs Band Together For NY Fed CDO Bid To Outbid Bank of America Corporation And Other Wall Street
2012-04-24 00:00:00,MacroSolve Inc Files Patent Infringement Suits Against Inc And Bank of America Corporation
2012-04-25 00:00:00,Judge Denies American International Motion In Bank of America Billion
2012-04-27 00:00:00,Bank of America Corporation Ceases To Be Substantial Shareholder Of Noble Mineral Resources Ltd
2012-05-01 00:00:00,Bank of America Corporation Planning More Job
2012-05-10 00:00:00,NY Fed Sells American International Bailout Assets To Bank of America Merrill Leaving Citigroup And
2012-05-11 00:00:00,Bank Of America Corporation Ceases To Be Shareholder Of Beach Energy Ltd
2012-05-15 00:00:00,US Court Refuses To Delay Bank of America Merrill Settlement
2012-05-17 00:00:00,Royal Bank of Credit Suisse Group AG Among Bidders For Bank of America Wealth
2012-05-21 00:00:00,Bank Of America Corporation Ceases To Be Shareholder Of Elders Limited
2012-05-22 00:00:00,Credit Suisse Group AG Wins Latest Maiden Lane III Deutsche Bank Bank of America Merrill Others Vying For Duke
2012-05-25 00:00:00,Bank of America Corp and Barclays Bank Subsidiary Enters Into Agreement To Sell Remaining Interest In Archstone to Lehman Brothers Subsidiary
2012-07-06 00:00:00,Bank of America Corporation Ceases To Be Shareholder Of Resolute Mining Limited
2012-07-11 00:00:00,Bank of America Corp Declares Quarterly Dividends
2012-07-23 00:00:00,Indophil Resources NL Announces Holding Interest Of Bank Of America Corporation And Its Related Corporate Bodies
2012-07-24 00:00:00,Walnut Place Drops Objections To Billion Bank Of America Corp
2012-09-28 00:00:00,Bank of America Corp Reaches Settlement in Merrill Lynch Class Action Litigation
2012-10-12 00:00:00,Saxena White and Kahn Swick LLC Announce the Proposed
2012-10-25 00:00:00,Bank of America Declares Quarterly Dividends
