2010-12-03 00:00:00,Coal of Africa Limited Announces Holding Interest Of Bank of America Corporation
2010-12-17 00:00:00,Bank of America Corporation Declares Quarterly Dividend on Series L Preferred Stock
2010-12-20 00:00:00,Beach Energy Limited Announces Holding Interest Of Bank Of America Corporation
2010-12-28 00:00:00,Lazio Region Sues 11 Banks Including Bank of America Merrill Lynch Over
2010-12-29 00:00:00,Carabella Resources Ltd Announces Holding Interest Of Bank of America Corporation
2011-01-26 00:00:00,Bank of America Corporation Declares Quarterly Dividends On Common Stock And Preferred Stock
2011-01-27 00:00:00,Proceeds With Amended Complaint Against Goldman Sachs And Bank of America Corporation Subsidiary Merrill Lynch
2011-02-02 00:00:00,Robbins Geller Rudman Dowd LLP Files Class Action Suit Against Bank of America Corporation
2011-02-03 00:00:00,QBE Insurance Group Limited On Talks To Buy US Insurer From Bank of America
2011-02-08 00:00:00,The Briscoe Law Firm Investigates Bank of America Corporation On Behalf of Shareholders For Possible Breaches of Fiduciary Duties By Officers And Directors
2011-02-16 00:00:00,Klayman Toskes Files Million Claim Against Bank of America Merrill Lynch
2011-02-18 00:00:00,Signature Metals Limited Announces Voting Power Of Bank of America Corporation
2011-03-02 00:00:00,Emergency Medical Services And Bank of America Sued Over Company
2011-03-14 00:00:00,Altona Mining Limited Announces Ownership Interest Of Bank of America Corporation
2011-03-17 00:00:00,Bank of America Corporation Declares Quarterly Dividend On Series L Preferred Stock
2011-03-22 00:00:00,Prosperity Resources Limited Announces Holding Interest Of Bank Of America Corporation
2011-03-29 00:00:00,Keller Rohrback Announces Investigation of Bank of America Corporation And JPMorgan Chase Regarding Force Placed Insurance
2011-03-30 00:00:00,Glancy Binkow Goldberg LLP Announces Class Action Lawsuit Against Bank of America Corporation
2011-03-31 00:00:00,Labaton Sucharow LLP Files Class Action Lawsuit On Behalf Of Investors In Bank of America Corporation
2011-04-04 00:00:00,Bank of America Corporation Declares Preferred Dividends
2011-04-08 00:00:00,Woori Investment Securities In Talks To Buy Bank of America Merrill South Korean PB
2011-04-25 00:00:00,The Securities Arbitration Law Firm of Klayman Toskes Files Million Claim Against Bank of America Merrill Lynch
2011-04-29 00:00:00,Signature Metals Limited Announces Ownership Interest Of Bank of America Corporation
2011-05-02 00:00:00,Thornburg Mortgage Bankruptcy Trustee Sues Banks Including Bank of America Corporation For
2011-05-09 00:00:00,Saracen Mineral Holdings Limited Announces Holding Bank of America Corporation
2011-05-16 00:00:00,Bank of America Corporation Launches Small Business Charge Cards
2011-06-17 00:00:00,Bank of America Corporation Declares Quarterly Dividend On Series L Preferred Stock
2011-06-21 00:00:00,Bank of America Corporation May Sell Part Of China Construction Bank Corporation Stake Later This
2011-06-28 00:00:00,New York Top Court Revives Banks Including Bank of America Lawsuit Versus MBIA
2011-07-05 00:00:00,Bank of America Corporation Declares Preferred Dividends
2011-07-06 00:00:00,Finkelstein Thompson LLP Announces Investigation Of Bank of America Corporation
2011-07-07 00:00:00,Judge Rules Homeowners May Pursue Lawsuit Against Bank of America Corporation
2011-07-12 00:00:00,MBIA And Bank of America Merrill Lynch Co To Dismiss
2011-08-17 00:00:00,Bank of America Corporation Mulls Foreclosure Probe
2011-08-29 00:00:00,FDIC Intervenes In Bank of America Billion Mortgage
2011-08-30 00:00:00,US As Sues Bank of America Corporation Over
2011-08-31 00:00:00,Hagens Berman Announces Securities Investigation Of Bank of America Corporation
2011-09-09 00:00:00,Bank of America Corporation Discussing About Job
2011-09-12 00:00:00,Bank of America Corporation Plans Job
2011-09-16 00:00:00,Bank of America Corporation Declares Quarterly Dividend On Series L Preferred Stock
2011-09-27 00:00:00,Hagens Berman Advances Investigation of Bank of America Corporation Following Lawsuit Filing
2011-09-29 00:00:00,Invesco Square Mile Canyon Combine To Acquire Million Loan Portfolio From Bank of America
2011-10-20 00:00:00,US Judge Takes Billion Bank of America Corporation Deal From State
2011-10-21 00:00:00,American International Loses Bid To Move Billion Fraud Case Versus Bank of America
2011-11-07 00:00:00,Bank of America Corporation Considering Further Stake Sale In China Construction Bank
2011-11-14 00:00:00,Bank of America Corporation Selling Most Of Remaining China Construction Bank Corporation
2011-11-18 00:00:00,Bank of America Corporation Declares Quarterly Dividends
2011-12-06 00:00:00,Bank of America Merrill Unit In Million Mortgage
2011-12-07 00:00:00,Bank of America Corporation Loses Bid To Oust American International Law Firm From
2011-12-16 00:00:00,Bank of America Corporation Declares Quarterly Dividend on Series L Preferred Stock
2012-01-25 00:00:00,The Securities Arbitration Law Firm of Klayman Toskes Launches Investigation On Behalf Of Customers Of Phil Scott Team And Bank of America Merrill Lynch
2012-02-07 00:00:00,Bank of America Corporation Wins Class Action
2012-03-05 00:00:00,Bank Of America Corporation Ceases To Be Substantial Holder In Beach Energy Limited
2012-03-06 00:00:00,Bank Of America Corporation Acquires Stake In Beach Energy Limited
2012-03-22 00:00:00,Bank of America Corporation Decreases Stake In Elders Limited
2012-03-23 00:00:00,Bank of America Corporation Ceases To Be Substantial Holder In Platinum Australia Limited
2012-03-29 00:00:00,Bank Of America Corporation Ceases To Be Substantial Holder In Beach Energy Limited
2012-04-03 00:00:00,Bank Of America Corporation Acquires Stake In Beach Energy Ltd
2012-04-11 00:00:00,Bank of America Corporation Declares Quarterly Dividends
2012-04-17 00:00:00,Bank of America Corporation Puts Wealth Arm Up For
2012-04-18 00:00:00,Apple Visa Intel The Company and Bank of America Corp Start Trading on Bucharest The Corporate Wire
2012-04-24 00:00:00,MacroSolve Inc Files Patent Infringement Suits Against Inc And Bank of America Corporation
2012-04-25 00:00:00,Judge Denies American International Motion In Bank of America Billion
2012-04-27 00:00:00,Bank of America Corporation Ceases To Be Substantial Shareholder Of Noble Mineral Resources Ltd
2012-05-01 00:00:00,Bank of America Corporation Planning More Job
2012-05-10 00:00:00,NY Fed Sells American International Bailout Assets To Bank of America Merrill Leaving Citigroup And
2012-05-25 00:00:00,Bank of America Corp and Barclays Bank Subsidiary Enters Into Agreement To Sell Remaining Interest In Archstone to Lehman Brothers Subsidiary
2012-06-22 00:00:00,Cuts Ratings Of 15 Banks Including Bank of America Morgan Stanley Down Two
2012-07-03 00:00:00,Bank of America Corp Declares Preferred Dividends
2012-07-06 00:00:00,Bank of America Corporation Ceases To Be Shareholder Of Resolute Mining Limited
2012-07-11 00:00:00,Bank of America Corp Declares Quarterly Dividends
2012-07-17 00:00:00,Syncora Holdings Ltd Settles Litigation With Countrywide Financial Bank of America Corporation And Affiliates
2012-08-13 00:00:00,Julius Baer Gruppe AG To Acquire Merrill International Wealth Management Business Outside United States From Bank of America Corporation
2012-08-14 00:00:00,Bank of America Corp Acquires Stake In IOOF Holdings Limited
2012-08-16 00:00:00,Stanmore Coal Ltd Announces Holding Interest Of Bank Of America Corporation And Its Related Corporate Bodies
2012-08-24 00:00:00,Dart Energy Ltd Announces Holding Interest Of Bank Of America Corporation And Its Related Corporate Bodies
2012-08-30 00:00:00,Bank Of America Corporation And Its Related Corporate Bodies Cease To Be Substantial Shareholders Of Indophil Resources NL
2012-09-17 00:00:00,Bank of America Corp Declares Quarterly Dividend on Series L Preferred Stock
2012-09-28 00:00:00,Bank of America Corp Reaches Settlement in Merrill Lynch Class Action Litigation
2012-10-22 00:00:00,Market Bank of Baker and
2012-10-24 00:00:00,Bank of America Corp Declares Quarterly Dividends
2012-10-25 00:00:00,Bank of America Declares Quarterly Dividends
2012-10-31 00:00:00,Bank of America Provides Relief in Wake of Hurricane Sandy
2012-11-05 00:00:00,Mortgage Rates Slight Upticks at Bank of America
2012-11-06 00:00:00,Top 6 Volume Hot Bank of Ford
