2010-11-17 00:00:00,Mitsubishi Motors Corporation Teams With Best Buy And Eaton Corporation For
2010-12-14 00:00:00,Best Buy Lowers FY 2011 EPS Guidance
2010-12-15 00:00:00,Best Buy Announces Regular Quarterly Cash Dividend
2011-02-01 00:00:00,Best Buy Announces Resignation Of Chief Executive 8K
2011-02-18 00:00:00,Robbins Geller Rudman Dowd LLP Files Class Action Suit Against Best Buy
2011-02-22 00:00:00,Harwood Feffer LLP Commences Class Action Lawsuit Against Best Buy
2011-02-23 00:00:00,Brower Piven Announces Class Action Lawsuit Against Best Buy
2011-03-17 00:00:00,Law Firm of Barroway Topaz Kessler Meltzer LLP Announces Shareholder Class Action Filed Against Best Buy
2011-03-21 00:00:00,The Law Firm of Weiss Lurie Investigates Best Buy
2011-03-24 00:00:00,Best Buy Issues FY 2011 Revenue Guidance Above Raises FY 2011 EPS Comments On FY 2011 Comparable Store Sales Guidance
2011-04-15 00:00:00,Joint Venture Of Carphone Warehouse Group plc And Best Buy Enters Into Agreement To Sell Retail Business To Belgacom
2011-06-15 00:00:00,Best Buy Sees FY 2012 Revenue Guidance At High End Of Prior Reaffirms FY 2012 Earnings Call
2011-12-13 00:00:00,Best Buy Issues FY 2012 Guidance In Line With Call
2012-03-29 00:00:00,Best Buy Issues FY 2013 Guidance In Line With Sees FY 2013 Charge Call
2012-04-10 00:00:00,Best Buy Announces Resignation Of Chief Executive Officer
2012-04-11 00:00:00,Best Buy Co Inc Board Still Probing
2012-05-14 00:00:00,Best Buy Releases Results of Independent New Chairman Of The Board Elected
2012-06-26 00:00:00,Best Buy Founder Works With Credit Suisse On
2012-07-20 00:00:00,Levi LLP Launches Investigation Into Possible Breaches Of Fiduciary Duty By Board Of Directors Of Best BUY Co Inc In Connection With Executive Compensation
2012-08-20 00:00:00,Best BUY Co Inc Offers Due Diligence Plan to Richard Schulze Declines
2012-08-21 00:00:00,Best BUY Co Inc Suspends FY 2013 Profit Outlook And
2012-08-27 00:00:00,Best BUY Co Inc And Founder Richard Schulze Reaches Agreement Permitting Schulze To Form Investment Group And Conduct Due Diligence
2012-10-12 00:00:00,Best Buy To Match Pricing This Holiday Season
2012-10-16 00:00:00,Is Best Buy a Good
2012-10-17 00:00:00,Best Buy to Sell its Own Tablet for
2012-10-23 00:00:00,Corp Files Patent Infringement Lawsuits Against Diasonic Technology Korg Yamaha Best Buy And Others
2012-10-24 00:00:00,The Zacks Analyst Blog Best
2012-10-25 00:00:00,Best Buy Shares Fall On Weak Q3 Management Rejig
2012-10-31 00:00:00,Stocks In The Walt Disney Company Best Buy Inc
2012-11-02 00:00:00,Best Buy reschedules analyst day postponed by Hurricane Sandy
2012-11-05 00:00:00,Analyst Opinion on Best Buy and GameStop Electronics Stores
