2011-06-21 00:00:00,Best Buy Raises Dividend By Plans Billion Stock
2011-06-28 00:00:00,AU Optronics Suing Samsung Electronics And Its Customers Including Best Buy On LCD Patent
2011-11-07 00:00:00,Carphone Warehouse Group plc Enters Into Series Of Transactions With Best Buy
2011-11-11 00:00:00,Best Buy Issues H2 2012 Charge Call
2012-06-07 00:00:00,Best BUY Co Inc Chairman
2012-06-21 00:00:00,Best BUY Co Inc Lifts Quarterly Dividend
2012-08-06 00:00:00,Rigrodsky Announces Investigation Of Best Buy Proposed Buyout
2012-08-07 00:00:00,Faruqi LLP Seeking More Cash For Shareholders Of Best BUY Co Inc
2012-08-08 00:00:00,Law Offices of Howard Smith Announces Investigation Of Best BUY Co Inc
2012-10-08 00:00:00,Weekly Top Insider FNFG
2012-10-09 00:00:00,Best BUY Co Inc CFO Looks For
