2010-11-11 00:00:00,Declares Quarterly Dividend Of On Common Stock
2010-11-15 00:00:00,Completes Secondary Offering Of Common Stock
2011-01-05 00:00:00,AZ Electronic Materials Group Announces Holding Interest Of
2011-01-11 00:00:00,Inc Reaches Stake in BR Malls Participacoes SA
2011-02-01 00:00:00,Reaches Stake in Totvs SA
2011-02-07 00:00:00,Increases Its Indirect Stake In Maple Energy plc Of
2011-02-14 00:00:00,Ffastfill plc Announces Holding Interest Of
2011-02-18 00:00:00,Weatherly International plc Announces Holding Interest Of
2011-02-24 00:00:00,Announces Dividend Increase
2011-02-28 00:00:00,Establishes Renewable Power Investment Announces Strategic Relationship Agreement With NTR plc
2011-03-31 00:00:00,Inc And Mizuho Financial Sign Business Alliance Agreement
2011-05-09 00:00:00,Launches New India Fund
2011-05-19 00:00:00,To Sell Two Part Debt
2011-05-20 00:00:00,iShares Exchange Traded Funds Announces Launch of Two New Bond Funds
2011-05-25 00:00:00,Declares Quarterly Cash Dividend
2011-05-31 00:00:00,Reaches Stake in Delhaize Group
2011-06-29 00:00:00,Bank of America Corporation Near Billion Settlement On Securities From Investor Group Includes BlackRock MetLife
2011-10-24 00:00:00,Raises Stake In Fresenius Medical Care AG
2011-11-29 00:00:00,Declares Quarterly Dividend Of On Common Stock
2012-01-11 00:00:00,To Acquire Claymore Inc
2012-01-23 00:00:00,Reports Acquisition of Interest in SBM Offshore
2012-02-23 00:00:00,Announces Increase In Quarterly Common Stock Increases Share Repurchase Availability To Million Shares
2012-03-07 00:00:00,Completes Acquisition Of Claymore
2012-04-03 00:00:00,iShares Exchange Traded Funds Launches New Income Focused Exchange Traded Funds
2012-07-03 00:00:00,To Buy Swiss Re Private Equity
2012-10-10 00:00:00,Fink Says Banks Would Get Boost From Resolution Plan
2012-10-15 00:00:00,Fiscal Cliff Risks US Chief Says
2012-10-16 00:00:00,BlackRock Buys at Tipping Muni Credit
2012-10-17 00:00:00,BlackRock Beats Revenue Rises Analyst Blog
2012-10-18 00:00:00,Normura Securities Reaffirms Buy Rating on Raises Price Target
2012-10-22 00:00:00,iShares Launches Core ETFs for International
2012-10-23 00:00:00,BlackRock Has Edge for Credit Suisse Citigroup Says
2012-10-24 00:00:00,Rendino to Retire From BlackRock as Geer Takes Over Role
2012-10-25 00:00:00,Fidelity Seeking Money Fund Deal With SEC
2012-10-26 00:00:00,Konecranes Abp Announces Holding Increase in Company
2012-11-01 00:00:00,iShares 529 Plan Expands Portfolio Lineup
2012-11-05 00:00:00,iShares Brings Financial Advisors and Industry Leaders
