2011-01-18 00:00:00,Ball Corporation Completes Acquisition of Aerocan
2011-01-26 00:00:00,Ball Corporation Elects New CEO And Increases Dividend By Authorizes Common Stock Repurchase
2011-01-27 00:00:00,Ball Corporation Issues FY 2011 Earnings Guidance Above Estimates
2011-07-12 00:00:00,Ball Corporation Delists From Chicago Exchange
2011-07-28 00:00:00,Ball Corporation Comments On Long Term Earnings Call
2011-09-09 00:00:00,NASA Selects Ball Ball Aerospace Technologies To Develop Cryogenic Storage And Transfer Concepts For Demonstration Mission
2011-11-30 00:00:00,NASA Selects Ball Corporation To Study Solar Electric Propulsion Spacecraft
2012-01-25 00:00:00,Ball Corporation Announces Increase In Approves Repurchase Authorization
2012-01-26 00:00:00,Ball Corporation Reaffirms Long Term EPS Call
2012-02-01 00:00:00,Ball Corporation Announces Accelerated Stock Repurchase
2012-04-25 00:00:00,Ball Corporation Board Declares Quarterly Dividend
2012-04-26 00:00:00,Ball Corporation Reaffirms Long Term EPS Comments On FY 2012 EPS Call
2012-07-25 00:00:00,Ball Corporation Declares Quarterly Dividend
2012-07-26 00:00:00,Ball Corporation Reaffirms FY 2012 EPS Call
2012-10-10 00:00:00,Ball Stock Rating Reaffirmed by Jefferies Group
2012-10-25 00:00:00,BLL Dividend Stocks Update
2012-10-26 00:00:00,Silgan Misses by a Penny Analyst Blog
2012-11-05 00:00:00,After Hours Most Active for Nov 2012 FTR
2012-11-06 00:00:00,Profit Slides in 4Q Analyst Blog
