2010-12-03 00:00:00,BMC Acquires GridApp
2010-12-29 00:00:00,BMC Help Galaxy Software Services Customers Optimize Mainframe
2011-03-02 00:00:00,BMC Selects Ingram As Authorized US Distribution Partner
2012-02-21 00:00:00,Leading Australian Bank Improves Customer Service With BMC
2012-06-12 00:00:00,BMC Reaffirms FY 2012 Call
2012-08-22 00:00:00,CompuCom Taps BMC To Drive Greater Strategic Business Value From Cloud
2012-09-11 00:00:00,Infoplex to Implement BMC Software Business Service Management Platform
2012-10-12 00:00:00,BMC Software intros new portfolio for access to Amazon cloud
2012-10-24 00:00:00,BMC Software reportedly in talks with potential buyers
2012-10-26 00:00:00,BMC Software Second Quarter Earnings Sneak Peek
