2010-11-30 00:00:00,TelstraClear Overhauls IT Service Management With BMC
2010-12-13 00:00:00,University of Arizona Goes from Old School IT to Cutting Edge with BMC
2010-12-14 00:00:00,Rand Capital Corporation Announces Sale of Software GridApp BMC
2011-02-28 00:00:00,Cash Converters to Manage IT Services with BMC SaaS solution
2011-05-04 00:00:00,BMC Issues FY 2012 Guidance In Line With Estimates
2011-06-16 00:00:00,BMC And Unisys Corporation Announces Joint Venture To Deliver Cloud Solutions
2011-07-27 00:00:00,BMC Raises FY 2012 EPS Reaffirms FY 2012 Revenue Guidance
2012-01-11 00:00:00,Tradentrix Chooses BMC Remedyforce Service Desk Solution
2012-01-31 00:00:00,BMC And VCE Form Strategic Alliance
2012-02-01 00:00:00,BMC Raises FY 2012 EPS Reaffirms FY 2012 Revenue Guidance
2012-02-29 00:00:00,BMC Teams With Servicesource International Inc To Deliver Higher Service Revenue Performance
2012-05-09 00:00:00,BMC Issues FY 2012 Revenue Guidance Below Estimates
2012-05-14 00:00:00,BMC Notified That Elliott Has Acquired Over Of The Company
2012-07-31 00:00:00,BMC Issues FY 2013 Guidance In Line With Call
2012-10-22 00:00:00,BMC CUSTOMER Better Place Gets Even Better
2012-11-01 00:00:00,selects FootPrints solution to manage IT assets
2012-11-02 00:00:00,MyIT May Be the Future of IT Services
2012-11-06 00:00:00,BMC CUSTOMER Australian Communications Leader
