2010-11-22 00:00:00,New Zealand Transport Agency Selects BMC For Service Desk Solution
2010-12-03 00:00:00,BMC Acquires GridApp
2010-12-08 00:00:00,And BMC Transform IT Management With Launch Of RemedyForce
2010-12-13 00:00:00,University of Arizona Goes from Old School IT to Cutting Edge with BMC
2010-12-14 00:00:00,Rand Capital Corporation Announces Sale of Software GridApp BMC
2010-12-15 00:00:00,Victorian Government Selects BMC Operations Monitoring and Management Platform
2010-12-29 00:00:00,BMC Help Galaxy Software Services Customers Optimize Mainframe
2011-02-28 00:00:00,Cash Converters to Manage IT Services with BMC SaaS solution
2011-07-07 00:00:00,BMC Acquires Aeroprise
2011-10-26 00:00:00,BMC Lower FY 2012 Guidance
2012-01-17 00:00:00,BMC Extends MainView Monitoring And Automation Suite With Concepts Acquisition
2012-01-30 00:00:00,BMC Enters Into Definitive Agreement To Acquire Numara Software
2012-01-31 00:00:00,BMC And VCE Form Strategic Alliance
2012-02-01 00:00:00,BMC Raises FY 2012 EPS Reaffirms FY 2012 Revenue Guidance
2012-02-21 00:00:00,Leading Australian Bank Improves Customer Service With BMC
2012-05-14 00:00:00,BMC Notified That Elliott Has Acquired Over Of The Company
2012-06-12 00:00:00,BMC Reaffirms FY 2012 Call
2012-08-08 00:00:00,BMC Acquires VaraLogix
2012-08-22 00:00:00,CompuCom Taps BMC To Drive Greater Strategic Business Value From Cloud
2012-09-11 00:00:00,Infoplex to Implement BMC Software Business Service Management Platform
