2010-11-16 00:00:00,Accenture Plc And BMC Software Expand Relationship With Technology Joint Development And Delivery Agreements
2010-11-22 00:00:00,New Zealand Transport Agency Selects BMC For Service Desk Solution
2010-11-30 00:00:00,TelstraClear Overhauls IT Service Management With BMC
2010-12-03 00:00:00,BMC Acquires GridApp
2010-12-08 00:00:00,And BMC Transform IT Management With Launch Of RemedyForce
2010-12-13 00:00:00,University of Arizona Goes from IT to Cutting Edge with BMC
2010-12-14 00:00:00,Rand Capital Corporation Announces Sale of Software GridApp BMC
2010-12-15 00:00:00,Victorian Government Selects BMC Operations Monitoring and Management Platform
2010-12-29 00:00:00,BMC Help Galaxy Software Customers Optimize Mainframe
2011-02-28 00:00:00,Cash Converters to Manage IT Services with BMC SaaS solution
2011-03-02 00:00:00,BMC Selects Ingram As Authorized US Distribution Partner
2011-04-28 00:00:00,BMC Acquires Coradiant
2011-05-04 00:00:00,BMC Issues FY 2012 Guidance In Line With Estimates
2011-06-08 00:00:00,China UnionPay Centralizes IT Monitoring And Management With BMC
2011-06-16 00:00:00,BMC And Unisys Corporation Announces Joint Venture To Deliver Cloud Solutions
2011-07-07 00:00:00,BMC Acquires Aeroprise
2011-07-27 00:00:00,BMC Raises FY 2012 EPS Reaffirms FY 2012 Revenue Guidance
2011-10-26 00:00:00,BMC Lower FY 2012 Guidance
2011-12-07 00:00:00,BMC And Cisco Deliver Superior Clouds Globally
2012-01-11 00:00:00,Tradentrix Chooses BMC Remedyforce Service Desk Solution
2012-01-17 00:00:00,BMC Extends MainView Monitoring And Automation Suite With Concepts Acquisition
2012-01-30 00:00:00,BMC Enters Into Definitive Agreement To Acquire Numara Software
2012-01-31 00:00:00,BMC And VCE Form Strategic Alliance
2012-02-01 00:00:00,BMC Raises FY 2012 EPS Reaffirms FY 2012 Revenue Guidance
2012-02-21 00:00:00,Leading Australian Bank Improves Customer Service With BMC
2012-02-29 00:00:00,BMC Teams With Servicesource International Inc To Deliver Higher Service Revenue Performance
2012-05-09 00:00:00,BMC Issues FY 2012 Revenue Guidance Below Estimates
2012-06-12 00:00:00,BMC Reaffirms FY 2012 Call
2012-07-31 00:00:00,BMC Issues FY 2013 Guidance In Line With Call
2012-08-08 00:00:00,BMC Acquires VaraLogix
2012-08-22 00:00:00,CompuCom Taps BMC To Drive Greater Strategic Business Value From Cloud
2012-09-11 00:00:00,Infoplex to Implement BMC Software Business Service Management Platform
2012-10-31 00:00:00,BMC Software Inc Reaffirms FY 2012 Guidance
2012-11-01 00:00:00,Notable Quarterly Results GGP
