2010-12-08 00:00:00,And BMC Transform IT Management With Launch Of RemedyForce
2010-12-14 00:00:00,Rand Capital Corporation Announces Sale of Software GridApp BMC
2011-02-28 00:00:00,Cash Converters to Manage IT Services with BMC SaaS solution
2011-07-07 00:00:00,BMC Acquires Aeroprise
2012-01-17 00:00:00,BMC Extends MainView Monitoring And Automation Suite With Concepts Acquisition
2012-01-31 00:00:00,BMC And VCE Form Strategic Alliance
2012-05-14 00:00:00,BMC Notified That Elliott Has Acquired Over Of The Company
2012-06-12 00:00:00,BMC Reaffirms FY 2012 Call
2012-10-01 00:00:00,BMC Rises on Report That It Hired Bank to Explore Sale
2012-10-02 00:00:00,BMC Software Explores Potential Sale
2012-10-22 00:00:00,BMC CUSTOMER Better Place Gets Even Better
