2011-02-01 00:00:00,Bemis Issues Q1 2011 EPS Guidance Below Issues FY 2011 EPS Guidance In Line With Call
2011-04-28 00:00:00,Bemis Issues Q2 2011 EPS Guidance Below Lowers FY 2011 EPS Call
2011-07-27 00:00:00,Bemis Co Inc Issues Q3 2011 EPS Guidance Below Lowers FY 2011 EPS Call
2012-05-03 00:00:00,Bemis Company Inc Declares Regular Quarterly Dividend
2012-07-10 00:00:00,Bemis Company Inc and Thin Film Electronics ASA To Develop Intelligent Packaging STORY
2012-08-02 00:00:00,Bemis Company Inc Declares Regular Quarterly Dividend
2012-10-10 00:00:00,Research Ratings Reiterations for 10th BAYN
2012-10-12 00:00:00,Neutral on Bemis Analyst Blog
2012-10-19 00:00:00,Colfax Corp Larger Than 500 Component Bemis
2012-10-26 00:00:00,Equities Research Ratings Reiterations for 26th AC
2012-11-02 00:00:00,Sealed Air Falls Short of Estimates Analyst Blog
2012-11-05 00:00:00,3 Dependable Dividend Stocks With Great Returns
2012-11-07 00:00:00,Bemis Company Momentum
