2010-11-11 00:00:00,Broadcom Corporation Declares Quarterly Dividend
2010-12-14 00:00:00,Broadcom Corporation Announces New Embedded NFC Tag Technology To Simplify Wireless Device Connectivity
2010-12-28 00:00:00,Broadcom Corporation Completes Acquisition Of Gigle Networks
2011-01-20 00:00:00,Broadcom Corporation And Reach Agreement To End Litigations
2011-02-09 00:00:00,Broadcom Corporation Announces Smartphone Baseband Chip With Cellular Modem And Merlyn Applications Processor
2011-02-23 00:00:00,Broadcom Corporation Launches Adapter With Full Offload Capabilities
2011-03-22 00:00:00,Topway Selects Broadcom Ethernet Over Coax Technology
2011-05-05 00:00:00,Broadcom Corporation Declares Quarterly Dividend
2011-05-23 00:00:00,Broadcom Corporation Completes Acquisition Of SC Square
2011-07-25 00:00:00,Broadcom Corporation Issues Q3 2011 Revenue Guidance In Line With Estimates
2011-09-06 00:00:00,Broadcom Corporation Strengthens TV Market With New Satellite Out Door Unit Technology
2011-09-09 00:00:00,Rovi Corporation And Broadcom Corporation Collaborate To Deliver Entertainment Experience
2011-09-12 00:00:00,Broadcom Corporation To Acquire NetLogic
2011-10-25 00:00:00,Broadcom Corporation Issues Q4 2011Revenue Guidance Below Estimates
2011-11-09 00:00:00,Broadcom Corporation Declares Quarterly Dividend
2012-02-17 00:00:00,Broadcom Corporation Completes Acquisition Of NetLogic
2012-10-19 00:00:00,Earnings Preview Broadcom Corporation Analyst Blog
2012-10-24 00:00:00,Broadcom Third Quarter Profit Tops Wall Street Guidance
