2010-11-15 00:00:00,Broadcom Corporation Completes Acquisition Of Percello
2010-12-22 00:00:00,Broadcom Corporation Receives Favourable Claim Construction Ruling in Patent Infringement Case Against Emulex Corporation
2010-12-28 00:00:00,Broadcom Corporation Completes Acquisition Of Gigle Networks
2011-03-21 00:00:00,Broadcom Corporation To Acquire Provigent
2011-03-22 00:00:00,Topway Selects Broadcom Ethernet Over Coax Technology
2011-04-08 00:00:00,NXP Semiconductors NV In Takeover Talks With Intel QUALCOMM And Broadcom
2011-05-04 00:00:00,NXP Semiconductors NV Plays Down Takeover Speculation With Intel QUALCOMM And Broadcom Corporation
2011-05-23 00:00:00,Broadcom Corporation Completes Acquisition Of SC Square
2012-02-17 00:00:00,Broadcom Corporation Completes Acquisition Of NetLogic
2012-04-05 00:00:00,Broadcom Corporation Completes Acquisition of BroadLight
2012-07-03 00:00:00,MIPS Signs Million Tech License Accord With Broadcom
2012-07-05 00:00:00,Broadcom Corporation And Emulex Corporation Reach Partial Settlement
2012-08-13 00:00:00,Broadcom Corp To Offer Senior Notes
2012-08-23 00:00:00,Broadcom Corp and Other Companies Form
2012-10-16 00:00:00,Broadcom Demonstrates Next Generation VDSL2 Residential Gateway Platform
2012-10-17 00:00:00,BROADCOM CORPORATION Broadcom Joins Alliance for Wireless Power
