2010-11-22 00:00:00,Broadcom Corporation To Acquire Gigle Networks
2010-11-24 00:00:00,Broadcom Corporation Completes Acquisition Of Beceem
2010-12-02 00:00:00,Rambus Files ITC Complaint Against Broadcom Freescale LSI MediaTek NVIDIA And STMicroelectronics
2011-01-05 00:00:00,LG Electronics Selects Broadcom Chipsets For Use In Wireless Connected Digital TVs
2011-01-06 00:00:00,Broadcom Corporation Secures Contract From Samsung Electronics Ltd
2011-01-10 00:00:00,Broadcom Corporation And CSR plc Settle All Litigation
2011-02-01 00:00:00,Broadcom Corporation Announces Increase In Quarterly Cash Dividend
2011-03-21 00:00:00,Broadcom Corporation To Acquire Provigent
2011-04-26 00:00:00,Broadcom Corporation Issues Q2 2011 Revenue Guidance Below Estimates
2011-05-04 00:00:00,NXP Semiconductors NV Plays Down Takeover Speculation With Intel QUALCOMM And Broadcom Corporation
2011-06-30 00:00:00,Selects Broadcom Broadcom Premier Custom IC Program
2011-08-11 00:00:00,Broadcom Corporation Declares Quarterly Dividend
2011-12-14 00:00:00,Broadcom Corporation Sees Q4 2011 Revenue Guidance At High End Of Prior Range
2012-03-21 00:00:00,Broadcom Corporation Signs Definitive Agreement To Acquire
2012-05-01 00:00:00,Broadcom Corporation Issues Q2 2012 Revenue Guidance In Line With Estimates
2012-05-15 00:00:00,Broadcom Corporation Declares Quarterly Dividend
2012-06-27 00:00:00,Broadcom Corporation Secures Contract From Alliance
2012-07-03 00:00:00,MIPS Signs Million Tech License Accord With Broadcom
2012-08-16 00:00:00,Broadcom Corp Declare Quarterly Dividend
2012-10-16 00:00:00,BROADCOM CORPORATION Broadcom Delivers GPON Product Portfolio with
2012-10-17 00:00:00,BROADCOM CORPORATION Broadcom Joins Alliance for Wireless Power
2012-10-18 00:00:00,Broadcom to equip vehicles with ethernet
2012-10-23 00:00:00,Broadcom Corp Issues Q4 2012 Revenue Guidance Below Estimates
2012-11-05 00:00:00,Upside Potential Suggests A Buy
