2011-03-01 00:00:00,BroadSoft Inc Announces HD Video Conferencing Service
2011-11-07 00:00:00,BroadSoft Inc Issues Q4 2011 Guidance In Line With Raises FY 2011 Guidance
2012-02-07 00:00:00,OXYCOM Selects BroadSoft Inc To Power Cloud Delivery Platform in Poland
2012-02-29 00:00:00,BroadSoft Inc Issues Q1 2012 Revenue Guidance Above Issues FY 2012 Revenue Below Estimates
2012-10-16 00:00:00,BROADSOFT BroadSoft Introduces Call Center Xpress
2012-10-17 00:00:00,OneAccess Networks and BroadSoft Announce Integration of BroadCloud
2012-10-19 00:00:00,Stock Verizon Hears Money Talking
2012-10-24 00:00:00,A Volatile Day
