2010-11-18 00:00:00,Cardinal To Acquire Kinray For Billion
2010-12-07 00:00:00,Cardinal Renews Distribution Agreement With Walgreens
2011-02-03 00:00:00,Cardinal Raises FY 2011 EPS Guidance
2011-04-28 00:00:00,Cardinal Raises FY 2011 EPS Guidance
2011-06-14 00:00:00,Cardinal Announces Opening Of First Cyclotron In Georgia
2011-08-03 00:00:00,Cardinal Announces Cash Dividend
2011-08-04 00:00:00,Cardinal Issues FY 2012 EPS Guidance Above Estimates
2011-10-27 00:00:00,Cardinal Reaffirms FY 2011 EPS Guidance
2011-12-05 00:00:00,Cardinal Launches Barcode Administration Solution
2011-12-20 00:00:00,Cardinal Cardinal Health Canada And Futuremed Healthcare Products Corp Announces Extension Of Offer
2012-02-02 00:00:00,Cardinal Raises FY 2012 EPS Guidance
2012-02-06 00:00:00,Cardinal Cardinal Health Canada Inc And Futuremed Healthcare Products Corp Announces Further Extension of Offer
2012-05-03 00:00:00,Cardinal Raises Low End Of Prior FY 2012 EPS Guidance To A Range In Line With Estimates
2012-08-02 00:00:00,Cardinal Issues FY 2013 EPS Guidance Below Estimates
2012-08-08 00:00:00,Cardinal Approves Cash Authorizes New Million Share Repurchase Program
2012-10-25 00:00:00,Cardinal Health First Quarter Earnings Sneak Peek
2012-10-31 00:00:00,Charting Cardinal Latest Earnings Release
2012-11-01 00:00:00,Cardinal Remains Neutral Analyst Blog
2012-11-05 00:00:00,Dividend Changes to Know Mercury DCP Midstream TD
