2010-11-18 00:00:00,Cardinal To Acquire Kinray For Billion
2010-12-07 00:00:00,Cardinal Renews Distribution Agreement With Walgreens
2011-02-03 00:00:00,Cardinal Raises FY 2011 EPS Guidance
2011-04-28 00:00:00,Cardinal Raises FY 2011 EPS Guidance
2011-08-03 00:00:00,Cardinal Announces Cash Dividend
2011-08-04 00:00:00,Cardinal Issues FY 2012 EPS Guidance Above Estimates
2011-12-05 00:00:00,Cardinal Launches Barcode Administration Solution
2012-02-02 00:00:00,Cardinal Raises FY 2012 EPS Guidance
2012-02-06 00:00:00,Cardinal Cardinal Health Canada Inc And Futuremed Healthcare Products Corp Announces Further Extension of Offer
2012-05-03 00:00:00,Cardinal Raises Low End Of Prior FY 2012 EPS Guidance To A Range In Line With Estimates
2012-08-02 00:00:00,Cardinal Issues FY 2013 EPS Guidance Below Estimates
2012-10-19 00:00:00,Cardinal Health Stock Rating Reaffirmed by Lazard
2012-10-25 00:00:00,Cardinal Health First Quarter Earnings Sneak Peek
2012-11-01 00:00:00,Cardinal Remains Neutral Analyst Blog
