2010-11-03 00:00:00,Callidus Software Secures New Business From Blue Cross of Northeastern Pennsylvania
2010-12-16 00:00:00,Callidus Software Announces New Data Center
2011-01-13 00:00:00,Selects Callidus Software To Drive Sales Performance Management
2011-01-14 00:00:00,Callidus Software Announces Formation Of CallidusRX Division
2011-02-25 00:00:00,Forcelogix Technologies Announces Completion Of Sale Of To Callidus Software
2011-03-04 00:00:00,Energy Systems Group Selects Callidus Software To Power Sales Performance Management
2011-03-11 00:00:00,MVP Health Care Implements Callidus Software ACom3 Suite
2011-03-22 00:00:00,Integra Telecom Selects Callidus Software Callidus Monaco On Demand Sales Performance Management Suite To Drive Sales Performance
2011-03-28 00:00:00,Callidus Software Acquires Salesforce Assessments
2011-05-11 00:00:00,Ingersoll Rand Selects Callidus Software Software Monaco On Demand Suite to Drive Sales Performance
2011-05-16 00:00:00,Callidus Software Announces Offering of Million Senior Convertible Notes Due 2016
2011-05-18 00:00:00,Callidus Software Announces Pricing Of Million Senior Convertible Notes Due 2016
2011-06-10 00:00:00,Callidus Software Acquires Litmos Limited
2011-07-01 00:00:00,Callidus Software Secures Contract
2011-07-06 00:00:00,Callidus Software Acquires iCentera
2011-08-15 00:00:00,Callidus Software Secures Contract From Tata Communications
2011-11-08 00:00:00,Callidus Software iCentera Receives Patent for Sales Enablement Platform
2011-11-18 00:00:00,G4S Selects Callidus Software Software Sales Coaching and Learning SaaS Solutions To Optimize Talent Development
2012-01-11 00:00:00,Global Leader In Data Solutions Selects Callidus Software CallidusCloud iCentera Sales Collaboration Platform
2012-03-01 00:00:00,Callidus Software Signs Partnership Agreement With SESTRA
2012-03-13 00:00:00,Callidus Software Expands Patent Acquires Two New Patents
2012-03-15 00:00:00,Callidus Software Inc Secures Contract
2012-03-27 00:00:00,Callidus Software Inc Selects LeadFormix Platform
2012-06-20 00:00:00,Broadstreet Data Selects Callidus Software LeadFormix Platform To Optimize Marketing Effectiveness And Revenue
2012-07-05 00:00:00,Colfondos Selects Callidus Software Commissions To Calculate Compensation For Sales Force
2012-07-25 00:00:00,Callidus Software Secures Contract
2012-08-02 00:00:00,Callidus Software Inc Issues FY 2012 Revenue Guidance In Line With Estimates
2012-10-02 00:00:00,Acteva Selects Callidus Software LeadFormix Marketing Automation Solution
2012-10-03 00:00:00,CallidusCloud Announces Integration With Oracle Sales and Marketing Cloud
2012-10-11 00:00:00,News Company Selects Callidus Software Commissions For Improved Sales Analytics
2012-10-12 00:00:00,Genesis Financial Solutions Selects Callidus Software Litmos Learning Management System
