2011-01-04 00:00:00,CalAmp Corp Issues Q4 2011 Revenue Guidance Below Estimates
2011-04-25 00:00:00,CalAmp Secures Contract To Upgrade Mobile Data Communications Network For Halton Regional Police Service
2012-08-01 00:00:00,CalAmp Corp Secures Contract To Create Mobile Data Communications Network
2012-09-25 00:00:00,CalAmp Corp Issues Q3 2013 EPS Guidance Above Issues Q4 2013 Revenue Guidance Above Estimates
2012-10-08 00:00:00,Stocks In News
2012-10-23 00:00:00,Facebook to Unveil Crucial Quarter Earnings on FB
