2011-02-03 00:00:00,CB Richard Ellis Issues FY 2011 EPS Guidance In Line With Estimates
2011-02-15 00:00:00,CB Richard Ellis Announces Definitive Agreements to Acquire Majority of ING Group Global Real Estate Investment Management Businesses
2011-03-07 00:00:00,CB Richard Ellis Announces Completion Of Financing for ING Real Estate Investment Management Acquisition
2011-06-28 00:00:00,TK Development Sells Entire Stake in Euro Mall Centre Management to CB Richard Ellis Inc
2011-07-01 00:00:00,CB Richard Ellis Announces Completion Of ING Clarion Real Estate Securities Acquisition
2011-10-18 00:00:00,CBRE Announces Plans For USD250 Million Equivalent Senior Secured Sterling Term Loan
2011-10-27 00:00:00,CBRE Reaffirms FY 2011 EPS Guidance
2012-02-06 00:00:00,CBRE Group Inc To Provide Property Management And Leasing Services For Million Houston Center
2012-02-07 00:00:00,CBRE Group Inc Issues FY 2012 EPS Guidance In Line With Estimates
2012-09-19 00:00:00,CBRE Group Inc to Provide Property Management Consultancy Services for Shanghai Tower
2012-09-24 00:00:00,CBRE Group Inc Acquisition of Affiliate in Vietnam
2012-10-08 00:00:00,Not New York Towers Rise With Embrace of Mortgages
2012-10-19 00:00:00,CBRE GROUP INC CBRE success at REIV Awards for Excellence
