2011-02-08 00:00:00,Declares Regular Quarterly Dividend
2011-02-11 00:00:00,Reaffirms FY 2011 Guidance
2011-09-12 00:00:00,Enterprises Inc Reaffirms FY 2011 EPS To Buy Back
2011-10-27 00:00:00,Enterprises Inc Raises FY 2011 EPS Reaffirms FY 2011 Revenue Raises Low End Of Prior FY 2011 EBIT Guidance
2011-11-10 00:00:00,Enterprises Inc Declares Regular Quarterly Dividend
2011-12-15 00:00:00,Enterprises Inc Reaffirms FY 2011 Revenue And EBIT Lowers FY 2011 EPS Call
2012-02-07 00:00:00,Enterprises Inc To Increase Quarterly Dividend
2012-02-09 00:00:00,Enterprises Inc Issues FY 2012 EPS And Revenue Guidance Above Estimates
2012-03-20 00:00:00,Enterprises Inc To Reaffirm FY 2012 Guidance
2012-04-24 00:00:00,Enterprises Inc Declares Regular Quarterly Dividend
2012-04-26 00:00:00,Enterprises Inc Reaffirms FY 2012 Guidance
2012-06-18 00:00:00,Enterprises Inc To Update FY 2012 Revenue To Reaffirm FY 2012 Earnings Guidance
2012-07-23 00:00:00,Enterprises Inc Revises FY 2012 Comments On Q3 2012 EPS Guidance
2012-07-25 00:00:00,Enterprises Inc Declares Regular Quarterly Dividend
2012-09-06 00:00:00,Enterprises Inc Confirms FY 2012 Guidance
2012-10-16 00:00:00,taps into waste heat for pilot energy project
2012-10-17 00:00:00,EPS Edges Fx Hurts Analyst Blog
2012-10-18 00:00:00,Global news 19 October 2012
2012-10-22 00:00:00,Enterprises Third Quarter Earnings Sneak Peek
2012-10-25 00:00:00,Enterprises Inc Raises Low End Of Prior FY 2012 EPS Guidance To A Range In Line With Lowers Low End Of Prior FY 2012 Revenue And Operating Income Guidance
2012-10-31 00:00:00,Plastics recycling opens up new ethnographic frontier
