2011-03-14 00:00:00,to Seek Secondary Listing on NYSE Euronext in Paris
2011-05-24 00:00:00,Announces Secondary Listing On NYSE Euronext
2011-07-26 00:00:00,Enterprises Inc Declares Regular Quarterly Dividend
2011-08-16 00:00:00,Enterprises Inc Plans Million Debt
2011-11-10 00:00:00,Enterprises Inc Declares Regular Quarterly Dividend
2012-04-24 00:00:00,Enterprises Inc Declares Regular Quarterly Dividend
2012-06-18 00:00:00,Enterprises Inc To Update FY 2012 Revenue To Reaffirm FY 2012 Earnings Guidance
2012-10-09 00:00:00,Is a Good Stock to
2012-10-10 00:00:00,DSD Refreshments
2012-10-16 00:00:00,taps into waste heat for pilot energy project
2012-10-17 00:00:00,EPS Edges Fx Hurts Analyst Blog
