2011-01-05 00:00:00,Crown Castle International Corp Comments On FY 2011 Revenue Call
2011-01-26 00:00:00,Crown Castle International Issues FY 2011 EPS In Line With Estimates
2011-04-13 00:00:00,Crown Castle International Declares Quarterly Preferred Stock Dividend Rate
2011-07-14 00:00:00,Crown Castle International Declares Quarterly Preferred Stock Dividend Rate
2011-12-16 00:00:00,Crown Castle International Announces Agreement To Acquire NextG
2012-01-12 00:00:00,Crown Castle International To Acquire Ground Lease Related Assets
2012-01-17 00:00:00,Crown Castle International Declares Quarterly Preferred Stock Dividend Rate
2012-01-25 00:00:00,Crown Castle International Issues Q1 2012 EBITDA Guidance In Line With Issues FY 2012 EBITDA Guidance Below Estimates
2012-02-01 00:00:00,Crown Castle International Crown Castle Operating Company Completes New Billion Credit Facility
2012-04-25 00:00:00,Crown Castle International Corp Issues Q2 2012 Mixed Raises FY 2012 Guidance
2012-10-03 00:00:00,Crown Castle International Corp Announces Pricing of Senior Notes Offering
2012-10-10 00:00:00,Crown Castle International Announces Revised Presentation Time at the
2012-10-15 00:00:00,Crown Castle Now Covered by Analysts at
2012-10-18 00:00:00,American Tower and Crown Castle Look to Benefit From Recent
2012-10-22 00:00:00,Earnings Crown Castle Analyst Blog
2012-10-24 00:00:00,Crown Castle International Corp Issues FY 2013 Earnings FY 2012 EBITDA Guidance Above FY 2013 EBITDA Guidance Below Estimates
2012-10-25 00:00:00,Stocks Forming an Upward Channel on
2012-10-26 00:00:00,Canaccord Genuity Boosts Numbers on Crown Castle Following Cash
2012-11-01 00:00:00,Stocks Forming an Upward Channel on
2012-11-05 00:00:00,KPN Said to Near Sale of Phone Towers to American Tower
