2010-12-21 00:00:00,Carnival plc Issues FY 2011 EPS Guidance Below Issues Q1 2011 EPS Guidance
2011-01-13 00:00:00,Carnival plc Announces Holding Interest Of Legal General Group Plc
2011-03-21 00:00:00,Carnival Holland America Line Partners With National Park Service
2011-06-21 00:00:00,Carnival Corporation Lowers FY 2011 Revenue Issue Q3 2011 Guidance Below Estimates
2011-09-01 00:00:00,Carnival Corporation Announces Quarterly Dividend
2012-06-22 00:00:00,Carnival Corporation Raises FY 2012 EPS Issues Q3 2012 EPS Guidance In Line With Estimates
2012-09-25 00:00:00,Carnival Corp Issues Q4 2012 EPS Guidance Below Narrows FY 2012 EPS Guidance To A Range Above Estimates
2012-10-15 00:00:00,Costa Concordia Captain Faces Victims at Hearing on Sinking
2012-10-25 00:00:00,Cruise Industry Is Throttling Up a Year After Costa Concordia
2012-10-26 00:00:00,Carnival Stock Rating Reaffirmed by Investec
2012-11-01 00:00:00,These Stocks are Forming a Rising Wedge on
2012-11-05 00:00:00,Royal Caribbean Cruises Momentum
