2010-01-21 00:00:00,Carnival plc To Resume Dividend
2011-03-21 00:00:00,Carnival Holland America Line Partners With National Park Service
2011-04-13 00:00:00,Carnival Corporation Declares Dividend
2012-10-09 00:00:00,Carnival Corp Declares Dividend
2012-10-15 00:00:00,Costa Concordia Captain Faces Victims at Hearing on Sinking
2012-10-26 00:00:00,Carnival Stock Rating Reaffirmed by Investec
2012-11-01 00:00:00,These Stocks are Forming a Rising Wedge on
2012-11-07 00:00:00,Price Target Changes for 7th AOL
