2011-04-05 00:00:00,ProMetic Life Sciences Enters Into Global Agreement With Celgene Corporation
2011-05-06 00:00:00,Celgene Corporation Announces Data From Multiple Phase III Studies
2011-11-22 00:00:00,Celgene Corporation Announces Discontinue Phase III MAINSAIL Trial in Prostate Cancer
2012-06-05 00:00:00,Celgene Celgene International Sarl Presents Results of Study into Use of ABRAXANE Combined with Gemcitabine in the Treatment of Resectable Pancreatic Cancer
2012-07-12 00:00:00,Celgene Celgene International Srl Announces Results Of Phase III Study In Patients With Psoriatic Arthritis
2012-10-24 00:00:00,Wells Fargo Securities Reiterates Outperform on Celgene
