2011-05-12 00:00:00,Cerner Corporation To Acquire Resource Systems
2011-10-27 00:00:00,Cerner Corporation Issues Q4 2011 Revenue Guidance Above Estimates
2011-11-25 00:00:00,Cellcura ASA Enters Reseller Agreement with Cerner Corporation
2012-02-07 00:00:00,Cerner Corporation Issues Q1 2012 Guidance In Line With Estimates
2012-07-23 00:00:00,Cerner Corporation And Launch Healthy Nevada Project
2012-10-10 00:00:00,CERNER CORPORATION Cerner and Nuance Expand Collaboration to
2012-10-11 00:00:00,Cerner Corp Stock Rating Reaffirmed by Jefferies Group
2012-10-22 00:00:00,Cerner Third Quarter Earnings Sneak Peek
2012-10-31 00:00:00,Cerner Remains Neutral Analyst Blog
2012-11-07 00:00:00,Insiders Sold These Stocks on
