2010-11-29 00:00:00,CareFusion Corporation Enters Into Exclusive Agreement With PHACTS To Improve Hospital Pharmacy Efficiency
2010-12-03 00:00:00,CareFusion Corporation Launches Clinical Pulmonary And Cardiopulmonary Diagnostics Software
2011-03-24 00:00:00,West Pharmaceutical And CareFusion Corporation Announce Plans To Develop Vented Vial Access Device
2011-05-05 00:00:00,CareFusion Corporation Raises Low End Of Prior FY 2011 EPS Guidance To A Range In Line With Reaffirms FY 2011 Revenue Guidance
2011-06-15 00:00:00,CareFusion Corporation Signs Exclusive BlisPack Distribution Agreement With Grifols To Help Improve Medication Safety In Hospitals
2011-07-25 00:00:00,Carefusion Corp And ResMed Announce Distribution Agreement For Hospital Market
2011-07-27 00:00:00,Surgical Innovations Group Plc Announces Distribution Agreement With Carefusion Corp
2011-08-01 00:00:00,Carefusion Corp Completes Acquisition Of Rowa
2011-08-08 00:00:00,Carefusion Corp Issues FY 2012 Guidance In Line With Estimates
2011-09-19 00:00:00,Carefusion Corp Launches New Emergency Transport Ventilator
2012-03-06 00:00:00,Carefusion Corp To Acquire LLC
2012-03-20 00:00:00,Carefusion Corp Announces Clearance And Launch Of New Advanced Electrodiagnostic System
2012-04-23 00:00:00,Carefusion Corp To Sell Neurodiagnostic Business To Natus Medical Inc For Million
2012-06-07 00:00:00,Carefusion Corp Announces Acquisition Of Medical Limited
2012-08-09 00:00:00,Carefusion Corp Issues FY 2013 Revenue Guidance Above Estimates
2012-10-09 00:00:00,FDA Nod for Analyst Blog
2012-10-10 00:00:00,CAREFUSION PRSENTIERT NEUES VERBLISTERUNGSKONZEPT AUF DER
2012-10-12 00:00:00,Notable Movers
2012-10-15 00:00:00,CareFusion Foundation Launches Grant Program To Support Infection
2012-10-19 00:00:00,Stocks In News
2012-10-26 00:00:00,The Zacks Analyst Blog Covidien and
2012-11-02 00:00:00,CAREFUSION CORPORATION CAREFUSION ANNOUNCES
2012-11-05 00:00:00,Forbes Earnings CareFusion
