2010-12-03 00:00:00,CareFusion Corporation Launches Clinical Pulmonary And Cardiopulmonary Diagnostics Software
2011-02-01 00:00:00,CareFusion Corporation Names Kieran Gallahue Chairman And CEO
2011-02-03 00:00:00,CareFusion Corporation To Sell International Surgical Products Distribution Business To Medline For Million
2011-06-15 00:00:00,CareFusion Corporation Signs Exclusive BlisPack Distribution Agreement With Grifols To Help Improve Medication Safety In Hospitals
2011-07-05 00:00:00,Carefusion Corp To Acquire Rowa
2011-08-01 00:00:00,Carefusion Corp Completes Acquisition Of Rowa
2011-08-08 00:00:00,Carefusion Corp Issues FY 2012 Guidance In Line With Estimates
2011-09-19 00:00:00,Carefusion Corp Launches New Emergency Transport Ventilator
2012-08-09 00:00:00,Carefusion Corp Issues FY 2013 Revenue Guidance Above Estimates
2012-11-06 00:00:00,Financial Review on Healthcare Stocks CareFusion and PerkinElmer Inc
