2010-12-09 00:00:00,Robinson Increases Its Quarterly Cash Dividend
2011-08-11 00:00:00,Robinson Declares Quarterly Cash Dividend
2012-10-17 00:00:00,Equity Ratings Changes for October DBD
2012-10-19 00:00:00,CH Robinson Worldwide Upgraded by Bank of America
2012-10-22 00:00:00,Market Influences That Drive Equities Forward Industry Report on Inc
2012-10-26 00:00:00,Robinson Worldwide Investment Weekly Ratings
2012-11-01 00:00:00,CH Robinson Worldwide Inc Acquires Phoenix International
2012-11-06 00:00:00,Yacktman Buys Boosts RIM Stake
2012-11-07 00:00:00,Opportunity in Recent Hurricane Presidential Election
