2011-04-21 00:00:00,Cliffs Natural Resources Inc Announces Settlement Agreement with Essar Steel Algoma
2011-06-06 00:00:00,Cliffs Natural Resources Inc Announces Public Offering of Common Shares
2012-02-02 00:00:00,Cliffs Natural Resources Cliffs Greene Announces Acquisition Of Common Shares of Debut Diamonds
2012-06-15 00:00:00,Cliffs Natural Resources Inc Announces North American Thermal Coal Sales and Production Volume Adjustments
2012-10-10 00:00:00,RAVN Among Charts to Watch
2012-10-15 00:00:00,Cliffs Natural Resources PT Lowered to
2012-10-22 00:00:00,6 Stocks in 60 CLF MTW BEAM SNDK REGN IFF
2012-11-01 00:00:00,Mining Stocks Poised to Cliffs Natural Resources
2012-11-06 00:00:00,Indicated Dividend Yield Ranking for the 500 by Industry
