2011-01-11 00:00:00,Cliffs Natural Resources Inc Declares Quarterly Cash Dividend On Common Shares
2011-06-07 00:00:00,Cliffs Natural Resources Inc Prices Public Offering of Common Shares
2011-08-08 00:00:00,Altius Minerals Corporation And Cliffs Natural Resources Cliffs Natural Resources Exploration Inc Announces Expanded Exploration Alliance
2012-01-11 00:00:00,Cliffs Natural Resources Declares Quarterly Cash Dividend On Common Shares
2012-02-07 00:00:00,Cliffs Natural Resources Inc To Dissolve Michigan Iron Nuggets Joint Venture With Kobe Steel
2012-10-25 00:00:00,US HOT Cliffs PSS World
