2011-01-03 00:00:00,The Clorox Updates On Share Lowers Upper End Of Prior FY 2011 Revenue Issues Q2 2011 Revenue Guidance Above Issues Q2 2011 Charge Guidance
2011-02-04 00:00:00,The Clorox Lowers FY 2011 EPS Guidance
2011-05-03 00:00:00,The Clorox Reaffirms FY 2011 Revenue Lowers High End Of Prior FY 2011 EPS Comments On FY 2012 Revenue Issues FY 2012 EPS Guidance Below Estimates
2011-05-19 00:00:00,The Clorox Increases Quarterly Dividend By to Per Share
2011-07-15 00:00:00,Harwood Feffer LLP Announces Investigation Of The Clorox
2011-07-18 00:00:00,The Clorox Rejects Icahn Bid As Too
2011-07-20 00:00:00,The Clorox Confirms Receipt Of Revised Unsolicited Conditional Proposal From Icahn Enterprises
2011-11-02 00:00:00,The Clorox Reaffirms FY 2012 Guidance
2012-05-02 00:00:00,The Clorox Comments On FY 2013 Revenue Issues FY 2012 EPS Guidance Below Updates On FY 2012 Revenue Reaffirms FY 2012 EPS Guidance
2012-10-09 00:00:00,Faruqi LLP Launches Investigation Against The Clorox Company For Potential Breaches Of Fiduciary Duties By Board Of Directors In Manner It Seeks Executive Compensation Approval
2012-10-10 00:00:00,The Clorox Dividend Stock Analysis
2012-10-19 00:00:00,X 5 Stock Reaching Their Date on October 22
2012-10-26 00:00:00,Clorox First Quarter Earnings Sneak Peek
2012-10-31 00:00:00,The Clorox Co Reaffirms FY 2013 Guidance
2012-11-01 00:00:00,Earnings Report for November 2012 MHP
2012-11-02 00:00:00,Price to Earnings Ratio According to Zacks Investment Research VRX
