2010-11-30 00:00:00,Cummins Cummins Power Generation Acquires Office Building
2011-01-19 00:00:00,Fitch Ratings Affirms Cummins Outlook Revised to Positive
2011-02-08 00:00:00,Cummins Announces Billion Stock Repurchase Declares Quarterly Dividend
2011-07-12 00:00:00,Cummins Increases Dividend By More Than
2011-10-17 00:00:00,Cummins Approves Dividend Payment
2011-10-25 00:00:00,Cummins Lowers FY 2011 Guidance
2012-02-14 00:00:00,Cummins Declares Quarterly Common Stock Dividend
2012-02-22 00:00:00,Cummins Announces Partnership in Central America
2012-05-01 00:00:00,Cummins Reaffirms FY 2012 Guidance
2012-07-10 00:00:00,Cummins Cummins Lowers FY 2012 Revenue Issues Q2 2012 Revenue Guidance Below Increases Dividend
2012-09-10 00:00:00,Hyundai Heavy Industries Co Ltd and Cummins Inc Announce Joint Venture Partnership To Build MidRange Engines In South Korea
2012-10-09 00:00:00,Cummins Inc Lowers FY 2012 Issues Q3 2012 Revenue Guidance In Line With Comments On Q3 2012 EBIT Announces Necessary Actions To Cut Costs
2012-10-11 00:00:00,Update on Cummins and Yum
2012-10-19 00:00:00,Cummins upgrades to producer of the
2012-10-24 00:00:00,Cummins to Reduce Headcount Analyst Blog
2012-10-31 00:00:00,Cummins Inc Reaffirms FY 2012 Guidance
2012-11-07 00:00:00,Effects of Monetary Stimulus Industry Report on
