2011-05-10 00:00:00,Cummins Reaffirms FY 2011 Guidance
2011-10-20 00:00:00,Cummins And Guangxi Liugong Machinery Announces Partnership
2012-02-14 00:00:00,Cummins Declares Quarterly Common Stock Dividend
2012-02-22 00:00:00,Cummins Announces Partnership in Central America
2012-04-24 00:00:00,Cummins Cummins Filtration Signs Agreement To Sell North Plant In Lake Iowa
2012-10-24 00:00:00,Cummins to Reduce Headcount Analyst Blog
2012-10-31 00:00:00,Cummins Inc Reaffirms FY 2012 Guidance
2012-11-05 00:00:00,Cummins Dividend Prospects
