2011-02-24 00:00:00,CMS Energy Comments On FY 2011 EPS Call
2011-04-19 00:00:00,CMS Energy Declares Quarterly Dividend On Common Stock
2011-07-28 00:00:00,CMS Energy Reaffirms FY 2011 EPS Guidance
2011-11-09 00:00:00,CMS Energy Reaffirms FY 2011 EPS Reaffirms Long Term Earnings Call
2012-02-23 00:00:00,CMS Energy Corp Issues FY 2012 EPS Guidance In Line With Estimates
2012-04-16 00:00:00,CMS Energy Corp Declares Quarterly Dividend On Common Stock
2012-09-05 00:00:00,CMS Energy Corp Reaffirms FY 2012 EPS Call
