2011-01-28 00:00:00,CMS Energy Declares Quarterly Dividend on Common Stock
2011-04-19 00:00:00,CMS Energy Declares Quarterly Dividend On Common Stock
2011-05-17 00:00:00,CMS Energy Issues FY 2011 Revenue Guidance Below Call
2011-07-22 00:00:00,CMS Energy Declares Quarterly Dividend On Common Stock
2011-10-27 00:00:00,CMS Energy Reaffirms FY 2011 EPS Reaffirms Long Term Earnings Guidance
2011-11-09 00:00:00,CMS Energy Reaffirms FY 2011 EPS Reaffirms Long Term Earnings Call
2012-07-16 00:00:00,CMS Energy Corp Declares Quarterly Dividend On Common Stock
2012-07-26 00:00:00,CMS Energy Corp Reaffirms FY Long Term EPS Guidance
2012-10-09 00:00:00,CMS ENERGY CORPORATION Consumers Energy Launches Michigan
2012-10-10 00:00:00,CMS ENERGY CORPORATION Consumers Energy Foundation Announces
2012-10-12 00:00:00,CMS ENERGY CORPORATION Cash In On Consumers Energy During Energy
2012-10-23 00:00:00,Wall Street expectations are high for CMS earnings
2012-11-06 00:00:00,CMS Energy CEO to Provide Business and Financial Outlook at EEI Financial
