2011-02-24 00:00:00,CMS Energy Comments On FY 2011 EPS Call
2011-04-28 00:00:00,CMS Energy Reaffirms FY 2011 EPS Guidance
2011-07-28 00:00:00,CMS Energy Reaffirms FY 2011 EPS Guidance
2011-10-21 00:00:00,CMS Energy Declares Quarterly Dividend on Common Stock
2012-01-27 00:00:00,CMS Energy Corp Announces Increased Quarterly Dividend
2012-02-23 00:00:00,CMS Energy Corp Issues FY 2012 EPS Guidance In Line With Estimates
2012-04-16 00:00:00,CMS Energy Corp Declares Quarterly Dividend On Common Stock
2012-04-26 00:00:00,CMS Energy Corp Reaffirms FY 2012 EPS Reaffirms Long Term Annual EPS Growth Guidance
2012-10-19 00:00:00,RBC Capital Reiterates Outperform on CMS Energy
2012-10-25 00:00:00,CMS Energy Announces Quarterly Misses Expectations By
2012-10-31 00:00:00,CMS ENERGY CORPORATION More Than 300 Consumers Energy And
