2011-01-27 00:00:00,Costco Wholesale Announces Quarterly Cash Dividend
2012-01-26 00:00:00,Costco Wholesale Announces Quarterly Cash Dividend
2012-05-09 00:00:00,Costco Wholesale Announces Quarterly Cash Dividend
2012-10-22 00:00:00,Top Insider Sells of the and IRM
2012-10-23 00:00:00,The Zacks Analyst Blog
2012-10-25 00:00:00,A Good Play But Wait A Bit Longer Before Jumping In
2012-10-31 00:00:00,What Ails Pharmacy or Supermarket A Survey Says Lousy Customer
2012-11-01 00:00:00,Janney Montgomery Scott Reiterates Buy on Costco Wholesale
