2011-01-27 00:00:00,Costco Wholesale Announces Quarterly Cash Dividend
2011-04-26 00:00:00,Costco Wholesale Announces Expansion Of Stock Repurchase Increases Quarterly Cash Dividend
2011-07-18 00:00:00,Costco Wholesale Announces Quarterly Cash Dividend
2011-08-31 00:00:00,Costco Wholesale Announces Planned Chief Executive Officer Change
2011-10-25 00:00:00,Costco Wholesale Announces Quarterly Cash Dividend
2012-01-26 00:00:00,Costco Wholesale Announces Quarterly Cash Dividend
2012-05-09 00:00:00,Costco Wholesale Announces Quarterly Cash Dividend
2012-06-14 00:00:00,Controladora Comercial Mexicana SAB de CV To Sell Its Entire Stake in Costco de Mexico SA de CV to Costco Wholesale Corp
2012-07-23 00:00:00,Costco Wholesale Announces Quarterly Cash Dividend
2012-10-09 00:00:00,Earnings Costco Analyst Blog
2012-10-10 00:00:00,Costco Beats on Higher Sales Analyst Blog
2012-10-16 00:00:00,Earnings Costco Analyst Blog
2012-10-17 00:00:00,Deutsche Bank Raises Price Target for Reaffirms Rating
2012-10-22 00:00:00,Weekly Top Insider and IRM
2012-10-23 00:00:00,The Zacks Analyst Blog
2012-10-25 00:00:00,A Good Play But Wait A Bit Longer Before Jumping In
2012-10-31 00:00:00,What Ails Pharmacy or Supermarket A Survey Says Lousy Customer
2012-11-01 00:00:00,US October 2012 Sales Retailers To Feel Impact Of
