2011-07-18 00:00:00,Costco Wholesale Announces Quarterly Cash Dividend
2012-05-09 00:00:00,Costco Wholesale Announces Quarterly Cash Dividend
2012-10-09 00:00:00,Earnings Costco Analyst Blog
2012-10-15 00:00:00,BMO Capital Analyst Upgrade Costco
2012-10-16 00:00:00,Earnings Costco Analyst Blog
2012-10-17 00:00:00,Deutsche Bank Raises Price Target for Reaffirms Buy Rating
2012-10-22 00:00:00,Top Insider Sells of the and IRM
2012-10-23 00:00:00,The Zacks Analyst Blog
2012-10-25 00:00:00,A Good Play But Wait A Bit Longer Before Jumping In
2012-11-01 00:00:00,Costco October sales beat forecast
2012-11-02 00:00:00,COSTCO WHOLESALE CORPORATION CPSC Portable Generators Recalled
