2011-01-27 00:00:00,Costco Wholesale Announces Quarterly Cash Dividend
2011-04-26 00:00:00,Costco Wholesale Announces Expansion Of Stock Repurchase Increases Quarterly Cash Dividend
2012-06-14 00:00:00,Controladora Comercial Mexicana SAB de CV To Sell Its Entire Stake in Costco de Mexico SA de CV to Costco Wholesale Corp
2012-10-10 00:00:00,Costco Beats on Higher Sales Analyst Blog
2012-10-15 00:00:00,BMO Capital Analyst Upgrade Costco
2012-10-16 00:00:00,Earnings Costco Analyst Blog
2012-10-17 00:00:00,Deutsche Bank Raises Price Target for Reaffirms Buy Rating
2012-10-23 00:00:00,The Zacks Analyst Blog
2012-10-31 00:00:00,What Ails Pharmacy or Supermarket A Survey Says Lousy Customer
