2010-11-18 00:00:00,Campbell Soup Company Raises Quarterly Dividend By
2011-01-12 00:00:00,Campbell Soup Company And Swire Pacific Limited Form Joint Venture In China
2011-06-28 00:00:00,Campbell Soup Company To Cut Save
2011-09-02 00:00:00,Campbell Soup Company Reaffirms FY 2012 Revenue Lowers FY 2012 Earnings Guidance
2011-11-16 00:00:00,Campbell Soup Company Announces Quarterly Dividend
2012-03-22 00:00:00,Campbell Soup Company Announces Quarterly Dividend
2012-06-19 00:00:00,Campbell Soup Company Reiterates FY 2012 Reiterates Long Term Call
2012-07-24 00:00:00,Campbell Soup Co Sees FY 2012 EBIT Guidance To Be Near Low End Of Prior Sees FY 2012 EPS Guidance To Be Upper End Of Prior Comments On FY 2013 Call
2012-08-06 00:00:00,Campbell Soup Company Completes Acquisition Of Bolthouse Farms
2012-09-20 00:00:00,Vilmorin Cie SA Announces Acquisition of Vegetable Seeds Activities of Campbell Soup Co in the United States
2012-10-11 00:00:00,Energi Beats Toyota Prius and General
2012-10-16 00:00:00,CAMPBELL SOUP COMPANY More Than 3600 Campbell Employees
2012-10-23 00:00:00,Solazyme hires Rotsaert as chief operating officer
2012-11-01 00:00:00,Flower Foods Dividend Stock Analysis
2012-11-02 00:00:00,Bolthouse Farms recalls some carrot chips
2012-11-05 00:00:00,CAMPBELL SOUP COMPANY and CH4 Create First
2012-11-06 00:00:00,Indicated Dividend Yield Ranking for the 500 by Industry
2012-11-07 00:00:00,Fitch May Withdraw Campbell Soup Ratings
