2011-01-04 00:00:00,Completes Acquisition of Heroku
2011-02-24 00:00:00,Issues Q1 2012 Mixed Raises FY 2012 Revenue Issues FY 2012 EPS Guidance Below Estimates
2011-03-07 00:00:00,Announces Selection By
2011-06-07 00:00:00,Netyear Group Corporation Announces Completion of Selling of Treasury Stock
2011-07-25 00:00:00,Announces Mobile Banking Provider Clairmail Selects Jigsaw Data Cloud To Drive Mobile Banking Success
2011-08-18 00:00:00,Issues Q3 2012 Revenue Guidance Above Raises FY 2012 Revenue Reaffirms FY 2012 EPS Guidance
2011-09-22 00:00:00,MacroSolve Inc Files Suit Against For Infringement Of Mobile App Patent
2011-11-17 00:00:00,Raises FY 2012 Issues Q4 2012 Revenue Guidance Above Issues 2013 Revenue Guidance Above Estimates
2011-12-13 00:00:00,GREE Deploys Global Partner Social Network Built on Social Enterprise Platform
2012-04-10 00:00:00,Cameleon Software SA Announces Partnership with
2012-04-16 00:00:00,1st Holdings Inc Forms Business and Capital Alliance with Inc
2012-05-17 00:00:00,Issues Q2 2013 Guidance Revenue Guidance Above Raises FY 2013 Guidance
2012-06-04 00:00:00,Inc Signs Definitive Agreement To Acquire Buddy Updates FY 2013 Guidance
2012-06-14 00:00:00,Inc and Twitter Announce Global Strategic Alliance
2012-10-11 00:00:00,Analyst and Citrix Systems
2012-10-17 00:00:00,Positioned as a Leader in the Magic Quadrant for Social CRM
2012-10-19 00:00:00,Microsoft and to Launch Latest Marketing
2012-10-23 00:00:00,Buddy Media Not a Pretty Picture
2012-10-24 00:00:00,SAP Lifts 2012 Revenue Target as Software Beats Estimates
2012-10-25 00:00:00,Marketing Need Signals ExactTarget Deal
2012-10-26 00:00:00,NetSuite Rises to Record as Client Adds Boost Forecast
2012-10-31 00:00:00,Salesforce Is a Power to Reckon With
2012-11-02 00:00:00,CRM from Enhances Unified Payments Merchant Services
2012-11-05 00:00:00,Live Cloud Channel Google
