2011-04-18 00:00:00,Acacia Research Subsidiary Enters Into Settlement And License Agreement With Cirrus
2011-04-28 00:00:00,Cirrus Issues Q1 2012 Revenue Guidance Below Estimates
2011-07-21 00:00:00,Cirrus Issues Q2 2012 Revenue Guidance In Line With Estimates
2011-10-19 00:00:00,Cirrus Issues Q3 2012 Revenue Guidance In Line With Estimates
2012-08-01 00:00:00,Cirrus Appoints Al Schuele As Chairman
2012-10-08 00:00:00,Cirrus Logic and Avago Technologies Look to Benefit From Strong iPhone 5
2012-10-09 00:00:00,Cirrus Logic to Announce Q2 Results on October 29
2012-10-23 00:00:00,Traders Await Results Before Deciding the Cirrus Trend
2012-10-25 00:00:00,CIRRUS Cirrus Logic Named One of Best Companies to Work for
