2011-07-20 00:00:00,Cornerstone Ondemand Inc Files Registration Statement For Proposed Offering
2011-08-04 00:00:00,Cornerstone Ondemand Inc Reaffirms FY 2011 Earnings Call
2012-04-09 00:00:00,Cornerstone Ondemand Inc Completes Acquisition Of Sonar Limited
2012-10-05 00:00:00,Cornerstone OnDemand Unveils Enhanced Social Sourcing for its Award
2012-10-17 00:00:00,Cornerstone OnDemand Showcases European Momentum at 2012 EMEA
2012-10-18 00:00:00,A Real Drag On The Indices
2012-10-19 00:00:00,Wedding Startup Appy Couple Raises Million Led By John Frankel
2012-10-23 00:00:00,SolarWinds Q3 EPS Seen Sales Amid Acquisitions SWI GOOG
