2010-12-21 00:00:00,Cintas Corporation Reiterates FY 2011 Guidance
2011-03-17 00:00:00,Cintas Corporation Acquires FACS Records Center
2012-01-19 00:00:00,Avendra Selects Cintas Corporation As Preferred Vendor Of Fire Protection Solutions For Hotels
2012-10-10 00:00:00,Cintas Expands Document Management Services with New Nationwide Hard
2012-10-18 00:00:00,Cintas Partners with the National Foundation for Credit Counseling for Fifth
2012-11-05 00:00:00,New Scrub Rental Dispensing System from Cintas Eliminates Scrub Shortage
