2011-04-29 00:00:00,Constant Issues Q2 2011 Guidance In Line With Reaffirms FY 2011 Call
2011-05-20 00:00:00,Constant Announces New Mobile Marketing Solutions
2011-07-28 00:00:00,Constant Contact Inc Issues Q3 2011 Guidance Below Lowers FY 2011 Revenue Raises Low End Of Prior FY 2011 EBITDA Raises FY 2011 EPS And Net Income Guidance
2012-02-09 00:00:00,Constant Contact And eTapestry Integration Available For Nonprofits
2012-06-13 00:00:00,Constant Contact Inc Acquires Digital Storefront Provider Updates FY 2012 EBITDA Guidance
2012-07-26 00:00:00,Constant Contact Inc Issues Q3 2012 Guidance Below Raises FY 2012 Guidance
2012-10-03 00:00:00,Constant Contact Announces Date for Third Quarter 2012 Financial Results
2012-10-09 00:00:00,Constant Contact Is Worth As New Tools Will Drive Growth
2012-10-26 00:00:00,Equity Ratings Changes for October CP
