2011-05-05 00:00:00,Coventry Health Announces Appointment Of Chief Financial Officer Form 8K
2012-01-17 00:00:00,Coventry Health Issues FY 2012 Revenue Guidance In Line With
2012-06-19 00:00:00,Coventry Health Reaffirms FY 2012 EPS Call
2012-07-27 00:00:00,Coventry Health Reaffirms FY 2012 EPS Call
2012-08-20 00:00:00,The Briscoe Law Firm and Powers LLP Investigate Sale Of Coventry Health To Aetna
2012-10-12 00:00:00,Highs Coventry Sycamore Virgin Media
2012-10-15 00:00:00,CVH Widens Use of HWAY Program Analyst Blog
2012-10-22 00:00:00,JPMorgan Chase Reiterates Neutral on Coventry Health Care
2012-11-06 00:00:00,Old Republic and 9 Others See Ratings Updates
