2010-11-19 00:00:00,APC Aragorn Power and Energy Corporation Signs Two Agreements With Chevron Chevron Kalinga
2010-12-15 00:00:00,Chevron Chevron Energy Oceanic Time Warner Tioga Energy Announce Solar Canopy Project On Oahu
2011-02-14 00:00:00,Chevron Announces Illegitimate Judgment In Ecuador Lawsuit
2011-03-11 00:00:00,Chevron To Sell Pembroke Refinery To Valero Energy Corporation
2011-04-11 00:00:00,Chevron Issues Q1 2011 Earnings Comments On Q1 2011 Charge Guidance
2011-04-21 00:00:00,Chevron Announces Evidence Of Fraud Found In Text Of Ecuador Judgment
2011-04-27 00:00:00,Chevron Announces Increase In Quarterly Dividend
2011-05-10 00:00:00,Chevron Subsidiary And JX Nippon Oil and Energy Corporation Sign LNG Agreement
2011-07-01 00:00:00,Chevron Begins Work To Double Capacity At Caspian
2011-07-19 00:00:00,Chevron Starts Trading on OTC
2011-07-20 00:00:00,Chevron Pays Million Penalty To On Gulf Of Mexico
2011-07-25 00:00:00,Chevron Forms Alliance With NASAs Jet Propulsion Laboratory
2011-07-26 00:00:00,Chevron To Pay Million For Leak Detection
2011-08-24 00:00:00,Chevron Subsidiary Announces Change in Consortium Structure in Block
2011-08-31 00:00:00,Chevron Secures Million In Arbitration Claim Against Government of Ecuador
2011-10-13 00:00:00,BP PLC And Its Partners Royal Dutch Shell ConocoPhillips And Chevron Corp Investing GBP10 Billion In UK Oil And Gas Projects
2011-11-07 00:00:00,Rubis SCA Expands in Caribbean by Acquiring Chevron Fuel Downstream Activities
2012-03-26 00:00:00,Chevron Launches Delo 400 NG SAE
2012-04-17 00:00:00,Chevron Corp And Chubu Sign Wheatstone LNG Agreement
2012-04-25 00:00:00,Chevron Corp Announces Increase In Quarterly Dividend
2012-05-16 00:00:00,EU Clears Angolan LNG JV By BP Chevron Eni Total
2012-05-22 00:00:00,Nigeria Plans To Renew Chevron Corp Oil And Royal Dutch Shell Plc Licenses By
2012-06-18 00:00:00,Chevron Corp To Sell Wheatstone More LNG To Tokyo Electric Power
2012-07-09 00:00:00,Nordsfonden Acquires Stake in Danish Underground Consortium by AP Moeller Maersk Royal Dutch Shell Plc and Chevron
2012-07-25 00:00:00,Chevron Corp Announces Quarterly Dividend
2012-08-07 00:00:00,Big Fire Hits Chevron California
2012-10-25 00:00:00,Chevron Announces Further Natural Gas Discovery Offshore Australia
2012-10-26 00:00:00,The Zacks Analyst Blog Johnson Chesapeake
2012-11-05 00:00:00,Lawsuit Slapped on Chevron Corporation in Argentina Due to Ecuadorian
2012-11-06 00:00:00,Timing Is Upside Analysis of Election Results New Outlook on Exxon
