2011-04-27 00:00:00,DuPont Declares Second Quarter Announces Share Repurchase Program
2011-05-02 00:00:00,Danisco Reiterates Unanimous Recommendation to Shareholders to Accept DuPont Denmark Holding ApS Offer
2011-07-15 00:00:00,DuPont Declares Third Quarter Dividend
2011-11-02 00:00:00,DuPont Signs Technology Agreement for Large AMOLED Television Displays
2012-01-23 00:00:00,DuPont Declares First Quarter Dividend
2012-08-02 00:00:00,du Pont de Nemours and Company Will Appeal Verdict In Monsanto DuPont Patent Case
2012-10-25 00:00:00,du Pont de Nemours and Co Declares Fourth Quarter Dividend
