2010-11-15 00:00:00,Coast Guard Selects Dell To Continue Providing Mission Critical IT Field Support Services
2011-02-08 00:00:00,Dell Closes SecureWorks Acquisition
2011-02-22 00:00:00,Dell Completes Acquisition of Compellent
2011-07-20 00:00:00,Dell Announces Intent To Acquire Force10 Networks Inc
2012-05-09 00:00:00,Dell Completes Acquisition of
2012-05-25 00:00:00,Dell Inc In Talks To Buy Quest Software
2012-07-27 00:00:00,International Business Machines Corp And Dell Inc Products From BDT Found Guilty Of Infringing On Overland Partitioning Patent
2012-11-02 00:00:00,Dell testing ARM server with chip from AppliedMicro
2012-11-06 00:00:00,Dell offers users free pocket edition of Windows 8 for Dummies
