2011-03-01 00:00:00,Joseph President And Chief Operating Departs Dean Foods Company
2011-05-25 00:00:00,The Securities Arbitration Law Firm of Klayman Toskes Launches Investigation On Behalf Of Dean Foods Shareholders
2012-03-28 00:00:00,Dean Foods Co Announces Dismissal of Tennessee Retailer Action
2012-11-02 00:00:00,Analyst Dean Foods Coverage Reinstated With TP of At
2012-11-05 00:00:00,Fitch Lifts Dean Foods Junk Rating a Citing Debt Reduction
2012-11-06 00:00:00,Dean Foods Third Quarter Earnings Sneak Peek
2012-11-07 00:00:00,Milk Dean Foods for All Worth
