2010-12-01 00:00:00,The Walt Disney Company Increases Annual Cash Dividend To Per Share
2011-11-30 00:00:00,The Walt Disney Company Increases Annual Cash Dividend by To Per Share
2012-01-31 00:00:00,The Walt Disney Company to Acquire Controlling Interest in UTV Software Communications Limited
2012-05-31 00:00:00,The Walt Disney Company Appoints Alan Horn As Chairman
2012-09-13 00:00:00,University of California Sues Facebook The Walt Disney Company Over
2012-10-31 00:00:00,Buzz General Walt and Netflix
2012-11-01 00:00:00,The Walt Disney Company Pledges to Hurricane Sandy Relief
2012-11-02 00:00:00,Walt Disney Stock Rating Reaffirmed by Zacks
2012-11-05 00:00:00,InvestorsObserver releases comments on Marathon Home Walt
