2010-12-01 00:00:00,The Walt Disney Company Increases Annual Cash Dividend To Per Share
2011-05-03 00:00:00,The Walt Disney Division Sues DISH Network
2011-07-01 00:00:00,Owned By The Walt Disney The News Comcast NBC Universal And Providence Equity Starts Sales Pitching To A Dozen
2011-07-26 00:00:00,The Walt Disney Company Plans To Buy Out UTV Software Communications Delist
2011-10-31 00:00:00,And The Walt Disney Television Group Announce Extension Of Existing Licensing Agreement to Stream TV Shows
2011-11-30 00:00:00,The Walt Disney Company Increases Annual Cash Dividend by To Per Share
2012-04-19 00:00:00,The Walt Disney Pixar Unit And Other Technology Companies Fail To Dismiss
2012-06-06 00:00:00,The News Corporation Buys The Walt Disney Stake In Asian Sports
2012-10-04 00:00:00,Cablevision Systems Corp And The Walt Disney Company Announce Comprehensive Distribution Agreement
2012-11-05 00:00:00,Earnings Gains are Expected for The Walt Disney Company Ahead of Q4
2012-11-06 00:00:00,Search local coupons and more
2012-11-07 00:00:00,Walt Disney Earnings Sports And Drive Home Higher Profits
