2010-10-01 00:00:00,Dialogic Corporation And Veraz Complete Merger
2011-08-30 00:00:00,Airtel Partners with Dialogic for Bandwidth Optimization for African Operations
2011-09-06 00:00:00,Dialogic And Voiceserve Inc Collaborate on Mobile Video Conferencing Solution
2011-09-29 00:00:00,Dialogic Names John Hanson As Executive Vice President And Chief Financial Officer
2012-10-02 00:00:00,Dworkin to talk open UC at ITEXPO
2012-10-04 00:00:00,Dialogic Selected as a Light Reading Leading Lights Award Finalist for Best
2012-10-10 00:00:00,Dialogic Nominated for Telecom Asia Choice Awards
