2011-02-02 00:00:00,The Dun Bradstreet Corporation Comments On FY 2011 EBIT Issues FY 2011 EPS Guidance In Line With Estimates
2011-03-22 00:00:00,The Dun Bradstreet Corporation Launches DNBi Professional for Small and Midsized Businesses
2011-04-27 00:00:00,The Dun Bradstreet Corporation Reaffirms FY 2011 Guidance
2011-05-03 00:00:00,The Dun Bradstreet Corporation Declares Quarterly Dividend
2011-08-31 00:00:00,And Dun Bradstreet Corporation Form Alliance
2011-10-18 00:00:00,Dun and Bradstreet Corp Declares Quarterly Dividend
2011-10-27 00:00:00,Dun and Bradstreet Corp Announces New Million Share Repurchase Enters Into New Million Revolving Credit Reaffirms FY 2011 Guidance
2012-02-06 00:00:00,Dun and Bradstreet Corp Increases Cash Issues FY 2012 EPS Guidance Below Comments On FY 2012 Operating Income Guidance
2012-03-19 00:00:00,Dun and Bradstreet Corp Reports On Investigation Related To China Operations
2012-08-08 00:00:00,Dun and Bradstreet Corp Increases Share Repurchase Plan To Declares dividend
2012-10-16 00:00:00,Dun Bradstreet Corp Declares Quarterly Dividend
2012-10-26 00:00:00,NewMarket Larger Than 500 Component Dun Bradstreet
