2010-11-04 00:00:00,Digital Launches Global Payments Solution
2010-11-10 00:00:00,Digital Signs Agreement With Nikon Inc
2011-03-18 00:00:00,Digital Appoints Tom Donnelly As President
2011-04-28 00:00:00,Digital Issues Mixed Q2 2011 Raises FY 2011 Guidance
2011-09-07 00:00:00,Digital Authorizes Million Share Repurchase Program
2011-10-27 00:00:00,Digital Lowers FY 2011 Guidance
2012-02-02 00:00:00,Digital Issues Q1 2012 Guidance Above Issues FY 2012 Revenue Guidance Above Estimates
2012-04-25 00:00:00,Digital Extends Commerce Agreement With HP
2012-07-31 00:00:00,Digital Issues Q3 2012 Guidance Below Lowers FY 2012 Guidance
