2010-12-16 00:00:00,DTE Energy Company Declares Dividend
2011-02-03 00:00:00,DTE Energy Company Declares Dividend
2011-07-06 00:00:00,DTE Energy Company To Build Solar Installation On Mercy High School Roof
2011-09-07 00:00:00,DTE Energy Company Introduces New iPhone App to Get Outage Information
2011-11-28 00:00:00,DTE Energy Company Introduces A New Android App To Get Outage Information
2012-02-02 00:00:00,DTE Energy Co Declares Dividend
2012-05-03 00:00:00,DTE Energy Company Declares Dividend
2012-09-20 00:00:00,DTE Energy Co Updates FY 2012 EPS Guidance To A Range Below Call
