2010-12-01 00:00:00,Devon Energy Corporation Announces First Quarter Cash Dividend For Common Stockholders
2011-03-03 00:00:00,Devon Energy Corporation Increases Cash Dividend For Common Stockholders
2012-03-07 00:00:00,Devon Energy Corporation Announces Second Quarter Cash Dividend For Common Stockholders
2012-08-27 00:00:00,Crestwood Midstream Partners LP Completes Acquisition Of Gathering And Processing Assets From Devon Energy Subsidiaries
2012-10-08 00:00:00,Sanford Bernstein Gives market perform Rating to Devon Energy
2012-10-12 00:00:00,Basic Chesapeake Selling Considerable Land in Oklahoma
2012-10-15 00:00:00,Is SandRidge Energy a Good Stock to
2012-10-16 00:00:00,GenOn open office space could stabilize downtown rents
2012-10-25 00:00:00,Stocks Poised to Devon Energy
