2011-04-28 00:00:00,Edison International Declare Dividends
2011-09-01 00:00:00,Edison International Declare Dividends
2012-02-14 00:00:00,Repsol YPF RWE AG and Edison International Consortium Obtain Authorization For Sahara Gas
2012-04-26 00:00:00,Edison International Declares Quarterly Common Stock Dividend
2012-10-18 00:00:00,Citigroup Lowers Edison International to Neutral
2012-10-25 00:00:00,BrightSource Approved for Two of Five California Solar Contracts
2012-10-26 00:00:00,Jefferies Group Reiterates Hold on Edison International
2012-11-01 00:00:00,Edison International Management Discusses Q3 2012 Results Earnings Call
