2011-03-04 00:00:00,Echelon Corporation Secures Million Smart Grid Project For NRGi In Denmark
2011-07-29 00:00:00,Echelon Corporation Receives Patent
2011-08-04 00:00:00,Echelon Corporation Issues Q3 2011 Guidance Above Raises FY 2011 Revenue Guidance
2012-03-27 00:00:00,Huazhi Holding Subsidiary to Set up Joint Venture with Echelon Corporation
2012-08-07 00:00:00,Echelon Corporation Issues Q3 2012 Revenue Guidance Below Estimates
2012-10-09 00:00:00,JV Lands Smart Meter Pilots in China
2012-10-10 00:00:00,In the FCS Wofford think small
2012-10-12 00:00:00,What Percentage Of The 120M China EV Bike Owners Will Kandi Technologies
2012-10-22 00:00:00,Q3 Smart Grid Preview
