2011-06-02 00:00:00,Electro Rent Corporation Increases Regular Quarterly Cash Dividend
2011-08-11 00:00:00,Electro Rent Corporation To Acquire Equipment Management
2011-12-09 00:00:00,Electro Rent Corporation Declares Regular Quarterly Cash Dividend
2011-12-15 00:00:00,Electro Rent Corporation Named Exclusive Reseller For Select Communication Components Products In And Canada
2012-06-06 00:00:00,Electro Rent Corp Declares Regular Quarterly Cash Dividend
2012-09-04 00:00:00,Electro Rent Corp Declares Regular Quarterly Cash Dividend
2012-09-18 00:00:00,Faruqi LLP Launches Investigation Against Electro Rent Corp
