2010-11-29 00:00:00,EMC Corporation And VMware Put Northern Hospital On Course To Private Cloud
2010-12-20 00:00:00,EMC Corporation Completes Tender Offer for Isilon
2011-02-15 00:00:00,EMC RSA Announces RSA Solution For Security Incident Management
2011-03-23 00:00:00,EMC EMC Isilon Enables University at Buffalo To Scale Out Big Data Compute Infrastructure
2011-04-05 00:00:00,EMC Iomega Partners With Axis Communications To Connect Cloud With Storage For Hosted Video Surveillance In SMB Market
2011-07-01 00:00:00,Nortel Networks Announces Sale Of Its Patent Portfolio For Billion To A Consortium Which Include EMC Corporation
2011-08-29 00:00:00,EMC RSA Secures Contract
2011-09-09 00:00:00,EMC Corporation Teams Up With Adobe Systems To Deliver Editing And Storage Technologies
2011-11-16 00:00:00,Proact IT Group AB Expands Partnership with EMC
2011-12-02 00:00:00,EMC Tulip Telecom Limited And MindTree Consulting Limited To Provide Digital Video Surveillance Solutions
2012-02-07 00:00:00,Jaguar Land Rover Selects Emc Isilon To Drive Simulation Operations
2012-02-09 00:00:00,Ameren Selects Emc EMC VMAX And VMware vSphere For Private Cloud Infrastructure
2012-03-20 00:00:00,Emc Corp Acquires Pivotal Labs
2012-05-03 00:00:00,Emc Corp To Meet Or Exceed FY 2012 Call
2012-08-01 00:00:00,Lenovo Group And EMC Corporation Team Up In Strategic Worldwide Partnership
2012-11-05 00:00:00,NYSE Hot Stocks Earnings Pitney Vertex
2012-11-06 00:00:00,EMC to acquire web fraud detection and security software provider silver tail
2012-11-08 00:00:00,EMC Adds Connectors to Kazeon
