2010-11-08 00:00:00,EMC Corporation Announces LLC Deploys EMC And VMware Solutions
2010-11-10 00:00:00,EMC Corporation Acquires
2010-11-15 00:00:00,EMC Corporation To Acquire Isilon Complete Story
2010-11-19 00:00:00,EMC Corporation Commences Tender Offer for All Outstanding Shares of Isilon
2010-11-29 00:00:00,EMC Corporation And VMware Put Northern Hospital On Course To Private Cloud
2010-12-13 00:00:00,Net One Systems to Sell Treasury Stock
2010-12-14 00:00:00,EMC Data Computing Products Division And Havas Digital Announces Joint Development Agreement
2010-12-20 00:00:00,EMC Corporation Completes Tender Offer for Isilon
2011-01-25 00:00:00,EMC Corporation Issues FY 2011 Guidance Above Estimates
2011-02-15 00:00:00,EMC RSA Announces RSA Solution For Security Incident Management
2011-02-28 00:00:00,EMC Corporation And IBM Corporation Announces Extension Of Technology Licensing Agreement
2011-04-20 00:00:00,EMC Corporation Raises FY 2011 Call
2011-05-04 00:00:00,EMC Corporation Reaffirms FY 2011 Call
2011-07-01 00:00:00,Nortel Networks Announces Sale Of Its Patent Portfolio For Billion To A Consortium Which Include EMC Corporation
2011-10-17 00:00:00,Intel McAfee and The Security Division of EMC Corporation Announce Joint Compliance and Risk Management Solution
2011-10-18 00:00:00,EMC Corporation Reaffirms FY 2011
2011-12-06 00:00:00,Israeli Government Selects EMC Corporation As Enterprise Content Management Platform Standard
2011-12-07 00:00:00,Carglass Chooses EMC VNX Unified Storage
2012-01-24 00:00:00,Emc Corp Issues FY 2012 EPS Guidance Below Call
2012-02-07 00:00:00,Jaguar Land Rover Selects Emc Isilon To Drive Simulation Operations
2012-02-09 00:00:00,Ameren Selects Emc EMC VMAX And VMware vSphere For Private Cloud Infrastructure
2012-02-15 00:00:00,Atos EMC Corporation and VMware Inc Announced Strategic Alliance for Open Cloud Atos Plans to Create New Company
2012-02-28 00:00:00,Good Technology And Emc RSA Team Up For Mobile Application Security
2012-03-13 00:00:00,Avnet Technology Solutions Americas Expands Agreement with EMC Corporation To Include Avnet Embedded
2012-03-20 00:00:00,Emc Corp Acquires Pivotal Labs
2012-08-01 00:00:00,Lenovo Group And EMC Corporation Team Up In Strategic Worldwide Partnership
2012-09-06 00:00:00,Emc Corp And Alpine Data Labs To Deliver Joint Solution For High Performance In Database Predictive Analytics
2012-09-17 00:00:00,Guidance Software Inc And Emc RSA Collaborate On Automated Cyber Security Incident Response
