2010-11-16 00:00:00,Edwards Lifesciences Corporation Announces Edwards SAPIEN Transcatheter Heart Valve Demonstrates Substantial Improvement In Quality Of Life In Inoperable Patients
2010-12-13 00:00:00,Edwards Lifesciences Corporation To Reaffirm Q4 2010 EPS Issues FY 2011 EPS Guidance Below Estimates
2011-03-02 00:00:00,Edwards Lifesciences Corporation Expands Treatable Patient Population With European Approval of Larger Transcatheter Valve
2011-07-20 00:00:00,FDA Panel Recommends Approval of Edwards Lifesciences Transcatheter Valve for Treatment of Inoperable Patients
2011-07-21 00:00:00,Edwards Lifesciences Corporation Issues Q3 2011 EPS Guidance Below Reaffirms FY 2011 EPS Guidance
2011-09-13 00:00:00,Edwards Lifesciences Corporation Announces New Million Share Repurchase Program
2011-10-19 00:00:00,Edwards Lifesciences Corporation Issues Q4 2011 EPS Guidance In Line With Narrows FY 2011 Revenue Lowers FY 2011 EPS Guidance
2011-11-02 00:00:00,Edwards Lifesciences Corporation Lifesciences Receives FDA Approval for Aortic Heart Valve in the
2011-12-09 00:00:00,Edwards Lifesciences Corporation Reaffirms FY 2011 Issues FY 2012 Guidance In Line With
2012-02-02 00:00:00,Edwards Lifesciences Corporation Issues Q1 2012 Guidance Below Reaffirms FY 2012 Guidance
2012-06-08 00:00:00,Edwards Lifesciences Corporation Receives IDE For Clinical Trial Of New Heart Valve Tissue Treatment Platform
2012-06-11 00:00:00,FDA Staff Say Edwards Lifesciences Corp Heart Valve Meets
2012-06-13 00:00:00,FDA Panel Recommends Approval Of Edwards Lifesciences Transcatheter Valve For Patients
2012-07-24 00:00:00,Edwards Lifesciences Corporation Issues Q3 2012 Outlook In Line With Lowers FY 2012 Revenue Reaffirms FY 2012 Net Income Raises Low End Of Prior FY 2012 EPS Outlook
2012-10-09 00:00:00,US HOT Edwards Owens Baidu
2012-10-10 00:00:00,Edwards Lifesciences Corp Completes Acquisition Of BMEYE
2012-10-19 00:00:00,FDA Approves Expanded Indication for Edwards Lifesciences Transcatheter Valve
2012-10-22 00:00:00,Jefferies Group Cuts Edwards Lifesciences Corp EPS Estimates
