2010-11-16 00:00:00,Edwards Lifesciences Corporation Announces Edwards SAPIEN Transcatheter Heart Valve Demonstrates Substantial Improvement In Quality Of Life In Inoperable Patients
2011-02-09 00:00:00,Edwards Lifesciences Corporation Comments On Court Ruling
2011-05-11 00:00:00,Edwards Lifesciences Corporation Announces Interim Data From Prospective Study Of EDWARDS INTUITY Valve System
2011-05-20 00:00:00,Edwards Lifesciences European Registry Of Transcatheter Patients Demonstrates Successful Secures CE Mark Approval For Sale Of
2011-06-15 00:00:00,Edwards Lifesciences Corporation Reaffirms FY 2011 Revenue Issues FY 2011 Net Income Guidance Below Call
2011-07-20 00:00:00,FDA Panel Recommends Approval of Edwards Lifesciences Transcatheter Valve for Treatment of Inoperable Patients
2011-07-21 00:00:00,Edwards Lifesciences Corporation Issues Q3 2011 EPS Guidance Below Reaffirms FY 2011 EPS Guidance
2011-10-19 00:00:00,Edwards Lifesciences Corporation Issues Q4 2011 EPS Guidance In Line With Narrows FY 2011 Revenue Lowers FY 2011 EPS Guidance
2011-11-07 00:00:00,Edwards Lifesciences Corporation Receives FDA Approval To Expand Clinical Trial Of Transcatheter Valve
2012-02-02 00:00:00,Edwards Lifesciences Corporation Issues Q1 2012 Guidance Below Reaffirms FY 2012 Guidance
2012-06-11 00:00:00,FDA Staff Say Edwards Lifesciences Corp Heart Valve Meets
2012-06-13 00:00:00,FDA Panel Recommends Approval Of Edwards Lifesciences Transcatheter Valve For Patients
2012-07-24 00:00:00,Edwards Lifesciences Corporation Issues Q3 2012 Outlook In Line With Lowers FY 2012 Revenue Reaffirms FY 2012 Net Income Raises Low End Of Prior FY 2012 EPS Outlook
2012-10-08 00:00:00,Edwards Lifesciences Corp Lowers Q3 2012 Revenue Guidance
2012-10-11 00:00:00,Edwards Lifesciences Recent Ratings Updates
2012-10-18 00:00:00,Edwards Lifesciences to Report on Lowered Outlook
2012-10-23 00:00:00,Company News for October 2012
2012-11-07 00:00:00,Edwards Lifesciences to Present at the Credit Suisse 2012 Healthcare Conference
