2010-12-30 00:00:00,Ford Motor Company Recalls Lincoln
2011-01-28 00:00:00,Fitch Upgrades Ford Motor Company Ford IDRs to Outlook Positive
2011-02-02 00:00:00,Ford Motor Ford Motor Credit To Sell Billion 10 Year
2011-02-03 00:00:00,Ford Motor Company Recalls
2011-02-11 00:00:00,Ford Motor Company To Reduce Debt By Additional Billion Through Trust Preferred Securities Redemption
2011-02-16 00:00:00,Ford Motor Ford India To Launch Eight More Models By Standard
2011-02-18 00:00:00,Ford Motor Company And Sollers OJSC Sign Memorandum Of Understanding To Establish Joint Venture In Russia
2011-02-23 00:00:00,Ford Motor Company Recalls Trucks For Airbag
2011-03-01 00:00:00,Ford Motor Company Issues Q2 2011 Production Call
2011-03-04 00:00:00,Ford Motor Company And Ferrari Settle Lawsuit Over
2011-03-18 00:00:00,Ford Motor Company Sells Norfolk Assembly Plant Property to Jacoby
2011-04-14 00:00:00,Ford Motor Company To Cut Australian Vehicle
2011-05-18 00:00:00,Ford Motor Company And ACH Announces Signing Of Definitive Agreements With Inergy Automotive Systems For Sale Of Fuel Tank Business Located At ACH Plant In Mich
2011-05-19 00:00:00,Compagnie Plastic Omnium POAI Acquires Fuel System Business in United States from Ford Motor Automotive Components Holdings LLC
2011-06-08 00:00:00,Ford Motor Transit Connect Electric Secures Contract
2011-06-09 00:00:00,Sollers OAO Signs Agreement With Ford Motor Company On Creation Of New Joint Venture Ford
2011-06-10 00:00:00,Ohio Judge Says Ford Motor Company Must Pay Dealers
2011-06-22 00:00:00,Ford Motor Company and Nuance Collaborate to Advance Voice Interactions Through Understanding and Intent
2011-07-20 00:00:00,Ford Motor Company To Recall More Than Trucks And Sports Utility Economic Times
2011-07-26 00:00:00,Ford Motor Company Reaffirms FY 2011 Earnings Call
2011-07-27 00:00:00,Ford Motor Company To Build Second India Car Factory In
2011-08-08 00:00:00,SunPower Corporation and Ford Motor Company To Provide Clean And Sustainable Energy
2011-08-23 00:00:00,Toyota Motor Corporation to Form Business Alliance with Ford Motor Company
2011-11-16 00:00:00,Azure Dynamics Corporation And Ford Motor Company Introduce Transit Connect Electric Wagon
2012-02-24 00:00:00,City Of Chicago Places Order For 500 Ford Motor Police Interceptors
2012-03-07 00:00:00,Ford Motor Company To Cut Production At Two German
2012-04-19 00:00:00,Ford Motor Company Invests Million For New China More
2012-04-27 00:00:00,Ford Motor Company Reaffirms FY 2012 Operating Profit Comments On H2 2012 Operating Profit Guidance
2012-05-03 00:00:00,Ford Motor Company and Automotive Components LLC Announce Signing Of Definitive Agreements With Faurecia For The Sale Of The Automotive Interior Trim Components Business
2012-06-05 00:00:00,The Ford Motor Heinz And Procter Gamble Co Form Collaboration To Accelerate Development Of Products Made Entirely From Plants
2012-06-27 00:00:00,Ford Motor Company To Close Philippine Car Assembly Plant By End
2012-07-12 00:00:00,Ford Motor Company Declares Third Quarter Dividend
2012-07-16 00:00:00,Ford Motor Company Recalls New Escape Crossover Over Braking
2012-07-17 00:00:00,Ford Motor Company Says To Cut Up To 440 Jobs In
2012-07-19 00:00:00,Ford Motor Co Recalls Ford
2012-07-25 00:00:00,Ford Motor Co Lowers FY 2012 Operating Profit Outlook
2012-07-26 00:00:00,Ford Motor Co Recalls Escape SUVs For Throttle
2012-08-01 00:00:00,Ford Motor Co Sues Dana Holding Corp Over Part Linked To Windstar
2012-08-30 00:00:00,Ford Motor Co Sued Over Fuel Injection
2012-10-10 00:00:00,Dealertrack Holdings DealerTrack Acquires Assets Of Ford Motor Co of iCONNECT Direct DMS Business
2012-10-11 00:00:00,Ford Motor Co Declares Fourth Quarter Dividend
