2010-11-09 00:00:00,Ford Motor FCE Bank PLC Sets Price Guidance On Five Year Sterling Benchmark
2010-11-18 00:00:00,Mazda Motor Corporation Announces Changes in Shareholding Structure
2010-12-01 00:00:00,Ford Motor Company Issues Q1 2011 Production Call
2011-01-25 00:00:00,Ford Motor Company Plans To Build Engines For Some New Models
2011-01-27 00:00:00,Ford Motor Company Recalls Lakh Windstar Standard
2011-05-03 00:00:00,Argentina Slaps Million Tax Penalty On Ford Motor
2011-05-12 00:00:00,Ford Motor Company Comments On FY 2011 Operating Call
2011-10-19 00:00:00,Workers Approve Ford Motor Company Labor
2011-12-09 00:00:00,Ford Motor Company Recalls
2012-02-09 00:00:00,Ford Motor CFO Lewis Booth And Global Product Chief Derrick Kuzak To Retire
2012-03-14 00:00:00,Ford Motor Company Declares Second Quarter Dividend
2012-03-15 00:00:00,Ford Motor Company Said To Hide Truck Fuel Tank
2012-05-30 00:00:00,Ford Motor Company To Sell Ohio Auto Lighting Plant To Ventra
2012-08-27 00:00:00,China Approves Ford Motor Mazda Motor Chongqing Changan Automotive Co Ltd To Split JV In Economic Times
2012-09-05 00:00:00,CAW Could Strike At General Motors Ford Motor Co And Fiat Chrysler In
2012-10-15 00:00:00,Ford Motor Company Launches an Upgraded Version of its Figo in India
2012-10-16 00:00:00,Ford Motor Co Recalls More Than Fiesta Subcompact For Air Bag Economic Times
2012-10-24 00:00:00,Ford Motor Co Plans To Close Belgian
2012-10-25 00:00:00,Ford Motor Co Cuts
2012-10-31 00:00:00,US HOT Western Ford Warnaco
2012-11-01 00:00:00,Ford Motor appoints Zwelakhe Onwell Msomi as an Independent NED
2012-11-02 00:00:00,Is it Time to Cross the
2012-11-05 00:00:00,Ford Hopes That its Production Will Not be Affected in Australia as
