2011-04-28 00:00:00,Federated Declares Quarterly Dividend
2011-07-28 00:00:00,Federated Declares Dividend
2011-10-27 00:00:00,Federated Declares Quarterly Dividend
2012-10-25 00:00:00,Federated Investors Inc Declares Cash Dividend Per Share Of Including Quarterly And Special Dividend
2012-10-26 00:00:00,LXK Dividend Stocks Update
2012-10-31 00:00:00,High Momentum Stocks
2012-11-01 00:00:00,Stocks To Watch
2012-11-05 00:00:00,Obama Stock Low Volatility Favors Incumbents
2012-11-06 00:00:00,Indicated Dividend Yield Ranking for the 500 by Industry
