2011-04-26 00:00:00,FMC Corporation Declares Quarterly Dividend
2011-11-18 00:00:00,FMC Corporation Prices Million Debt Offering
2011-12-06 00:00:00,FMC Corporation Acquires Rovral and Sportak Fungicides From Bayer CropScience
2012-02-17 00:00:00,FMC Corporation Authorizes Million Of Share Repurchases And Increases Quarterly Dividend By
2012-04-24 00:00:00,FMC Corporation Announces Quarterly Dividend
2012-09-05 00:00:00,FMC Corp Forms Joint Venture With BCEG Environmental Remediation And Brisea Inc To Market Environmental Technologies In China
2012-10-24 00:00:00,FMC suggests review of easy credit for trading in commodities
2012-11-06 00:00:00,FMC Technologies to Present at the Bank of America Merrill Lynch 2012 Global
