2011-08-31 00:00:00,FMC Agriculture Group And Marrone Bio Innovations Sign Development And Distribution Agreement For Regalia
2011-10-26 00:00:00,FMC Corporation Signs Agreement To Acquire Natural Color And Health Ingredients Innovator South Pole Biogroup
2011-10-31 00:00:00,FMC Corporation Issues Q4 2011 EPS Guidance In Line With Raises Low End Of Prior FY 2011 EPS Guidance To A Range In Line With Estimates
2011-11-21 00:00:00,FMC Corporation Acquires Adventus Intellectual Property
2012-03-14 00:00:00,FMC Corporation Opens New Singapore Technical Center
2012-07-23 00:00:00,FMC Corp Declares Quarterly Dividend
2012-09-17 00:00:00,FMC Corp Announces New Chief Financial Officer
2012-09-24 00:00:00,Isagro SpA Enters into Research and Development Collaboration Agreement with FMC Corporation
2012-10-09 00:00:00,NEW PRODUCT Verifi by FMC Corporation
2012-10-15 00:00:00,FMC CORPORATION FMC Lithium Announces Specialty Organics
2012-10-22 00:00:00,FMC Technologies and Edison Chouest Offshore Form Subsea Services Joint
2012-11-05 00:00:00,FMC Corporation Donates to Hurricane Sandy Relief Efforts through the
