2011-07-28 00:00:00,FMC Subsidiary Forms New Argentine Agrochemical Distribution Joint Venture
2011-08-02 00:00:00,FMC Corporation Issues FY 2011 Revenue Guidance In Line With Raises High End Of Prior FY 2011 EPS Issues Q3 2011 EPS Guidance Below Call
2011-08-05 00:00:00,FMC Corporation Executes Billion Credit Agreement
2011-09-22 00:00:00,Church Dwight FMC Corporation And Tata Chemicals Limited Sign Partnership Agreement
2011-11-18 00:00:00,FMC Corporation Prices Million Debt Offering
2011-11-21 00:00:00,FMC Corporation Acquires Adventus Intellectual Property
2011-11-22 00:00:00,FMC Corporation Completes Million Debt Announces Share Repurchases
2012-04-24 00:00:00,FMC Corporation Announces Quarterly Dividend
2012-06-13 00:00:00,FMC Corporation Acquires
2012-08-01 00:00:00,FMC Corp Signs Agreement to Acquire Pectine Italia
2012-09-05 00:00:00,FMC Corp Forms Joint Venture With BCEG Environmental Remediation And Brisea Inc To Market Environmental Technologies In China
2012-10-09 00:00:00,NEW PRODUCT Verifi by FMC Corporation
2012-10-15 00:00:00,FMC CORPORATION FMC Lithium Announces Specialty Organics
2012-10-22 00:00:00,FMC Technologies and Edison Chouest Offshore Form Subsea Services Joint
2012-10-24 00:00:00,Forbes Earnings FMC
2012-10-31 00:00:00,COUNTERPATH CORPORATION CounterPath Signs Software License and
2012-11-01 00:00:00,FMC Stock Rating Reaffirmed by KeyBanc
