2010-11-09 00:00:00,Comments On Q4 2010 Revenue Raises FY 2010 EPS Guidance
2011-05-10 00:00:00,Issues Q2 2011 Mixed Raises FY 2011 Guidance
2012-02-14 00:00:00,Issues Q1 2012 EPS Guidance Below Issues FY 2012 EPS Guidance In Line With Comments On FY 2012 Revenue Guidance
2012-08-07 00:00:00,Fossil Inc Comments On Q3 2012 Revenue Issues Q3 2012 EPS Guidance Below Comments On Q4 2012 Revenue Lowers FY 2012 EPS Guidance
2012-10-16 00:00:00,Fossil Stock Rating Upgraded by Citigroup
2012-11-01 00:00:00,Fossil Third Quarter Earnings Sneak Peek
