2011-08-09 00:00:00,Comments On Q4 2011 Revenue Issues Q4 2011 EPS Guidance In Line With Issues Q3 2011 EPS Guidance Below Lowers High End Of FY 2011 EPS Guidance
2011-11-08 00:00:00,Lowers Q4 2011 Raises FY 2011 EPS Call
2012-05-08 00:00:00,Fossil Inc Comments On Q2 2012 Revenue Issues Q2 2012 EPS Raises FY 2012 Revenue Lowers FY 2012 EPS Guidance
2012-09-13 00:00:00,Fossil Inc Announces CFO Retirement
2012-10-08 00:00:00,Fossil Retained at Neutral Analyst Blog
2012-10-09 00:00:00,Fossil Vice Chairman Mark Quick to Retire and Join Board of Directors
