2010-11-09 00:00:00,GE Engages In Chinese Joint Ventures to Advance Development Of Smarter Energy And Electrification of Local Infrastructure Projects
2010-11-10 00:00:00,GE Oil Gas And ZKMK Localize Oil And Gas Turbine Manufacturing In Kazakhstan
2010-11-11 00:00:00,GE Announces Largest Single Electric Vehicle Commits to Convert Half of Global Fleet By Announces New Electric Vehicle Customer Experience Centers In Minnesota
2010-11-15 00:00:00,GE Capital Is for Billion Credit Facility to Bay Company
2010-12-09 00:00:00,GE Intelligent Platforms And plc Launches Intelligent Building Automation Platform For Data Centers
2010-12-20 00:00:00,General Electric Austria GMBH Announces Update On Recommended Cash Offer For Wellstream Holdings PLC
2010-12-22 00:00:00,GE Healthcare Completes Tender Offer for Clarient
2010-12-27 00:00:00,Russian Firms Set Energy And Medical JVs With
2010-12-28 00:00:00,Says In Talks With Hon Hai Precision Industry On Panel Enters Into JV With
2011-01-06 00:00:00,GE Intelligent Acquires SmartSignal Corporation
2011-01-11 00:00:00,GE Signs Agreements To Form Joint Ventures With Rostekhnologii And INTER RAO EES OAO
2011-01-31 00:00:00,GE Capital Sales Finance Secures Contract
2011-02-01 00:00:00,Sopharma Trading AD Sofia Signs Distribution Deal with General Electric
2011-02-03 00:00:00,Aviation Unit And Air India Signs Engine Maintenance
2011-02-07 00:00:00,General Electric Austria GmbH Updates On Recommended Cash Offer For Wellstream Holdings PLC
2011-02-09 00:00:00,GE Intelligent Proficy Workflow Adopted By S3 Development For Intelligent Control Room Management Solution
2011-02-10 00:00:00,Butler Health System To Implement Health Information Exchange
2011-02-11 00:00:00,GE Capital Is Agent For Million In Credit Facilities For
2011-02-14 00:00:00,GE Healthcare And SAS Announces Collaboration
2011-02-16 00:00:00,General Electric Austria GmbH Updates On Recommended Cash Offer For Wellstream Holdings PLC
2011-02-17 00:00:00,IBC Advanced Alloys Corp Signs Agreement With Joint Venture To Advance Beryllium Oxide Nuclear Fuel Research
2011-02-18 00:00:00,GE Capital Is Agent On Million Financing To Borders
2011-02-25 00:00:00,GE Capital Is Agent On Million Credit Facility To Tourneau
2011-02-28 00:00:00,GE Aviation Secures Systems On Boeing Tanker For United States Air Force
2011-03-03 00:00:00,Erlanger Health System to Implement Health Information Exchange
2011-03-09 00:00:00,Acacia Research Subsidiary Enters Into License Agreement With General Electric Company
2011-03-29 00:00:00,Energy Business Announces Acquisition Of Converteam
2011-04-01 00:00:00,Wood Group plc Announces Update On Disposal Of Well Support Division To GE Energy
2011-04-05 00:00:00,GE To Supply Water Recycling Technology To First US Power Plant To Be Built With Stricter State Emissions Limits
2011-04-12 00:00:00,GE Announces Water Treatment Outsourcing Agreement Yara International Yara
2011-04-28 00:00:00,GE Healthcare To Acquire Applied
2011-05-02 00:00:00,GE Capital Completes Million Credit Facility for
2011-05-10 00:00:00,GE Capital Signs Million Distribution Finance Programme With Nimbus Boats AB
2011-05-12 00:00:00,Rapidscan Pharma Solutions EU Ltd Selects GE Healthcare To Promote And Distribute Rapiscan In United Kingdom And Germany
2011-05-17 00:00:00,GE Gas Turbines to Provide Power for Russia
2011-06-09 00:00:00,GE Healthcares AngioViz Vascular Vision Software Receives FDA Clearance
2011-06-20 00:00:00,GE Aviation To Deploy RNP Paths At Jiuzhai Huanglong Airport
2011-06-27 00:00:00,Calpine GE Obtain Million Credit Facility To Finance Calif
2011-06-30 00:00:00,Brimar Limited GE Intelligent Platforms To Equip New Patrol Vehicles With Video
2011-07-05 00:00:00,GE Healthcare Financial Services Closes Million Credit Facilities for SpecialtyCare
2011-07-06 00:00:00,GE Oil Gas Receives Contract
2011-07-07 00:00:00,GE Capital Agents Billion in Credit Facilities for Alere
2011-07-25 00:00:00,GE Lighting Acquires Lightech
2011-08-16 00:00:00,GE Healthcare To Acquire PAA Laboratories GmbH
2011-08-19 00:00:00,GE Acquires Enhances Bently Nevada Condition Monitoring Portfolio
2011-08-29 00:00:00,GE Hitachi Nuclear Energy Secures Contract
2011-09-02 00:00:00,GE Board of Directors Authorizes Regular Quarterly Dividend
2011-09-07 00:00:00,GE To Distribute NTrainer System From KC BioMedix
2011-09-20 00:00:00,Egypt Selects GE Technology For Million In Electricity Contracts
2011-10-14 00:00:00,GE Plans to Build Solar Factory in Colorado
2011-10-31 00:00:00,GE To Supply Key Components For Centerline SWD Saltwater Disposal Well System
2011-11-07 00:00:00,GE Intelligent Platforms And Juniper To Develop Family of Secure Network Appliances for Military Vehicles
2011-11-16 00:00:00,GE Transportation Acquires Rail Software Provider RMI From The Carlyle Group
2011-11-18 00:00:00,GE Announces Expansion Of Integrated Renewable Combined Cycle Plant With MetCap Energy Investments
2011-12-23 00:00:00,in Consortium with General Electric Co Signs Contract with
2011-12-27 00:00:00,GE Capital To Acquire MetLifes Retail Deposit Business
2012-01-10 00:00:00,GE Healthcare Announces Biosense Webster Agreement
2012-01-30 00:00:00,Over Billion In New Orders Announced At 2012 GE Oil Gas Annual Meeting
2012-01-31 00:00:00,General Electric GE Capital Retail Bank Announces New Agreement To Provide Credit Card Program For Toys R Acquires Card Program Assets From JPMorgan Chase Co
2012-02-15 00:00:00,General Electric GE Capital Provides Million Credit Facility to Lightower Fiber Networks
2012-02-23 00:00:00,General Electric GE Oil Gas Secures Contract Of More Than Million For Julimar Development Project Offshore Western Australia
2012-02-27 00:00:00,Nippon Carbon to Establish Joint Venture with GE and Safran
2012-03-05 00:00:00,General Electric Co Signs Agreement For Locomotive Service Center With PT Kereta Api Indonesia
2012-03-09 00:00:00,Mitsubishi Heavy Announces Verdict of Lawsuit Filed by General Electric Co
2012-04-04 00:00:00,General Electric GE Healthcare Completes Acquisition Of
2012-04-05 00:00:00,General Electric Co And Massachusetts Institute of Technology Building Crowdsourcing Software Platform To Revolutionize Product Design And Manufacturing
2012-04-11 00:00:00,General Electric GE Healthcare Announces Preliminary Phase 3 Results For Flutemetamol
2012-04-13 00:00:00,General Electric GE Healthcare Announces Research Collaboration With Clino Ltd
2012-04-17 00:00:00,General Electric Wind Turbines Selected By Chinese Wind Power Developer For Project In Canada
2012-04-30 00:00:00,General Electric GE Oil Gas Receives Million Contract From ATP Oil Gas For Cheviot Oilfield Project In North Sea
2012-05-07 00:00:00,General Electric Co And China Xd Electric Co Form Global Transmission And Distribution Partnership
2012-05-10 00:00:00,General Electric GE Healthcare Completes Acquisition Of
2012-06-05 00:00:00,General Electric GE Healthcare Completes Acquisition of XPRO
2012-06-06 00:00:00,PETRONAS Selects General Electric GE Oil Gas Technology For PETRONAS LNG Train 9 Project
2012-06-12 00:00:00,General Electric Co To Supply General Dynamics UK With Subsystems For Scout SV ISTAR Platform
2012-07-09 00:00:00,Duro Felguera SA To Built Electric Power Plant In Argentina In Collaboration With General Electric Co And Fainser
2012-07-16 00:00:00,General Electric GE Aviation Signs Contract For Systems On Boeing Tanker For United States Air Force
2012-08-01 00:00:00,General Electric Co Acquires PRESENS
2012-08-07 00:00:00,General Electric Co and Nautic Global Group Announce Strategic Inventory Finance Program
2012-08-09 00:00:00,RAO Energeticheskiye sistemy Vostoka OAO Signs Deal To Buy Equipment From General Electric GE
2012-08-10 00:00:00,General Electric Co Signs Agreement To Acquire Naxys
2012-08-21 00:00:00,FDA Approves Labeling Changes For General Electric GE Healthcares Optison
2012-09-18 00:00:00,General Electric GE Oil Gas Signs Contract Of Nearly Billion With Petrobras
2012-09-19 00:00:00,General Electric Co Receives million in New Orders For Breakthrough Battery
2012-09-26 00:00:00,General Electric Co Trims Stake In Bank of Ayudhya Public Company
2012-10-01 00:00:00,Integrys Energy Group Subsidiary Enters Into Agreement To Buy General Electric Co And Tyr Fox Energy Company LLC
2012-10-03 00:00:00,Safran and General Electric CFM Receives Order from GOL Airlines
2012-10-08 00:00:00,General Electric Oil Gas Secures Contract
2012-10-11 00:00:00,Safran and General Electric CFM Enters into Joint Cooperation Agreement with Lufthansa Technik
2012-11-05 00:00:00,GENERAL ELECTRIC COMPANY More Support Needed for Veterans
2012-11-06 00:00:00,A Busy Year for Hiring at GE
