2010-12-02 00:00:00,Advinus Therapeutics And Corning Incorporated Sign Agreement To Bring Corning Epic Technology To India
2011-01-06 00:00:00,Corning Corning Gorilla Glass Selected For Sonys BRAVIA Line O LCD TVs
2011-01-31 00:00:00,Corning Incorporated Announces To Acquire MobileAccess
2011-03-02 00:00:00,Corning Incorporated Announces Purchases Of MobileAccess
2011-03-03 00:00:00,Corning Corning Cable Systems To Provide Passive Optical Solutions For Astanatelecom FTTH Pilot
2011-04-14 00:00:00,Corning Incorporated And DSM Extends Agreement For Supply Of Optical Fiber Coating
2011-04-27 00:00:00,Corning Incorporated Declares Quarterly Dividend
2011-06-07 00:00:00,Mersen SA Announces Agreement with Corning SAS to Develop Reactors via Boostec
2011-06-16 00:00:00,Corning Corning MobileAccess Receives Contract
2011-06-28 00:00:00,SICCAS and Corning Incorporated Open Joint Research Facility
2011-07-20 00:00:00,Corning Incorporated Declares Quarterly Dividend
2011-11-10 00:00:00,Bluechiip Ltd Signs Agreement With Corning Incorporated
2011-12-01 00:00:00,Corning Incorporated Acquires
2012-02-01 00:00:00,Corning Inc Declares Quarterly Dividend
2012-02-15 00:00:00,Corning Inc Prices Million Of Senior Unsecured Notes
2012-06-26 00:00:00,Corning Incorporated Receives Contract
2012-07-18 00:00:00,Corning Inc Declares Quarterly Dividend
2012-10-03 00:00:00,Corning Inc Increases Quarterly Common Dividend
2012-10-16 00:00:00,ADVA AG Optical Networking and Corning Inc Jointly Demonstrate ADVA 100G Metro Solution
2012-11-01 00:00:00,Corning Inc Completes BD Discovery Labware Business Acquisition From Becton Dickinson And Co
2012-11-02 00:00:00,Corning Closes BD Labware Unit Buy Analyst Blog
2012-11-05 00:00:00,Completes Sale of Majority of Discovery Labware Unit
