2010-12-02 00:00:00,Advinus Therapeutics And Corning Incorporated Sign Agreement To Bring Corning Epic Technology To India
2011-01-03 00:00:00,Corning Incorporated Announces Appointment Of President Form 8K
2011-01-06 00:00:00,Corning Corning Gorilla Glass Selected For Sonys BRAVIA Line O LCD TVs
2011-04-27 00:00:00,Corning Incorporated Declares Quarterly Dividend
2012-07-18 00:00:00,Corning Inc Declares Quarterly Dividend
2012-10-03 00:00:00,Corning Inc Increases Quarterly Common Dividend
2012-10-16 00:00:00,ADVA AG Optical Networking and Corning Inc Jointly Demonstrate ADVA 100G Metro Solution
2012-10-24 00:00:00,Corning Inc To Cut
2012-10-25 00:00:00,Earnings Forecast Newfield Pfizer
2012-11-01 00:00:00,Corning Inc Completes BD Discovery Labware Business Acquisition From Becton Dickinson And Co
