2010-11-15 00:00:00,Genuine Parts Company Declares Regular Quarterly Dividend
2011-09-01 00:00:00,Genuine Parts Electrical Announces Acquisition of Cobra Wire
2011-09-26 00:00:00,Exego Group Announces Ownership Interest Of Genuine Parts Company
2012-02-28 00:00:00,Genuine Parts Company Announces Proposed Acquisition Of NAPA Distributor
2012-04-23 00:00:00,Genuine Parts Company Declares Regular Quarterly Dividend
2012-08-20 00:00:00,Genuine Parts Co Declares Regular Quarterly Dividend
2012-10-15 00:00:00,Genuine Parts Third Quarter Earnings Sneak Peek
2012-10-16 00:00:00,Wunderlich Gives hold Rating to Genuine Parts Company
