2011-01-03 00:00:00,The Goldman Sachs Digital Sky Technologies Invest In
2011-01-06 00:00:00,Accordia Golf Ltd Announces Changes in Shareholding Structure
2011-01-14 00:00:00,The Goldman Sachs Declares Preferred Stock Dividends
2011-01-27 00:00:00,Proceeds With Amended Complaint Against Goldman Sachs And Bank of America Corporation Subsidiary Merrill Lynch
2011-03-01 00:00:00,The Goldman Sachs Liquidates Two Proprietary Trading
2011-03-16 00:00:00,The Goldman Sachs Goldman Sachs Asset Management Company Buys Benchmark Asset Management
2011-04-07 00:00:00,The Goldman Sachs To Buy Australian
2011-04-14 00:00:00,The Goldman Sachs Moves Closer To Selling Litton Loan
2011-04-15 00:00:00,The Goldman Sachs Declares Preferred Stock Dividends
2011-04-19 00:00:00,The Goldman Sachs Declares Dividend
2011-04-20 00:00:00,The Goldman Sachs Sells Part Of Stake In Hana Financial Group
2011-06-02 00:00:00,The Goldman Sachs Subpoenaed For Financial Crisis
2011-06-29 00:00:00,The Goldman Sachs To Lay Off 230 Employees In New
2011-07-19 00:00:00,The Goldman Sachs Declares Dividend
2011-07-21 00:00:00,The Goldman Sachs Wins Dismissal Of Timberwolf CDO
2011-08-08 00:00:00,American International Expected To Sue Bank of The Goldman Sachs Over Mortgage
2011-08-09 00:00:00,The Goldman Sachs Says Others Threatened Mortgage
2011-08-10 00:00:00,SEC Examining The Goldman Sachs Compliance With Anti Bribery
2011-08-11 00:00:00,The Goldman Sachs Likely To Join Bidding Consortium For Woori Finance Holdings
2011-09-23 00:00:00,Consortium Led By Abertis Infraestructuras SA And Goldman Sachs Infrastructure Partners II Investment Fund Closes Contract To Manage And Toll Roads And Forms Joint Venture
2011-09-27 00:00:00,The Goldman Sachs May Cut Additional
2011-10-18 00:00:00,The Goldman Sachs Declares Dividend
2011-11-01 00:00:00,Lehman Brothers Holdings The Goldman Sachs Settle Tiff Over Real Estate
2011-11-09 00:00:00,The Goldman Sachs Selling Up To Billion In Industrial and Commercial Bank of China
2011-12-13 00:00:00,The Goldman Sachs Buys In Max India Limited From Warburg Economic Times
2011-12-16 00:00:00,Fitch Cuts The Goldman Sachs Barclays Five Other Large Banks
2012-03-01 00:00:00,The Goldman Sachs to Acquire Operations of Reinsurer Ariel Re
2012-03-16 00:00:00,Banks Including The Goldman Sachs Eye American International Toxic Assets Held By Federal Reserve Bank of New
2012-03-20 00:00:00,The Goldman Sachs Cuts Staff In Annual Review
2012-04-13 00:00:00,Goldman Sachs Group Inc Declares Preferred Stock Dividends
2012-04-16 00:00:00,Temasek Buys Billion of Industrial and Commercial Bank of China Shares From The Goldman Sachs
2012-04-17 00:00:00,Goldman Sachs Group Inc Increases Quarterly Dividend To Per Common Share
2012-04-19 00:00:00,Judge Dismisses Claims Against Goldman Sachs Group Inc And Other Banks In General Electric Co
2012-04-23 00:00:00,Credit Goldman Sachs Group Inc Band Together For NY Fed CDO Bid To Outbid Five Other Wall Street
2012-05-22 00:00:00,Credit Suisse Group AG Wins Latest Maiden Lane III Deutsche Bank The Goldman Sachs Others Vying For Duke
2012-06-19 00:00:00,Japan Selects Goldman Sachs And Others For Billion JAPAN TOBACCO Share
2012-06-22 00:00:00,Judge Allows Investor Suit Over Goldman Sachs Group Inc
2012-07-17 00:00:00,State Street Corporation To Acquire Goldman Sachs Administration Services From The Goldman Sachs
2012-09-07 00:00:00,Carlyle Group Infrastructure Fund To Acquire Cogentrix Energy Assets And Power Project Development And Acquisition Platform From Goldman Sachs Group Inc
2012-10-16 00:00:00,Goldman Sachs Group Inc Announces Quarterly Dividend
