2010-07-09 00:00:00,Liberty Mutual Insurance Co Sues Goldman Sachs Group Inc Over Fannie Mae
2010-11-16 00:00:00,H H International Announces Discontinuation of Dialogue with Potential Buyers Including Goldman Sachs Capital Partners PAI Partners
2010-12-17 00:00:00,Endesa Completes Gas Asset Sale To Two Goldman Sachs Group Infrastructure Funds
2010-12-23 00:00:00,BF Utilities Limited In Talks With The Goldman Sachs On Expressway Stake
2010-12-28 00:00:00,The Goldman Sachs Takes Minority Stake In Lucas
2010-12-31 00:00:00,Citigroup Citigroup Global And The Goldman Sachs Plan To Buy Of Reliance
2011-01-03 00:00:00,The Goldman Sachs Digital Sky Technologies Invest In
2011-01-06 00:00:00,Accordia Golf Ltd Announces Changes in Shareholding Structure
2011-01-14 00:00:00,The Goldman Sachs Declares Preferred Stock Dividends
2011-02-17 00:00:00,Goldman Sachs Decreases Stake In Apex Minerals NL
2011-02-18 00:00:00,Goldman Sachs Acquires Stake In Northern Energy Corporation
2011-04-07 00:00:00,The Goldman Sachs To Buy Australian
2011-04-08 00:00:00,The Goldman Sachs Buys More Than Million Stake In Taikang Life Insurance Co From
2011-04-12 00:00:00,Founders of Marvell Technology Group File Lawsuit Against The Goldman Sachs
2011-06-17 00:00:00,The Goldman Sachs Eyes Including
2011-06-21 00:00:00,Abertis Infraestructuras SA And Including Unit Of Goldman Sachs Group Preferred Bidder For Puerto Rico Highways
2011-07-21 00:00:00,The Goldman Sachs Wins Dismissal Of Timberwolf CDO
2011-07-22 00:00:00,The Goldman Sachs Selling Benchmark Ten Year Global
2011-07-26 00:00:00,The Goldman Sachs Wins Mandate For Sydney Desalination Plant
2011-07-27 00:00:00,Lehman Brothers Plans Deal To Sell Majority Of Virginia Property To A Goldman Sachs
2011-10-18 00:00:00,The Goldman Sachs Declares Dividend
2011-10-28 00:00:00,The Goldman Sachs Sued For Billion Over Timberwolf
2011-11-01 00:00:00,Lehman Brothers Holdings The Goldman Sachs Settle Tiff Over Real Estate
2012-02-07 00:00:00,The Goldman Sachs Goldman Sachs Asset Management to Acquire Dwight Asset Management from Old Mutual Asset Management
2012-02-09 00:00:00,The Goldman Sachs To Buy Stake In Trade And Development Bank Of
2012-02-13 00:00:00,The Goldman Sachs Sells Million Stake In Hana Financial Group
2012-02-16 00:00:00,Warns May Downgrade 17 Global Banks And Securities Firms Including The Goldman Sachs
2012-02-17 00:00:00,Transunion Corp To Be Acquired By Advent International And The Goldman Sachs GS Capital Partners
2012-03-01 00:00:00,The Goldman Sachs to Acquire Operations of Reinsurer Ariel Re
2012-03-16 00:00:00,Banks Including The Goldman Sachs Eye American International Toxic Assets Held By Federal Reserve Bank of New
2012-03-20 00:00:00,The Goldman Sachs Cuts Staff In Annual Review
2012-03-21 00:00:00,The Goldman Sachs Loses Bid To Dismiss Hudson CDO
2012-06-19 00:00:00,Japan Selects Goldman Sachs And Others For Billion JAPAN TOBACCO Share
2012-07-03 00:00:00,Goldman Sachs Group Inc Loses Appeal Of Million Bayou
2012-07-05 00:00:00,Mahindra And Mahindra Ltd May Bid For Hawker Part Owned By Goldman Sachs Group Times
2012-07-06 00:00:00,Goldman Sachs Group Inc Secures Three Properties For New Japan
2012-07-13 00:00:00,Goldman Sachs Group Inc Declares Preferred Stock Dividends
2012-07-17 00:00:00,State Street Corporation To Acquire Goldman Sachs Administration Services From The Goldman Sachs
2012-08-10 00:00:00,Goldman Sachs Group Inc To Sell Japan Contractor Fujita Corp To Daiwa House Industry For
2012-09-07 00:00:00,Carlyle Group Infrastructure Fund To Acquire Cogentrix Energy Assets And Power Project Development And Acquisition Platform From Goldman Sachs Group Inc
2012-09-18 00:00:00,Goldman Sachs Group Inc Announces Chief Financial Officer Change
2012-10-05 00:00:00,Westpac TPS Trust Announces Holding Interest Of The Goldman Sachs Group Goldman Sachs Holdings ANZ Pty Limited And Their Subsidiaries
2012-10-10 00:00:00,Goldman Sachs Group Inc Backs CVC Capital Partners Nine Entertainment Debt For Equity
2012-10-12 00:00:00,Goldman Sachs Group Inc Declares Preferred Stock Dividends
2012-10-16 00:00:00,Goldman Sachs Group Inc Announces Quarterly Dividend
2012-10-17 00:00:00,Gupta Deserves Probationary Term in Lawyer Says
2012-10-22 00:00:00,Goldman Sachs Versus Greg Smith Saga Continues
2012-11-01 00:00:00,Goldman Loses Bid to Avoid Trial Over Dragon Systems Sale
2012-11-02 00:00:00,Goldman urges Supreme Court to end mortgage
2012-11-05 00:00:00,Hawker Sees Strong Growth in Turkish Demand
