2010-12-13 00:00:00,Goodyear Tire Rubber Company To Sell Latin American Farm Tire Businesses
2011-02-23 00:00:00,The Goodyear Tire Rubber Company Sells Its Stake In Good Year Lastikleri To Goodyear
2011-03-31 00:00:00,Goodyear Tire Rubber Company Announces Closing of Mandatory Convertible Preferred Stock Offering
2011-06-03 00:00:00,Goodyear Tire Rubber Company Declares Preferred Stock Dividend
2011-07-11 00:00:00,Goodyear Tire Rubber Company Closes Tennessee Plant
2011-08-02 00:00:00,Goodyear Tire Rubber Company Declares Dividend On Preferred Stock
2012-03-06 00:00:00,Goodyear Tire Rubber Company Declares Dividend On Preferred Stock
2012-10-11 00:00:00,Apollo Tyres eyeing Cooper source
2012-10-23 00:00:00,The Goodyear Tire Rubber Co Says Workers At South African Plant Go On
