2010-12-13 00:00:00,Goodyear Tire Rubber Company To Sell Latin American Farm Tire Businesses
2011-03-29 00:00:00,Goodyear Tire Rubber Company Announces Pricing Of Mandatory Convertible Preferred Stock
2011-04-01 00:00:00,Titan Titan Tire Corporation Closes on Purchase of Goodyear Tire Rubber Latin American Farm Tire Business
2011-12-06 00:00:00,Goodyear Tire Rubber Company Declares Dividend On Preferred Stock
2012-10-11 00:00:00,Apollo Tyres eyeing Cooper source
2012-10-31 00:00:00,Effects of Monetary Stimulus Industry Report on
