2010-12-06 00:00:00,Health Care Completes Million Common Stock Offering
2011-04-04 00:00:00,Health Care Completes Billion Acquisition Of Genesis HealthCare Real Estate Raises FY 2011 FFO Guidance
2011-07-28 00:00:00,Health Care Declares Second Quarter Dividend
2011-11-09 00:00:00,Health Care Completes Million Common Stock Offering
2012-03-27 00:00:00,Health Care Announces Pricing Of Million Of Senior Notes
2012-07-26 00:00:00,Health Care Declares Second Quarter Dividend
2012-09-24 00:00:00,Health Care Reit Inc Completes Billion Common Stock Offering
2012-11-06 00:00:00,Health Care Reit Inc Lowers FY 2012 FFO Guidance
