2011-02-02 00:00:00,The Hartford Financial Services Group Issues FY 2011 EPS Guidance In Line With Estimates
2011-07-27 00:00:00,The Hartford Financial Services Group Declares Quarterly Dividend Of Per Share Of Common Stock
2012-04-26 00:00:00,The Hartford Financial Services Group Signs Agreement To Sell Individual Annuity New Business Capabilities
2012-07-25 00:00:00,The Hartford Financial Services Group Declares Quarterly Dividend Of Per Share Of Common Stock
2012-09-04 00:00:00,The Hartford Financial Services Group Inc To Sell Retirement Plans Business To MassMutual
2012-10-18 00:00:00,Hartford Settles Suit Involving Treasury Deputy
2012-10-25 00:00:00,The Hartford Financial Services Group Inc Declares Quarterly Dividend Of Per Share Of Common Stock
2012-10-31 00:00:00,Hartford Earnings Focus On To Pay Off
2012-11-01 00:00:00,Earnings Report for November 2012 EIX
2012-11-07 00:00:00,Prudential Financial Posts Q3 Loss
