2011-02-23 00:00:00,The Company And Heinz Company Announce Partnership To Expand Use Of Innovative Plant Bottle Packaging
2011-02-24 00:00:00,Heinz Company Raises FY 2011 EPS Guidance
2011-03-03 00:00:00,Heinz Company To Acquire Stake In Brazilian Food Reaffirms FY 2011 EBIT Lowers FY 2011 Revenue Guidance
2011-03-09 00:00:00,Heinz Company Declares Quarterly Dividend
2011-04-01 00:00:00,Heinz Company Completes Acquisition Of Stake In Brazilian Foodmaker
2011-05-26 00:00:00,Heinz Company Raises Annualized Dividend To
2011-08-30 00:00:00,H J Heinz Co Declares Quarterly Dividend
2011-09-07 00:00:00,H J Heinz Co Preparing Five And Ten Year Senior Unsecured Note
2012-02-17 00:00:00,H J Heinz Co Narrows FY 2012 EPS Outlook To A Range In Line With Reaffirms FY 2012 Revenue Outlook
2012-06-05 00:00:00,The Ford Motor Heinz And Procter Gamble Co Form Collaboration To Accelerate Development Of Products Made Entirely From Plants
2012-08-28 00:00:00,Heinz Co Declares Quarterly Dividend
2012-09-10 00:00:00,Heinz Co Reaffirms FY 2013 Call
2012-10-11 00:00:00,Giant Eagle locking in some prices through holidays
2012-10-15 00:00:00,Double Buy Signal Issued for HJ Heinz
2012-11-01 00:00:00,McCormick Is Spicy
2012-11-06 00:00:00,Indicated Dividend Yield Rankings of 500 Companies
