2010-11-08 00:00:00,Company Introduces Digital Signage
2010-11-17 00:00:00,Company Launches Startup Central At Incubate
2010-11-19 00:00:00,Company Declares Regular Dividend
2010-11-22 00:00:00,Company Issues Q1 2011 Guidance Below Issues FY 2011 EPS Guidance Above Estimates
2010-11-29 00:00:00,Marriott Selects Company To Meet Demand For Premium Technology In Australia
2010-11-30 00:00:00,Company Announces First Unified System To Manage Application Lifecycle
2010-12-06 00:00:00,TOPS Markets Renews Services Agreement With Company
2010-12-10 00:00:00,Company Collaborates With Rossignol To Deliver Notebooks
2010-12-13 00:00:00,Company Wins Contract worth CZK Daily News
2010-12-14 00:00:00,Company Improves Reduces Costs with Support for Virtualized Server Environments
2010-12-15 00:00:00,Signs Services Agreement With Company
2010-12-16 00:00:00,Company Secures Cloud Infrastructure Bid At SHI International
2010-12-21 00:00:00,BP Signs Million Global Hosting Services Agreement With Company
2010-12-28 00:00:00,HCL Technologies Company May Bid For IT
2011-01-10 00:00:00,Company Introduces Interactive Technologies for Retailers
2011-01-12 00:00:00,Company Receives Contract To Implement Texas Electronic Health Information System
2011-01-18 00:00:00,Advanced Vision Technology Joins Partner Program for Indigo Division
2011-01-20 00:00:00,HP Enterprise Services Secures Million Technology Services Agreement With FCC to Support Rapid Growth
2011-01-21 00:00:00,GrandTech Systems Obtains Dealership
2011-01-25 00:00:00,Company Drives New Era For Cloud Computing
2011-01-27 00:00:00,Company Opens First Branded Store in Czech Daily News
2011-01-31 00:00:00,To Reach Settlement With Company
2011-02-02 00:00:00,Company Receives Contract
2011-02-04 00:00:00,Bottling Selects Company To Improve Business Agility
2011-02-07 00:00:00,Announces New Solution for Base Stations Via Partnership with Freescale and
2011-02-08 00:00:00,Reed Smith LLP Selects To Enhance Network Visibility And Mitigate Risk
2011-02-14 00:00:00,Company Helps Telecom Operators In Korea Expand App Stores For Mobile Users
2011-02-15 00:00:00,Company And To Market Security Technology For Cloud
2011-02-16 00:00:00,HP Enterprise Services Secures Contract
2011-02-22 00:00:00,Company Issues Q2 2011 Guidance Below Lowers FY 2011 Revenue Raises FY 2011 EPS Guidance
2011-02-23 00:00:00,Converged Infrastructure Helps Payroll Processor Grow Improve Customer Response Time
2011-02-28 00:00:00,Centrica Selects Company For Million Technology Migration
2011-03-01 00:00:00,Company Delivers First Mobile Access Solution
2011-03-07 00:00:00,Company Provides For Success
2011-03-10 00:00:00,Company Lights Way For Clients To Optimize Energy Resources
2011-03-14 00:00:00,Company Increases Regular Quarterly Dividend By
2011-03-22 00:00:00,Nevada Awards Company Million Medicaid Contract
2011-03-28 00:00:00,FEMSA Signs Million Technology Services Agreement With Company To Support Growth
2011-03-29 00:00:00,Acacia Research Subsidiary Enters into Settlement Agreement with Company
2011-04-11 00:00:00,Company Held Talks To Buy TIBCO
2011-04-28 00:00:00,Company Secures Billion Services Contract From NASA
2011-05-03 00:00:00,HP Enterprise Services Signs Services Agreement with Dollar Thrifty Automotive Group
2011-05-04 00:00:00,Company Secures Contract For Information Technology Services From San Diego County
2011-05-09 00:00:00,Australian Taxation Office Signs Million Centralized Computing Services Agreement with Company
2011-05-17 00:00:00,Company Updates Q3 2011 Guidance To A Range Below Lowers FY 2011 Guidance
2011-05-18 00:00:00,Company Secures Contract
2011-05-23 00:00:00,Company To Help Telecoms Drive Growth With New Consulting Services and Management Introduces HP Agent Enablement Solution
2011-05-25 00:00:00,Company To Buy Print Services Company Standard
2011-05-26 00:00:00,Signs Services Agreement With Company
2011-05-31 00:00:00,Company Expands Recall Of Laptop
2011-06-01 00:00:00,Inc To Acquire Assets Of Visual Collaboration Business Including Halo Products And Managed Services Business
2011-06-07 00:00:00,Company Receives Contract From Air Force For Supplies And Services
2011-06-13 00:00:00,Avista Corporation Renews Services Agreement With Company
2011-06-15 00:00:00,Company Secures Contract
2011-06-16 00:00:00,Toshiba Corporation And Company To Explore Smart Community Collaboration
2011-06-28 00:00:00,Company Helps Telekom Serbia Transform Operations For Better User Experience
2011-06-29 00:00:00,Company Boosts Research At University of Utah
2011-06-30 00:00:00,Oracle Corporation Fires New Salvo Against
2011-07-07 00:00:00,Company Announces Extension To Multimillion Dollar Business Deal With BMW Group
2011-07-21 00:00:00,Company Declares Regular Dividend
2011-07-25 00:00:00,Company Announces New Solutions And Services
2011-07-27 00:00:00,Services Provider Core Services Selects Company To Host Business Applications
2011-08-01 00:00:00,Advanced Micro Teams With and Clarkson University for Sustainable Data Center Energy Research
2011-08-18 00:00:00,Indirect Subsidiary HP SPV To Acquire Autonomy Corporation plc
2011-08-22 00:00:00,NHIC Corp Secures Contract
2011-08-23 00:00:00,Holding Subsidiary Concludes Contract with Hewlett Packard
2011-08-24 00:00:00,Company Sues AU Optronics Over Alleged LCD Panel Price
2011-08-25 00:00:00,PrimeLending Selects Company To Secure Vital Assets
2011-08-30 00:00:00,Oracle Corporation Brings New Claims Against Company In Itanium
2011-08-31 00:00:00,Company Powers Global Expansion For Spencer Hart
2011-09-01 00:00:00,Acer Incorporated Says No Interest In Company PC
2011-09-02 00:00:00,Initiates Litigation Against Dell Company And Novatel
2011-09-07 00:00:00,Company Introduces PCs For Everyone
2011-09-13 00:00:00,Robbins Geller Rudman Dowd LLP Files Class Action Suit Against Company
2011-09-14 00:00:00,The Briscoe Law Firm and Powers LLP Announce Investigation of Company
2011-09-15 00:00:00,Holzer Holzer LLC Announces Investigation Into Potential Claims For Breach Of Fiduciary Duties By Certain Officers And Directors Of Company
2011-09-16 00:00:00,Hagens Berman Investigates Company
2011-09-19 00:00:00,Security Commences Patent Litigation Against 16 Data Networking Companies Including Company
2011-09-22 00:00:00,Company Extends Customer Service Agreement With Loan Value Group LLC For Five Years
2011-09-23 00:00:00,Hagens Berman Continues Investigation Of Company
2011-09-28 00:00:00,Vision Offer For Autonomy Corporation plc Open For Acceptances Until October
2011-09-29 00:00:00,Autonomy Corporation Company Confirms Clearance
2011-10-14 00:00:00,Autonomy Corporation Announces Update On Recommended Cash Offer From Vision An Indirect Wholly Owned Subsidiary Of Company
2011-10-19 00:00:00,Arkansas Signs Million Medicaid Contract Extension With Company
2011-10-20 00:00:00,Company Secures Contract
2011-10-21 00:00:00,Law Firm Brower Piven Announces Class Action Lawsuit Against Company
2011-10-25 00:00:00,Idemitsu Petroleum Norge Selects Company For Business Continuity
2011-10-27 00:00:00,Company To Keep PC Division
2011-10-31 00:00:00,Company Secures Contract
2011-11-03 00:00:00,Company Introduces Multitouch Slate Tablet PC for Business
2011-11-08 00:00:00,Company Weighing Sale Of webOS
2011-11-14 00:00:00,Intercede Group plc And Company Announces New Partnership
2011-11-16 00:00:00,Company Unveils Business Ultrabook
2011-11-17 00:00:00,Company Declares Regular Dividend
2011-11-21 00:00:00,Company Issues Q1 2012 EPS Guidance Below Issues FY 2012 EPS Guidance
2011-12-02 00:00:00,VISION Announces OFFER TO CLOSE
2011-12-06 00:00:00,Company Acquires Hiflex Software
2012-01-17 00:00:00,Company And Blue Shield Of California Sign Infrastructure And Applications Services Agreement
2012-01-20 00:00:00,Company Declares Regular Dividend
2012-01-23 00:00:00,Company Provides Hutchison 3G Austria With Mobility Solution For LTE Network
2012-02-06 00:00:00,Company Helps Liaoning Mobile Manage Its Network For Better Customer Experience
2012-02-14 00:00:00,Company Introduces Thin Clients With Unprecedented Exceptional Flexibility and Performance
2012-02-22 00:00:00,Company Issues Q2 2012 EPS Guidance Below Reaffirms FY 2012 EPS Guidance
2012-02-23 00:00:00,HP Enterprise Services Secures Million Medicaid Contract Extension
2012-03-05 00:00:00,Swisscom Delivers Unified Communications Services With Private Cloud Solution From Hewlett Packard Company
2012-03-06 00:00:00,Veterans Affairs Selects Hewlett Packard Company to Improve Healthcare Claims Processing
2012-03-07 00:00:00,Hewlett Packard Hewlett Packard Romania Gets Awarded EUR Million Contract For Electronic Prescription News Brief Service
2012-03-19 00:00:00,Cloud Services Provider CenterBeam Selects Hewlett Packard Company To Support Customer Demand
2012-03-20 00:00:00,Hewlett Packard Company To Merge PC Arms In
2012-03-21 00:00:00,Hewlett Packard Hewlett Packard Romania Gets Hit by France Presse
2012-03-22 00:00:00,Hewlett Packard Company Announces Turkcell Is Using HP Cloud Solutions To Generate New Revenue Through A Offerings To Businesses
2012-03-27 00:00:00,Hewlett Packard Oracle Corporation Seek Pretrial Wins In Itanium
2012-04-03 00:00:00,Hewlett Packard Company Announces Award Of Army Contract for Enterprise Cloud Computing Services
2012-04-19 00:00:00,Hewlett Packard Co To Build Printer Factory In
2012-04-23 00:00:00,FAS Chooses Hewlett Packard HP Converged Infrastructure
2012-05-03 00:00:00,Oracle Attorney Rules Out Settlement With
2012-05-14 00:00:00,Hewlett Packard Co Loses Million Tax Case Against
2012-05-17 00:00:00,Hewlett Packard Co Mulls Cutting At Least
2012-05-18 00:00:00,Hewlett Packard Co Declares Regular Dividend
2012-05-23 00:00:00,Hewlett Packard Co Issues Q3 2012 EPS Guidance Below Updates FY 2012 EPS Guidance To A Range Above Comments On FY 2012 Charge Guidance
2012-05-29 00:00:00,Hewlett Packard Co Resolves Ink Cartridge Patent Infringement Lawsuit With Multilaser
2012-05-30 00:00:00,Hewlett Packard HP Enterprise Services Secures Contract From Oklahoma State and Education Employees Group Insurance Board
2012-06-04 00:00:00,Hewlett Packard Co Says Oracle Corp Violated Seeks Up To Billion In
2012-06-18 00:00:00,Hewlett Packard HP Enterprise Services Signs Multiyear Agreement With Procter Gamble
2012-06-26 00:00:00,Hewlett Packard Co Signs New Technology Agreement With Vodafone And Mobile TeleSystems OJSC
2012-06-27 00:00:00,Hewlett Packard Co Announces Healthcare Publisher Lifescript Selects HP 3PAR Storage To Expand Enhance Customer Service
2012-07-09 00:00:00,State of Delaware Awards Hewlett Packard Co Million Medicaid Contract Renewal
2012-07-19 00:00:00,MLP Signs New Outsourcing Agreement With Hewlett Packard Co
2012-07-20 00:00:00,Hewlett Packard Co Declares Regular Dividend
2012-08-01 00:00:00,Hewlett Packard Co Wins Court Ruling In Itanium Litigation With Oracle Corp
2012-08-15 00:00:00,Co Secures Contract
2012-08-16 00:00:00,Global Investment Manager BlackRock Selects Co To Speed Application Delivery
2012-08-22 00:00:00,Co Lowers High End Of Prior FY 2012 EPS Guidance To A Range In Line With Estimates
2012-08-23 00:00:00,Co Receives Contract for Air Force
2012-09-05 00:00:00,New vBridge Selects Converged Storage
2012-09-10 00:00:00,Co Adds To Layoff Now Plans Job Sees FY 2014 Charge
2012-09-19 00:00:00,Co Resolves Ink Cartridge Patent Infringement Lawsuit With Maxprint
2012-10-02 00:00:00,Co Secures Contract From plc
2012-10-03 00:00:00,Co Issues FY 2013 EPS Guidance In Line With Estimates
2012-10-04 00:00:00,moved down following the decision
2012-10-05 00:00:00,Company Turn Around BAML
2012-10-08 00:00:00,Renault Selects For Private Cloud Services
2012-10-09 00:00:00,Citigroup Starts as a Street Expectations Still too
2012-10-10 00:00:00,Reign as Top PC Maker Ended by Lenovo
2012-10-17 00:00:00,Belgian Bank Selects Autonomy Scrittura For Management
2012-10-18 00:00:00,General Motors Co and Co Team Up On IT Transformation
2012-10-19 00:00:00,Ending Deal With Violin Memory
2012-10-24 00:00:00,wins Idaho school laptop contract
2012-10-25 00:00:00,Zamansky Associates LLC Announces Investigation Of Co
2012-10-31 00:00:00,This Tech Stock See Gains For Years
