2011-02-02 00:00:00,The Hershey Company Comments On FY 2011 Increases Quarterly Dividend
2011-03-30 00:00:00,The Hershey Company Reaffirms FY 2011 Guidance
2011-07-05 00:00:00,Hershey Co And Godrej Group End India
2011-07-06 00:00:00,Godrej Consumer Products Limited Denies Report Of End To The Hershey India Joint
2011-07-26 00:00:00,Hershey Co Raises FY 2011 Guidance
2012-04-24 00:00:00,The Hershey Co Raises FY 2012 Guidance
2012-04-30 00:00:00,The Hershey Co Declares Quarterly Dividends
2012-05-07 00:00:00,The Hershey Co Announces GPS Project to Map Cocoa Farms in Week
2012-06-19 00:00:00,The Hershey Co Mulls An End To JV With Plans To Go Solo In Economic Times
2012-06-25 00:00:00,The Hershey Co Reaffirms FY 2012 Call
2012-08-07 00:00:00,The Hershey Co Declares Quarterly Dividends
2012-09-05 00:00:00,The Hershey Co Extends NCAA Corporate Partner Expands College Presence Through New University Sponsorships
2012-10-09 00:00:00,Hershey An Impressive Mix Of Dividends And Growth
2012-10-18 00:00:00,THE HERSHEY COMPANY Named to the Dow Jones Sustainability North
