2011-02-25 00:00:00,IntercontinentalExchange Announces Acquisition Of Ballista Securities
2011-04-21 00:00:00,NASDAQ OMX And IntercontinentalExchange Respond To NYSE Continued Rejection Of NASDAQ Superior Proposal
2011-08-30 00:00:00,IntercontinentalExchange Receives Patent For Electronic Trade Matching And Confirmation Technology
2012-05-16 00:00:00,NYSE Euronext Out Of Bidding For Leaves IntercontinentalExchange And Others In
2012-05-31 00:00:00,LME To Hear Presentations From Two Final IntercontinentalExchange And Hong Kong Exchanges and Clearing Limited On
2012-11-02 00:00:00,JPMorgan Chase Reaffirms Overweight Rating on IntercontinentalExchange
2012-11-05 00:00:00,IntercontinentalExchange Reports Third Quarter Diluted EPS of
