2011-02-25 00:00:00,IntercontinentalExchange Announces Acquisition Of Ballista Securities
2011-04-21 00:00:00,NASDAQ OMX And IntercontinentalExchange Respond To NYSE Continued Rejection Of NASDAQ Superior Proposal
2011-05-16 00:00:00,NASDAQ OMX And IntercontinentalExchange Withdraws Proposal To Acquire NYSE Euronext
2011-07-14 00:00:00,IntercontinentalExchange Announces Strategic Investment With Stake In Cetip
2011-08-30 00:00:00,IntercontinentalExchange Receives Patent For Electronic Trade Matching And Confirmation Technology
2012-09-04 00:00:00,Intercontinentalexchange Inc Announces Acquisition of WhenTech
2012-09-17 00:00:00,Intercontinentalexchange Inc and Gasunie Announce Transaction for Derivatives and Spot Gas Business of
2012-10-22 00:00:00,Goldman Sachs Starts Stock Coverage on IntercontinentalExchange
2012-11-05 00:00:00,3Q profit beats on lower tax rate
