2010-11-10 00:00:00,Infosys Technologies Limited Hunts For Acquisitions In
2010-12-14 00:00:00,Infosys Technologies Introduces Digital Smart Home Gateway Based On Intel Intel Atom E600 Processor
2011-03-08 00:00:00,Infosys Technologies Gives Digital Consumer Solution
2011-06-06 00:00:00,Housing bank for Trade Finance Finacle Core Banking Solution
2012-06-14 00:00:00,Infosys Ltd and Office Of Chief Scientist Of Israel Sign MoU To Drive Industrial Research And Development
2012-08-21 00:00:00,Court Dismisses Lawsuit Against Infosys
