2010-11-17 00:00:00,Intel Wind River Secures Contract
2010-12-29 00:00:00,DRS Technologies Selects Intel Drive 310 Series
2011-02-09 00:00:00,Symantec Corporation Integrates VeriSign Identity Protection Into Intel Intel Identity Protection Technology
2011-03-22 00:00:00,Netgem Delivers IPTV Solutions Powered by Intel Corporation
2011-03-23 00:00:00,Intel McAfee Delivers Comprehensive Database Security Solution
2011-04-08 00:00:00,Intel Intel Capital Invests Million in Kno
2011-06-08 00:00:00,Intel And Beijing Traffic Control Technology Collaborate To Develop Advanced Subway Train Control System
2011-06-28 00:00:00,Intel Wind River Receives Contract
2011-08-30 00:00:00,Intel Corporation Forms New Intel Federal LLC
2011-10-17 00:00:00,Intel McAfee and The Security Division of EMC Corporation Announce Joint Compliance and Risk Management Solution
2011-11-08 00:00:00,Intel Corporation And Others Likely To Be Interested In webOS
2011-11-10 00:00:00,Intel Toyota Motor Corporation Drive Joint Research On Infotainment Systems
2012-03-12 00:00:00,Intel Corporation Eyes TV
2012-03-22 00:00:00,Intel Corporation Declares Quarterly Cash Dividend
2012-06-07 00:00:00,Intel Corporation Selects Phoenix Technologies as Collaborative Partner for UEFI BIOS Development and Server Software Development
2012-06-11 00:00:00,Mellanox Technologies Ltd Secures New Contract With Intel Corporation
2012-10-08 00:00:00,Intel McAfee Security Plans
