2010-11-16 00:00:00,Intel Corporation Acquires Toronto CognoVision
2010-12-14 00:00:00,Infosys Technologies Introduces Digital Smart Home Gateway Based On Intel Intel Atom E600 Processor
2011-01-10 00:00:00,Updates On Litigation Initiated By Intel Corporation Against
2011-01-20 00:00:00,Toppan Printing Announces Business Alliance of Subsidiary with Subsidiary of Intel Corporation
2011-01-26 00:00:00,Intel Corporation EU Clears Intel Corporation To Buy Subject To
2011-02-14 00:00:00,Intel Corporation Expands Mobile Computing With New Software And Connectivity Capabilities
2011-02-16 00:00:00,And Intel Wind River Announce Strategic Agreement for Security Protection beyond the PC
2011-02-18 00:00:00,Intel Corporation To Invest More Than Billion To Build New Factory In Arizona
2011-02-24 00:00:00,Intel Corporation Announces Thunderbolt Technology In Collaboration With
2011-03-14 00:00:00,Intel Corporation Acquires Assets Of SySDSoft
2011-03-17 00:00:00,MOSAID Technologies Incorporated Files Wireless Patent Infringement Litigation Against Intel Corporation
2011-03-18 00:00:00,Intel Corporation Declares Quarterly Cash Dividend
2011-04-18 00:00:00,Larsen Toubro Infotech Announces Channel Relationship With Intel
2011-05-05 00:00:00,Lawsuit Accuses Adobe Apple Google Intel Corporation And Intuit For Fixing
2011-05-11 00:00:00,Intel Corporation Announces Increase In Quarterly Cash Dividend
2011-06-30 00:00:00,Intel McAfee Partners with Toshiba to offer McAfee WaveSecure on Toshiba REGZA Tablet
2011-07-19 00:00:00,Intel Corporation To Acquire Fulcrum Microsystems
2011-07-20 00:00:00,Intel Corporation Issues Q3 2011 Revenue Guidance Above Estimates
2011-09-13 00:00:00,Intel Corporation And Google to Optimize Android Platform for Intel Architecture
2011-09-14 00:00:00,Intel Corporation Announces Senior Notes Offering
2011-11-22 00:00:00,Intel Wind River And Wurldtech Security Technologies Partner to Expand Services and Offerings
2011-12-01 00:00:00,Forms DCiM Development Agreement With Intel Corporation
2012-01-25 00:00:00,Intel Corporation Declares Quarterly Cash Dividend
2012-02-27 00:00:00,Visa Inc And Intel Corporation Form Strategic Alliance To Advance Mobile Commerce
2012-02-29 00:00:00,QLogic Completes Sale Of Infiniband Assets To Intel Corporation
2012-03-06 00:00:00,Nationz Technologies Inc Signs MOU with Intel Corporation
2012-04-11 00:00:00,Rerun Inc Announces Partnership With Intel Corporation And Feitian
2012-04-13 00:00:00,Maxthon Labs Partners With Intel Corporation To Optimize GPU Browsing Technology
2012-04-24 00:00:00,Cray Agrees To Sell Interconnect Hardware Assets To Intel
2012-04-25 00:00:00,Intel Corporation To Challenge Antitrust Fine In EU
2012-04-27 00:00:00,Announces Sale Of Selected Patents To Intel Corporation
2012-05-02 00:00:00,Cray Completes Sale Of Interconnect Hardware Assets To Intel Corporation
2012-05-07 00:00:00,Intel Corporation Announces Increase In Quarterly Cash Dividend
2012-06-04 00:00:00,Avanquest Software SA Announces Collaboration with Intel Corporation
2012-06-18 00:00:00,InterDigital Subsidiaries Agrees To Million Patent Transaction With Intel Corporation
2012-07-26 00:00:00,Intel Corporation Declares Quarterly Cash Dividend
2012-09-06 00:00:00,InterDigital Subsidiaries Completes Sale of Patent Assets to Intel Corp
2012-09-24 00:00:00,Intel Corp Declares Quarterly Cash Dividend
2012-10-10 00:00:00,10x10 and Intel Corporation to Ring the NASDAQ Stock Market Closing Bell
2012-11-05 00:00:00,Guru Stocks at DD
2012-11-06 00:00:00,Intel Launches its Next Generation Data Center Solid State Drive
