2010-12-29 00:00:00,DRS Technologies Selects Intel Drive 310 Series
2011-01-04 00:00:00,Intel Corporation Announces Negotiation To Takeover Nordic
2011-01-06 00:00:00,Microsoft Links Up With ARM Holdings plc In New Tablet Step Away From Intel
2011-01-10 00:00:00,Updates On Litigation Initiated By Intel Corporation Against
2011-01-20 00:00:00,Toppan Printing Announces Business Alliance of Subsidiary with Subsidiary of Intel Corporation
2011-02-24 00:00:00,Intel Corporation Announces Thunderbolt Technology In Collaboration With
2011-02-28 00:00:00,Intel Corporation Completes Acquisition Of
2011-03-14 00:00:00,Intel Corporation Acquires Assets Of SySDSoft
2011-03-17 00:00:00,MOSAID Technologies Incorporated Files Wireless Patent Infringement Litigation Against Intel Corporation
2011-03-18 00:00:00,Intel Corporation Declares Quarterly Cash Dividend
2011-03-22 00:00:00,Netgem Delivers IPTV Solutions Powered by Intel Corporation
2011-03-23 00:00:00,Intel McAfee Delivers Comprehensive Database Security Solution
2011-04-08 00:00:00,Intel Intel Capital Invests Million in Kno
2011-04-18 00:00:00,Larsen Toubro Infotech Announces Channel Relationship With Intel
2011-04-19 00:00:00,Intel Corporation Issues Q2 2011 Revenue Guidance Above Estimates
2011-06-08 00:00:00,Intel And Beijing Traffic Control Technology Collaborate To Develop Advanced Subway Train Control System
2011-06-28 00:00:00,Intel Wind River Receives Contract
2011-07-27 00:00:00,Intel Corporation Declares Quarterly Cash Dividend
2011-08-03 00:00:00,Intel Intel Capital Announces Investment In China Digital TV Holding Beijing JoySee Technology
2011-08-08 00:00:00,Entropic Communications Inc And Intel Corporation Announces Technology Collaboration
2011-08-30 00:00:00,Intel Corporation Forms New Intel Federal LLC
2011-11-22 00:00:00,Intel Wind River And Wurldtech Security Technologies Partner to Expand Services and Offerings
2011-12-12 00:00:00,Intel Corporation Lowers Q4 2011 Revenue Outlook
2012-03-06 00:00:00,Nationz Technologies Inc Signs MOU with Intel Corporation
2012-04-11 00:00:00,Rerun Inc Announces Partnership With Intel Corporation And Feitian
2012-04-18 00:00:00,Apple Visa Intel The Company and Bank of America Corp Start Trading on Bucharest The Corporate Wire
2012-04-19 00:00:00,Intel Corporation And Other Technology Companies Fail To Dismiss
2012-04-24 00:00:00,Cray Agrees To Sell Interconnect Hardware Assets To Intel
2012-04-25 00:00:00,Intel Corporation To Challenge Antitrust Fine In EU
2012-05-07 00:00:00,Intel Corporation Announces Increase In Quarterly Cash Dividend
2012-06-04 00:00:00,Avanquest Software SA Announces Collaboration with Intel Corporation
2012-06-07 00:00:00,Intel Corporation Selects Phoenix Technologies as Collaborative Partner for UEFI BIOS Development and Server Software Development
2012-07-10 00:00:00,Intel Corporation Spends More Than Billion To Buy Up To Of ASML Holding
2012-07-17 00:00:00,Intel Corporation Issues Q3 2012 Revenue Guidance In Line With Lowers FY 2012 Revenue Guidance
2012-07-26 00:00:00,Intel Corporation Declares Quarterly Cash Dividend
2012-09-06 00:00:00,InterDigital Subsidiaries Completes Sale of Patent Assets to Intel Corp
2012-09-07 00:00:00,Intel Corp Lowers Q3 2012 Revenue Guidance
2012-09-24 00:00:00,Intel Corp Declares Quarterly Cash Dividend
2012-10-08 00:00:00,Intel McAfee Security Plans
2012-10-10 00:00:00,10x10 and Intel Corporation to Ring the NASDAQ Stock Market Closing Bell
2012-10-11 00:00:00,Intel Corporation leaked the details of its upcoming Core i7
2012-10-16 00:00:00,Intel Corp Issues Q4 2012 Revenue Guidance In Line With Estimates
2012-10-17 00:00:00,Intel Corporation Ties Hopes with Microsoft Windows 8
2012-10-26 00:00:00,Intel Blew Its Mobile Business Or Did
