2011-02-17 00:00:00,Intuit Reiterates FY 2011 EBIT Raises FY 2011 EPS Issues Q3 2011 Guidance In Line With Estimates
2011-05-19 00:00:00,Intuit Issues Q4 2011 Earnings Guidance Above Raises FY 2011 Revenue And EPS Raises Low End Of Prior FY 2011 EBIT Guidance
2011-08-18 00:00:00,Intuit Approves Quarterly Cash Dividend
2011-11-17 00:00:00,Intuit Approves Quarterly Cash Dividend
2011-12-05 00:00:00,BigTime Announces Licensing Agreement With Intuit
2012-05-18 00:00:00,Intuit Completes Acquisition Of Demandforce
2012-08-21 00:00:00,Intuit Inc Issues FY 2013 Guidance
