2010-11-09 00:00:00,Invesco And Morgan Stanley Announce Commencement Of Secondary Offering Of Common Stock Of Invesco By Morgan Stanley
2010-12-29 00:00:00,National Grid plc Announces Holding Interest Of Invesco
2011-07-26 00:00:00,Invesco Ltd Announces Dividend
2012-01-26 00:00:00,Invesco Ltd Announces Dividend
2012-09-27 00:00:00,Invesco Ltd To Acquire Of Religare Enterprises Religare Asset Management Company
2012-10-08 00:00:00,Invesco Uplifted to Neutral Analyst Blog
2012-10-17 00:00:00,Invesco Mortgage Capital To Announce Third Quarter 2012 Results
