2011-03-23 00:00:00,Grafton Group plc Announces Holding Interest Of Invesco Limited
2011-04-27 00:00:00,Invesco Declares Cash Dividend
2011-07-26 00:00:00,Invesco Ltd Announces Dividend
2011-09-29 00:00:00,Invesco Square Mile Canyon Combine To Acquire Million Loan Portfolio From Bank of America
2012-01-26 00:00:00,Invesco Ltd Announces Dividend
2012-04-26 00:00:00,Invesco Ltd Announces First Quarter Cash Dividend
2012-05-31 00:00:00,Invesco Ltd To Sell Euro CLO Contracts
2012-09-27 00:00:00,Invesco Ltd To Acquire Of Religare Enterprises Religare Asset Management Company
2012-10-17 00:00:00,INVESCO Invesco ETF Usage Increasing Among RIAs
2012-10-25 00:00:00,INVESCO Invesco Unveils Mobile Access to Investment Product
2012-11-01 00:00:00,Invesco Ltd Declares Third Quarter Cash Dividend
2012-11-05 00:00:00,Invesco Ltd Announces Senior Notes Offering
2012-11-06 00:00:00,Invesco Announces Pricing of Million Senior Notes Offering Due 2022
