2010-11-23 00:00:00,EU Clears Johnson To Buy Michel Thierry
2010-12-30 00:00:00,Johnson To Acquire German Seat
2011-01-20 00:00:00,Johnson Raises FY 2011 Guidance
2011-02-02 00:00:00,Johnson Prices Billion Senior Notes Offering
2011-04-25 00:00:00,Johnson Raises FY 2011 Revenue Issues Q3 2011 EPS Guidance Below Estimates
2011-05-02 00:00:00,YIT Subsidiary Completes Acquisition of Johnson Commercial Refrigeration Operations
2011-06-07 00:00:00,Aamal Company Signs Shareholder Agreement With Johnson Controls
2011-07-05 00:00:00,Johnson Completes Acquisition of EnergyConnect
2011-07-20 00:00:00,Johnson Issues Q4 2011 Guidance Below Call
2011-07-27 00:00:00,Johnson Announces Quarterly Dividend
2011-09-02 00:00:00,Johnson and Saft Groupe SA Reach an Agreement to End Automotive Battery Joint Venture
2011-09-30 00:00:00,Saft Groupe SA Completes Acquisition Of Automotive Battery Joint Venture
2011-11-16 00:00:00,Johnson Increases Dividend
2012-01-19 00:00:00,Johnson Raises FY 2012 EPS Issues Q2 2012 EPS Guidance Above Estimates
2012-03-27 00:00:00,Pricol Pricol Pune Limited Becomes Joint Venture Company of Pricol Limited and Johnson Johnson Controls Enterprise Limited
2012-04-20 00:00:00,Johnson Controls Inc Issues Q3 2012 Earnings Guidance Below Issues Q4 2012 Earnings Guidance In Line With Estimates
2012-04-24 00:00:00,Johnson Controls Inc Acquires Majority Position In Joint Venture TPV Johnson Controls In Slovenia
2012-07-19 00:00:00,Johnson Controls Inc Lowers Q4 2012 EPS Guidance
2012-08-20 00:00:00,XL Hybrids Signs Supply Agreement With Johnson Controls Inc
2012-10-19 00:00:00,Johnson Controls to Acquire A123 Analyst Blog
