2010-12-07 00:00:00,Brocade Communications Google JDS Uniphase Corporation And Santur Corporation Announce Formation Of Agreement
2011-02-02 00:00:00,Cadillac Selects JDS Uniphase JDSU SpectraFlair Bright Silver Pigment For New Car Color
2011-03-24 00:00:00,Saudi Telecom Selects JDS Uniphase Corporation For IPTV Monitoring Solution
2011-08-17 00:00:00,JDS Uniphase Corporation Issues Q1 2012 Revenue Guidance Below Estimates
2012-03-06 00:00:00,Infinera Selects JDS Uniphase JDSU 100G Test Solution For Infinera Express Global Demonstrations
2012-08-17 00:00:00,Jds Uniphase Corp Completes Acquisition Of GenComm
2012-10-09 00:00:00,JDS Uniphase Corp Files Patent Application for a Mixture of Magnetically
2012-10-16 00:00:00,JDS UNIPHASE CORP JDSU Announces PacketPortal CONNECT
