2011-02-02 00:00:00,Cadillac Selects JDS Uniphase JDSU SpectraFlair Bright Silver Pigment For New Car Color
2011-03-24 00:00:00,Saudi Telecom Selects JDS Uniphase Corporation For IPTV Monitoring Solution
2011-03-30 00:00:00,JDS Uniphase Corporation Announces SAMComplete
2011-07-07 00:00:00,JDS Uniphase Corporation Acquires Assets From QuantaSol For CPV Solar Offering
2012-02-01 00:00:00,JDS Uniphase Corporation Issues Q3 2012 Revenue Guidance In Line With Estimates
2012-10-11 00:00:00,Recent Ratings Updates for JDS Uniphase
2012-10-15 00:00:00,Stock Three Three Sells for October 15
2012-10-16 00:00:00,JDS UNIPHASE CORP JDSU Announces PacketPortal CONNECT
2012-10-25 00:00:00,Forbes Earnings JDS Uniphase
2012-10-26 00:00:00,What to Expect from JDS Uniphase
2012-11-01 00:00:00,Weak Guidance From but Balance Sheet Notably Improves
2012-11-05 00:00:00,Hexcel Larger Than 500 Component JDS Uniphase
2012-11-07 00:00:00,Orbitz slide in big tech slump
