2010-11-04 00:00:00,Stanley Chesley Files Class Action Against Johnson Johnson And DePuy
2010-11-10 00:00:00,Johnson Unit Janssen Pharmaceutica Together with Eight Other Companies to Collaborate on Data Share on Psychiatric
2011-01-05 00:00:00,Bayer Johnson Johnson Ask For Approval For Main Use Of
2011-02-18 00:00:00,Johnson Johnson Recalls Two Lots Of Simponi Injection
2011-03-08 00:00:00,Johnson Johnson Acquires Of Issued Crucell Shares
2011-03-09 00:00:00,Johnson Johnson Recalls Leaky Insulin
2011-04-05 00:00:00,Higher Bleeding Risk Seen In Johnson Johnson And Bayer AG Clot
2011-04-08 00:00:00,Johnson Johnson Announces Settlement With Department Of Justice And Securities and Exchange Commission
2011-04-14 00:00:00,Johnson Johnson Recalls Bottles Of Epilepsy
2011-04-15 00:00:00,Johnson Johnson Provides Additional Information Regarding Amended Agreement With Merck
2011-04-18 00:00:00,Synthes Confirms In Deal Talks With Johnson
2011-04-19 00:00:00,Johnson Johnson Raises FY 2011 EPS Guidance
2011-04-27 00:00:00,Johnson Johnson To Acquire Inc
2011-04-28 00:00:00,Johnson Johnson Announces Dividend Increase Of
2011-04-29 00:00:00,Johnson Centocor Ortho Biotech Products LP Informs to Zeltia Pharma Mar SA Its Decision to Withdraw the NDA for Yondelis in Combination With Doxil
2011-05-26 00:00:00,Johnson Johnson To Seek Approval For 11 New Drugs By
2011-06-01 00:00:00,Johnson Terminates Agreement with Diamyd Medical AB Concerning Diabetes Therapy
2011-06-02 00:00:00,Korres Appoints New Chief Executive Announces Initiation Of Business Deal With Johnson Johnson
2011-06-14 00:00:00,Johnson Johnson Wins Approval For Hip Replacement
2011-06-15 00:00:00,Johnson Johnson To Quit Struggling Heart Stent
2011-06-16 00:00:00,Johnson Johnson To Exit Stent To CLose Two Announces
2011-07-01 00:00:00,US Regulators Approve Bayer AG And Johnson Blood
2011-07-07 00:00:00,Johnson Johnson Announces Global Sponsorship Of 2014 FIFA World Cup Brazil
2011-07-18 00:00:00,Johnson Johnson Announces Third Quarter 2011 Quarterly Dividend
2011-08-26 00:00:00,Johnson Janssen Pharmaceuticals Inc Unit Gets FDA Approval For Pain Drug Nucynta
2011-09-06 00:00:00,Bayer AG And Johnson Johnson Stroke Drug Not Ready For Approval From US
2011-09-08 00:00:00,Johnson Johnson Announces FDA Advisory Committee Recommends Approval of Oral Anticoagulant Rivaroxaban For Prevention Of Stroke Systemic Embolism In Patients With Non Valvular Atrial Fibrillation
2011-09-29 00:00:00,Boston Scientific Announces Favorable Appellate Court Ruling Affirming of Johnson Johnson Patent
2011-10-13 00:00:00,Johnson Johnson Starts Trading on OTC
2011-10-18 00:00:00,Johnson Johnson Raises Low End Of Prior FY 2011 EPS Guidance To A Range In Line With Estimates
2011-10-21 00:00:00,Johnson Johnson Announces Fourth Quarter 2011 Quarterly Dividend
2011-12-02 00:00:00,Squibb And Johnson Johnson Team Up Against Hepatitis
2011-12-08 00:00:00,Johnson Janssen Initiates Phase II Clinical Trial with CNTO 1959 with MorhoSys AG
2011-12-12 00:00:00,Symmetry Medical To Acquire Surgical Instruments Business of Codman Shurtleff A Johnson Johnson Company
2012-01-03 00:00:00,Johnson Johnson Announces 2012 Quarterly Dividend
2012-01-12 00:00:00,Johnson Biosense Webster Announces FDA Approval Of THERMOCOOL SF Catheter In The United States
2012-01-18 00:00:00,FDA Warns Johnson DePuy Unit Over Joint
2012-03-15 00:00:00,Johnson Johnson Set To Win EU Okay To Buy Synthes
2012-03-26 00:00:00,Johnson Janssen Research LLC Announces XARELTO Demonstrates Comparable Efficacy To Standard of Care For Treatment Secondary Prevention Of Venous Blood Clots
2012-04-26 00:00:00,Johnson Johnson Announces Dividend Increase Of
2012-06-13 00:00:00,Johnson Johnson Expects To Complete Billion Purchase Of Synthes on
2012-06-14 00:00:00,Johnson Johnson Announces Completion of Synthes Inc Acquisition
2012-06-20 00:00:00,Johnson Johnson Close To Settling With DOJ Over
2012-06-21 00:00:00,US FDA Rejects Wider Use For Johnson And Bayer
2012-07-09 00:00:00,Bayer AG And Johnson Xarelto Gets FDA Priority
2012-07-16 00:00:00,Johnson Johnson Announces Quarterly Dividend For Third Quarter 2012
2012-07-17 00:00:00,Johnson Johnson Lowers FY 2012 EPS Guidance
2012-09-13 00:00:00,Johnson Johnson Picks Bayer Bayer CropScience AG Executive Sandra Peterson As Group Worldwide
2012-10-16 00:00:00,Genmab Announces Results of Private Placement to Johnson Johnson Development Corporation
2012-10-17 00:00:00,Johnson Johnson Announces Quarterly Dividend For Fourth Quarter 2012
2012-10-18 00:00:00,Johnson Johnson A Stock For Dividend Investors No Capital
2012-10-23 00:00:00,Johnson Litigation Makes This Pharma A Pass In 2013
2012-10-25 00:00:00,Johnson Johnson to Host Medical Devices Diagnostics Review
2012-10-26 00:00:00,The Zacks Analyst Blog Johnson Chesapeake
2012-10-31 00:00:00,The Zacks Analyst Blog Johnson First
2012-11-01 00:00:00,Johnson Johnson Is En Route To
2012-11-02 00:00:00,Johnson Johnson Wins Wider Approval For Leg And Lung
2012-11-05 00:00:00,Buzz Goldman Kraft and Johnson Johnson
