2010-12-08 00:00:00,Jury Rules Against Johnson Johnson In Antibiotic
2010-12-23 00:00:00,Johnson Janssen Announces New Drug Submission For Abiraterone Acetate For The Treatment Of Metastatic Advanced Prostate Cancer
2010-12-28 00:00:00,FDA Places Johnson Johnson Pain Drug On Clinical
2011-02-16 00:00:00,Johnson Johnson Recalls Invega
2011-02-17 00:00:00,Johnson Johnson And Crucell Announce Minimum Acceptance Condition Satisfied
2011-03-24 00:00:00,Johnson Johnson Unit Recalls Surgical Drain
2011-04-08 00:00:00,Johnson Johnson Announces Settlement With Department Of Justice And Securities and Exchange Commission
2011-06-02 00:00:00,Korres Appoints New Chief Executive Announces Initiation Of Business Deal With Johnson Johnson
2011-06-28 00:00:00,Gilead And Johnson Tibotec Unit To Develop Combination HIV
2011-08-26 00:00:00,Johnson Janssen Pharmaceuticals Inc Unit Gets FDA Approval For Pain Drug Nucynta
2011-09-06 00:00:00,Bayer AG And Johnson Johnson Stroke Drug Not Ready For Approval From US
2011-09-28 00:00:00,Boston Scientific Did Not Infringe Johnson Unit US Court Upholds Blood Vessel Stent
2011-09-29 00:00:00,Boston Scientific Announces Favorable Appellate Court Ruling Affirming of Johnson Johnson Patent
2011-10-13 00:00:00,Johnson Johnson Starts Trading on OTC
2012-01-12 00:00:00,Johnson Biosense Webster Announces FDA Approval Of THERMOCOOL SF Catheter In The United States
2012-02-08 00:00:00,FDA Says Ulcer Drugs Such As AstraZeneca Nexium May Raise Diarrhea Other Proton Pump Inhibitors Includes Johnson Johnson and Eisai Co
2012-05-16 00:00:00,Johnson Johnson Shows Promise In High Risk Prostate
2012-05-24 00:00:00,US Advisers Reject Johnson Xarelto For Acute Coronary
2012-06-05 00:00:00,Law Office of Brodsky LLC Investigates Potential Claims Against Johnson DePuy Orthopedics
2012-07-09 00:00:00,Bayer AG And Johnson Xarelto Gets FDA Priority
2012-10-25 00:00:00,Johnson Johnson May Have Come Down With A Mild Case Of Sclerotic
2012-10-26 00:00:00,The Zacks Analyst Blog Johnson Chesapeake
2012-10-31 00:00:00,The Zacks Analyst Blog Johnson First
2012-11-02 00:00:00,Johnson Johnson Wins Wider Approval For Leg And Lung
2012-11-05 00:00:00,Johnson Johnson Settles Court Case with 845 Plaintiffs of
