2010-11-30 00:00:00,360networks Expands Capabilities With Juniper
2010-12-06 00:00:00,Juniper Announces Acquisition Of Altor Networks
2010-12-07 00:00:00,SkyVision Selects Juniper Juniper Networks To Support Global Connectivity Expansion
2011-01-25 00:00:00,Juniper Issues Q1 2011 EPS Below Estimates
2011-03-15 00:00:00,Juniper Powers Tenaga New MPLS Backbone
2011-03-29 00:00:00,New World Telecom Picks Juniper To Power Highly Scalable And Flexible Metro Ethernet Services
2011-04-18 00:00:00,Juniper Announces Contract
2011-04-19 00:00:00,Juniper Issues Q2 2011 EPS Guidance Below Estimates
2011-06-20 00:00:00,Comcast Deploys Juniper Carrier Class Routing And Switching Solution
2011-06-21 00:00:00,Juniper And IBM Corporation Deliver Energy Efficient Services To Hess Corporation
2011-06-22 00:00:00,Juniper and OnLive Partner to Deliver Instant Access to Any on Any Device
2011-06-27 00:00:00,Juniper Receives Contract From
2011-06-28 00:00:00,Nokia Oyj and Siemens AG Joint Venture Secure Italian Order Together with Juniper
2011-07-26 00:00:00,Juniper Issues Q3 2011 Revenue Guidance Below Estimates
2011-08-09 00:00:00,MOSAID Technologies Incorporated Files Suit Against Seven Companies Including Juniper
2011-08-16 00:00:00,Robbins Geller Rudman Dowd LLP Files Class Action Suit Against Juniper
2011-08-18 00:00:00,The Law Firm of Levi Korsinsky Announces Class Action Lawsuit Against Juniper
2011-08-22 00:00:00,Robbins Umeda LLP Announces An Investigation Of Juniper
2011-08-23 00:00:00,The Briscoe Law Firm And Powers LLP Announces Investigation Of Juniper
2011-08-25 00:00:00,Harris Farm Markets Improves Customer Service With Juniper Solutions
2011-09-19 00:00:00,Security Commences Patent Litigation Against 16 Data Networking Companies Including Juniper
2011-09-22 00:00:00,Deloitte Belgium Implements Juniper Wireless LAN
2012-06-11 00:00:00,Juniper Announces New Common Stock Repurchase Authorization Of Up To Billion
2012-07-10 00:00:00,NTT Communications Chooses Juniper Mobile Security Solutions
2012-07-11 00:00:00,Juniper Secures Contract From Telefonica Digital
2012-07-24 00:00:00,Juniper Issues Q3 2012 EPS Guidance Below Estimates
2012-10-24 00:00:00,US Stock Futures Inch Data in Focus
2012-10-25 00:00:00,Juniper Networks Research Recent Ratings Updates
2012-10-26 00:00:00,Is the Worst Over for Juniper
