2010-11-23 00:00:00,Joy Global Declares Quarterly Dividend Of Per Share
2010-12-15 00:00:00,Joy Global Issues FY 2011 Guidance Above Estimates
2011-03-02 00:00:00,Joy Global Raises FY 2011 Guidance
2011-06-02 00:00:00,Joy Global Raises FY 2011 Guidance
2011-06-22 00:00:00,Joy Global And Rowan Announces Completion Of LeTourneau Technologies Acquisition
2011-07-14 00:00:00,Joy Global Inc In Talks To Buy Mining Machinery Holdings
2011-08-31 00:00:00,Joy Global Inc Raises FY 2011 Guidance
2011-10-24 00:00:00,Joy Global Inc Announces Completion Of Sale Of Drilling Products Business To Cameron International Corporation
2011-11-04 00:00:00,Joy Global Inc Announces Transfer Listing To NYSE
2012-08-20 00:00:00,Joy Global Inc Declares Quarterly Dividend Of Per Share
2012-09-21 00:00:00,Joy Global Inc Announces Retirement Of And Names Replacement
2012-10-15 00:00:00,6 Stocks in 60 RIO LOW GOOG CHS EBAY JOY
2012-10-17 00:00:00,Add Some Joy To Your Portfolio
2012-10-24 00:00:00,Zacks Investment Ideas feature Joy Global and
2012-10-31 00:00:00,Research Reports for Hot Stocks and Penny Cabot Oil
2012-11-01 00:00:00,Morgan Stanley Raises Joy Global to Overweight
2012-11-02 00:00:00,He Was Right About Chipotle So What is David Einhorn Shorting
2012-11-05 00:00:00,Can Caterpillar
