2010-12-14 00:00:00,JPMorgan Chase Declares Common Stock Dividend
2011-04-07 00:00:00,JPMorgan Chase Acquires Stake In Murchison Metals Ltd
2011-04-12 00:00:00,JPMorgan Chase Chase Card Services Announces Exclusive Partnership With Department Stores
2011-06-21 00:00:00,JPMorgan Chase Morgan Securities LLC Reaches Settlement With SEC Regarding CDOs
2011-08-01 00:00:00,The Securities Arbitration Law Firm of Klayman Toskes Files Claim Against JPMorgan Chase Co On Behalf Of Two Seeking Recovery Of Million
2011-08-25 00:00:00,The Charles Schwab Corporation Sues Major Banks Including JPMorgan Chase Over
2011-09-08 00:00:00,JPMorgan Chase Chase Auto Finance And Subaru of Renew Captive Lender Agreement
2011-10-14 00:00:00,JPMorgan Chase Co Declares Preferred Stock Dividend
2012-04-25 00:00:00,Freepoint Commodities To Acquire JPMorgan Chase Morgan Concentrates Business
2012-10-10 00:00:00,JPMorgan Chase Co Must pay Million In Trust Mismanagement
