2010-11-03 00:00:00,Hagens Berman Sobol Shapiro LLP Announces Class Action Lawsuit Agianst JPMorgan Chase And HSBC Holdings HSBC Securities
2010-11-08 00:00:00,Eagle Asset Management Selects JPMorgan Chase Morgan Worldwide Securities Services to Provide Fund Administration and Custody for Mutual Funds
2010-11-10 00:00:00,Bathurst Resources Ltd Announces Holding Interest Of JPMorgan Chase
2010-11-15 00:00:00,JPMorgan Chase Morgan Launches iPad Research App
2010-11-16 00:00:00,True North Management Group Selects JPMorgan Chase Morgan Worldwide Securities Services for Real Estate Fund Administration
2010-11-17 00:00:00,JPMorgan Chase Morgan Worldwide Securities Services To Provide Custody And Liquidity Services To FHLBank Atlanta
2010-11-24 00:00:00,JPMorgan Chase and Varun Bery Reach Amicable Settlement
2010-11-29 00:00:00,Azumah Resources Limited Announces Voting Power Of JPMorgan Chase And Affiliates
2010-12-01 00:00:00,Sempra Royal Bank of Scotland Group plc Complete Sale of Commodities Joint Venture North American Assets to JP Morgan Chase Morgan Ventures Energy Corp
2010-12-02 00:00:00,JPMorgan Chase Hits Back At Lehman Says It Was
2010-12-06 00:00:00,Rex Minerals Limited Announces Holding Interest Of JPMorgan Chase
2010-12-09 00:00:00,Anvil Mining Limited Announces Holding Interest Of JPMorgan Chase
2010-12-14 00:00:00,JPMorgan Chase Declares Common Stock Dividend
2010-12-20 00:00:00,JPMorgan Chase Acquires New European Investment Bank Headquarters In London
2010-12-21 00:00:00,Cape Lambert Resources Limited Announces Holding Interest Of JPMorgan Chase And Affiliates
2010-12-28 00:00:00,Lazio Region Sues 11 Banks Including JPMorgan Chase Over
2011-01-14 00:00:00,JPMorgan Chase Declares Preferred Stock Dividend
2011-01-19 00:00:00,Kagara Ltd Announces Holding Interest Of JPMorgan Chase
2011-01-20 00:00:00,JPMorgan Chase Ceases To Be Substantial Holder In Kagara Ltd
2011-01-26 00:00:00,Berkeley Resources Limited Announces Holding Interest Of JPMorgan Chase
2011-02-03 00:00:00,Trustee For Liquidation Of Bernard Madoff Investment Securities Announces Unsealing Of Complaint Against JPMorgan Chase Primary Banker
2011-02-08 00:00:00,Landkom International Plc Announces Holding Interest Of JPMorgan Chase
2011-02-16 00:00:00,The Allstate Corporation Sues JPMorgan Chase Over Mortgage Debt
2011-02-28 00:00:00,JPMorgan Chase Fund In Talks To Buy Twitter
2011-03-15 00:00:00,JPMorgan Chase Declares Preferred Stock Dividend
2011-03-18 00:00:00,JPMorgan Chase Increase Quarterly Common Stock Dividend To Per Board Authorizes Billion Common Stock Repurchase Program
2011-03-29 00:00:00,Keller Rohrback Announces Investigation of Bank of America Corporation And JPMorgan Chase Regarding Force Placed Insurance
2011-04-05 00:00:00,JPMorgan Chase Morgan Worldwide Securities Services Selected By Maine Public Employees Retirement System As New Global Custodian and Securities Lending Provider
2011-04-07 00:00:00,JPMorgan Chase Acquires Stake In Murchison Metals Ltd
2011-04-12 00:00:00,JPMorgan Chase Chase Card Services Announces Exclusive Partnership With Department Stores
2011-04-13 00:00:00,JPMorgan Chase Expects To Buy At Least Billion Of
2011-04-15 00:00:00,Keller Rohrback Announces Investigation of Bank of America Corporation And JPMorgan Chase Regarding Mortgages Protected By Servicemembers Civil Relief Act
2011-04-19 00:00:00,Three Asset Management Firms Sue Banks Including JPMorgan Chase Over
2011-04-21 00:00:00,JPMorgan Chase Announces Resolution To Lawsuit With Military Families
2011-05-02 00:00:00,Thornburg Mortgage Bankruptcy Trustee Sues Banks Including JPMorgan Chase For
2011-05-05 00:00:00,Keller Rohrback Announces Investigation of JPMorgan Chase JPMorgan Chase Bank and Other Lenders Regarding FHA Mortgage Insurance
2011-05-11 00:00:00,Keller Rohrback Announces Class Actions Filed in California Against SunTrust and Chase Home Finance LLC
2011-05-17 00:00:00,JPMorgan Chase Declares Common Stock Dividend
2011-05-20 00:00:00,Eolas Technologies Announces JPMorgan Chase Settlement In Patent Lawsuit
2011-05-24 00:00:00,JPMorgan Chase Reaches Stake in Rhodia SA
2011-06-06 00:00:00,JPMorgan Chase Secures Contract From Palmer Square Capital Management
2011-06-09 00:00:00,Ausgold Ltd Announces Holding Interest Of JPMorgan Chase And Its Affiliates
2011-06-15 00:00:00,JPMorgan Chase To Pay Million In Auto Lending
2011-06-20 00:00:00,NCUA Sues Royal Bank of Scotland Group plc And JPMorgan Chase Over Mortgage
2011-06-21 00:00:00,JPMorgan Chase Morgan Securities LLC Reaches Settlement With SEC Regarding CDOs
2011-06-22 00:00:00,Hagens Berman LLP Announces Investigation Of The Goldman Sachs JPMorgan Chase And Glencore International plc
2011-06-23 00:00:00,Judge Approves Million JPMorgan Chase Settlement With Lehman
2011-06-27 00:00:00,Lehman Brothers To Sell Toy Center For Million To JPMorgan Chase
2011-07-07 00:00:00,JPMorgan Chase Co Wins Dismissal Of Madoff Conspiracy
2011-07-14 00:00:00,JPMorgan Chase Co Prepping Benchmark 30 Year Senior Note
2011-07-15 00:00:00,JPMorgan Chase Co Declares Preferred Stock Dividend
2011-07-29 00:00:00,JPMorgan Chase Co To Exit Tax Lien Business
2011-08-01 00:00:00,The Securities Arbitration Law Firm of Klayman Toskes Files Claim Against JPMorgan Chase Co On Behalf Of Two Seeking Recovery Of Million
2011-08-17 00:00:00,JPMorgan Chase Morgan Worldwide Securities Services To Provide Custody Services To Federal Home Loan Bank of Chicago
2011-08-25 00:00:00,The Charles Schwab Corporation Sues Major Banks Including JPMorgan Chase Over
2011-08-26 00:00:00,JPMorgan Chase Co Acquires Stake In Equatorial Resources Ltd
2011-08-30 00:00:00,JPMorgan Chase KKR and Co LP In Talks To Buy Future Capital Holdings
2011-09-06 00:00:00,JPMorgan Chase Investment Banking Chief Sees No Job
2011-09-08 00:00:00,JPMorgan Chase Chase Auto Finance And Subaru of Renew Captive Lender Agreement
2011-09-13 00:00:00,JPMorgan Chase Co To Invest Million In SKIL Infrastructure
2011-09-15 00:00:00,Wells Fargo Sues JPMorgan Chase Co Over 800 Mortgage
2011-09-20 00:00:00,JPMorgan Chase Co Declares Common Stock Dividend
2011-10-14 00:00:00,JPMorgan Chase Co Declares Preferred Stock Dividend
2011-11-08 00:00:00,Hagens Berman Investors Accuse JPMorgan Chase Co Of Complicity On Madoff Ponzi Scheme
2011-11-22 00:00:00,JPMorgan Chase Co To Buy LME Stake From MF Global Holdings For GBP25
2011-12-01 00:00:00,Massachusetts Attorney General Files Lawsuit Against JPMorgan Chase And Other
2011-12-13 00:00:00,JPMorgan Chase Co Declares Common Stock Dividend
2011-12-16 00:00:00,Fitch Cuts Goldman Citigroup Five Other Large Banks Ratings Affirms JPMorgan Chase Co And Others Banks Long Term
2012-01-13 00:00:00,JPMorgan Chase Co Declares Preferred Stock Dividend
2012-01-18 00:00:00,The Madison Square Garden Co And JPMorgan Chase Expand Marquee Partnership To Include Additional Benefits For Chase Cardmembers
2012-01-19 00:00:00,State Street JPMorgan Chase And Ameriprise Bid For Deutsche Bank
2012-01-31 00:00:00,General Electric GE Capital Retail Bank Acquires Card Program Assets From JPMorgan Chase Co
2012-02-06 00:00:00,JPMorgan Chase Co Settles Overdraft Fee Case For
2012-02-09 00:00:00,JPMorgan Chase Wells Fargo Reserved For Mortgage
2012-02-28 00:00:00,JPMorgan Chase Co Sells Its Stake In PetroNeft Resources plc
2012-03-08 00:00:00,JPMorgan Chase Co And AirPlus International Forms Strategic Partnership
2012-03-15 00:00:00,JPMorgan Chase Declares Preferred Stock Dividend
2012-03-20 00:00:00,JPMorgan Chase To Pay Million Over Failed Sigma
2012-04-04 00:00:00,CFTC Orders JPMorgan Chase To Pay Million In Lehman
2012-04-13 00:00:00,JPMorgan Chase Declares Preferred Stock Dividend
2012-04-19 00:00:00,Judge Dismisses Claims Against JPMorgan Chase And Other Banks In General Electric Co
2012-04-24 00:00:00,Koninklijke KPN NV Hires JPMorgan Chase Co For Base
2012-04-25 00:00:00,Freepoint Commodities To Acquire JPMorgan Chase Morgan Concentrates Business
2012-05-07 00:00:00,Microsoft Google JPMorgan Chase Co and Merck Co Inc to Be Listed on Bucharest Stock Exchange Starting May
2012-05-10 00:00:00,Levi LLP Launches Investigation Into Possible Breaches Of Fiduciary Duty By JPMorgan Chase
2012-05-14 00:00:00,Robbins Geller Rudman Dowd LLP Files Class Action Suit Against JPMorgan Chase
2012-05-15 00:00:00,Bernstein Liebhard LLP Files Securities Class Action Against JPMorgan Chase Co
2012-05-16 00:00:00,MURRAY FRANK LLP Files Class Action Suit Against JPMorgan Chase
2012-05-17 00:00:00,JPMorgan Chase Stops Stock Maintains
2012-05-18 00:00:00,Law Offices of Howard Smith Announces Class Action Lawsuit Against JPMorgan Chase
2012-05-21 00:00:00,FDIC Sues JPMorgan Chase And Other Big Banks Over Mortgage
2012-05-22 00:00:00,SEC Looking At JPMorgan Chase Financial
2012-05-25 00:00:00,Lieff Cabraser Announces Investigation Of JPMorgan Chase On Behalf Of Shareholders
2012-06-05 00:00:00,Regulator Says Looking At JPMorgan Chase
2012-06-11 00:00:00,JPMorgan Chase Subsidiary Acquires Stake in REN Redes Energeticas Nacionais SGPS SA
2012-06-19 00:00:00,Japan Selects JPMorgan Chase And Others For Billion JAPAN TOBACCO Share
2012-06-21 00:00:00,JPMorgan Chase Creates New Asset Management
2012-06-22 00:00:00,Cuts Ratings Of 15 Banks Including JPMorgan Chase Morgan Stanley Down Two
2012-06-25 00:00:00,JPMorgan Chase And Its Affiliates Cease To Be Shareholders Of Integra Mining
2012-07-03 00:00:00,JPMorgan Chase One Equity To Buy For
2012-07-05 00:00:00,Judge Orders JPMorgan Chase To Explain Withholding
2012-07-10 00:00:00,Zamansky Associates Announces Investigation Of JPMorgan Chase Over Sales Of Mutual Funds And Chase Strategic Portfolios
2012-07-17 00:00:00,JPMorgan Chase Sued Over Pushing Funds On Reuters
2012-07-20 00:00:00,Enel Green Power Enel Green Power North America Awarded Grant in Consortium with JPMorgan Chase Wells Fargo Wind Holdings LLC and Metropolitan Life Insurance Company
2012-07-24 00:00:00,JPMorgan Chase In Million Credit Card
2012-08-10 00:00:00,Judge OKs JPMorgan Chase Co Million Credit Card
2012-08-15 00:00:00,JPMorgan Chase Deutsche Bank Barclays PLC And Others Subpoenaed Over
2012-08-17 00:00:00,JPMorgan Chase Co And Its Affiliates Cease To Be Substantial Shareholders Of Bathurst Resources Ltd
2012-08-24 00:00:00,Bharti Airtel Ltd Shortlists JPMorgan Chase And Other Banks For Telecom Masts
2012-09-06 00:00:00,Senate Committee Launches Probe Of JPMorgan Chase
2012-09-14 00:00:00,JPMorgan Chase Co Declares Preferred Stock Dividend
2012-09-18 00:00:00,JPMorgan Chase Co Declares Common Stock Dividend
2012-09-20 00:00:00,JPMorgan Chase Co And Its Affiliates Cease To Be Substantial Shareholders Of Industrea Ltd
2012-10-08 00:00:00,JPMorgan Chase Acquires Stake In Bathurst Resources Ltd
2012-10-10 00:00:00,JPMorgan Chase Co Must pay Million In Trust Mismanagement
2012-10-11 00:00:00,JPMorgan Chase Co CFO Braunstein May Step
2012-10-12 00:00:00,JPMorgan Chase Co Declares Preferred Stock Dividend
2012-10-15 00:00:00,JPMorgan Chase Co Declares Preferred Stock Dividend
2012-10-25 00:00:00,JPMorgan Trader Fired for Metal Mispricing Loses Lawsuit
2012-10-31 00:00:00,JPMorgan Chase Co Sues Former London Whale
2012-11-01 00:00:00,Saba Capital Joins Other Quant Hedge Funds Experiencing a Tough 2012
