2011-02-03 00:00:00,Kellogg Company Reaffirms FY 2011 Guidance
2011-04-29 00:00:00,Kellogg Company Declares Regular Dividend Of Per Share
2011-05-04 00:00:00,Kellogg Company Reaffirms FY 2011 EPS Guidance
2011-06-14 00:00:00,EnWave Corp Signs Research Development Agreement With Kellogg Company
2011-07-28 00:00:00,Kellogg Company Reaffirms FY 2011 EPS Guidance
2011-11-03 00:00:00,Kellogg Company Lowers FY 2011 EPS Comments On FY 2012 Long Term Operating Profit and EPS Guidance
2012-02-02 00:00:00,Kellogg Company Reaffirms FY 2012 Guidance
2012-02-15 00:00:00,Kellogg Company Announces Agreement To Acquire Procter Pringles Business
2012-02-17 00:00:00,Kellogg Company Declares Regular Dividend Of Per Share
2012-04-23 00:00:00,Kellogg Company Lowers FY 2012 EPS Guidance
2012-05-31 00:00:00,Procter Gamble Co Completes Sale Of Pringles To Kellogg Company
2012-07-20 00:00:00,Kellogg Company Declares Regular Dividend Of Per Share
2012-08-02 00:00:00,Kellogg Company Reaffirms FY 2012 Guidance
2012-09-24 00:00:00,Kellogg Co And Wilmar International Limited Announce China Joint Venture
2012-10-25 00:00:00,Kellogg agrees to pay in emissions case
2012-10-26 00:00:00,Kellogg Co Declares Regular Dividend Of Per Share
2012-10-31 00:00:00,Kellogg Company Directors Elect International Paper Executive Mary Laschinger
2012-11-01 00:00:00,Kellogg Co Reaffirms FY 2012 EPS Guidance
2012-11-05 00:00:00,launches virtual store for Special K
2012-11-06 00:00:00,Kellogg A Dividend Stock To Buy
