2010-11-19 00:00:00,KeyCorp Declares Regular Dividends
2011-03-18 00:00:00,KeyCorp Announces Pricing of Common Stock Offering
2011-03-30 00:00:00,KeyCorp Completes Repurchase Of TARP Capital
2012-01-12 00:00:00,KeyBank National Association To Acquire 37 Retail Banking Branches Owned By HSBC Bank NA
2012-01-19 00:00:00,KeyCorp Declares Quarterly Dividends
2012-03-01 00:00:00,KeyCorp Announces Closing of million Public Offering of Common Shares
2012-10-15 00:00:00,Forbes Earnings KeyCorp
2012-10-18 00:00:00,quarterly net inches up on revenue jump
2012-10-23 00:00:00,KeyCorp Daily Volume Update
2012-11-07 00:00:00,KeyCorp To Present At The Goldman Sachs Financial Services Conference
