2010-11-19 00:00:00,KeyCorp Declares Regular Dividends
2011-07-15 00:00:00,KeyCorp And Others Bidding For HSBC Holdings New York Bank
2011-07-22 00:00:00,KeyCorp Increases Regular Dividend
2011-11-17 00:00:00,KeyCorp Declares Regular And Preferred Dividends
2012-01-12 00:00:00,KeyBank National Association To Acquire 37 Retail Banking Branches Owned By HSBC Bank NA
2012-01-19 00:00:00,KeyCorp Declares Quarterly Dividends
2012-03-01 00:00:00,KeyCorp Announces Closing of million Public Offering of Common Shares
2012-05-17 00:00:00,KeyCorp Increases Quarterly Cash Dividend
2012-10-19 00:00:00,Third Quarter Profit Tops Analysts Guidance
2012-10-22 00:00:00,Diamond Hill Capital Buys 4 All Financials
2012-10-23 00:00:00,KeyCorp Daily Volume Update
2012-10-26 00:00:00,KeyCorp vice chairman Thomas Stevens to retire next June
2012-11-07 00:00:00,KeyCorp To Present At The Goldman Sachs Financial Services Conference
