2011-05-04 00:00:00,Kimco Realty Declares Quarterly Cash Dividend
2011-11-02 00:00:00,Kimco Realty Narrows FY 2011 FFO Guidance To A Range In Line With Issues FY 2012 FFO Guidance In Line With Announces Increase In Common Dividend
2012-02-08 00:00:00,Kimco Realty Declares Quarterly Cash Dividend
2012-07-16 00:00:00,Kimco Realty Announces Million Perpetual Preferred Stock Offering
2012-07-31 00:00:00,Kimco Realty Raises Low End Of Prior FY 2012 FFO Guidance To A Range In Line With Estimates
2012-10-17 00:00:00,KIMCO REALTY CORP Nordstrom Rack To Open Third Store On Long Island
2012-10-24 00:00:00,Weingarten Realty A Yield For Your REIT Portfolio
2012-10-25 00:00:00,Kimco Realty Third Quarter Earnings Sneak Peek
2012-11-05 00:00:00,Retail REITs Continue To Provide Measurable Consistency And Durability
2012-11-06 00:00:00,Indicated Dividend Yield Ranking for the 500 by Industry
