2011-01-05 00:00:00,Big Shopping Centers Subsidiary To Jointly Acquire US Commercial Center With Kimco Realty Corporation
2011-04-27 00:00:00,Kimco Realty Reaffirms FY 2011 FFO Guidance
2011-11-10 00:00:00,General Growth And Kimco Realty Forms Joint Venture Partnership To Redevelop Owings Mills Mall In Maryland
2012-01-23 00:00:00,Kimco Realty Acquires Two Shopping Centers In Southwest
2012-03-09 00:00:00,Kimco Realty Announces Million Perpetual Preferred Stock Offering
2012-10-31 00:00:00,Analyst Estimates for US Earnings Tuesday
2012-11-01 00:00:00,Ratings Reiterations for 1st ANGO
2012-11-07 00:00:00,Inland Real Should You Buy This Dividend
