2010-12-02 00:00:00,Kroger Company Raises Low End Of Prior FY 2010 Identical Supermarket Sales Narrows FY 2010 EPS Guidance
2011-01-21 00:00:00,Kroger Company Declares Quarterly Dividend
2011-04-19 00:00:00,Kroger Company Joins UnitedHealth Group As Diabetes Prevention And Control Alliance Partner
2011-09-09 00:00:00,Kroger Company Raises FY 2011 Identical Supermarket Sales Reaffirms FY 2011 EPS Guidance
2012-01-20 00:00:00,Kroger Company Declares Quarterly Dividend
2012-06-21 00:00:00,Kroger Co Declares Quarterly Dividend
2012-07-05 00:00:00,Pfizer Inc And Ranbaxy Laboratories Ltd Sued By Kroger Co And Other Retailers For Generic Lipitor
2012-09-07 00:00:00,Kroger Co Raises FY 2012 EPS Reaffirms FY 2012 Identical Supermarket Sales Guidance
2012-09-13 00:00:00,Kroger Co Raises Quarterly Dividend
2012-10-10 00:00:00,Kroger Co Stock Upgraded
2012-10-19 00:00:00,Kroger Discontinues Sprouts Due To Potential Food Safety Risk
2012-10-24 00:00:00,THE KROGER Fred Meyer Jewelers Selects TD Retail Card Services For
2012-10-31 00:00:00,What Ails Pharmacy or Supermarket A Survey Says Lousy Customer
2012-11-01 00:00:00,Kroger Co Ratifies Agreements with UFCW Local 1529
2012-11-02 00:00:00,4 Less Join Hurricane Sandy Relief Efforts
2012-11-05 00:00:00,Upon further Kroger credit rating holds Fitch says
2012-11-07 00:00:00,Kroger Recalls French Vanilla Ice Cream
