2010-11-10 00:00:00,Corporation Comments On Q4 2010 Revenue And Comparable Same Stores Sales Issues Q4 2010 EPS Guidance To A Range In Line With Estimates
2011-04-12 00:00:00,JPMorgan Chase Chase Card Services Announces Exclusive Partnership With Corporation
2012-10-15 00:00:00,Insiders Sold These Stocks on
2012-10-18 00:00:00,The Zacks Analyst Blog Ulta Salon
2012-10-19 00:00:00,Structurally Advantaged Relative to Retail Peers and Trading at
2012-11-05 00:00:00,Critical Alerts For Tiffany Focus and Texas
