2011-02-08 00:00:00,Loews Announces Quarterly Dividend On Common Stock
2011-11-08 00:00:00,Loews Announces Quarterly Dividend on Common Stock
2012-05-08 00:00:00,Loews Announces Quarterly Dividend on Common Stock
2012-08-14 00:00:00,Loews Corp Announces Quarterly Dividend on Common Stock
2012-10-15 00:00:00,Boardwalk Purchases Remaining Interest in PL Midstream
2012-10-19 00:00:00,Traders Look to New Levels Ahead Research Analysis on Loews
2012-10-24 00:00:00,Forbes Earnings Loews
2012-11-01 00:00:00,These Stocks are Forming a Rising Wedge on
