2011-01-12 00:00:00,Lennar Corporation Declares Quarterly Dividends
2011-06-22 00:00:00,Lennar Corporation Declares Quarterly Dividends
2011-09-09 00:00:00,Hagens Berman LLP Investigating Home Building Companies Over Potential Violations of Fair Labor Standards Act Including Lennar Corporation
2011-11-22 00:00:00,Lennar Corporation to Sell Convertible Senior Notes
2012-06-26 00:00:00,Lennar Corporation Declares Quarterly Dividends
2012-10-17 00:00:00,Housing Starts Rise To Four Year Builder Stocks Surge
2012-10-19 00:00:00,Zacks Reiterates Neutral on Lennar
