2011-04-13 00:00:00,Lennar Corporation Declares Quarterly Dividends
2012-07-17 00:00:00,Lennar Corporation Proposes To Sell Million Of Senior Notes
2012-10-01 00:00:00,Lennar Corp Declares Quarterly Dividends
2012-10-09 00:00:00,Nationstar Lennar Lead in Strong Real Estate Outlooks
2012-10-10 00:00:00,9 Stocks to Go Ex Dividend on October 2012 RYL
2012-10-11 00:00:00,MKM Partners Cuts Lennar to Neutral
2012-10-15 00:00:00,Lennar Downgraded by MKM Partners
2012-10-16 00:00:00,Market C NWSA AAPL BLK S IBM INTC ISRG LEN CLWR AONE WMT T
2012-10-18 00:00:00,Lennar Corp Proposes To Sell Million Of Senior Notes
2012-10-22 00:00:00,Market Bank of Baker and
2012-10-23 00:00:00,Lennar Walks on a Tightrope Analyst Blog
2012-10-25 00:00:00,CA
2012-10-26 00:00:00,Herbalife Larger Than 500 Component Lennar
2012-11-05 00:00:00,These Stocks are Forming a Rising Wedge on
