2011-01-18 00:00:00,Linear Technology Corporation Raises Quarterly Dividend
2011-01-19 00:00:00,Linear Technology Corporation Issues Q3 2011 Revenue Below Call
2011-04-07 00:00:00,Advanced Analogic Technologies Announces Resolution of Litigation With Linear Technology Corporation
2011-04-12 00:00:00,Linear Technology Corporation Settles Patent Enforcement Action Against Advanced Analogic Inc
2011-04-19 00:00:00,Linear Technology Corporation Comments On Q4 2011 Revenue Declares Dividend
2011-07-26 00:00:00,Linear Technology Corporation Issues Q1 2012 Revenue Guidance Below Estimates
2011-09-20 00:00:00,Linear Technology Corporation Teams with AEi Systems to Offer WCCA and SPICE Modeling
2011-10-19 00:00:00,Linear Technology Corporation Issues Q2 2012 Revenue Guidance Below Call
2011-12-20 00:00:00,Linear Technology Corporation Announces Acquisition Of Dust Networks
2012-01-17 00:00:00,Linear Technology Corporation Comments On Q3 2012 Revenue Raises Quarterly Dividend To Per Share
2012-04-17 00:00:00,Linear Technology Corporation Issues Q4 2012 Revenue Guidance Above Estimates
2012-07-24 00:00:00,Linear Technology Corporation Issues Q1 2013 Revenue Guidance Below Declares Cash Dividend
2012-10-08 00:00:00,ISI Group Lowers Linear Technology to Hold
2012-10-10 00:00:00,Linear Technology Downgraded by ISI Group
2012-10-11 00:00:00,Linear Technology First Quarter Earnings Sneak Peek
2012-10-16 00:00:00,Earnings Report for October 2012 LLTC
2012-10-17 00:00:00,Microchip Technology A Dividend Idea In The Semiconductor Space
2012-10-18 00:00:00,Deutsche Bank Reiterates Hold on Linear Technology
2012-10-22 00:00:00,Linear Technology Downgraded to at Nomura
2012-11-01 00:00:00,LLTC Makes Bullish Cross Above Critical Moving Average
