2010-12-02 00:00:00,Republic of Korea Selects Lockheed Martin Super Hercules For New Airlift Fleet
2010-12-10 00:00:00,Lockheed Martin Corporation And Kaman Receives Million From Navy To Prepare Unmanned Helicopter For Deployment
2010-12-14 00:00:00,Lockheed Martin Corporation Secures Million Contract to Produce Laser Enhanced Sniper Systems From DARPA
2010-12-20 00:00:00,Lockheed Martin Corporation Receives Order From Customs And Border Protection For Additional Orion MLU Kits
2010-12-30 00:00:00,Lockheed Martin Austal Limited Split Navy Ship
2011-01-12 00:00:00,Lockheed Martin Corporation Secures C4ISR Contract For Coast Fourth National Security Cutter
2011-01-14 00:00:00,Navy Selects Lockheed Martin Corporation For Submarine Sonar Upgrades
2011-01-27 00:00:00,Lockheed Martin Corporation Declares First Quarter 2011 Dividend Of
2011-01-28 00:00:00,Lockheed Martin Team Submits Proposal For Midcourse Defense Contract
2011-02-07 00:00:00,Lockheed Martin Corporation Secures Air Force Million Space Fence Radar Contract
2011-02-16 00:00:00,GE Hitachi Nuclear Energy And Lockheed Martin Corporation Sign Major Nuclear Industry Supply Chain Agreement
2011-03-01 00:00:00,Lockheed Martin Corporation and Bristow Helicopters Australia Team For Helicopter Aircrew Training System
2011-03-30 00:00:00,Lockheed Martin Corporation Secures Million THAAD Production Contract
2011-04-05 00:00:00,Lockheed Martin Corporation Completes PAE Divestiture To Lindsay LLC
2011-04-08 00:00:00,Lockheed Martin Corporation Secures Million Contract for Concept Definition of Standard Block IIB
2011-04-28 00:00:00,Lockheed Martin Corporation Declares Second Quarter 2011 Dividend of
2011-05-03 00:00:00,Lockheed Martin Corporation Secures Contract From Navy
2011-05-10 00:00:00,Lockheed Martin Corporation Receives Instrumented Ranges Digital Range Training System Contract From US Army
2011-05-11 00:00:00,Lockheed Martin Corporation Receives Million Contract To Upgrade Marine Corps Gunnery Trainers
2011-06-09 00:00:00,Lockheed Martin Corporation Receives Million Contract Award For And Portable Sensor Systems
2011-06-14 00:00:00,Lockheed Martin Corporation To Shed About
2011-06-15 00:00:00,Lockheed Martin Corporation Receives Million Contract for Precision Strike GMLRS Rockets From Army
2011-07-18 00:00:00,Lockheed Martin Corporation Receives Million Contract To Support Navy Antisubmarine Warfare Mission
2011-07-20 00:00:00,Lockheed Martin Corporation Puts In Place Voluntary Layoff
2011-07-21 00:00:00,Lockheed Martin Magnelink Wireless Communication System Receives Federal Safety Approval
2011-07-25 00:00:00,The Briscoe Law Firm And Powers LLP Announces Investigation Of Lockheed Martin Corporation
2011-08-16 00:00:00,Lockheed Martin Corporation Secures Up To Million To Develop Unmanned Autonomous Technologies
2011-08-18 00:00:00,General Dynamics Lead Team Including Lockheed Martin Corp Secures Army Ground Combat Vehicle Million Technology Development Contract
2011-09-06 00:00:00,Lockheed Martin Corporation Preparing Benchmark Three Part Bond
2011-09-12 00:00:00,Lockheed Martin Corporation Secures Million To Provide New Training Technology for Air Force Program
2011-09-14 00:00:00,Lockheed Martin Corporation Secures Million Contract To Upgrade Army Advanced Gunnery Training Systems
2011-09-15 00:00:00,Lockheed Martin Corporation Secures Contract
2011-09-27 00:00:00,Lockheed Martin Corporation Completes Acquisition Of QTC Holdings
2011-11-07 00:00:00,Lockheed Martin Corporation To Modernize 29 Air Force Early Warning Surveillance Radars
2011-11-16 00:00:00,Lockheed Martin Corporation And Space Florida Collaborate For Underwater Vehicle Program In Palm Beach County
2011-12-05 00:00:00,Lockheed Martin Corporation Secures Contracts Totaling Million For Marine Corps Targeting System Date
2012-01-17 00:00:00,Lockheed Martin Corporation Acquires Procerus Technologies
2012-01-27 00:00:00,Lockheed Martin Corp Declares First Quarter 2012 Dividend
2012-02-06 00:00:00,Lockheed Martin Corp to Provide Distributed Training Mission Support for Air Force
2012-03-26 00:00:00,Lockheed Martin Corp Receives Million Development Contract From Missile Defense Agency
2012-04-03 00:00:00,Lockheed Martin Corp Receives Contract To Continue To Maintain Shared Early Warning System For Space And Missile Command
2012-04-17 00:00:00,Lockheed Martin Corp Awards Of Army Intelligence Training Contract
2012-04-24 00:00:00,Lockheed Martin Corp Receives Million Contract For Development Of New GMLRS Variant
2012-05-08 00:00:00,Lockheed Martin Corp Wins Role ON Department OF Homeland Security Communications Program
2012-05-23 00:00:00,Lockheed Martin Corp Wins Role On Air Force Medical Advisory Services Contract
2012-05-30 00:00:00,Lockheed Martin Corp Secures Contract To Compete Task Orders On Acquisition Contracting Vehicle
2012-06-26 00:00:00,Lockheed Martin Corp Receives Million Contract For MLRS M270A1 Launcher Cab Upgrades
2012-07-09 00:00:00,Navy Awards Lockheed Martin Million Contract For Additional VLA Missiles
2012-07-11 00:00:00,Ocean Power And Lockheed Martin Corp To Develop Project In Australia
2012-07-19 00:00:00,Lockheed Martin Corp Receives Million Contract For MSE Production
2012-07-30 00:00:00,Lockheed Martin Corp Secures Contract
2012-08-17 00:00:00,Lockheed Martin Corp Secures Million JAGM Contract For Extended Technology Development
2012-08-20 00:00:00,Lockheed Martin Corp To Build Spacecraft For InSight Mars Next Discovery Mission
2012-08-23 00:00:00,Lockheed Martin Corp Wins Million JLTV Engineering And Manufacturing Development Phase
2012-09-06 00:00:00,Lockheed Martin Corp Receives Million Sniper ATP Sustainment Contract From Air Force
2012-09-18 00:00:00,Lockheed Martin Corp Wins Role On Army Sustainment Services Program
2012-09-27 00:00:00,Lockheed Martin Corp Raises Quarterly Dividend By
2012-10-01 00:00:00,Lockheed Martin Corp Receives Upgrade Contract Valued Up To Billion
2012-10-03 00:00:00,Lockheed Martin Corp Announces To Begin Work On Billion Defense Information Systems Agency Contract
2012-10-18 00:00:00,Lockheed Gets Air Force Order Analyst Blog
2012-10-23 00:00:00,Lockheed Martin Corp Wins Million Deal For 13
2012-10-25 00:00:00,Air Force Selects Lockheed Martin Corp To Initial Contract For Next Set Of Missile Warning Satellites
2012-10-31 00:00:00,Lockheed Microsoft to Take EPA to the Cloud
2012-11-01 00:00:00,Lockheed Martin Submits Final Proposal For Ballistic Missile
