2010-12-10 00:00:00,Lockheed Martin Corporation And Kaman Receives Million From Navy To Prepare Unmanned Helicopter For Deployment
2011-01-12 00:00:00,Lockheed Martin Corporation Secures C4ISR Contract For Coast Fourth National Security Cutter
2011-03-30 00:00:00,Lockheed Martin Corporation Secures Million THAAD Production Contract
2011-04-28 00:00:00,Lockheed Martin Corporation Declares Second Quarter 2011 Dividend of
2011-05-03 00:00:00,Lockheed Martin Corporation Secures Contract From Navy
2011-06-15 00:00:00,Lockheed Martin Corporation Receives Million Contract for Precision Strike GMLRS Rockets From Army
2011-07-21 00:00:00,Lockheed Martin Magnelink Wireless Communication System Receives Federal Safety Approval
2011-09-27 00:00:00,Lockheed Martin Corporation Completes Acquisition Of QTC Holdings
2011-11-16 00:00:00,Lockheed Martin Corporation And Space Florida Collaborate For Underwater Vehicle Program In Palm Beach County
2012-01-17 00:00:00,Lockheed Martin Corporation Acquires Procerus Technologies
2012-01-27 00:00:00,Lockheed Martin Corp Declares First Quarter 2012 Dividend
2012-02-06 00:00:00,Lockheed Martin Corp to Provide Distributed Training Mission Support for Air Force
2012-05-08 00:00:00,Lockheed Martin Corp Wins Role ON Department OF Homeland Security Communications Program
2012-05-23 00:00:00,Lockheed Martin Corp Wins Role On Air Force Medical Advisory Services Contract
2012-07-09 00:00:00,Navy Awards Lockheed Martin Million Contract For Additional VLA Missiles
2012-07-11 00:00:00,Ocean Power And Lockheed Martin Corp To Develop Project In Australia
2012-10-23 00:00:00,Lockheed Martin Corp Wins Million Deal For 13
2012-10-31 00:00:00,Lockheed Trident II D5 Missile Achieves 143 Successful Test Flights
2012-11-01 00:00:00,Lockheed Martin Submits Final Proposal For Ballistic Missile
