2010-11-01 00:00:00,Lockheed Martin Corporation Wins Million Modernization Contract
2010-11-18 00:00:00,Lockheed Martin Corporation To Close Cut
2010-11-19 00:00:00,Lockheed Martin Corporation Secures Billion Full Funding Contract
2010-12-02 00:00:00,Republic of Korea Selects Lockheed Martin Super Hercules For New Airlift Fleet
2010-12-10 00:00:00,Lockheed Martin Corporation And Kaman Receives Million From Navy To Prepare Unmanned Helicopter For Deployment
2010-12-14 00:00:00,Lockheed Martin Corporation Secures Million Contract to Produce Laser Enhanced Sniper Systems From DARPA
2011-01-06 00:00:00,Lockheed Martin Corporation Secures Million Production Contract To Upgrade Military Helicopter Sensor System
2011-01-12 00:00:00,Lockheed Martin Corporation Secures C4ISR Contract For Coast Fourth National Security Cutter
2011-01-14 00:00:00,Navy Selects Lockheed Martin Corporation For Submarine Sonar Upgrades
2011-01-18 00:00:00,Lockheed Martin Corporation Takes Stake In Abu Dhabi Contractor Advanced Military Maintenance Repair and Overhaul Centre Asia Pulse
2011-01-20 00:00:00,Lockheed Martin Corporation Receives Million For Long Range Anti Ship Missile Demonstrations
2011-01-27 00:00:00,Lockheed Martin Corporation Declares First Quarter 2011 Dividend Of
2011-01-31 00:00:00,Lockheed Martin Corporation Receives Million Contract For Artillery Rocket System
2011-02-01 00:00:00,Lockheed Martin Corporation To Provide Idaho Falls Power Utility Cyber Security Services
2011-02-07 00:00:00,Lockheed Martin Corporation Secures Air Force Million Space Fence Radar Contract
2011-02-15 00:00:00,Lockheed Martin Corporation Secures Million Aircrew Training System Contract
2011-02-17 00:00:00,Group plc Secures USD246 Million Engine Support Services Contracts For Teamed With Marshall Aerospace and Lockheed Martin Corporation To Deliver HIOS
2011-03-14 00:00:00,Lockheed Martin Corporation Receives Million Contract For Reentry Vehicle Fuze Refurbishment For Air ICBM Program
2011-03-18 00:00:00,Lockheed Martin Corporation Secures Contract From Navy To Construct Littoral Combat Ship
2011-03-29 00:00:00,Lockheed Martin Lockheed Martin Canada Awarded Million Contract To Provide Live Fire Target Training For Canadian Army
2011-04-01 00:00:00,Lockheed Martin Corporation Secures Lockheed Martin Million Contract For Warfare Training Targets From Navy
2011-04-05 00:00:00,Lockheed Martin Corporation Completes PAE Divestiture To Lindsay LLC
2011-04-07 00:00:00,Lockheed Martin Corporation Secures DARPA Contract To Improve Command and Control Systems
2011-04-26 00:00:00,Lockheed Martin Corporation Reaffirms FY 2011 EBIT Raises FY 2011 EPS Guidance
2011-05-03 00:00:00,Lockheed Martin Corporation Secures Contract From Navy
2011-05-18 00:00:00,Lockheed Martin Corporation Receives Million Contract To Upgrade Precision Fires Capability
2011-06-09 00:00:00,Lockheed Martin Corporation Receives Million Contract Award For And Portable Sensor Systems
2011-06-13 00:00:00,Lockheed Martin Corporation Secures Contract From Navy
2011-06-14 00:00:00,Lockheed Martin Corporation To Shed About
2011-06-21 00:00:00,Lockheed Martin Corporation Secures Contract From Navy
2011-06-27 00:00:00,Lockheed Martin Corporation Secures Role On Army Forces Command Training And Operations Contract
2011-06-30 00:00:00,Lockheed Martin Aeronautics Business To Eliminate About Positions
2011-07-20 00:00:00,Lockheed Martin Corporation Puts In Place Voluntary Layoff
2011-07-21 00:00:00,Lockheed Martin Magnelink Wireless Communication System Receives Federal Safety Approval
2011-07-26 00:00:00,Lockheed Martin Corporation Raises FY 2011 EPS Guidance
2011-08-03 00:00:00,Faruqi LLP Announces Investigation Of Lockheed Martin Corporation
2011-08-09 00:00:00,Lockheed Martin Corporation Secures Contract From Naval Air Systems Command To Support Tactical Tomahawk Weapons Control System
2011-08-16 00:00:00,Lockheed Martin Corporation Secures Up To Million To Develop Unmanned Autonomous Technologies
2011-08-22 00:00:00,Lockheed Martin Corporation Agrees to Acquire QTC Holdings
2011-08-23 00:00:00,Lockheed Martin Corporation Announces Increase Of Billion To Existing Share Repurchase Authority
2011-08-26 00:00:00,Air Force And Lockheed Martin Corporation Sign Five Year Seeker Cooperative Agreement
2011-09-12 00:00:00,Lockheed Martin Corporation Secures Million To Provide New Training Technology for Air Force Program
2011-09-13 00:00:00,Ocean Power And Lockheed Martin To Collaborate On Utility Scale PowerBuoy For Oregon Wave Power Project
2011-09-14 00:00:00,Lockheed Martin Corporation Secures Million Contract To Upgrade Army Advanced Gunnery Training Systems
2011-09-15 00:00:00,Lockheed Martin Corporation Secures Contract
2011-09-22 00:00:00,Lockheed Martin Corporation Raises Quarterly Dividend By And Increases Share Repurchase Authority By Billion
2011-09-26 00:00:00,Lockheed Martin Corporation Reduces About 540 Positions
2011-09-27 00:00:00,Lockheed Martin Corporation Completes Acquisition Of QTC Holdings
2011-10-18 00:00:00,Lockheed Martin Corporation Receives Million Contract From Army To Maintain Aerostat Detection Systems
2011-11-03 00:00:00,Lockheed Martin Corporation Acquires
2011-11-07 00:00:00,Lockheed Martin Corporation To Modernize 29 Air Force Early Warning Surveillance Radars
2011-11-22 00:00:00,Lockheed Martin Corporation Secures Sensor System EMD Contract
2011-12-05 00:00:00,Lockheed Martin Corporation Secures Contracts Totaling Million For Marine Corps Targeting System Date
2012-01-26 00:00:00,CORRECTION Lockheed Martin Corporation Issues FY 2012 Operating Profit Guidance Below Estimates
2012-01-31 00:00:00,Lockheed Martin Raytheon Team To Provide SEWIP Electronic Attack Capability For Navy Missile Defense
2012-02-06 00:00:00,Lockheed Martin Corp to Provide Distributed Training Mission Support for Air Force
2012-02-22 00:00:00,Lockheed Martin Foliage Penetrating Reconnaissance Radar Deployed To Support Southern Command
2012-03-26 00:00:00,Lockheed Martin Corp Receives Million Development Contract From Missile Defense Agency
2012-03-27 00:00:00,Lockheed Martin Corp Starts Trading on OTC
2012-04-17 00:00:00,Lockheed Martin Corp Awards Of Army Intelligence Training Contract
2012-04-24 00:00:00,Lockheed Martin Corp Receives Million Contract For Development Of New GMLRS Variant
2012-04-26 00:00:00,Lockheed Martin Corp Declares Second Quarter 2012 Dividend
2012-05-23 00:00:00,Lockheed Martin Corp Wins Role On Air Force Medical Advisory Services Contract
2012-05-29 00:00:00,Lockheed Martin Corp Secures Contract to Deliver Innovative Platform Of Secure IT And Data Solutions To Marshals Service
2012-05-30 00:00:00,Lockheed Martin Corp Secures Contract To Compete Task Orders On Acquisition Contracting Vehicle
2012-06-05 00:00:00,Lockheed Martin Corp Wins Billion Missile Interceptor
2012-06-07 00:00:00,Lockheed Martin Corp Announces Strategic Supply Chain Agreement With Arrow Electronics Inc
2012-06-15 00:00:00,Lockheed Martin Corp Wins Million Deal To Buy
2012-07-09 00:00:00,Navy Awards Lockheed Martin Million Contract For Additional VLA Missiles
2012-07-24 00:00:00,Lockheed Martin Corp Reaffirms FY 2012 Revenue Raises FY 2012 Operating Profit And EPS Outlook
2012-08-17 00:00:00,Lockheed Martin Corp Secures Million JAGM Contract For Extended Technology Development
2012-08-20 00:00:00,Lockheed Martin Corp To Build Spacecraft For InSight Mars Next Discovery Mission
2012-09-06 00:00:00,Lockheed Martin Corp Receives Million Sniper ATP Sustainment Contract From Air Force
2012-09-26 00:00:00,TeleCommunication Systems Northrop Grumman Corp and Lockheed Martin Corp Team to Produce Affordable Satellite Terminals for Protected Communications
2012-09-27 00:00:00,Lockheed Martin Corp Raises Quarterly Dividend By
2012-10-11 00:00:00,Lockheed Gets Triple Korean Orders Analyst Blog
2012-10-17 00:00:00,Lockheed Martin Corp Receives Million Contract For Paveway II Plus Laser Guided Bomb Kits
2012-10-18 00:00:00,Lockheed Gets Air Force Order Analyst Blog
2012-10-24 00:00:00,Lockheed Martin Corp Wins Contract To Increase Tactical Vehicle Safety With Autonomous Technology
2012-10-31 00:00:00,Lockheed Microsoft to Take EPA to the Cloud
2012-11-01 00:00:00,Lockheed Martin Submits Final Proposal For Ballistic Missile
2012-11-05 00:00:00,Barclays Capital Reiterates Equalweight on Lockheed Martin
2012-11-06 00:00:00,Clears Sale Of Lockheed Martin Missile Defense System To
