2011-03-18 00:00:00,Lorillard Shares Rise As Menthol Ban Seen
2011-05-19 00:00:00,Lorillard Announces Quarterly Dividend On Common Increase In Stock Repurchase Program
2012-02-09 00:00:00,Lorillard Declares Dividend Increase
2012-04-25 00:00:00,Lorillard Announces Acquisition Of Blu Ecigs
2012-08-16 00:00:00,Lorillard Inc Announces Pricing of Million Debt Offering
2012-10-19 00:00:00,Lorillard Stock Rating Reaffirmed by Goldman Sachs
2012-10-24 00:00:00,Market Influences That Drive Equities Forward Industry Report on Lorillard
2012-10-31 00:00:00,Lorillard Inc Announces Quarterly Dividend
