2010-12-02 00:00:00,Rambus Files ITC Complaint Against Broadcom Freescale LSI MediaTek NVIDIA And STMicroelectronics
2011-06-07 00:00:00,LSI Corporation Announces New Multiservice Processor For Wireless Networks
2011-06-21 00:00:00,LSI Corporation Secures Contract From National Center For Supercomputing Applications
2011-10-26 00:00:00,LSI Corporation Announces Agreement To Acquire SandForce
2011-11-15 00:00:00,LSI Corporation And Fujitsu Collaborate On SPARC64 IXfx
2012-03-14 00:00:00,LSI Corporation Raises Q1 2012 Guidance
2012-04-25 00:00:00,LSI Corporation Issues Q2 2012 Revenue Guidance Above Estimates
2012-07-25 00:00:00,LSI Corporation Issues Q3 2012 Guidance In Line With Estimates
2012-10-11 00:00:00,Citadel Advisors Increases Stake In LSI Corporation To
2012-10-16 00:00:00,LSI CORPORATION LSI and 6WIND Team Up to Accelerate Mobile
2012-10-22 00:00:00,LSI Corporation Earnings Watch For Weakness In Storage
2012-10-25 00:00:00,LSI Corp Issues Q4 2012 Revenue Guidance Below Call
2012-10-26 00:00:00,Critical Stock Johnson F5
2012-11-05 00:00:00,Zacks Reiterates Neutral on LSI
