2010-12-06 00:00:00,Leucadia National Corporation Announces Cash Dividend
2010-12-15 00:00:00,Inmet Mining Corporation Closes Transaction With Leucadia National Corporation Consolidating Ownership of Cobre Las Cruces
2011-04-08 00:00:00,Leucadia National Corporation To Purchase Additional Common Stock of Jefferies
2011-12-05 00:00:00,Leucadia National Corporation Announces Agreement to Acquire Control of National Beef and Declares Per Share Cash Dividend
2011-12-30 00:00:00,Leucadia National Corporation Completes Acquisition Of Control Of National Beef
2012-10-17 00:00:00,Conglomerates Set to Leucadia
2012-10-25 00:00:00,Berkshire Wins ResCap Loan Auction With Billion Bid
2012-11-05 00:00:00,Conglomerates Caterpillar Shares Boosted by Chinese
