2010-11-17 00:00:00,PDG Realty SA e Participacoes Signs Term Sheet With Marriott International Through Subsidiary
2011-02-11 00:00:00,Marriott Declares Cash Dividend
2011-02-15 00:00:00,Marriott To Spin Off Timeshare
2011-04-20 00:00:00,Marriott Lowers Prior FY 2011 EBITDA Reaffirms FY 2011 EPS Guidance
2011-05-06 00:00:00,Marriott Announces Increase In Cash Board Increases Stock Repurchase Authorization By 25 Million Shares
2011-06-28 00:00:00,Marriott Subsidiary Files SEC Form 10 For Planned By Of Vacation Club Business
2011-07-13 00:00:00,Marriott Lowers Prior FY 2011 EBITDA Reaffirms FY 2011 EPS Guidance
2011-11-10 00:00:00,Marriott Declares Cash Dividend
2011-11-29 00:00:00,Digicel Marriott And President Clinton Join Prime Minister To Announce New Hotel In
2012-02-03 00:00:00,Marriott To Open Courtyard And Residence Inn Hotels In Alberta
2012-02-28 00:00:00,MacroSolve Inc Files Patent Infringement Suit Against Marriott Inc
2012-04-16 00:00:00,Marriott To Sell ExecuStay Corporate Housing Brand To Oakwood Signs Eight Year Reciprocal Preferred Provider Agreement
2012-06-18 00:00:00,Marriott Reaffirms FY 2012 RevPAR Comments On FY 2014 RevPAR Issues FY 2014 EPS Guidance Above Estimates
2012-09-14 00:00:00,Gaylord Entertainment Co To Transfer Management Of Radisson Hotel General Jackson Gaylord Springs Golf And Wildhorse Saloon To Marriott
2012-10-03 00:00:00,Marriott International Inc Issues Q4 2012 Earnings Guidance Below Narrows FY 2012 Earnings Guidance To A Range In Line With Estimates
2012-10-12 00:00:00,The Zacks Analyst Blog IBM and
2012-10-15 00:00:00,Marriott Sues Miami Beach Hotel Owner Over Takeover Attempt
2012-10-18 00:00:00,MARRIOTT Marriott Hotels Resorts Signs New
2012-11-05 00:00:00,MARRIOTT Nearly 2500 Fairfield Inn Suites
2012-11-06 00:00:00,MARRIOTT A Dog Wearing a Tie Visits Boulder on a
