2011-06-24 00:00:00,Masco Corporation Declares Quarterly Dividend
2011-12-07 00:00:00,Masco Corporation Declares Quarterly Dividend
2012-02-17 00:00:00,Faruqi LLP Is Investigating Masco Corporation On Behalf Of Its Shareholders
2012-06-22 00:00:00,Masco Corp Declares Quarterly Dividend
2012-10-09 00:00:00,X 5 Stock Reaching Their Date on October 10
2012-10-10 00:00:00,Consumer Cyclical Sector Disappoints Ford Motor and General
2012-10-24 00:00:00,Kennametal Unveils Lower Quarterly Cuts Guidance KMT
2012-10-31 00:00:00,Identifying Placing Risk Consensus Reports on Masco
2012-11-01 00:00:00,Top Movers
