2011-01-27 00:00:00,Corporation Announces Quarterly Cash Dividend
2011-07-20 00:00:00,First Corporation Restaurant in Bosnia Opens for
2012-01-26 00:00:00,Corporation Announces Quarterly Cash Dividend
2012-05-07 00:00:00,Microsoft Google JPMorgan Chase Co and Merck Co Inc to Be Listed on Bucharest Stock Exchange Starting May
2012-05-24 00:00:00,Corp Announces Quarterly Cash Dividend
2012-09-20 00:00:00,Corp Raises Quarterly Cash Dividend By
2012-10-11 00:00:00,Option Players Bet On a Drop
2012-10-16 00:00:00,The Zacks Analyst Blog Stryker and
2012-11-05 00:00:00,Guru Stocks at DD
