2010-12-16 00:00:00,Taoglas Enters Into Wireless Design Partnership Agreement With Microchip
2011-04-19 00:00:00,Microchip Technology Inc Introduces Wireless PICtail Daughter Board Developed with Holding AG
2011-05-23 00:00:00,Microchip Announces MCP16301
2011-07-11 00:00:00,Microchip Lowers Q1 2012 Guidance
2011-08-29 00:00:00,Microchip Launches Development Kit
2011-11-29 00:00:00,Microchip Unveils Development Tool For and PIC dsPIC DSCs
2012-10-15 00:00:00,Microchip Technology Inc Lowers Q2 2013 Revenue Guidance
