2010-11-04 00:00:00,Microchip Declares Issues Mixed Q3 2011 Guidance
2011-02-10 00:00:00,Microchip Issues FY 2011 EPS Guidance Above Call
2011-08-29 00:00:00,Microchip Launches Development Kit
2011-11-03 00:00:00,Microchip Comments On Q3 2012 Revenue Comments On Q4 2012 Declares Quarterly Cash Dividend of Cents Per Share
2012-10-15 00:00:00,Microchip Technology Inc Lowers Q2 2013 Revenue Guidance
2012-10-16 00:00:00,Quarter Millennial Company
2012-10-26 00:00:00,Microchip Technology Poised For Capital Appreciation With Dividend
