2010-12-30 00:00:00,McKesson Corporation Completes Acquisition Of US Oncology
2011-01-26 00:00:00,McKesson Corporation Declares Quarterly Dividend
2011-02-28 00:00:00,Health Robotics Announces Termination Of Distribution Contract With McKesson Corporation In North America
2011-03-04 00:00:00,Federal Court Judge Certifies Hagens Berman Municipal Class Action Against McKesson Corporation Over Drug Price Manipulation
2011-05-05 00:00:00,System C Healthcare plc Updates On Court Sanction Of Scheme Of Arrangement
2011-06-22 00:00:00,Safeguard Announces Acquisition Of Portico By McKesson Corporation
2011-10-28 00:00:00,McKesson Corporation Declares Quarterly Dividend
2012-01-30 00:00:00,McKesson Corporation Reaffirms FY 2012 EPS Guidance
2012-06-19 00:00:00,McKesson Corporation Reaffirms FY 2013 Earnings Guidance
2012-10-11 00:00:00,McKesson Corporation Fiscal 2013 Second Quarter Conference Call Scheduled
2012-10-12 00:00:00,UBS AG Boosts Price Target on McKesson
2012-10-16 00:00:00,SEAC our Free Stock Picks
2012-10-23 00:00:00,JPMorgan Chase Gives Overweight Rating to McKesson
2012-10-24 00:00:00,McKesson Corporation Daily Trading Report
