2011-01-27 00:00:00,Mead Johnson Nutrition CO Issues FY 2011 EPS Guidance Below Estimates
2011-06-08 00:00:00,Mead Johnson Nutrition CO Declares Dividend
2012-04-18 00:00:00,Nestle SA Near Deal For Pfizer Baby Formula Appears To Outstrip Danone SA And Mead Johnson Nutrition
2012-07-26 00:00:00,Mead Johnson Nutrition CO Updates 2012 Guidance
2012-10-16 00:00:00,MEAD JOHNSON NUTRITION CO Brown Crouppen Files Suit over Infant
2012-10-17 00:00:00,Mead Johnson Nutrition Stock Rating Reaffirmed by Atlantic Securities
2012-10-22 00:00:00,Morgan Reiterates Overweight Raises PT on Mead
2012-10-25 00:00:00,Mead Johnson Nutrition CO Lowers FY 2012 Guidance
2012-10-26 00:00:00,Mead Johnson Nutrition Company Trading Analysis
2012-11-02 00:00:00,Children to become smart investigators
