2011-01-27 00:00:00,Mead Johnson Nutrition CO Issues FY 2011 EPS Guidance Below Estimates
2011-12-07 00:00:00,Mead Johnson Nutrition CO Declares Dividend
2012-04-18 00:00:00,Nestle SA Near Deal For Pfizer Baby Formula Appears To Outstrip Danone SA And Mead Johnson Nutrition
2012-07-26 00:00:00,Mead Johnson Nutrition CO Updates 2012 Guidance
2012-09-06 00:00:00,Mead Johnson Nutrition CO Declares Dividend
2012-10-22 00:00:00,Morgan Reiterates Overweight Raises PT on Mead
2012-10-25 00:00:00,US HOT Cliffs PSS World
