2010-11-24 00:00:00,Marsh McLennan Mercer To Acquire Hammond Associates
2011-01-20 00:00:00,Marsh McLennan Companies Declares Quarterly Dividend
2011-08-31 00:00:00,Marsh McLennan Marsh To Acquire Brokerage Business of Alexander Forbes
2012-01-18 00:00:00,Marsh McLennan Companies Declares Quarterly Dividend
2012-01-19 00:00:00,Marsh McLennan Companies Declares Quarterly Dividend
2012-03-05 00:00:00,Western Union Co Signs Deal With Marsh McLennan Companies Mercer Outsourcing To Process Pension Payments To 80 Countries
2012-04-02 00:00:00,Marsh McLennan Companies Marsh Acquires Cosmos Services
2012-09-04 00:00:00,Marsh McLennan Companies Inc Names Michael Bischoff Chief Financial Officer
2012-10-08 00:00:00,MARSH MCLENNAN Employers and Local
