2012-05-01 00:00:00,The Company Says Not In Talks To Buy Monster Beverage
2012-08-24 00:00:00,Branham LLP Announces Securities Class Action against Monster Beverage Corp
2012-08-29 00:00:00,Robbins Umeda LLP Announces Investigation of Monster Beverage Corp
2012-08-31 00:00:00,Izard Nobel LLP Announces Class Action Lawsuit Against Monster Beverage Corporation
2012-09-06 00:00:00,Lieff Cabraser Announces Class Action Lawsuits Against Monster Beverage Corp
2012-10-24 00:00:00,Monster Beverage jumps leads 500
2012-11-05 00:00:00,Does The Street Have Monster Beverage Figured
2012-11-06 00:00:00,Is Monster Beverages A Falling Knife Or A Great Buying
2012-11-07 00:00:00,Monster Beverage shares sink on earnings miss
