2011-03-25 00:00:00,Reports Quarterly Cash Dividend
2012-02-24 00:00:00,Inc and TE Connectivity Announce HighSpeed Interconnect Second Source Agreements
2012-09-12 00:00:00,Law Firm of Levi LLP Launches Investigation Into Possible Breaches Of Fiduciary Duty By Board Of Directors Of Molex Inc
2012-10-12 00:00:00,Molex Inc Acquires Affinity Medical Technologies LLC
2012-10-25 00:00:00,Levi LLP Announces Investigation Of Molex Inc
2012-11-02 00:00:00,Riley Acts as Exclusive Financial Advisor to Affinity Medical Technologies
