2011-02-22 00:00:00,Monsanto Company Acquires
2011-07-11 00:00:00,Monsanto Company In Talks To Deepen Ties With
2011-08-03 00:00:00,Monsanto Company Approves Dividend Increase to Per Share
2011-09-28 00:00:00,Monsanto Company Motion Denied Agent Orange Case Goes
2011-12-05 00:00:00,Monsanto Company Approves Dividend of Per Share
2012-06-06 00:00:00,Monsanto Company Announces Billion Share Repurchase Declares Dividend
2012-06-19 00:00:00,Monsanto Co Sues Rival Du Pont de Nemours and Co for Copying Seed
2012-07-10 00:00:00,Monsanto Co And du Pont de Nemours and Co Take Seed Battle To
2012-08-01 00:00:00,Federal Court Jury Finds In Favor Of Monsanto Co In Patent DuPont And DuPont Pioneer Found Guilty Of Infringement Of Intellectual Property
2012-08-02 00:00:00,du Pont de Nemours and Company Will Appeal Verdict In Monsanto Co DuPont Patent Case
2012-08-28 00:00:00,Monsanto Co and Alnylam Pharmaceuticals Inc Form Strategic Alliance
2012-10-10 00:00:00,Major Patent Case for Monsanto to Go Before the Supreme Court
2012-10-11 00:00:00,Insiders Sold These Stocks on
2012-10-19 00:00:00,Companies Paying Dividends Regularly for a considerably Long Time
2012-11-06 00:00:00,Hardt Upgrades Monsanto to Buy
