2010-12-06 00:00:00,Monsanto Company Declares Quarterly Dividend
2010-12-22 00:00:00,Monsanto Company Names Pierre Courduroux As CFO
2011-03-08 00:00:00,Monsanto Company And Sapphire Energy Enter Collaboration To Advance Yield and Stress Research
2011-04-14 00:00:00,Monsanto Company and Atlas Venture Enter Alliance to Invest in Innovative Life Sciences Companies
2011-06-08 00:00:00,Monsanto Company Approves Dividend
2011-07-19 00:00:00,Monsanto Company Starts Trading on OTC
2011-09-21 00:00:00,Monsanto Company wins lawsuit against Indiana soybean farmer
2011-09-27 00:00:00,GrassRoots Biotechnology And Monsanto Company Extends Collaboration
2012-02-14 00:00:00,Monsanto Company To Appeal French Poisoning
2012-06-21 00:00:00,Monsanto Co Completes Purchase Of Planting Technology Developer Precision
2012-08-08 00:00:00,Monsanto Co Board Approves Quarterly Dividend Increase To Per Share
2012-08-14 00:00:00,Monsanto Co Reaffirms FY 2012 EPS Comments On FY 2013 EPS Guidance
2012-10-08 00:00:00,Brazil State Court Orders Monsanto Co To Suspend Seed
2012-10-12 00:00:00,Monsanto Stock Rating Reaffirmed by Jefferies Group
2012-10-15 00:00:00,Weekly Top Insider and LNKD
2012-10-16 00:00:00,Can Mosaic Outperform The
2012-10-18 00:00:00,MONSANTO COMPANY Board Sets Record and Meeting Date for Next
2012-10-22 00:00:00,Possible Loss From Brazil Seed Royalties Suit
2012-10-25 00:00:00,Monsanto Alfalfa Should Be Court Told
2012-10-31 00:00:00,Strong Performance Suggests Gains
