2012-07-02 00:00:00,Marathon Petroleum MPLX LP Files For Million
2012-10-08 00:00:00,Marathon Petroleum Corp To Buy BP Plc Texas City Refinery For Up To
2012-10-15 00:00:00,Marathon Petroleum BP Is Handing Out Free Money Again
2012-10-24 00:00:00,Marathon has about bln agreements
2012-10-26 00:00:00,Analyst Credit Suisse On US Independent Refiners Upgrades Delek
2012-11-05 00:00:00,MPC Sets Second Accelerated Share Repurchase Program of Year
2012-11-06 00:00:00,Critical Alerts For F5 Marathon Western
