2011-05-17 00:00:00,Bank Corporation Announces Second Quarter Dividend
2012-05-15 00:00:00,Bank Corporation Announces Second Quarter Dividend
2012-08-27 00:00:00,Hudson City Bancorp Inc To Merge With Bank Corporation
2012-10-10 00:00:00,Credit Suisse Upgrades Bank to Outperform
2012-10-17 00:00:00,Bank Corp Announces Dividend Declaration On Series A And Series C Preferred Stock
2012-10-18 00:00:00,Bank Earnings Call Cash Balance Mortgage Pipeline
2012-10-31 00:00:00,Fitch Affirms Ratings of 14 Banks Analyst Blog
2012-11-01 00:00:00,Bank Corporation to Participate in BancAnalysts Association of Boston
2012-11-02 00:00:00,Bank Donates To Sandy Relief
