2010-11-29 00:00:00,MeadWestvaco Signs Agreement To Sell Envelope Products Business To
2011-04-18 00:00:00,MeadWestvaco Declares Regular Quarterly Dividend
2011-06-28 00:00:00,Meadwestvaco Corp Declares Regular Quarterly Dividend
2011-11-15 00:00:00,Meadwestvaco Corp Declares Regular Quarterly Dividend
2012-01-23 00:00:00,Meadwestvaco Corp Declares Regular Quarterly Dividend
2012-06-06 00:00:00,Meadwestvaco Corp Acquires AARDEX Group SA
2012-10-09 00:00:00,MWV paperboard declared fit for EU confectionery packaging
2012-10-18 00:00:00,MeadWestvaco Third Quarter Earnings Sneak Peek
2012-10-19 00:00:00,Meadwestvaco Corp To Acquire Ruby Macons Ltd
2012-10-22 00:00:00,MWV acquires corrugated packaging producer to target Indian market
2012-10-26 00:00:00,MGM Resorts International Moves Up In Market Cap Passing
2012-10-31 00:00:00,Consumer insight sprays new life into Melodie pump
2012-11-01 00:00:00,MWV Chairman and Chief Executive Officer to Present at 42nd Annual Baird
2012-11-05 00:00:00,Calgon Carbon Posts Loss in 3Q Analyst Blog
2012-11-06 00:00:00,Indicated Dividend Yield Ranking for the 500 by Industry
