2010-11-17 00:00:00,MeadWestvaco Announces Expansion In Brazil To Increase Packaging Production
2011-01-05 00:00:00,Cobra Electronics Corporation Selects MeadWestvaco As Sustainable Packaging Partner
2011-01-24 00:00:00,MeadWestvaco Declares Regular Quarterly Dividend
2011-04-27 00:00:00,MeadWestvaco Comments On Q2 2011 Guidance
2011-06-16 00:00:00,Hagens Berman LLP Announces Investigation Of MeadWestvaco
2011-07-27 00:00:00,Meadwestvaco Corp Comments On Q3 2011 Earnings Guidance
2011-11-17 00:00:00,ACCO Brands Corporation To Merge With MeadWestvaco Consumer Office Products Business
2012-04-23 00:00:00,Meadwestvaco Corp Declares Regular Quarterly Dividend
2012-04-25 00:00:00,Meadwestvaco Corp Comments On Q2 2012 Earnings Guidance
2012-05-01 00:00:00,Meadwestvaco Corp Completes and Merger of Consumer Office Products Business with ACCO Brands Corp
2012-07-25 00:00:00,Meadwestvaco Corp Comments On Q3 2012 Earnings Reaffirms Long Term Guidance
2012-10-08 00:00:00,Printkote Approved for Chocolate and Confectionery Packaging Market
2012-10-15 00:00:00,Printkote Gets Approval Analyst Blog
2012-10-23 00:00:00,MeadWestvaco Management Discusses Q3 2012 Results Earnings Call
2012-10-24 00:00:00,MeadWestvaco Stock Rating Reaffirmed by RBC Capital
