2010-11-17 00:00:00,MeadWestvaco Announces Expansion In Brazil To Increase Packaging Production
2011-01-05 00:00:00,Cobra Electronics Corporation Selects MeadWestvaco As Sustainable Packaging Partner
2011-01-24 00:00:00,MeadWestvaco Declares Regular Quarterly Dividend
2011-02-01 00:00:00,Completes Acquisition Of Envelope Products Business
2011-04-27 00:00:00,MeadWestvaco Comments On Q2 2011 Guidance
2011-06-28 00:00:00,Meadwestvaco Corp Declares Regular Quarterly Dividend
2011-10-26 00:00:00,Meadwestvaco Corp Comments On Q4 2011 Earnings Call
2011-11-17 00:00:00,ACCO Brands Corporation To Merge With MeadWestvaco Consumer Office Products Business
2012-04-25 00:00:00,Meadwestvaco Corp Comments On Q2 2012 Earnings Guidance
2012-06-06 00:00:00,Meadwestvaco Corp Acquires AARDEX Group SA
2012-07-25 00:00:00,Meadwestvaco Corp Comments On Q3 2012 Earnings Reaffirms Long Term Guidance
2012-10-11 00:00:00,Equity Research on Packaging of America and MeadWestvaco Corp
2012-10-15 00:00:00,Printkote Gets Approval Analyst Blog
2012-10-18 00:00:00,MeadWestvaco Third Quarter Earnings Sneak Peek
2012-10-22 00:00:00,MWV acquires corrugated packaging producer to target Indian market
2012-10-26 00:00:00,MGM Resorts International Moves Up In Market Cap Passing
2012-10-31 00:00:00,Get ready for the new board tray
2012-11-05 00:00:00,Calgon Carbon Posts Loss in 3Q
2012-11-06 00:00:00,Indicated Dividend Yield Ranking for the 500 by Industry
