2011-07-28 00:00:00,Maxim Integrated Products Declares Dividend
2011-10-20 00:00:00,Maxim Integrated Products Declares Dividend
2012-01-26 00:00:00,Maxim Integrated Products Issues Q3 2012 Revenue Guidance In Line With Declares Dividend
2012-04-26 00:00:00,Maxim Integrated Products Declares Dividend
2012-10-03 00:00:00,MAXIM INTEGRATED PRODUCTS Maxim Schedules Conference Call For
2012-10-08 00:00:00,Morgan Upgrades Maxim Integrated Products to Raises PT
2012-10-11 00:00:00,New SoC for Smart Grid Analyst Blog
2012-10-12 00:00:00,Zacks Reaffirms Neutral Rating on Maxim Integrated Products
2012-10-15 00:00:00,MAXIM INTEGRATED PRODUCTS Maxim SFP
2012-10-23 00:00:00,A Refreshing Outlook Consensus Reports on Altera Corporation and Maxim
2012-10-25 00:00:00,Maxim Integrated Products Inc Declares Cash Dividend
