2012-04-19 00:00:00,TransForce Subsidiary Miller Inc Acquires Certain Assets Of Peak USA Energy Subsidiary Of Nabors Industries Ltd
2012-10-11 00:00:00,CEO Petrello files suit over Houston home
2012-10-16 00:00:00,Deep Dive Into Trading Activity for Nabors Industries
2012-10-18 00:00:00,Four Top Plays From a Sector
2012-10-25 00:00:00,Equity Ratings Changes for October NUVA
2012-10-31 00:00:00,Equity Ratings Changes for October PFG
2012-11-02 00:00:00,Zacks Bull and Bear of the Day CNO Financial Nabors
2012-11-06 00:00:00,Investment Ratings Reiterations for 6th ACA
