2011-01-11 00:00:00,Standard Announces Indices Change For Noble Corporation
2011-01-19 00:00:00,Noble Subsidiary Announces Contract With Hyundai Heavy Industries
2011-01-31 00:00:00,Noble Corporation Prices Offering Of Senior Notes
2011-02-23 00:00:00,Noble Corporation Secures Letter Of Intent From Subsidiary Of Royal Dutch Shell plc
2011-09-06 00:00:00,Noble Corporation Announces Management Change
2012-02-07 00:00:00,Noble Corporation Prices Offering Of Senior Notes
2012-07-12 00:00:00,Noble Corporation Secures Contract For Drillship Noble Bob Douglas
2012-07-27 00:00:00,Noble Corporation Announces Dividend Payment To Shareholders
2012-10-15 00:00:00,Forbes Earnings Noble Corporation
2012-10-17 00:00:00,Noble Corp third quarter profit drops on rig downtime
2012-10-18 00:00:00,Drives Drilling Stocks
2012-10-19 00:00:00,Stock Three Three Sells for October 19
2012-10-24 00:00:00,Time To Add These 2 Drillers Back Into Portfolios
2012-10-26 00:00:00,Noble Corp Announces Dividend Payment To Shareholders
2012-11-05 00:00:00,Aerosmith Puts a Fresh Spin on Its Old Tricks
