2011-01-11 00:00:00,Standard Announces Indices Change For Noble Corporation
2011-01-19 00:00:00,Noble Subsidiary Announces Contract With Hyundai Heavy Industries
2011-08-08 00:00:00,Noble Corporation Secures Contract For Rigs In Gulf Of Mexico And North Sea
2011-09-06 00:00:00,Noble Corporation Announces Management Change
2012-02-07 00:00:00,Noble Corporation Prices Offering Of Senior Notes
2012-07-12 00:00:00,Noble Corporation Secures Contract For Drillship Noble Bob Douglas
2012-09-04 00:00:00,Noble Corp Announces Contract
2012-10-17 00:00:00,Earnings Report for October 2012 KMI
2012-10-24 00:00:00,Time To Add These 2 Drillers Back Into Portfolios
2012-10-26 00:00:00,Noble Corp Announces Dividend Payment To Shareholders
2012-11-02 00:00:00,Noble Corporation Provides Fleet Contract Status Update
2012-11-07 00:00:00,Zacks Reaffirms Rating on Noble Corp
