2011-01-27 00:00:00,Q4 2010 Profit Shares
2011-07-13 00:00:00,NBCUniversal and Renew TV And Film Content Agreement
2011-12-20 00:00:00,And BBC Worldwide Announce Streaming Agreement For The United Kingdom And Ireland
2012-01-13 00:00:00,Robbins Geller Rudman Dowd LLP Files Class Action Suit Against
2012-01-18 00:00:00,Holzer Holzer LLC Announces Investigation Into Potential Claims For Breaches Of Fiduciary Duty By Certain Officers And Directors Of
2012-01-19 00:00:00,Robbins Umeda LLP Announces an Investigation of
2012-10-25 00:00:00,Netflix Time To Panic Or Time To
2012-10-26 00:00:00,Microsoft Corporation Eyeing Netflix
