2011-04-21 00:00:00,Newfield Exploration Company Reaffirms FY 2011 Production Call
2011-09-27 00:00:00,Newfield Exploration Company Announces Pricing Of Million Of 5 Senior Notes Due 2022
2012-02-06 00:00:00,Newfield Exploration Company Sell Million Of Assets In
2012-04-24 00:00:00,Newfield Exploration Company Raises FY 2012 Production Issues Q2 2012 Production Guidance
2012-06-19 00:00:00,Newfield Exploration Company Announces Pricing Of Billion Of 5 Senior Notes Due 2024
2012-10-05 00:00:00,Newfield Exploration Co Revises FY 2012 Production Guidance
2012-10-08 00:00:00,Newfield Completes GoM Divestitures Analyst Blog
2012-10-24 00:00:00,NFX Crosses Critical Technical Indicator
2012-10-25 00:00:00,Equity Ratings Changes for October NUVA
