2010-11-18 00:00:00,Announces Increase In Quarterly Dividend
2011-02-17 00:00:00,Declares Quarterly Dividend
2011-05-16 00:00:00,Declares Quarterly Dividend
2011-07-13 00:00:00,Hagens Berman LLP Announces Investigation Of
2011-07-19 00:00:00,Starts Trading on OTC
2012-08-13 00:00:00,Nike Inc Declares Quarterly Dividend
2012-10-16 00:00:00,Nike to supply gear to International Olympic Committee
2012-10-17 00:00:00,Incentives approved for million expansion
2012-11-05 00:00:00,Nike Inc Close To Selling Cole Haan To Apax
