2011-02-24 00:00:00,Bank of Ireland Announces Sale Of Bank of Ireland Securities Services To The Northern Trust Corporation
2011-03-03 00:00:00,The Northern Trust Corporation Secures Billion Mandate From Stenham Asset Management
2011-03-10 00:00:00,The Northern Trust Corporation Wins Billion Mandate From Dyfed Pension Fund
2011-04-19 00:00:00,The Northern Trust Corporation Declares Quarterly Dividend
2011-05-05 00:00:00,The Northern Trust Corporation Wins GBP25 Billion Mandate From Legal General Trust Limited
2011-06-01 00:00:00,The Northern Trust Corporation Completes Acquisition Of Bank Of Ireland Securities Services From Bank of Ireland
2011-06-13 00:00:00,The Northern Trust Corporation To Provide Custody Mandate Services To Taube Hodson Stonex Partners LLP
2011-07-13 00:00:00,LML Payment Subsidiary Settles Litigation With The Northern Trust Company And Northern Trust Corporation
2011-07-19 00:00:00,The Northern Trust Corporation Declares Quarterly Dividend
2011-07-27 00:00:00,The Northern Trust Corporation Wins Billion Asset Servicing Mandate For Lancashire County Council
2011-08-04 00:00:00,The Northern Trust Corporation Wins GBP710 Million Asset Servicing Mandate For Health Foundation
2011-08-17 00:00:00,The Northern Trust Corporation Preparing Million 10 Year Debt
2011-08-18 00:00:00,The Northern Trust Corporation Secures Contract From Northumberland County Council Pension Fund
2011-08-23 00:00:00,The Northern Trust Corporation Wins NOK606 Million Asset Servicing Mandate For Brum Kommune
2011-09-21 00:00:00,RCM Selects The Northern Trust Corporation For Investment Operations Outsourcing
2011-11-15 00:00:00,The Northern Trust Corporation Declares Quarterly Dividend
2012-07-30 00:00:00,Northern Trust Corp Prices Million Of Senior Notes
2012-10-11 00:00:00,NORTHERN TRUST CORPORATION Northern Trust Strengthens Foundation
2012-10-23 00:00:00,Northern Trust to Improve Outcomes for Defined
