2011-02-24 00:00:00,Northeast Utilities Issues FY 2011 EPS Guidance In Line With Estimates
2011-05-05 00:00:00,Northeast Utilities Reaffirms FY 2011 EPS Guidance
2011-08-02 00:00:00,Northeast Utilities Raises Low End Of Prior FY 2011 EPS Guidance To A Range In Line With Estimates
2012-02-14 00:00:00,Northeast Utilities Announces Common Dividend
2012-10-09 00:00:00,Equities Research Ratings Reiterations for 9th ALU
2012-10-23 00:00:00,Wunderlich Reiterates Hold on Northeast Utilities System
2012-11-01 00:00:00,Northeast Utilities Declares Regular Common Dividend
2012-11-02 00:00:00,Hurricane Smart Grids And Advanced Storage Technology
2012-11-05 00:00:00,Investment Ratings Reiterations for 5th ACS
