2011-02-08 00:00:00,Northeast Utilities Raises Common Dividend
2011-11-04 00:00:00,Northeast Utilities Reiterates FY 2011 EPS Guidance
2012-05-02 00:00:00,Northeast Utilities Announces Common Dividend
2012-10-10 00:00:00,Investment Ratings Reiterations for 9th FNF
2012-10-11 00:00:00,Weekly Ratings Changes for Northeast Utilities System
2012-10-18 00:00:00,NORTHEAST UTILITIES SYSTEM Northeast Utilities Commits to Preserving
2012-10-24 00:00:00,Equities Research Ratings Reiterations for 24th ABE
