2011-01-03 00:00:00,Nucor Corporation Announces Appointment Of President
2011-02-16 00:00:00,Nucor Corporation Declares Dividend
2011-06-07 00:00:00,Nucor Corporation Declares Quarterly Cash Dividend
2011-09-07 00:00:00,Nucor Corporation Announces Quarterly Cash Dividend
2011-09-15 00:00:00,Nucor Corporation Issues Q3 2011 EPS Guidance Below Estimates
2012-02-15 00:00:00,Nucor Corporation Announces Cash Dividend
2012-06-05 00:00:00,Nucor Corporation Announces Cash Dividend
2012-10-08 00:00:00,Barclays Capital Reiterates equalweight on Nucor
2012-10-09 00:00:00,VTB Capital Starts Stock Coverage on Nucor
2012-10-10 00:00:00,Bidders Including Nucor Corporation Line Up For ThyssenKrupp Steel Americas
2012-10-12 00:00:00,Nucor Stock Rating Reaffirmed by Jefferies Group
2012-10-31 00:00:00,Buy Nucor For The Long Dividend Yield Is As Solid As Steel
2012-11-06 00:00:00,Nucor Corp Signs Deal To Develop Natural Gas Wells With Encana
