2010-12-16 00:00:00,Nucor Corporation Issues Q4 2010 EPS Guidance Below Estimates
2011-01-03 00:00:00,Nucor Corporation Announces Appointment Of President
2011-06-07 00:00:00,Nucor Corporation Declares Quarterly Cash Dividend
2011-09-07 00:00:00,Nucor Corporation Announces Quarterly Cash Dividend
2011-09-15 00:00:00,Nucor Corporation Issues Q3 2011 EPS Guidance Below Estimates
2011-10-20 00:00:00,Nucor Corporation Comments On Q4 2011 Earnings Call
2012-01-26 00:00:00,Nucor Corporation Issues Q1 2012 EPS Guidance
2012-06-05 00:00:00,Nucor Corporation Announces Cash Dividend
2012-09-11 00:00:00,Nucor Corp Announces Cash Dividend
2012-10-09 00:00:00,VTB Capital Starts Stock Coverage on Nucor
2012-10-16 00:00:00,NUE Crosses Above Key Moving Average Level
2012-10-17 00:00:00,Earnings Report for October 2012 BAX
2012-10-18 00:00:00,NUCOR CORPORATION Nucor Reports Results For Third Quarter And First
2012-10-22 00:00:00,Block Trading and Options Highlights for Nucor Corporation
2012-11-01 00:00:00,Zacks Reiterates Neutral on Nucor
2012-11-06 00:00:00,Nucor Corp Signs Deal To Develop Natural Gas Wells With Encana
