2010-12-16 00:00:00,The News Myspace and Renew and Expand Search and Advertising Agreement
2011-01-25 00:00:00,The News Response To Statement By Secretary Of State For Media And Sport Regarding Acquisition Of Shares In British Sky Broadcasting Group plc
2011-02-02 00:00:00,The News Corporation Declares Dividend
2011-02-09 00:00:00,The News News America Incorporated Prices Issue of Billion of New Debt
2011-02-23 00:00:00,The News FOX News Channel Renews Agreement With Cablevision Systems
2011-04-06 00:00:00,Prescott Calls For Delay To The News British Sky Broadcasting Group plc
2011-05-03 00:00:00,The News EXOR SpA Look For Partners For Formula 1
2011-05-09 00:00:00,The News Takeover Bid For British Sky Broadcasting Group plc Hit By
2011-05-11 00:00:00,The News Corporation Ups Stake In Rotana For
2011-06-10 00:00:00,Activision Blizzard In Final Talks To Buy Out The News
2011-06-22 00:00:00,Ofcom Report Brings The News Sky Broadcasting Group Nod
2011-07-01 00:00:00,Owned By The Walt Disney The News Comcast NBC Universal And Providence Equity Starts Sales Pitching To A Dozen
2011-07-21 00:00:00,Levi Korsinsky Notifies Investors With Losses on Their Investment in The News Corporation of Class Action Lawsuit
2011-08-09 00:00:00,Hagens Berman Files Lawsuit Against Apple News HarperCollins Pearson Penguin Group And CBS Simon Schuster
2011-09-29 00:00:00,The CME The News Corporation Eye Indexes
2012-05-21 00:00:00,The News Murdoch Denies Planning To Spin Off UK
2012-09-07 00:00:00,Consolidated Media Holdings Ltd Agrees To Back Revised Takeover Offer From The News
2012-09-11 00:00:00,News News America Inc Prices Issue of Billion of New Debt
2012-10-31 00:00:00,News Corp Seals Billion Consolidated Media Holding Limited Takeover
2012-11-02 00:00:00,Forbes Earnings News
2012-11-05 00:00:00,Hold Get Long News Despite Rupert
2012-11-08 00:00:00,News Subsidiary Completes Acquisition Of ESPN STAR Sports
