2010-11-23 00:00:00,The News STAR Launches Seven Channels On Bell Fibe TV
2010-12-02 00:00:00,EU Extends Deadline For The News British Sky Broadcasting Group
2010-12-21 00:00:00,The News Corporation Wins EU Approval For British Sky Broadcasting Group plc
2011-03-08 00:00:00,The News COO Says GBP7 Is Still Fair Price For British Sky Broadcasting Group
2011-03-11 00:00:00,The News Corporation Sees Paying Over For Prized British Sky Broadcasting Group
2011-03-29 00:00:00,New Delhi Television And The News Star India Enter Into Pact For Advertising
2011-04-27 00:00:00,The News Corporation Seeks Myspace Bids Over Standard
2011-06-28 00:00:00,The News Corporation Close To Selling
2011-06-30 00:00:00,The News Corporation Will Continue To Engage Constructively With Regulatory Process For British Sky Broadcasting Group plc
2011-07-20 00:00:00,Abbey Spanier Rodd LLP Commences Lawsuit on Behalf of Investors Of The News Corporation
2011-07-22 00:00:00,The News Corporation Completes Sale Of News Outdoor Russia And News Outdoor Romania
2011-07-28 00:00:00,Brower Piven Announces Investigation Against The News Corporation
2011-08-24 00:00:00,The News Walt Disney And JV Hulu Seen Drawing Bids From
2011-09-19 00:00:00,The News News International To Pay GBP3 Million To Settle Hacking
2011-10-13 00:00:00,Hulu Equity News Corporation and The Walt Disney Announce Decision to Terminate Hulu Sale Process
2011-11-22 00:00:00,Australian Police Investigate Australian Arm Of The News
2011-11-23 00:00:00,The News Australian Arm Denies Improper
2011-12-23 00:00:00,The News Corporation Announces Stock Repurchase Program
2012-02-21 00:00:00,Rentrak Corporation Signs TV Measurement Contract with News Corp Star LLC
2012-06-19 00:00:00,The News News Limited Announces Proposal To Acquire Consolidated Media Holdings Limited
2012-06-20 00:00:00,The News Corporation Cuts Jobs In
2012-07-24 00:00:00,Cisco Systems Inc Wins EU Approval For billion NDS Acquisition From News Corp And
