2011-01-18 00:00:00,Reaffirms FY 2010 Net Profit Issues FY 2011 Net Profit Guidance In Line With Estimates
2011-01-19 00:00:00,Increases Quarterly Dividend
2011-04-19 00:00:00,Declares Quarterly Dividend
2011-07-20 00:00:00,Announces Quarterly Dividend Increase
2011-08-02 00:00:00,Lowers High End Of Prior FY 2011 Net Income Guidance To A Range In Line With Estimates
2011-12-01 00:00:00,To Sell Retail Natural Gas Marketing Subsidiary To Constellation Energy
2012-01-19 00:00:00,Raises Low End Of Prior FY 2011 Earnings Guidance To A Range Above Estimates
2012-01-23 00:00:00,Announces Million Notes Offering
2012-07-25 00:00:00,Oneok Inc Increases Quarterly Dividend
2012-10-10 00:00:00,The New Energy How To Play It From Here
2012-10-19 00:00:00,Stochastic Issues Buy Signal for OKE
2012-10-25 00:00:00,Oneok Third Quarter Earnings Sneak Peek
2012-10-26 00:00:00,NL Dividend Stocks Update
