2010-12-10 00:00:00,Omnicom Group Declares Dividend
2011-04-12 00:00:00,Omnicom Group Ketchum Acquires Sampark PR
2012-03-08 00:00:00,Omnicom Group Announces Agreement With Itochu Corp To Acquire Majority Stake In Medical Collective Intelligence
2012-05-24 00:00:00,Omnicom Group DDB Worldwide Announces Acquisition Of
2012-06-28 00:00:00,Asia Digital Holdings plc Completes Disposal Of Selected Assets Of DGM Asia Pacific Pte Ltd To Omnicom Flow Digital Pte Limited
2012-08-07 00:00:00,Omnicom Group Prices Offering of Million Senior Notes With Effective Yield of
2012-10-10 00:00:00,OMNICOM GROUP Lainey Canevaro Joins Ketchum as Midwest Brand
2012-10-11 00:00:00,Forbes Earnings Omnicom Group
2012-11-06 00:00:00,Indicated Dividend Yield Ranking for the 500 by Industry
