2010-12-14 00:00:00,Myriad Group AG Files Lawsuit Against Oracle America
2010-12-16 00:00:00,Oracle Corporation Declares Dividend
2010-12-29 00:00:00,Judge Orders SAP AG To Pay Interest On Award In Oracle Corporation
2011-01-04 00:00:00,Oracle Corporation Announces Advance Auto Parts Accelerates Business Transformation With Oracle Retail Merchandising
2011-01-05 00:00:00,Oracle Corporation Announces Belgian Federal Service Bus Platform Powered By Oracle WebLogic Server And Oracle SOA Suite
2011-01-06 00:00:00,National Instruments Upgrades To Oracle Suite
2011-01-18 00:00:00,Oracle Corporation Announces Inova Health System Selects Oracle Health Sciences Solutions As The IT Foundation For Personalized
2011-01-25 00:00:00,Oracle Corporation Announces Hyundai Securities Improves Customer Services With Real Time Data Integration Using Oracle GoldenGate
2011-01-27 00:00:00,Green Mountain Power Selects Oracle Corporation Utilities Solutions To Improve Customer Service And Support Smart Grid Initiatives
2011-01-31 00:00:00,WealthEngine Selects Oracle Exadata To Advance Prospect Research Services
2011-02-01 00:00:00,Fitness First Australia Implements Oracle Oracle Business Intelligence 11g
2011-02-07 00:00:00,Atos Origin SA and Oracle Corporation to Collaborate on Digital Content Management
2011-02-09 00:00:00,Fujitsu Limited and Oracle Corporation Strengthen Relationship
2011-02-14 00:00:00,F5 Joins With Oracle Corporation To Offer Enhanced Security For Database Applications
2011-03-24 00:00:00,Oracle Corporation Declares Quarterly Cash Dividend
2011-03-29 00:00:00,Oracle Corporation Announces Bank of the Lao PDR Selects Oracle FLEXCUBE Universal Banking To Modernize Operations
2011-04-13 00:00:00,Massimo Zanetti Beverage USA Improves Enterprise Supply Chain Visibility And Efficiency With Oracle Corporation
2011-04-14 00:00:00,Helm Bank Selects Oracle software And Hardware
2011-04-18 00:00:00,KT Selects Oracle Oracle Communications Solutions For Service Delivery Platform And Operational
2011-04-19 00:00:00,BMC Software Implements Oracle SPARC Enterprise Servers With Oracle Solaris
2011-04-20 00:00:00,Transplace Selects Oracle Exadata Database Machine To Deliver Logistics Intelligence
2011-04-25 00:00:00,PHH Corporation Selects Oracle Oracle Exalogic Elastic Cloud And Oracle Exadata Database Machine
2011-04-27 00:00:00,Sony Ericsson Selects Oracle Siebel CRM as Part of Its Global Customer Experience Management Strategy
2011-04-28 00:00:00,healthAlliance Selects Oracle Oracle Exadata To Deliver Shared Services Platform
2011-05-10 00:00:00,Tectia Oyj Enterprise Security Software Solutions Certified to Work with Oracle Oracle Linux
2011-05-11 00:00:00,Oracle Corporation Planning To Exit Software Services Times Of India
2011-06-21 00:00:00,Cognizant Technology Solutions Cap Gemini SA Chasing Oracle Corporation To Buy India Unit Services Business of Oracle Financial Services Software
2011-06-28 00:00:00,Oracle Corporation Secures Contract
2011-06-29 00:00:00,Oracle Corporation Secures Contract
2011-06-30 00:00:00,Oracle Corporation Fires New Salvo Against
2011-07-07 00:00:00,Oracle Corporation Secures Contract
2011-07-13 00:00:00,SAP AG Seeks To Cut Billion Oracle Corporation
2011-07-22 00:00:00,US Judge Rejects Oracle Corporation Damages Estimate Against Google
2011-08-30 00:00:00,Oracle Corporation Brings New Claims Against Company In Itanium
2011-08-31 00:00:00,Probes Oracle Ties With Governments In
2011-09-01 00:00:00,Judge Rejects Oracle Corporation Billion Verdict Against
2011-09-13 00:00:00,SAP AG To Pay Million In Oracle Corporation Crim
2011-09-20 00:00:00,Oracle Corporation Declares Dividend
2011-09-21 00:00:00,Google Spurns Oracle Corporation Billion Android Damage
2011-09-22 00:00:00,Inogen Selects Oracle Corporation To Transform Customer Experiences
2011-09-26 00:00:00,Canon and Oracle Corporation Join Forces to Integrate Imaging Technologies With Oracle
2011-10-18 00:00:00,Burns McDonnell Implements Oracle Primavera Enterprise Project Portfolio Management Solutions for Billion
2011-10-19 00:00:00,Trial postponed In Oracle Corporation Patent Suit Versus Google
2011-10-24 00:00:00,Oracle Corporation To Buy RightNow In Deal Valuing At
2011-11-08 00:00:00,Oracle Corporation And Others Likely To Be Interested In webOS
2012-01-18 00:00:00,City of Long Beach Selects Oracle Oracle Utilities Solutions To Deploy Billing System
2012-01-31 00:00:00,Ambow Education Holding Ltd Announces Partnership With Oracle Corporation To Provide Workforce Development Program
2012-02-07 00:00:00,Oracle Corporation Seeks New Trial Against SAP AG Over
2012-02-09 00:00:00,Bernstein Liebhard LLP Announces Investigation Of Acquisition Of Taleo Corporation By Oracle Corporation
2012-04-05 00:00:00,USC Shoah Foundation Institute Selects Oracle StorageTek Tape Drives
2012-04-17 00:00:00,Swift Transportation Selects Oracle Oracle Transportation Management
2012-04-19 00:00:00,HyperCITY Retail India Ltd Leverages Oracle Oracle Retail Stores Applications To Optimize Store Operations And Enhance Customer Experience
2012-04-30 00:00:00,Charming Shoppes Selects Oracle Oracle Retail Merchandising And Store Applications To Drive Growth
2012-05-03 00:00:00,Oracle Attorney Rules Out Settlement With
2012-06-05 00:00:00,Oracle Corporation Buys Collective Intellect
2012-06-18 00:00:00,Oracle Corporation Comments On Q1 2013 Revenue Issues Q1 2013 EPS Guidance In Line With Call
2012-06-26 00:00:00,SGS Life Science Services Selects Oracle Oracle Health Sciences LabPas to Accelerate Phase I Clinical Trial
2012-07-19 00:00:00,Oracle Corporation To Acquire Skire
2012-07-30 00:00:00,Oracle Corporation Enters Into Agreement To Acquire Xsigo Systems
2012-08-01 00:00:00,Hewlett Packard Co Wins Court Ruling In Itanium Litigation With Oracle Corp
2012-08-06 00:00:00,Oracle Corporation Secures Contract
2012-08-08 00:00:00,Judge In Google Oracle Corporation Case Seeks Names Of Paid
2012-08-17 00:00:00,Oracle Corp Settles SEC Charges Over Secret India Reuters
2012-09-06 00:00:00,Oracle Inc Judge Ends Probe Into Paid
2012-09-17 00:00:00,Oracle Corp Enters Into Agreement To Acquire Selectminds
2012-09-20 00:00:00,Oracle Corp Comments On Q2 2013 Revenue Issues Q2 2013 EPS Guidance In Line With Call
2012-10-16 00:00:00,Customer Survey Creates Positive Expectations for Oracle Earnings
2012-10-31 00:00:00,Adventist Health System Selects Oracle Corp for New Enterprise Resource Planning and Enterprise Performance Management Environment
2012-11-01 00:00:00,Oracle Is Well Positioned For Solid Upside
2012-11-05 00:00:00,US Stocks Near High over Strong Jobs Data
