2011-09-14 00:00:00,Announces Proposed Offering of Million of Senior Notes Due 2021
2011-11-16 00:00:00,Announces Additional Million Share Repurchase Authorization
2012-08-10 00:00:00,Automotive Inc Announces Additional Million Share Repurchase Authorization
2012-08-16 00:00:00,Automotive Inc Announces Proposed Offering Of Million Of Senior Notes Due 2022
2012-10-26 00:00:00,Automotive Earnings Call CSK DIY Side
2012-11-02 00:00:00,Advance Auto Parts Mulling Over Possible Sale to Private Equity
2012-11-05 00:00:00,Top 4 Stocks In The Auto Parts Stores Industry With The Highest Cash
