2010-11-16 00:00:00,LSB Corporation Receives Final Regulatory Approval For Acquisition By United
2011-01-20 00:00:00,United Announces to Acquire Danvers
2011-02-23 00:00:00,United Names Kirk Walters As Chief Financial Officer
2012-04-19 00:00:00,United Announces Dividend Increase
2012-06-25 00:00:00,United United Bank Completes Acquisition Of 57 Branches In Metro New York Area
2012-10-15 00:00:00,Webster Profit Surges in 3Q over Higher Loans and Deposits
2012-10-18 00:00:00,United Financial Inc Declares Quarterly Dividend
2012-11-02 00:00:00,After Hours Most Active for Nov 2012 COP
