2010-11-12 00:00:00,Precision Castparts Declares Dividend
2011-02-18 00:00:00,Precision Castparts Declares Dividend
2011-09-20 00:00:00,Tenaris and Precision Castparts PCC Energy Group Sign Contract With Saudi Aramco
2012-05-07 00:00:00,Precision Castparts Announces Acquisition Of Centra Industries
2012-05-25 00:00:00,Precision Castparts Declares Dividend
2012-07-17 00:00:00,Precision Castparts Broadens Machining Capabilities With Acquisition Of Businesses From Inc
2012-08-31 00:00:00,Heroux Devtek Inc Completes Sale Of Substantially All Aerostructure And Industrial Products Operations To Precision Castparts Corp
2012-10-10 00:00:00,Precision Castparts Sets Second Quarter Fiscal 2013 Earnings Release
2012-10-19 00:00:00,Stock Ratings Reiterations for 19th DKS
