2011-02-18 00:00:00,Precision Castparts Declares Dividend
2011-05-05 00:00:00,Precision Castparts Announces Acquisition of Assets Of PB Fasteners
2011-05-26 00:00:00,Precision Castparts Declares Dividend
2011-06-14 00:00:00,Precision Castparts Announces Acquisition Of Rings Operations
2011-06-21 00:00:00,Precision Castparts To Acquire KLAD Manufacturing And Assets Of Rollmet Business From Rockwell Collins Inc
2011-09-20 00:00:00,Tenaris and Precision Castparts PCC Energy Group Sign Contract With Saudi Aramco
2012-03-08 00:00:00,Precision Castparts Acquires LLC
2012-07-02 00:00:00,Precision Castparts Broadens Aerostructures Capabilities With the Acquisition Of Klune Industries
2012-07-17 00:00:00,Precision Castparts Broadens Machining Capabilities With Acquisition Of Businesses From Inc
2012-08-15 00:00:00,Precision Castparts Corp Declares Dividend
2012-10-08 00:00:00,Precision Castparts Corp Announces Acquisition Of Texas
2012-10-09 00:00:00,UTC Aerospace Achieves Milestone Analyst Blog
2012-10-15 00:00:00,Precision Castparts Breaks Above Moving Average Bullish for PCP
2012-10-16 00:00:00,Jefferies Group Reiterates hold on Precision Castparts
2012-10-19 00:00:00,Stock Ratings Reiterations for 19th DKS
2012-10-22 00:00:00,Precision Castparts Second Quarter Earnings Sneak Peek
2012-10-25 00:00:00,Precision Castparts Q3 Profit Increases Quick Facts
2012-10-26 00:00:00,Equities Research Price Target Changes for 26th ASGN
