2011-02-22 00:00:00,Public Service Enterprise Group Issues FY 2011 Earnings Guidance Below Estimates
2011-07-19 00:00:00,Public Service Enterprise Group Declares Quarterly Dividend
2011-07-22 00:00:00,Public Service Enterprise Group Roseton LLC and Danskammer LLC Files Suit Against Dynegy
2012-04-17 00:00:00,Public Service Enterprise Group Declares Quarterly Dividend
2012-09-19 00:00:00,Public Service Enterprise Group Inc Reaffirms FY 2012 EPS Call
2012-10-31 00:00:00,PUBLIC SERVICE ENTERPRISE GROUP PSEG a Repair
