2010-12-01 00:00:00,Principal Financial Group Issues FY 2011 Guidance In Line With Estimates
2011-03-02 00:00:00,Principal Financial Group Announces Preferred Dividend
2011-05-04 00:00:00,Principal Financial Group Issues FY 2011 Revenue Guidance Above Raises H2 2011 EPS Call
2011-10-27 00:00:00,Principal Financial Group Issues FY 2011 Revenue Guidance In Line With Estimates
2011-10-28 00:00:00,Principal Financial Group Announces Preferred Dividend
2011-12-01 00:00:00,Principal Financial Group Reaffirms FY 2012 EPS Call
2012-05-22 00:00:00,Principal Financial Group Announces New Authorization Of Share Repurchase Program
2012-05-23 00:00:00,Principal Financial Group Announces Preferred Dividend
2012-10-09 00:00:00,Morning Market NFLX
2012-10-11 00:00:00,Evercore Partners Lowers Principal Financial Group to Equal Weight
2012-10-19 00:00:00,Pacific Century Group to Buy Asian Business Unit for
2012-10-25 00:00:00,Principal Financial Group Inc Announces Preferred Dividend
2012-10-26 00:00:00,Daily Dividend JBHT
2012-10-31 00:00:00,Equity Ratings Changes for October PFG
