2011-09-09 00:00:00,Hagens Berman LLP Investigating Home Building Companies Over Potential Violations of Fair Labor Standards Act Including
2012-10-18 00:00:00,Industrial PulteGroup Rallies on Housing Textron
2012-10-19 00:00:00,500 Weekly Gain Trimmed as Tech Slump Tempers Economy
2012-10-22 00:00:00,PulteGroup Third Quarter Earnings Sneak Peek
2012-10-23 00:00:00,PulteGroup Options Sellers Pile on Ahead of Earnings
2012-10-24 00:00:00,PulteGroup Stock Rating Reaffirmed by Deutsche Bank
2012-10-26 00:00:00,Top Losers in
2012-11-01 00:00:00,PulteGroup Investment Recent Ratings Updates
