2010-11-09 00:00:00,Pall Corporation Reaffirms FY 2011 EPS Call
2010-11-11 00:00:00,Pall Corporation Launches New Filtration Modeling System to Optimize Biofuels Processes
2011-04-21 00:00:00,Pall Corporation Board of Directors Declares Dividend
2011-06-27 00:00:00,Pall Corporation Announces New GeneDisc Cycler
2011-09-26 00:00:00,Pall Corporation Declares Dividend
2011-12-19 00:00:00,Pall Corporation Signs Agreement to Acquire
2012-08-15 00:00:00,Pall Corp Secures Contract to Design Water Treatment System for Navy
2012-10-09 00:00:00,Pall Partners with Carson Helicopters on Sea King Engine Upgrade
2012-10-12 00:00:00,Pall Stock Rating Reaffirmed by Macquarie
2012-10-25 00:00:00,Pall to Present at Baird 2012 Industrial Conference
