2011-01-06 00:00:00,PNC Financial Services Declares Dividend Of On Common Stock
2011-01-31 00:00:00,BankAtlantic BankAtlantic Agrees To Sell 19 Tampa Branches To PNC Financial Services Group PNC Bank
2011-03-18 00:00:00,PNC Financial Services Receives No Objection From Regulators To Raise Common Stock Dividend
2011-04-07 00:00:00,PNC Financial Services Raises Common Stock Dividend By To Per Confirms Existing 25 Million Share Repurchase Program
2011-04-18 00:00:00,BankAtlantic Receives Regulatory Approval For Sale Of 19 Tampa Branches To PNC Financial Services Group PNC
2011-06-06 00:00:00,BankAtlantic BankAtlantic Completes the Sale of its 19 Tampa Branches To PNC Financial Services Group PNC Bank
2011-06-17 00:00:00,Royal Bank of Canada Near Sale Of US Unit To The PNC Financial Services
2011-06-20 00:00:00,The PNC Financial Services Signs Agreement With Royal Bank of Canada To Acquire RBC Bank
2012-10-04 00:00:00,PNC Financial Services Group Inc Declares Dividend Of On Common Stock
2012-10-16 00:00:00,PNC Financial ratings unaffected by Q3 results
2012-10-17 00:00:00,PNC Financial Services Quarterly Earnings Sneak Peek
2012-10-18 00:00:00,PNC Financial Services Investment Weekly Ratings Changes
2012-10-25 00:00:00,PNC Financial Services Research Weekly Ratings Changes
