2011-03-23 00:00:00,Pioneer Natural Resources Company Lowers Q1 2011 Production Guidance
2011-05-16 00:00:00,OMV AG Acquires Additional Stake in Petrol Ofisi and Two Tunisian Exploration and Production Subsidiaries from Pioneer Natural Resources
2011-08-26 00:00:00,Pioneer Natural Resources Company Declares Dividend On Common Shares
2011-12-12 00:00:00,Pioneer Natural Resources Company And Pioneer Southwest Energy Partners Announce Public Offering Of Common Units
2012-02-23 00:00:00,Pioneer Natural Resources Company Declares Dividend On Common Shares
2012-07-18 00:00:00,Pioneer Natural Resources Company Issues Q2 2012 Production Guidance
2012-07-31 00:00:00,Pioneer Natural Resources Company Q3 2012 Production Guidance
2012-08-20 00:00:00,Pioneer Natural Resources Co Announces Closing Of Sale Of South Africa Business To Petrosa For Million
2012-08-23 00:00:00,Pioneer Natural Resources Co Declares Dividend on Common Shares
2012-10-10 00:00:00,Critical Alerts For Las Vegas Pioneer Natural Peabody
2012-10-19 00:00:00,Natural Gas Outlook Ahead of Q3 Earnings
2012-10-26 00:00:00,Forbes Earnings Pioneer Natural Resources
