2011-03-08 00:00:00,QUALCOMM Announces Quarterly Dividend
2011-03-17 00:00:00,Bharti Airtel Limited To Buy Qualcomm Broadband Wireless Licenses For
2011-04-12 00:00:00,QUALCOMM Announces Self Quality Care Project To Benefit Chronic Disease Patients In Korea
2011-04-13 00:00:00,QUALCOMM And ZOOM Sign WCDMA Subscriber Unit License Agreement
2011-05-24 00:00:00,QUALCOMM Completes Billion Acquisition Of Atheros Communications
2011-06-10 00:00:00,QUALCOMM To Acquire Assets Of Rapid Bridge LLC
2011-07-25 00:00:00,QUALCOMM Acquires Gesture Recognition Assets From GestureTek
2011-08-17 00:00:00,Apple Nokia QUALCOMM And Others Eye
2011-11-02 00:00:00,QUALCOMM Issues Q1 2012 Guidance Above Issues FY 2012 Revenue Guidance Above Estimates
2011-12-05 00:00:00,QUALCOMM Forms Qualcomm Life Subsidiary To Deliver Comprehensive Wireless Solutions For Medical Devices
2011-12-06 00:00:00,AirStrip Technologies Announces Home Health Collaboration With QUALCOMM Qualcomm Life
2012-03-06 00:00:00,QUALCOMM Increases Quarterly Dividend By And Announces New Billion Stock Repurchase Program
2012-04-18 00:00:00,QUALCOMM Issues Q3 2012 EPS Guidance Below Raises FY 2012 Guidance
2012-04-23 00:00:00,Imagination Technologies Group plc Signs License Agreement With Qualcomm Incorporated
2012-05-16 00:00:00,Bharti Airtel Limited In Talks For Stake In QUALCOMM India
2012-05-24 00:00:00,Bharti Airtel Limited To Buy In Qualcomm India Broadband
2012-06-18 00:00:00,QUALCOMM Acquires Summit Microelectronics
2012-06-27 00:00:00,QUALCOMM And Akamai Collaborates To Optimize Mobile Page Loads
2012-07-06 00:00:00,QUALCOMM Declares Quarterly Cash Dividend
2012-10-08 00:00:00,Weekly Top Insider and GOOG
2012-10-10 00:00:00,Qualcomm Inc And Semp Toshiba Sign License Agreement
2012-10-11 00:00:00,QCOM Inks Deal with Semp Toshiba Analyst Blog
2012-10-17 00:00:00,Qualcomm Inc Declares Quarterly Cash Dividend
2012-10-18 00:00:00,Unit Intros New AV2 Chip Analyst Blog
2012-10-22 00:00:00,Subsidiary Announces Collaborations with
2012-10-24 00:00:00,Still Neutral on Qualcomm Analyst Blog
2012-10-26 00:00:00,QUALCOMM Traders Hope for a Boost
2012-11-02 00:00:00,Maxis Joins Cherie Blair Foundation for Women and the Foundation
