2011-01-14 00:00:00,Reynolds To Sell Limited To Scandinavian Tobacco Group
2011-02-03 00:00:00,Reynolds Issues FY 2011 EPS Guidance In Line With Estimates
2011-04-21 00:00:00,Reynolds Reaffirms FY 2011 EPS Call
2011-07-22 00:00:00,Reynolds Raises Low End Of Prior FY 2011 EPS Guidance To A Range In Line With Call
2011-08-16 00:00:00,Cigarette Makers Including Reynolds Unit Sue FDA Over New Labeling
2011-10-25 00:00:00,Reynolds Announces Increase In Quarterly
2012-02-08 00:00:00,Reynolds Comments On FY 2012 EPS Guidance
2012-04-24 00:00:00,Reynolds Reaffirms FY 2012 EPS Call
2012-07-24 00:00:00,Reynolds Reaffirms FY 2012 EPS Call
2012-09-05 00:00:00,Reynolds American Inc Reaffirms FY 2012 EPS Call
2012-10-10 00:00:00,Reynolds American Breaks Below Moving Average Notable for RAI
2012-10-18 00:00:00,Forbes Earnings Reynolds American
2012-10-23 00:00:00,Reynolds American Inc Reaffirms FY 2012 EPS Guidance
2012-10-24 00:00:00,Marathon Oil Lead Billion Bond Sale
