2011-02-01 00:00:00,Rowan LeTourneau Secures Significant Order For 15 Wheel Loaders
2011-02-25 00:00:00,Rowan Issues FY 2011 Revenue Call
2011-05-03 00:00:00,Rowan Reaffirms FY 2011 Revenue Call
2011-05-16 00:00:00,Joy Global Announces Acquisition Of LeTourneau From Rowan
2011-07-20 00:00:00,Ensign Energy Services To Buy Rowan Land Drilling Division For
2011-11-01 00:00:00,Rowan Expands Share Repurchase Program
2012-02-28 00:00:00,Rowan Issues Q1 2012 Revenue Guidance In Line With Call
2012-04-12 00:00:00,Rowan Updates Timing Of Change In Corporate Structure
2012-10-18 00:00:00,Rowan Companies Shares Cross Above 200 DMA
2012-10-31 00:00:00,Analyst Estimates for US Earnings Wednesday
2012-11-01 00:00:00,Head and Shoulders Inverse Pattern Formed on These Stocks on
2012-11-02 00:00:00,Equity Ratings Changes for November SAM
