2011-01-26 00:00:00,Robert Half International Issues Q1 2011 Revenue Above Call
2011-02-09 00:00:00,Robert Half International Announces Quarterly Dividend
2011-05-04 00:00:00,Robert Half International Announces Quarterly Dividend
2011-07-27 00:00:00,Robert Half International Announces Quarterly Dividend
2012-01-26 00:00:00,Robert Half International Issues Q1 2012 Guidance In Line With Call
2012-07-25 00:00:00,Robert Half International Issues Q3 2012 Guidance In Line With Call
2012-10-22 00:00:00,Zacks Gives Neutral Rating to Robert Half
2012-10-24 00:00:00,SolarWinds Moves Up In Market Cap Passing Robert Half International
2012-11-02 00:00:00,The Zacks Analyst Blog Kelly Robert Half
2012-11-05 00:00:00,ROBERT HALF INTERNATIONAL Protiviti IT Audit Study Analyzes Gaps in
