2011-07-21 00:00:00,Robert Half International Issues Q3 2011 Guidance In Line With Call
2011-10-26 00:00:00,Robert Half International Issues Q4 2011 Guidance In Line With Call
2011-11-02 00:00:00,Robert Half International Announces Quarterly Dividend
2012-04-24 00:00:00,Robert Half International Issues Q2 2012 Guidance In Line With Call
2012-05-02 00:00:00,Robert Half International Announces Quarterly Dividend
2012-10-11 00:00:00,Robert Half International Announces Schedule For Earnings
2012-10-15 00:00:00,Forbes Earnings Robert Half International
2012-10-18 00:00:00,Earnings Report for October 2012 SNDK
2012-10-19 00:00:00,US HOT Microsoft
2012-10-23 00:00:00,Call the IT department where the jobs are
2012-10-25 00:00:00,ROBERT HALF INTERNATIONAL Protiviti Named in Magic
2012-10-31 00:00:00,Use salary guides to assess job worth
2012-11-06 00:00:00,Indicated Dividend Yield Ranking for the 500 by Industry
