2011-04-27 00:00:00,Range Resources Issues Q2 2011 Production Call
2011-05-02 00:00:00,Range Resources Closes Barnett Property Sale
2011-05-11 00:00:00,Range Resources Announces Offering Of Senior Subordinated Notes
2011-06-07 00:00:00,Range Resources Declares Quarterly Dividend
2011-08-18 00:00:00,New York Subpoenas Energy Companies Including Range Resources Over Gas Well
2012-06-01 00:00:00,Range Resources Corp Declares Quarterly Dividend
2012-07-24 00:00:00,Range Resources Corp Issues Q3 2012 Production Raises FY 2012 Production Guidance
2012-09-04 00:00:00,Range Resources Corp Declares Quarterly Dividend
2012-10-12 00:00:00,Top NYSE Movers Teekay Dean Foods
2012-10-24 00:00:00,advisories and surprises
2012-10-26 00:00:00,Range Resources Corporation Stock Downgraded
2012-10-31 00:00:00,Stephens Cuts Range Resources to Equal Weight
2012-11-02 00:00:00,Research Weekly Ratings Changes for Range Resources
2012-11-06 00:00:00,Indicated Dividend Yield Ranking for the 500 by Industry
