2011-02-28 00:00:00,Range Resources Announces Barnett Property Sale
2011-03-01 00:00:00,Range Resources Declares Quarterly Dividend
2011-05-02 00:00:00,Range Resources Closes Barnett Property Sale
2011-05-11 00:00:00,Range Resources Announces Offering Of Senior Subordinated Notes
2011-06-27 00:00:00,Range Resources Announces CEO Transition Plan
2011-08-18 00:00:00,New York Subpoenas Energy Companies Including Range Resources Over Gas Well
2011-10-25 00:00:00,Range Resources Issues Q4 2011 Production Guidance
2011-12-01 00:00:00,Range Resources Declares Quarterly Dividend
2012-06-01 00:00:00,Range Resources Corp Declares Quarterly Dividend
2012-07-24 00:00:00,Range Resources Corp Issues Q3 2012 Production Raises FY 2012 Production Guidance
2012-10-12 00:00:00,Top NYSE Movers Teekay Dean Foods
2012-10-15 00:00:00,Insiders Sold These Stocks on
2012-10-19 00:00:00,Range Resources Corporation Options Trading Review
2012-10-22 00:00:00,Top Insider Sells of the and IRM
2012-10-24 00:00:00,advisories and surprises
2012-10-25 00:00:00,Monster Beverage Defends Energy Drink
2012-10-26 00:00:00,Range Resources Corporation Stock Downgraded
2012-10-31 00:00:00,Stephens Cuts Range Resources to Equal Weight
2012-11-02 00:00:00,Research Weekly Ratings Changes for Range Resources
