2010-11-23 00:00:00,Donnelley Sons Company Receives Notification From Federal Trade Commission Regarding Acquisition Of Bowne
2011-01-25 00:00:00,Donnelley Sons Company Secures Customer Communications Management Contract
2011-02-18 00:00:00,Donnelley Sons Company Receives New Dollar Magazine Production Agreement From Bauer Publishing Group
2011-05-17 00:00:00,Donnelley Sons Company Prices Million Debt Offering
2012-07-19 00:00:00,Donnelley Sons Company Declares Quarterly Dividend
2012-10-24 00:00:00,Donnelley Sons Co Declares Quarterly Dividend
2012-11-05 00:00:00,Donnelley Sons Co Secures Agreement by AARP
