2011-03-08 00:00:00,Republic Reaffirms FY 2011 EPS Call
2011-04-28 00:00:00,Republic Declares Quarterly Dividend
2011-05-02 00:00:00,Republic To Sell Debt Deal
2011-08-15 00:00:00,Republic Authorizes Million For Stock Repurchases
2011-10-27 00:00:00,Republic Declared Quarterly Dividend
2012-04-26 00:00:00,Republic Announces Future Retirement Of Tod Holmes As Chief Financial Declares Regular Quarterly Dividend
2012-10-17 00:00:00,RSG Crosses Above Key Moving Average Level
2012-10-25 00:00:00,US Airways beat stock market droop
2012-11-05 00:00:00,Zacks Reaffirms Underperform Rating on Republic Services
