2011-01-13 00:00:00,Tata Coffee Limited And Starbucks Sign MoU For Strategic Alliance in India
2011-06-02 00:00:00,Starbucks Acquires Full Ownership of Starbucks Stores in South Western China
2011-11-03 00:00:00,Starbucks Declares Cash Dividend
2012-06-04 00:00:00,Starbucks Coffee Company Announces Agreement To Acquire Bay LLC And La Boulange Bakery To Elevate Core Food Offerings And Artisanal Bakery Brand
2012-06-12 00:00:00,Starbucks Lowers FY 2012 EPS Raises Q4 2012 EPS Call
2012-10-16 00:00:00,Verismo Now in Stores Analyst Blog
2012-10-19 00:00:00,Starbucks Corp Opens Flagship Store In Mumbai In Joint Venture With Tata Global Beverages Limited
2012-10-25 00:00:00,Starbucks Time To Jump In Or
2012-10-31 00:00:00,Starbucks Corporation All Set To report Q4 Earnings On
2012-11-01 00:00:00,Starbucks Corp Declares Cash Reaffirms FY 2013 Revenue Raises FY 2013 EPS Outlook
