2010-11-18 00:00:00,The Smucker Company Reaffirms FY 2011 Revenue Raises FY 2011 EPS Call
2011-01-27 00:00:00,The Smucker Company Announces Dividend Increase And Additional Shares For Repurchase Authorized By Board Of Directors
2011-08-18 00:00:00,The Smucker Company Lowers FY 2012 Revenue Reaffirms FY 2012 EPS Guidance
2011-11-17 00:00:00,The Smucker Company Updates FY 2012 Revenue Lowers FY 2012 EPS Guidance
2012-01-03 00:00:00,The Smucker Company Completes Acquisition Of Majority Of Sara Lee North American Foodservice Coffee Business
2012-01-26 00:00:00,The Smucker Company Declares Authorizes Repurchase of Additional Shares
2012-02-16 00:00:00,The Smucker Company Lowers FY 2012 Guidance
2012-04-19 00:00:00,The Smucker Company Declares Dividend
2012-06-07 00:00:00,The Smucker Company Issues FY 2013 EPS Guidance Below Estimates
2012-10-08 00:00:00,Hilliard Lyons Starts JM Smucker as Stock Looks Fairly Valued
2012-10-09 00:00:00,JM Smucker Issues Update on Folgers Coffee Packaging Supply
2012-10-11 00:00:00,Kraft to sell Maxwell House for Keurig
2012-10-12 00:00:00,Kraft to sell Maxwell House cups for Keurig
2012-10-15 00:00:00,General Mills and Nestle May Cut Amount of Sugar and Salt in
2012-10-16 00:00:00,Dividends are an Important Part of your Investment Return SJM
2012-10-18 00:00:00,Peanut Supply Fears Are Eased by Record Crop
2012-10-22 00:00:00,THE SMUCKER COMPANY The Smucker Company Announces
2012-10-24 00:00:00,Smucker Co Declares Dividend
2012-10-26 00:00:00,Galleon Portfolio Manager Sentenced to 3 Years Probation for Insider
