2011-01-06 00:00:00,SanDisk SanDisk Modular SSD Selected By ASUS For New Eee Slate Tablet
2011-05-25 00:00:00,SanDisk Corporation Completes Acquisition Of Pliant
2011-06-23 00:00:00,SanDisk Corporation Eyes Manufacturing Base In Times
2011-07-21 00:00:00,SanDisk Corporation Issues Q3 2011 Revenue Raises Low End Of Prior FY 2011 Revenue Guidance To A Range In Line With Call
2011-10-20 00:00:00,SanDisk Corporation Issues Q4 2011 Revenue Guidance In Line With Reaffirms FY 2011 Revenue Call
2012-10-23 00:00:00,SanDisk Delivers Solid State Drive Technology for ASUS TAICHI
2012-10-24 00:00:00,SanDisk Appoints Drew Henry as Senior Vice OEM Marketing
2012-10-26 00:00:00,Affirms Rating on Sandisk Corp at Rating Outlook Stable
