2011-01-06 00:00:00,SanDisk SanDisk Modular SSD Selected By ASUS For New Eee Slate Tablet
2011-01-27 00:00:00,SanDisk Corporation Issues FY 2011 Revenue Guidance Above Call
2011-02-02 00:00:00,SanDisk Corporation Announces License Agreement With Imation Settles Patent Litigation
2011-02-14 00:00:00,SanDisk Corporation Secures Contract For New Iconia Tab Windows 7 Productivity Tablet
2011-02-24 00:00:00,SanDisk Corporation Comments On FY 2011 Profit Reaffirms FY 2011 Revenue Call
2011-04-21 00:00:00,SanDisk Corporation Issues Q2 2011 Revenue Guidance In Line With Reaffirms FY 2011 Revenue Call
2011-05-16 00:00:00,SanDisk Corporation Announces Agreement To Acquire Pliant
2011-05-25 00:00:00,SanDisk Corporation Completes Acquisition Of Pliant
2011-05-31 00:00:00,ASUS Selects SanDisk Solid State Drive For New Notebook
2011-06-23 00:00:00,SanDisk Corporation Eyes Manufacturing Base In Times
2011-07-21 00:00:00,SanDisk Corporation Issues Q3 2011 Revenue Raises Low End Of Prior FY 2011 Revenue Guidance To A Range In Line With Call
2011-10-20 00:00:00,SanDisk Corporation Issues Q4 2011 Revenue Guidance In Line With Reaffirms FY 2011 Revenue Call
2011-10-27 00:00:00,SanDisk Corporation Announces Million Stock Repurchase Program
2012-01-25 00:00:00,SanDisk Corporation Issues Q1 2012 Revenue Guidance Below Issues FY 2012 Revenue Guidance In Line With Call
2012-02-15 00:00:00,SanDisk Corporation And Diskeeper Announces Strategic Partnership To Improve Performance Of Client SSD Computing Applications
2012-06-26 00:00:00,SanDisk Corporation Acquires Enterprise Storage Software Maker Schooner Information Technology
2012-07-19 00:00:00,SanDisk Corporation Issues Q3 2012 Revenue Guidance In Line With Call
2012-08-21 00:00:00,Marvell Technology Group Ltd And SanDisk Corporation Announces Collaboration
2012-10-15 00:00:00,Mellanox and SanDisk set to beat estimates
2012-10-16 00:00:00,SANDISK CORPORATION SanDisk Appoints Drew Henry as Senior Vice
2012-10-19 00:00:00,Sandisk Corp Issues Q4 2012 Revenue Guidance In Line With Call
2012-11-01 00:00:00,Sanford Bernstein Reaffirms Outperform Rating on SanDisk
2012-11-06 00:00:00,Corp Files Patent Infringement Lawsuits Against Sandisk Grundig And Others
