2011-02-08 00:00:00,SunTrust Declares Quarterly Dividend
2011-03-18 00:00:00,SunTrust Announces Completion Of Its Comprehensive Capital Analysis And Commences Billion Common Stock Offering And Plans To Repurchase TARP Preferred Stock
2011-04-25 00:00:00,SunTrust Announces Chief Financial Officer Change
2011-06-16 00:00:00,Hagens Berman LLP Announces Investigation Of SunTrust
2011-06-24 00:00:00,Keller Rohrback Announces Class Action Complaint Filed Against SunTrust
2011-08-09 00:00:00,SunTrust Announces Increase in Common Stock Dividend
2011-11-08 00:00:00,SunTrust Declares Quarterly Dividend
2012-04-24 00:00:00,SunTrust Declares Quarterly Dividend
2012-08-14 00:00:00,Suntrust Banks Inc Declares Quarterly Dividend
2012-10-09 00:00:00,Capital One Target as Cyber Attacks Resume on US Banks
2012-10-11 00:00:00,APTRA Passport in Demand Analyst Blog
2012-10-31 00:00:00,Fitch Affirms Ratings of 14 Banks Analyst Blog
2012-11-05 00:00:00,Citigroup and JPMorgan Lowers mortgage rates
2012-11-06 00:00:00,Scots Money Managers Like Regional Banks Whether Obama or Romney
