2010-11-09 00:00:00,SunTrust Declares Quarterly Dividend
2011-02-08 00:00:00,SunTrust Declares Quarterly Dividend
2011-04-25 00:00:00,SunTrust Announces Chief Financial Officer Change
2011-04-26 00:00:00,SunTrust Declares Quarterly Dividend
2011-05-11 00:00:00,Keller Rohrback Announces Class Actions Filed in California Against SunTrust and Chase Home Finance LLC
2011-06-24 00:00:00,Keller Rohrback Announces Class Action Complaint Filed Against SunTrust
2011-07-26 00:00:00,FINRA Fines SunTrust Million For Alleged ARS
2011-11-08 00:00:00,SunTrust Declares Quarterly Dividend
2011-11-15 00:00:00,SunTrust Announces Management Change
2012-04-24 00:00:00,SunTrust Declares Quarterly Dividend
2012-08-14 00:00:00,Suntrust Banks Inc Declares Quarterly Dividend
2012-10-24 00:00:00,Financials bounce back after dip
2012-10-26 00:00:00,SEI Investments Co Expands Long Term Relationship With Suntrust Banks Inc
2012-10-31 00:00:00,Fitch Affirms Ratings of 14 Banks Analyst Blog
2012-11-02 00:00:00,Banks Split From Wall Street in DC Lobbying
2012-11-05 00:00:00,Citigroup and JPMorgan Lowers mortgage rates
2012-11-06 00:00:00,More SunTrust Plaza office space to hit downtown market
