2010-11-18 00:00:00,Jude Medical Announces Completion And Preliminary Results Of Exchange Offer For AGA Medical
2010-11-19 00:00:00,Jude Medical Announces Completion Of Acquisition Of AGA Medical
2010-12-02 00:00:00,Jude Medical Announces New Approvals Of Neurostimulation Lead to Manage Chronic Pain
2010-12-03 00:00:00,Jude Medical Neurostimulation Study Demonstrates Sustained Improvement in Chronic Low Back Pain Symptoms And Quality Of Life
2010-12-16 00:00:00,Fukuda Denshi to Close Sales Agent Contract with Jude
2011-01-12 00:00:00,Jude Medical Sees Q4 2010 EPS Guidance Will Be Near The Top End Of Prior Issues Q4 2010 Revenue Guidance
2011-01-20 00:00:00,Jude Medical Reaches Settlement with United States Department of Justice
2011-04-04 00:00:00,Jude Medical Receives FDA Approval For New Ablation Catheters
2011-04-20 00:00:00,Jude Medical Announces FDA Approval Of Trifecta Valve
2011-04-26 00:00:00,Jude Medical Awarded Billion In
2011-06-16 00:00:00,Jude AGA Files Patent Infringement Lawsuits Against Occlutech
2011-06-21 00:00:00,Jude Medical Receives Regulatory Approval From Japanese Ministry Of Labor And Welfare For Launch Of ICD And Devices
2011-07-12 00:00:00,Jude Medical Announces FDA Clearance For Neurostimulation Lead Delivery System For Management Of Chronic Pain
2011-07-20 00:00:00,Jude Medical Issues Q3 2011 EPS Guidance Below Lowers FY 2011 EPS Guidance
2011-08-03 00:00:00,Jude Medical Announces Third Quarter Dividend
2011-09-07 00:00:00,Jude Medical Announces European Regulatory Approval Of First Implanted Neurostimulation Device To Treat Chronic Migraine
2011-09-20 00:00:00,Jude Medical Announces European Launch of Smaller Quadripolar Pacing System
2011-10-19 00:00:00,Jude Medical Issues Q4 2011 EPS Guidance Below Narrows FY 2011 EPS Guidance To A Range In Line With Estimates
2011-12-15 00:00:00,FDA Classifies Voluntary Physician Advisory Letter on Jude Riata and Riata ST Silicone Defibrillation Leads as Class I Recall
2012-01-18 00:00:00,Independent Data Safety Monitoring Board Recommends Jude FAME II Clinical Trial Stop Enrollment Following Positive Interim Analysis
2012-01-25 00:00:00,Jude Medical Issues FY 2012 EPS Guidance Below Estimates
2012-04-23 00:00:00,Abbott Laboratories and Jude Medical Broaden Alliance For Cardiovascular Products In United States
2012-05-09 00:00:00,St Jude Announces FDA Approval Of Smaller ICD With Physician Inspired Shape
2012-06-18 00:00:00,Holzer Holzer LLC Announces Investigation Into Potential Claims For Breaches of Fiduciary Duty By Certain Officers And Directors Of Jude Medical Inc
2012-06-20 00:00:00,Gewirtz LLC Announces Class Action Has Been Filed Against Jude Medical Inc
2012-07-13 00:00:00,Brower Piven Announces Class Action Lawsuit Against Jude Medical Inc
2012-08-01 00:00:00,Jude Medical Inc Announces Third Quarter Dividend
2012-10-22 00:00:00,A Refreshing Outlook Consensus Reports on Ebay and Jude
2012-10-24 00:00:00,Jude Medical Says FFR Guided Treatment Is Cost Effective
2012-11-05 00:00:00,Significant Blood Pressure Reduction from Jude EnligHTN Renal
