2010-11-30 00:00:00,State Street Corporation Announces Targeted Cost Initiatives
2010-12-09 00:00:00,State Street Corporation Reaffirms FY 2010 EPS Guidance
2011-01-10 00:00:00,State Street State Street Global Advisors Completes Acquisition Of Bank Of Ireland Asset Management
2011-02-17 00:00:00,State Street Corporation And International Financial Data Services To Provide Investment Servicing For New Canadian Funds
2011-03-02 00:00:00,State Street Corporation Announces Senior Notes Offering
2011-05-11 00:00:00,State Street Corporation Appointed By Manulife Asset Management Limited To Provide Full Administrative Services For Canadian Institutional Pooled Funds
2011-07-19 00:00:00,State Street Corporation Issues Long Term Charge Issues H2 2011 Charge Announces Expanded Service Relationships With IBM And Wipro Technologies
2011-09-21 00:00:00,State Street Corporation to Acquire Pulse
2011-11-15 00:00:00,State Street Corporation To Provide Investment Operations Outsourcing Services To AllianceBernstein For More Than Billion In Assets
2011-12-15 00:00:00,State Street Corporation Announces Quarterly Dividend
2012-03-19 00:00:00,State Street Corporation Launches Fund Insights
2012-05-16 00:00:00,State Street Corporation Announces Quarterly Dividend
2012-07-17 00:00:00,State Street Corporation To Acquire Goldman Sachs Administration Services From The Goldman Sachs
2012-09-20 00:00:00,State Street Corp Announces Quarterly Common Stock Dividend
2012-10-09 00:00:00,BK to Charge for Deposits Analyst Blog
2012-10-23 00:00:00,State Street Executives to Present at Upcoming Conferences
2012-11-02 00:00:00,State Street CEO Jay Hooley offers management advice at the MIT Sloan School
2012-11-07 00:00:00,Standpoint Research Lowers State Street to Hold
