2011-01-19 00:00:00,Seagate Technology Issues Q3 2011 Revenue Guidance In Line With Call
2011-07-21 00:00:00,Seagate Technology Issues Q1 2012 Mixed Call
2012-04-17 00:00:00,Seagate Technology PLC Reaffirms CY 2012 Revenue Call
2012-05-23 00:00:00,Seagate Technology PLC and LaCie SA Announce Exclusive Agreement with Intent for Seagate to Acquire Controlling Interest in Jones
2012-07-31 00:00:00,Seagate Technology PLC Issues Q1 2013 Revenue Guidance Below Call
2012-08-21 00:00:00,Seagate Technology PLC To Buy Solyndra Plant
2012-10-09 00:00:00,Top 10th Percentile Ranked Dividend Stock STX Becomes Oversold
2012-10-18 00:00:00,Seagate Technology PLC Market Recap
2012-10-23 00:00:00,Movers Western
