2010-12-01 00:00:00,Constellation Completes Accelerated Share Buyback Transaction
2010-12-23 00:00:00,Constellation To Sell Some International Wine
2012-10-15 00:00:00,General Motors Considering to Sell Opel to Peugeot
2012-10-16 00:00:00,Beverage Invest in what you a snapshot of wine stocks
2012-10-18 00:00:00,Stocks To Watch
2012-10-19 00:00:00,Stock Ratings Reiterations for 19th DKS
2012-10-22 00:00:00,Weekly Top Insider GBDC
2012-10-24 00:00:00,Constellation Brands Stays Neutral Analyst Blog
2012-11-02 00:00:00,US craft brewers fear Modelo deal will limit their route to pubs
