2010-12-08 00:00:00,Stryker Corporation Declares Increase In Quarterly Announces Additional Million Share Repurchase Program
2011-01-25 00:00:00,Stryker Corporation Issues FY 2011 Revenue Guidance Above Estimates
2011-04-19 00:00:00,Stryker Corporation Reaffirms FY 2011 Call
2011-05-02 00:00:00,Stryker Corporation Reaffirms FY 2011 Call
2011-05-16 00:00:00,Agrees To Be Acquired By Stryker Corporation For Per Share In Cash
2011-07-20 00:00:00,Stryker Corporation Reaffirms FY 2011 Call
2011-10-20 00:00:00,Stryker Corporation Lowers High End Of Prior FY 2011 Revenue Raises FY 2011 EPS Call
2012-02-09 00:00:00,Stryker Corporation Announces Resignation Of Chairman And CEO
2012-04-17 00:00:00,Stryker Corporation Issues FY 2012 Revenue Guidance In Line With Issues FY 2012 EPS Call
2012-07-19 00:00:00,Stryker Corporation Reaffirms FY 2012 Call
2012-10-15 00:00:00,Surgically Sound BSX
2012-10-17 00:00:00,Earnings Report for October 2012 KMI
2012-10-18 00:00:00,Stryker Corp Narrows FY 2012 Revenue Raises FY 2012 EPS Issues FY 2013 EPS Guidance Below Call
2012-10-19 00:00:00,Stryker to Aims Surpass Analyst Blog
