2011-07-11 00:00:00,Symantec Corporation Completes Acquisition of Clearwell Systems
2011-07-27 00:00:00,Symantec Corporation Issues Q2 2012 Revenue Guidance Above Estimates
2011-11-14 00:00:00,Huawei Technologies Co Ltd Acquires Symantec Corporation Stake In Huawei Symantec Joint Venture
2012-03-06 00:00:00,Autodesk Selects Symantec Clearwell eDiscovery Platform
2012-03-14 00:00:00,Symantec Corporation And Experian Credentialing Solution Selected By Centers For Medicare Medicaid Services
2012-04-24 00:00:00,Symantec Corporation Lowers Q4 2012 Guidance
2012-06-11 00:00:00,Symantec Corporation Prices Billion Senior Unsecured Note Offering
2012-10-08 00:00:00,SYMANTEC CORPORATION Symantec to Host 2012 Annual Stockholder
