2010-11-04 00:00:00,Pepperweed Consulting Consolidates Its Data Backup and Security With Symantec Corporation
2010-11-08 00:00:00,Symantec Corporation And Dell Services Expand Strategic Partnership To Deliver Solutions
2010-12-01 00:00:00,ARX Announces Partnership With Symantec Corporation
2012-01-25 00:00:00,Symantec Corporation Authorizes Billion Share Repurchase Program
2012-03-30 00:00:00,Symantec Corporation Completes Sale of Huawei Symantec Joint Venture to Huawei Technologies Co Ltd
2012-04-25 00:00:00,Symantec Norton And Facebook Partner To Make Web Safer
2012-07-25 00:00:00,Symantec Corporation Announces Senior Executive Changes
2012-10-25 00:00:00,Stifel Nicolaus Sets Symantec Price Target at
