2011-02-14 00:00:00,And SYSCO SYGMA Announce Plans To Form A Supply Chain Distribution Alliance
2011-03-23 00:00:00,Krispy Kreme To Sign Distribution Agreement With SYSCO Corporation
2011-05-20 00:00:00,SYSCO Corporation Declares Quarterly Dividend
2011-05-27 00:00:00,SYSCO Corporation Announces Acquisition of Goldberg Solovy
2011-11-16 00:00:00,SYSCO Corporation Increases Quarterly Dividend Payment
2012-06-12 00:00:00,SYSCO Pallas Foods Announces Acquisition Of Crossgar Foodservice
2012-10-10 00:00:00,Shop at Safeway or Go For Food Service CHEF
2012-10-22 00:00:00,Sysco Corp Announces Acquisitions In Ireland
2012-10-24 00:00:00,A Dividend Aristocrat On A Growth Track
2012-11-02 00:00:00,Forbes Earnings SYSCO
2012-11-05 00:00:00,Results Announcing MTW
2012-11-06 00:00:00,Sysco Dines on Record Sales in Fiscal Lines Up
2012-11-07 00:00:00,Tom Markel Buys and Norfolk Southern
