2011-02-11 00:00:00,Integrys Energy Declares Dividend On Common Stock
2011-05-05 00:00:00,Integrys Energy Reaffirms FY 2011 EPS Call
2011-05-11 00:00:00,Integrys Energy Declares Dividend on Common Stock
2011-08-04 00:00:00,Integrys Energy Group Inc Narrows FY 2011 EPS Guidance To A Range In Line With Call
2011-09-01 00:00:00,Integrys Energy Group Inc Announces Acquisition of Two Compressed Natural Gas Fueling Businesses
2012-02-09 00:00:00,Integrys Energy Group Inc Declares Dividend On Common Stock
2012-02-29 00:00:00,Integrys Energy Group Inc Issues FY 2012 EPS Guidance In Line With Call
2012-05-03 00:00:00,Integrys Energy Group Inc Reaffirms FY 2012 EPS Call
2012-08-09 00:00:00,Integrys Energy Group Inc Lowers FY 2012 EPS Call
2012-08-16 00:00:00,Integrys Energy Group Inc Declares Dividend on Common Stock
2012-10-11 00:00:00,Integrys Energy Group Rating Lowered to Underperform at Zacks
2012-10-12 00:00:00,TEG Lowered to Underperform Analyst Blog
2012-10-18 00:00:00,Stock Outlook 2012 Industry Outlook
2012-10-23 00:00:00,Utility Stock Outlook October 2012 Industry Outlook
2012-11-05 00:00:00,Earnings Report for November 2012 CF
2012-11-07 00:00:00,Integrys Energy Group Inc Raises FY 2012 EPS Call
