2011-08-04 00:00:00,Integrys Energy Group Inc Narrows FY 2011 EPS Guidance To A Range In Line With Call
2012-02-29 00:00:00,Integrys Energy Group Inc Issues FY 2012 EPS Guidance In Line With Call
2012-08-09 00:00:00,Integrys Energy Group Inc Lowers FY 2012 EPS Call
2012-08-16 00:00:00,Integrys Energy Group Inc Declares Dividend on Common Stock
2012-10-23 00:00:00,Utility Stock Outlook October 2012 Industry Outlook
2012-10-25 00:00:00,INTEGRYS ENERGY Announces Third Quarter 2012 Earnings
2012-10-31 00:00:00,Integrys Energy Group Third Quarter Earnings Sneak Peek
2012-11-05 00:00:00,Earnings ARC
