2011-06-03 00:00:00,Rowe Price Declares Quarterly Dividend
2012-10-08 00:00:00,Citigroup Upgrades Rowe Price Group to Raises PT
2012-10-18 00:00:00,Rowe Price Equity Income Fund Top AVY
2012-10-19 00:00:00,KR
2012-10-23 00:00:00,5 stocks maintaining a strong Dividend providing a regular Dividend
2012-10-24 00:00:00,Rowe Price Posts Quarterly Beats Estimates By EPS
2012-10-25 00:00:00,Rowe Price Stock Rating Reaffirmed by Zacks
2012-11-06 00:00:00,Indicated Dividend Yield Ranking for the 500 by Industry
