2011-05-09 00:00:00,Tyson Announces Quarterly Dividend
2011-05-12 00:00:00,Tyson Announces Share Repurchase Program
2011-08-04 00:00:00,Tyson Announces Quarterly Dividend
2011-08-08 00:00:00,Tyson Reaffirms FY 2011 Revenue Guidance
2012-02-06 00:00:00,Tyson Announces Quarterly Dividend
2012-05-04 00:00:00,Tyson Announces Quarterly Dividend
2012-06-06 00:00:00,Tyson Proposes Public Offering Of Senior Notes
2012-08-03 00:00:00,Tyson Announces Quarterly Dividend
2012-08-06 00:00:00,Tyson Lowers FY 2012 Revenue Issues FY 2013 Revenue Guidance In Line With Comments On FY 2013 Earnings Guidance
2012-10-09 00:00:00,Marathon to Benefit After Refinery Purchase and 4 Stock Analyses Trending Today
2012-10-10 00:00:00,Japan Easing Restrictions on US Paving Way for Tyson
2012-10-11 00:00:00,Corn Surges to High as USDA Sees Smaller World Supply
2012-10-12 00:00:00,Tyson Foods Announces New Audit Program to Help Ensure Responsible On
2012-10-15 00:00:00,Corn Prices Increasing Companies Costs
2012-10-16 00:00:00,Smithfield Retained at Neutral Analyst Blog
