2011-02-01 00:00:00,Comcast And Time Warner Announce TV Everywhere Agreement For Xfinity Customers
2011-03-29 00:00:00,Time Warner Announces Proposed Debt Offering
2011-03-30 00:00:00,Time Warner Prices Billion Debt Offering
2011-07-28 00:00:00,Time Warner Inc Declares Regular Quarterly Cash Dividend
2011-08-03 00:00:00,Time Warner Inc Updates FY 2011 EPS Guidance
2011-11-02 00:00:00,Time Warner Inc Raises FY 2011 EPS Guidance
2012-10-22 00:00:00,Puts Closed on Time Warner
2012-10-26 00:00:00,Coinstar Profit Slips as Redbox Growth Slows
2012-10-31 00:00:00,Time Warner Inc Declares Regular Quarterly Cash Dividend
2012-11-01 00:00:00,The Zacks Analyst Blog Walt News Time Warner
2012-11-02 00:00:00,Time Warner Third Quarter Earnings Sneak Peek
2012-11-05 00:00:00,Weak Demand is Hurting Time Warner
