2011-04-04 00:00:00,Texas Instruments To Acquire National Semiconductor Corp
2011-04-20 00:00:00,Texas Instruments Incorporated Declares Quarterly Dividend
2011-10-20 00:00:00,Texas Instruments Incorporated Declares Quarterly Dividend
2012-03-12 00:00:00,Texas Instruments Incorporated And iRobot Corp Team Up To Shape Future Robotic Innovation
2012-07-30 00:00:00,Texas Instruments Incorporated Announces Proposed Public Offering Of Investment Grade Notes
2012-09-20 00:00:00,Texas Instruments Inc increase dividend
2012-10-22 00:00:00,Texas Instruments Inc Issues Q4 2012 Guidance Below Estimates
2012-10-25 00:00:00,Texas Instruments to webcast Analog investor meeting
2012-10-31 00:00:00,Key Concerns Impacting Our Texas Instruments Price Estimate
2012-11-01 00:00:00,Bluetooth low energy smartphone app development in minutes with
2012-11-05 00:00:00,TEXAS INSTRUMENTS INCORPORATED TI ZigBee wireless network
