2010-11-10 00:00:00,Texas Instruments Incorporated Launches LED Lighting Controller With Power Factor Correction
2010-11-15 00:00:00,Texas Instruments Incorporated Launches Integrated USB Charging Port Power Switch
2010-12-07 00:00:00,Texas Instruments Incorporated Narrows Q4 2010 Guidance To A Range In Line With Estimates
2011-01-20 00:00:00,Texas Instruments Incorporated Board Declares Quarterly Dividend
2011-01-24 00:00:00,Texas Instruments Incorporated Issues Q1 2011 Guidance In Line With Estimates
2011-02-14 00:00:00,Texas Instruments Incorporated Launches Multistandard Wireless Base Station System On Chip
2011-02-16 00:00:00,Texas Instruments Incorporated Launches Sink LED Driver
2011-02-22 00:00:00,Texas Instruments Incorporated Announces Power Development Kits
2011-03-08 00:00:00,Texas Instruments Incorporated Narrows Q1 2011 Guidance To A Range In Line With Analysts Estimates
2011-04-07 00:00:00,Texas Instruments Incorporated Launches Power Solutions With Protection
2011-04-18 00:00:00,Texas Instruments Incorporated Launches Smallest Wireless Power Receiver Chip
2011-04-20 00:00:00,Texas Instruments Incorporated Declares Quarterly Dividend
2011-04-27 00:00:00,Texas Instruments Incorporated Introduces controller With High Efficiency And Accuracy
2011-09-15 00:00:00,Texas Instruments Incorporated Raise Quarterly Cash Dividend
2011-09-21 00:00:00,Texas Instruments Incorporated Acquisition Of National Semiconductor Clears Regulatory Reviews
2011-09-23 00:00:00,Texas Instruments Incorporated Completes Acquisition Of National Semiconductor
2011-09-26 00:00:00,Fitch Affirms Texas Instruments Incorporated at and Upgrades National IDR to Stable Outlook
2011-10-20 00:00:00,Texas Instruments Incorporated Declares Quarterly Dividend
2011-10-24 00:00:00,Texas Instruments Incorporated Issues Q4 2011 Guidance In Line With Estimates
2012-01-19 00:00:00,Texas Instruments Incorporated Declares Quarterly Dividend
2012-01-23 00:00:00,Texas Instruments Incorporated Issues Q1 2012 Revenue Guidance Above Estimates
2012-07-19 00:00:00,Texas Instruments Incorporated Declares Quarterly Dividend
2012-07-30 00:00:00,Texas Instruments Incorporated Announces Proposed Public Offering Of Investment Grade Notes
2012-10-15 00:00:00,Inc In Talks To Buy Texas Instruments Mobile Chip
2012-10-16 00:00:00,Texas Instruments named in prestigious 2012 Wall Street Journal
2012-10-18 00:00:00,Texas Instruments Inc Declares Quarterly Dividend
2012-10-23 00:00:00,Earnings Texas Instruments Incorporated
2012-10-25 00:00:00,Texas Instruments to webcast Analog investor meeting
2012-10-31 00:00:00,Key Concerns Impacting Our Texas Instruments Price Estimate
2012-11-01 00:00:00,Bluetooth low energy smartphone app development in minutes with
2012-11-05 00:00:00,TI Introduces an Enterprise Tablet Solution
