2010-11-10 00:00:00,Tyco International Ltd Issues Q1 2011 Guidance Above Issues FY 2011 Guidance Below Call
2010-12-09 00:00:00,Tyco International Declares Quarterly Dividend
2010-12-22 00:00:00,Tyco International Completes Sale Of Majority Interest In Electrical And Metal Products Business To Dubilier Rice
2011-01-05 00:00:00,Tyco International Unit Sells Million Debt In Two
2011-03-09 00:00:00,Tyco International Shareholders Approve Dividend Increase
2011-03-21 00:00:00,Tyco International To Acquire Valve Manufacturer KEF Holdings In United Arab Emirates
2011-04-28 00:00:00,Tyco International Raises FY 2011 EPS Updates FY 2011 Revenue Guidance To A Range In Line With Call
2011-04-29 00:00:00,Oceania Capital Partners Limited Divests Investment In Signature Security Group To Tyco International Tyco International Security Group Pty Limited
2011-05-05 00:00:00,Tyco International Announces Quarterly Dividend
2011-07-19 00:00:00,Tyco International To Buy Maker Of Firefighting
2011-08-31 00:00:00,Tyco International Flow Control Unit Secures Contract
2011-09-02 00:00:00,Tyco International Completes Acquisition of
2011-09-14 00:00:00,Tyco International Announces Quarterly Dividend
2011-09-15 00:00:00,Tyco International To Acquire Visonic
2011-12-06 00:00:00,Tyco International Completes Acquisition of Visonic
2012-03-08 00:00:00,Tyco International Announces Quarterly Dividend
2012-04-10 00:00:00,Form 10 Registration Statement Filed by ADT Corporation In Connection With Separation Of Tyco International Into Three Independent Companies
2012-05-02 00:00:00,Tyco International Announces Quarterly Dividend
2012-10-10 00:00:00,Top Downgrades
2012-10-15 00:00:00,Imperial Capital Downgrades Tyco International Ltd to Outperform
2012-10-16 00:00:00,Upside Purchased on Tyco International
2012-10-17 00:00:00,Examining Options and Block Trading Activity for Tyco International
2012-10-18 00:00:00,Some Numbers at Tyco International that Make Your Stock Look Good
2012-10-22 00:00:00,Weekly Guru Bargains MMP
2012-10-25 00:00:00,ADT says it has held talks with shareholder Corvex
2012-11-01 00:00:00,The Zacks Analyst Blog New York News Gannett
2012-11-05 00:00:00,Iridian Asset Top Stock Picks
