2010-11-18 00:00:00,Union Pacific Announces Second Dividend Increase In 2010
2011-05-05 00:00:00,Union Pacific Announces Dividend Increase
2012-07-19 00:00:00,Union Pacific Corp Comments On FY 2012 EPS Call
2012-09-19 00:00:00,Union Pacific Corp Reaffirms FY 2012 Earnings Call
2012-10-17 00:00:00,Union Pacific Corporation Trade Flow Update
2012-10-18 00:00:00,Union Pacific profit rises
2012-10-19 00:00:00,Union Pacific Stock Rating Reaffirmed by RBC Capital
2012-10-26 00:00:00,lifts Union Pacific rating
2012-11-01 00:00:00,Weekly Ratings Changes for Union Pacific
