2010-11-18 00:00:00,Union Pacific Announces Second Dividend Increase In 2010
2011-05-05 00:00:00,Union Pacific Announces Dividend Increase
2011-11-17 00:00:00,Union Pacific Announces Dividend Increase for Fourth Quarter 2011
2012-05-10 00:00:00,Union Pacific Corp Declares Quarterly Dividend
2012-06-25 00:00:00,Union Pacific PS Technology Acquires Yard Control Systems Division Of Ansaldo STS USA
2012-07-19 00:00:00,Union Pacific Corp Comments On FY 2012 EPS Call
2012-07-26 00:00:00,Union Pacific Corp Declares Quarterly Dividend
2012-09-19 00:00:00,Union Pacific Corp Reaffirms FY 2012 Earnings Call
2012-10-17 00:00:00,UNION PACIFIC CORPORATION Awarded Membership in Union
2012-10-18 00:00:00,Earnings NUE
2012-10-19 00:00:00,Union Pacific Stock Rating Reaffirmed by RBC Capital
2012-10-23 00:00:00,UNION PACIFIC CORPORATION Invites You To Join Its 2012 Investor Day
2012-10-26 00:00:00,lifts Union Pacific rating
2012-10-31 00:00:00,Critical Alerts For Union Cabot Oil Motorola
2012-11-01 00:00:00,Weekly Ratings Changes for Union Pacific
2012-11-05 00:00:00,Barclays Capital Reiterates Overweight on Union Pacific
