2011-02-03 00:00:00,Union Pacific Announces New Share Repurchase Authorization And Declares First Quarter Dividend
2011-11-17 00:00:00,Union Pacific Announces Dividend Increase for Fourth Quarter 2011
2012-05-10 00:00:00,Union Pacific Corp Declares Quarterly Dividend
2012-06-25 00:00:00,Union Pacific PS Technology Acquires Yard Control Systems Division Of Ansaldo STS USA
2012-07-26 00:00:00,Union Pacific Corp Declares Quarterly Dividend
2012-10-11 00:00:00,Union Pacific Corporation Invites You To Join Its Third Quarter 2012 Earnings
2012-10-15 00:00:00,Forbes Earnings Union Pacific
2012-10-31 00:00:00,Critical Alerts For Union Cabot Oil Motorola
2012-11-05 00:00:00,Barclays Capital Reiterates Overweight on Union Pacific
