2010-11-09 00:00:00,Elavon Introduces Enterprise Billing Solution
2010-11-15 00:00:00,Bancorp To Buy Bank Of America Corporate Trust
2010-11-30 00:00:00,Suntron Announces New Credit Facility By Bank Asset Based Finance To Support Growth
2010-12-08 00:00:00,Citigroup Credicard And Elavon Announces Alliance To Establish Merchant Payments Solutions Company In Brazil
2010-12-14 00:00:00,Bancorp Announces Quarterly Dividends
2011-01-04 00:00:00,Bancorp Completes Acquisition Of Securitization Trust Administration Business From Bank of
2011-03-18 00:00:00,Bancorp Announces Increase In Quarterly Common Stock Dividend And Authorizes New 50 Million Share Repurchase Program
2011-05-10 00:00:00,Morgan Stanley Settles 1 CDO Suit With
2011-06-21 00:00:00,Bancorp Announces Quarterly Dividends
2011-08-30 00:00:00,US As Sues Bank of America Corporation Over
2011-09-20 00:00:00,Bancorp Announces Quarterly Dividends
2011-12-13 00:00:00,Bancorp Announces Quarterly Dividends
2011-12-21 00:00:00,Elan Financial Services Acquires Million in Financial Institution Credit Card Portfolios
2012-01-27 00:00:00,Bank National Association Acquires Banking Operations Of BankEast Corporation Of Tennessee
2012-01-30 00:00:00,US Bank National Association Acquires Indiana Corporate Trust Business From UMB Financial UMB Bank
2012-02-01 00:00:00,US Bank National Association Enters Into Definitive Agreement To Purchase Institutional Trust Business
2012-03-13 00:00:00,US Bancorp Announces Increase In Quarterly Common Stock Dividend And Authorizes New 100 Million Share Repurchase Program
2012-04-13 00:00:00,Bank of America US Bancorp Sued For Role As WaMu Bond
2012-06-19 00:00:00,US Bancorp Announces Quarterly Dividends
2012-09-18 00:00:00,Bancorp Announces Quarterly Dividends
2012-10-17 00:00:00,US Bancorp 3Q Profit Grows
2012-10-19 00:00:00,Reduce Long Exposure
2012-10-25 00:00:00,Bancorp Growth Income
2012-10-26 00:00:00,US Bancorp Stock Rating Upgraded by Susquehanna
2012-11-01 00:00:00,Boost Your Earnings Now With This Financial Powerhouse
