2010-12-23 00:00:00,Sells Harmonix Music Systems
2011-01-13 00:00:00,Declares Quarterly Cash Dividend
2011-02-03 00:00:00,Hulu and Announce Content Partnership
2011-02-14 00:00:00,Announces Million Debt Offering
2011-05-25 00:00:00,Announces Increase In Quarterly Dividend
2011-07-26 00:00:00,Declares Quarterly Cash Dividend
2012-02-23 00:00:00,Announces Million Debt Offering
2012-05-16 00:00:00,Time Warner Cable Inc Reach iPad Views
2012-05-23 00:00:00,Increases Quarterly Cash Dividend
2012-07-20 00:00:00,And DirecTv Announces Agreement To Renew Carriage Of Networks
2012-07-24 00:00:00,Viacom Inc Declares Quarterly Cash Dividend
2012-09-10 00:00:00,Time Warner Cable Inc And Viacom Inc Partner To Provide More
2012-10-05 00:00:00,Paramount Inks Deal with Warner Bros Analyst Blog
2012-10-09 00:00:00,Paramount Paranormal Activity 4 Haunts IMAX
2012-10-11 00:00:00,VH1 Bets On Love With The Premiere Of The Game
2012-10-12 00:00:00,President Barack Obama to Appear as a Guest on Daily
2012-10-18 00:00:00,Pirate Intellectual Property
2012-10-24 00:00:00,NYC New York Comedy Festival and Comedy
