2011-01-24 00:00:00,Paramount Pictures And Indian Paintbrush Acquire Worldwide Rights Out Of Sundance For
2011-02-14 00:00:00,Announces Million Debt Offering
2011-05-25 00:00:00,Announces Increase In Quarterly Dividend
2011-06-23 00:00:00,Sues Cablevision Systems Over iPad
2011-12-07 00:00:00,Announces Billion Debt Offering
2012-01-18 00:00:00,Declares Quarterly Cash Dividend
2012-02-23 00:00:00,Announces Million Debt Offering
2012-04-30 00:00:00,And WhoSay Forge Relationship Spanning And Content Creation
2012-05-16 00:00:00,Time Warner Cable Inc Reach iPad Views
2012-06-07 00:00:00,Announces Million Debt Offering
2012-07-24 00:00:00,Viacom Inc Declares Quarterly Cash Dividend
2012-09-10 00:00:00,Time Warner Cable Inc And Viacom Inc Partner To Provide More
2012-11-05 00:00:00,MTV to Help the With Fundraising
2012-11-06 00:00:00,Viacom Media Networks Usher In The Launch Of of Duty
