2011-01-21 00:00:00,Verizon Communications Sees Million Accounting Change
2011-07-25 00:00:00,Verizon Communications Inc to Bolster Lines of Communication for Australian Department of Defense
2011-12-05 00:00:00,Verizon Communications Verizon Wireless And Collaborate to Make Healthcare Management Simpler Via Mobile Technology
2011-12-06 00:00:00,Verizon Communications Inc And Vodafone Group Verizon Wireless Acquires Wireless Services Spectrum Licenses
2012-02-06 00:00:00,Verizon Communications Inc And Redbox Form Joint Venture
2012-03-02 00:00:00,Verizon Communications Inc Declares Quarterly Dividend
2012-03-14 00:00:00,Verizon And Vodafone Group Joint Verizon Wireless Completes Purchase Of Operating Assets Of Cellular One Of Northeast Pennsylvania
2012-11-01 00:00:00,Verizon Communications Headquarters Share Price Unaffected
