2011-02-15 00:00:00,Warner Chilcott Plc Issues FY 2011 Earnings Above Estimates
2011-03-08 00:00:00,Warner Chilcott Plc Reaffirms FY 2011 Call
2011-04-18 00:00:00,Warner Chilcott Plc Announces Plans To Restructure Western European Operations
2011-07-15 00:00:00,Warner Chilcott Plc Announces Decision In ACTONEL Arbitration
2011-07-26 00:00:00,Warner Chilcott Plc Announces Acquisition Of Patent Portfolio From AGI Therapeutics
2011-08-05 00:00:00,Warner Chilcott Plc Reaffirms FY 2011 Adjusted CNI No Longer Expects FY 2011 Revenue To Be At The High End Of Range
2011-09-22 00:00:00,Warner Chilcott Plc Receives Court Injection Against Mylan
2011-09-28 00:00:00,Warner Chilcott Bowel Disease Drug Gets Generic
2011-12-12 00:00:00,Warner Chilcott Plc Announces Decision on Appeal of DORYX Preliminary Injunction
2012-01-27 00:00:00,Warner Chilcott Plc Issues FY 2012 EPS Guidance Below Reaffirms FY 2011 Guidance
2012-05-04 00:00:00,Warner Chilcott Plc Lowers FY 2012 Guidance
2012-07-09 00:00:00,Mylan Mylan Pharmaceuticals Inc Sues Warner Chilcott Mayne Pharma Group Limited Over
2012-08-03 00:00:00,Warner Chilcott Plc Raises FY 2012 EPS Call
2012-08-21 00:00:00,Warner Chilcott Plc Declares Special Cash Dividend
2012-09-05 00:00:00,Warner Chilcott Plc Announces Secondary Equity Offering
2012-10-05 00:00:00,A Flood Of Is About To Hit The Market
2012-10-11 00:00:00,After Hours Most Active for Oct 2012 CLWR
2012-10-15 00:00:00,Research Price Target Changes for 15th ARII
2012-10-17 00:00:00,Warner Chilcott Price Target Lowered to at JPMorgan Chase
2012-10-22 00:00:00,Astellas launches bladder aiming for a franchise
2012-10-23 00:00:00,For 5 RSI value suggests a Buy Opportunity GGR
2012-10-25 00:00:00,Warner Chilcott Needs To Grow Up
2012-10-26 00:00:00,Investment Ratings Reiterations for 26th BIIB
2012-11-01 00:00:00,Top Dogs In 9 Indices Reckon To Net Gains
