2011-01-20 00:00:00,Wisconsin Energy Corporation Announces Quarterly Dividend
2011-02-02 00:00:00,Wisconsin Energy Corporation Issues FY 2011 Guidance In Line With Call
2011-07-28 00:00:00,Wisconsin Energy Corporation Raises FY 2011 EPS Issues Q3 2011 EPS Guidance Above Call
2012-01-19 00:00:00,Wisconsin Energy Corporation Declares Quarterly Dividends
2012-05-01 00:00:00,Wisconsin Energy Corporation Reaffirms CY 2012 EPS Guidance
2012-07-19 00:00:00,Wisconsin Energy Corporation Declares Quarterly Dividends
2012-08-01 00:00:00,Wisconsin Energy Corporation Issues Q3 2012 EPS Guidance In Line With Reaffirms FY 2012 EPS Call
2012-10-18 00:00:00,Dividend BTU
2012-10-19 00:00:00,Strong Dividend History Helps Get It To The Top 10
2012-10-23 00:00:00,Utility Stock Outlook October 2012 Industry Outlook
2012-10-24 00:00:00,Barclays Capital Reaffirms Overweight Rating on Wisconsin Energy
2012-11-07 00:00:00,Wisconsin Energy Shares Cross Below 200 DMA
