2010-11-09 00:00:00,Wells Fargo Spurs Growth of Blue Microphones With Million Line of Credit
2010-11-12 00:00:00,Wells Fargo And Rainbow PUSH Announce New Financial Education Program
2010-11-18 00:00:00,Wells Fargo Provides Million In Funding To Affiliates Of Blackstone Real Estate Advisors For Acquisition Of Industrial Properties Portfolio
2010-11-19 00:00:00,Wells Fargo And Citigroup Announce Settlement
2010-12-29 00:00:00,Ohio Sues Wells Fargo Over Pension Fund
2011-01-11 00:00:00,Wells Fargo Wells Fargo Insurance Services Acquires JFK Consulting LLC
2011-01-25 00:00:00,Wells Fargo Announces Dividend
2011-01-26 00:00:00,Gemino Healthcare Finance Secures Million Credit Facility From Wells Fargo Wells Fargo Capital Finance
2011-02-04 00:00:00,The Securities Law Firm of Menzer Files Arbitration Claim Against Wells Fargo Subsidiary
2011-02-07 00:00:00,LLC Announces Agreement To Acquire American Insurance Brokers From Wells Fargo Wells Fargo Insurance Services
2011-02-17 00:00:00,Wells Fargo Declares Cash Dividends On Preferred Stock
2011-04-26 00:00:00,Wells Fargo To Fund Million In Solar Projects Developed by MEMC Electronic SunEdison LLC
2011-04-28 00:00:00,Wells Fargo And JA Solar Holdings To Explore Strategic Cooperation In Renewable Energy
2011-05-09 00:00:00,Wells Fargo Acquires Wholesale Currency Provider From Bank Of Ireland
2011-05-20 00:00:00,Wells Fargo Declares Cash Dividends On Preferred Stock
2011-05-26 00:00:00,Wells Fargo Wells Fargo To Acquire Remaining Equity Interest In CP Equity LLC
2011-06-28 00:00:00,New York Top Court Revives Banks Including Wells Fargo Lawsuit Versus MBIA
2011-06-29 00:00:00,Parthenon Capital Partners And Wells Fargo Announced Agreement For Parthenon To Purchase Vest Financial Services
2011-06-30 00:00:00,Wells Fargo Cuts 49 Jobs In Sioux
2011-07-05 00:00:00,Wells Fargo Wells Fargo Completes Acquisition Of Castle Pines Capital
2011-07-07 00:00:00,Wells Fargo Settles Mortgage Case For
2011-07-26 00:00:00,Wells Fargo Announces Third Quarter Dividend
2011-09-06 00:00:00,Wells Fargo To Acquire Fund Administration LaCrosse Global Fund Services
2011-09-15 00:00:00,Wells Fargo Sues JPMorgan Chase Co Over 800 Mortgage
2011-09-28 00:00:00,Wells Fargo Wells Fargo Insurance Services Acquires ISU Insurance
2011-09-30 00:00:00,Wells Fargo And Indian Bank Announces Trade Services Agreement
2011-10-25 00:00:00,Wells Fargo Announces Fourth Quarter Dividend
2011-11-02 00:00:00,Wells Fargo Under Contract To Purchase Billion IBRC Commercial Real Estate Loan Portfolio
2011-11-18 00:00:00,Wells Fargo Declares Cash Dividends On Preferred Stock
2011-12-01 00:00:00,Massachusetts Attorney General Files Lawsuit Against Wells Fargo And Other
2011-12-19 00:00:00,Wells Fargo Wells Fargo Agrees To Purchase Burdale Financial Holdings Limited From Bank Of Ireland
2012-01-24 00:00:00,Wells Fargo Announces Quarterly Dividend
2012-02-09 00:00:00,JPMorgan Chase Wells Fargo Reserved For Mortgage
2012-04-24 00:00:00,Wells Fargo Co Announces Quarterly Dividend
2012-06-14 00:00:00,Wells Fargo Co And HDFC Bank Limited Sign Agreement for Remittance Service
2012-06-25 00:00:00,Wells Fargo Company To Acquire Fund Financing Portfolio From WestLB
2012-08-20 00:00:00,Wells Fargo Co Declares Cash Dividends on Preferred Stock
2012-11-01 00:00:00,Wells Fargo Co Fights New US
2012-11-02 00:00:00,Wells Fargo to Present at the Bank of America Merrill Lynch Banking and
2012-11-05 00:00:00,First Now Wells Fargo Looks to Enter into Hedge Funds
2012-11-06 00:00:00,Wells Fargo Beefs Up Commercial Banking in Canada
