2011-05-04 00:00:00,Whole Foods Narrows FY 2011 Revenue And Comparable Same Store Sales Raises FY 2011 Earnings Issues H2 2011 Outlook Above Estimates
2012-07-25 00:00:00,Whole Foods Raises FY 2012 EPS Issues FY 2013 Guidance
2012-10-10 00:00:00,Whole Foods Announces Fourth Quarter Earnings Conference Call
2012-10-11 00:00:00,The Zacks Analyst Blog Bed Bath Cheesecake
2012-10-24 00:00:00,Kroger Safeway Whole Foods How Are Hedge Funds
2012-10-25 00:00:00,UBS Raises Price Target for Whole Strong Q4
2012-10-26 00:00:00,Whole Foods to replace Foodmaster in six Greater Boston locations
2012-11-01 00:00:00,Maybe Whole Foods will follow Starbucks dividend hike
