2010-11-03 00:00:00,Whole Foods Raises FY 2011 EPS Call
2011-02-09 00:00:00,Whole Foods Raises FY 2011 Raises FY 2011 Comparable Store Sales Guidance
2011-11-02 00:00:00,Whole Foods Reaffirms FY 2012 EPS Comments On Same Store Sales Guidance For Fiscal Declares Announces Share Repurchase
2012-02-08 00:00:00,Whole Foods Raises Low End Of Prior FY 2012 Revenue Guidance To A Range In Line With Reaffirms FY 2012 EBITDA Raises FY 2012 EPS Guidance
2012-10-05 00:00:00,Whole Foods among several seeking big space
2012-10-16 00:00:00,Whole Foods Eats Up Bigger Share of Organic Market
