2011-05-06 00:00:00,Williams Companies Raises FY 2012 EPS Call
2011-06-23 00:00:00,Williams Companies Proposes To Acquire Southern Union Company For Per Share In Cash
2011-06-24 00:00:00,Southern Union Company Acknowledges Receipt Of Acquisition Proposal From Williams Companies
2011-07-14 00:00:00,Williams Companies Announces Revised Proposal To Acquire Southern Union For Per Share In Cash
2011-08-03 00:00:00,Williams Companies Raises FY 2011 EPS Reaffirms FY 2012 EPS Guidance
2011-08-16 00:00:00,Williams Companies Affirms Proposal To Acquire Southern Union Company For Per Share In Cash
2011-09-06 00:00:00,Williams Companies To Increase Annual Dividend By to per Share
2011-11-17 00:00:00,Williams Companies Raises Quarterly Dividend To Per Share
2012-05-17 00:00:00,Williams Companies Inc Increases Dividend To Per Share
2012-10-19 00:00:00,Williams Stock Rating Lowered by Tudor Pickering
2012-10-22 00:00:00,WILLIAMS Williams Partners Raises Cash Distribution to
2012-10-24 00:00:00,Williams Companies Options Insight
2012-10-25 00:00:00,Winning Stocks and Sectors with Mitt Romney as President
2012-10-31 00:00:00,Williams Partners LP Signs Agreement To Purchase Williams Companies Gulf Olefins Business
2012-11-01 00:00:00,Williams Companies Management Discusses Q3 2012 Results Earnings Call
2012-11-05 00:00:00,Williams Partners LP Completes Acquisition of Williams Companies Gulf Olefins Business
