2010-12-07 00:00:00,The Washington Post Kaplan Higher Education Announces Staff Reductions
2010-12-20 00:00:00,The Washington Post Announces Formation of Kaplan Global Solutions
2011-02-22 00:00:00,The Washington Post Declares Regular Quarterly Dividend
2011-05-03 00:00:00,The Washington Post Kaplan Australia Announces Acquisition Of Franklyn Scholar
2011-05-19 00:00:00,K12 Announces Agreement To Purchase Assets of Kaplan Virtual Education From The Washington Post Company In partnership with School Districts and Charter Schools
2012-02-08 00:00:00,The Washington Post To Reduce Newsroom
2012-09-13 00:00:00,The Washington Post Co Declares Regular Quarterly Dividend
2012-10-01 00:00:00,The Washington Post Co To Acquire Majority Interest in Celtic
