2011-02-04 00:00:00,Societe des Bains de Mer et du Cercle des Etrangers a Monaco Confirms FY Guidance and Announces Sale of Stake in Wynn Limited
2011-03-25 00:00:00,Wynn Limited Announces Alliance With PokerStars
2011-04-19 00:00:00,Wynn Limited Declares Dividend
2011-07-18 00:00:00,Wynn Limited Declares Dividend
2011-11-02 00:00:00,Wynn Limited Declares Cash Dividend
2012-02-02 00:00:00,Wynn Limited Declares Dividend
2012-03-05 00:00:00,Wynn Wynn Las LLC And Wynn Las Vegas Capital Announces Pricing Of Private Offering Of Aggregate Principal Amount
2012-03-13 00:00:00,Universal Entertainment Corporation Files Counterclaim Against Wynn Limited
2012-03-21 00:00:00,Ryan LLP Announces Investigation Of Wynn Limited
2012-03-22 00:00:00,Law Offices of Howard Smith Announces Investigation of Wynn Resorts Ltd
2012-03-23 00:00:00,Law Firm of Levi LLP Announces Investigation Into Possible Securities Laws Violations By Wynn Resorts
2012-04-02 00:00:00,The Law Firm of Levi LLP Launches Investigation Into Possible Securities Laws Violations By Wynn Resorts
2012-04-09 00:00:00,Wynn Limited Announces Investor Lawsuit Against Directors Over Alleged Wrongdoing Announced By Shareholders
2012-05-07 00:00:00,Wynn Limited Declares Dividend
2012-08-28 00:00:00,Universal Entertainment and Kazuo Okada File Defamation Lawsuit In Japan Against Wynn Resorts Limited CEO Stephen Wynn Resorts Directors And General Counsel
2012-10-24 00:00:00,Wynn Resorts Ltd Declares Dividend
2012-10-26 00:00:00,Janney Montgomery Scott Gives Neutral Rating to Wynn Limited
2012-10-31 00:00:00,Wynn Limited Given Rating at Topeka Capital
2012-11-01 00:00:00,Menards Teaches Employees The Values Of Limited
