2011-02-28 00:00:00,Macsteel Service Centers USA Acquires Steel Coil Services From United States Steel Corporation
2012-03-12 00:00:00,United States Steel Corp Announces Proposed Senior Notes Offering
2012-10-15 00:00:00,Getting a Bead on and FGP
2012-10-16 00:00:00,US sets tariffs on some Asia exports
2012-10-22 00:00:00,US Steel Skeptics Back Down
2012-10-23 00:00:00,Review Of Suggested Strategy Already Showing Healthy Gains
2012-10-25 00:00:00,Forbes Earnings United States Steel
2012-10-26 00:00:00,United States Upcoming What You Need To Know
