2011-01-31 00:00:00,Announces Acquisition Of AutoESL Design
2012-04-25 00:00:00,Issues Q1 2013 Revenue Guidance In Line With Estimates
2012-10-15 00:00:00,Top Tech Analyst Issues Investor Updates and Previews Earnings
2012-10-16 00:00:00,Xilinx Accelerates Automotive Driver Assistance Deployment at
2012-10-22 00:00:00,Market Influences That Drive Equities Forward Industry Report on Inc
2012-10-25 00:00:00,Xilinx Addresses System Integration with All Programmable SoCs at ARM
2012-10-31 00:00:00,Xilinx All Programmable SoC Accelerates the Development of
