2010-11-19 00:00:00,Declares Quarterly Dividend Of Per Share
2011-03-25 00:00:00,Declares Quarterly Dividend of Per Share
2011-04-19 00:00:00,Beasley Allen Law Firm Voluntarily Withdraws Class Action Lawsuit Against Taco Bell
2011-04-21 00:00:00,Reaffirms FY 2011 EPS Call
2011-04-26 00:00:00,Makes Preliminary Proposal To Acquire Chinas Little Sheep Restaurants
2011-05-12 00:00:00,Announces Proposed Privatization of Little Sheep Group Limited at per Scheme Share
2011-05-19 00:00:00,Declares Quarterly Dividend Of Per Share
2011-07-13 00:00:00,Brands Inc Raises FY 2011 EPS Guidance
2011-11-08 00:00:00,Chinas Ministry of Commerce Approves Brands Proposal To Acquire Little Sheep Group Limited
2011-11-22 00:00:00,Brands Inc To Separates India Chronicle
2011-12-05 00:00:00,Brands Inc Raises FY 2011 EPS Comments On FY 2012 EPS Guidance
2012-02-07 00:00:00,Brands Inc Reaffirms FY 2012 EPS Comments On Long Term EPS Call
2012-03-23 00:00:00,Brands Inc Declares Quarterly Dividend
2012-05-01 00:00:00,Brands Inc Promotes Carucci President And Grismer Chief Financial Officer
2012-07-18 00:00:00,Brands Inc Reaffirms FY 2012 EPS Guidance
2012-09-20 00:00:00,Brands Inc Announces Increase in Quarterly Dividend
2012-10-10 00:00:00,Ahead of the Yum Brands
2012-10-16 00:00:00,Taking a Bite Out of Brands Stock
2012-10-19 00:00:00,Yum Brands stock slips on lackluster earnings reports
2012-10-22 00:00:00,Brands executive to speak on reputation global PR strategy
2012-10-23 00:00:00,World Series Stolen Base Could Earn America Free
2012-11-01 00:00:00,David Yum Brands Chipotle
2012-11-05 00:00:00,Yum Looks Tasty In The Near Future
