2011-02-08 00:00:00,Zions Bancorporation Declares Dividends For Common And Preferred Shares
2012-02-08 00:00:00,Zions Bancorporation Declares Dividends For Common And Preferred Shares
2012-04-26 00:00:00,Zions Bancorporation Announces Completion Of Million Senior Notes Auction
2012-05-01 00:00:00,Zions Bancorporation Announces Completion Of Million Perpetual Preferred Stock Auction
2012-05-07 00:00:00,Zions Bancorporation Declares Dividends For Common And Preferred Shares
2012-06-14 00:00:00,Zions Bancorporation Announces Pricing Of Senior Notes
2012-10-11 00:00:00,Zions Bancorporation Research Recent Ratings Updates
2012-10-17 00:00:00,Zions Bancorp Third Quarter Earnings Sneak Peek
2012-11-05 00:00:00,Snatch This Bargain Even Cheaper Than Exec Vice President Feiger Did
2012-11-06 00:00:00,Indicated Dividend Yield Ranking for the 500 by Industry
