2011-02-10 00:00:00,Zions Bancorporation Announces Entry Into New Equity Distribution Agreements
2011-05-12 00:00:00,Zions Bancorporation Declares Dividends For Common And Preferred Shares
2011-08-10 00:00:00,Zions Bancorporation Declares Dividends For Common And Preferred Shares
2011-11-09 00:00:00,Zions Bancorporation Declares Dividends for Common and Preferred Shares
2012-03-22 00:00:00,Zions Bancorporation Announces Completion Of Million Senior Note Auction
2012-06-11 00:00:00,Zions Bancorporation Announces Plans To Auction million Of Senior Notes Through Zions Direct
2012-08-09 00:00:00,Zions Bancorporation Declares Dividends For Common And Preferred Shares
2012-10-12 00:00:00,For five Financial RSI now represents an Overbought Condition
2012-10-19 00:00:00,Stocks In News
2012-10-22 00:00:00,advisories and surprises
2012-11-07 00:00:00,Best Rally in Decade May Slow as Obama Faces Congress
